19,[],False,mrfreshmint,,[],,text,t2_bw46w,False,False,False,[],False,False,1662872480,self.AskEngineers,https://www.reddit.com/r/AskEngineers/comments/xb9qzm/how_is_the_sr71_j58_engine_88_efficient/,{},xb9qzm,False,True,False,False,False,True,True,False,,blue,[],90a1d45a-3f64-11e5-8667-0e60d8112001,Mechanical,dark,text,False,False,True,0,0,False,all_ads,/r/AskEngineers/comments/xb9qzm/how_is_the_sr71_j58_engine_88_efficient/,False,6,1662872491,1,"Does this not violate the Carnot Efficiency simply because it isn't converting heat into work, but rather chemical potential energy into work? 

[Here is the reference](https://youtu.be/MJrXUh0eZjw?t=737)",True,False,False,AskEngineers,t5_2sebk,283531,public,self,How is the SR-71 J58 Engine 88% efficient?,0,[],1.0,https://www.reddit.com/r/AskEngineers/comments/xb9qzm/how_is_the_sr71_j58_engine_88_efficient/,all_ads,6,,,,,self,"{'enabled': False, 'images': [{'id': 'DWvTTOFVbFRsA3bfRmZUiQSLxU8FRIAyfElxSuMlVVs', 'resolutions': [{'height': 81, 'url': 'https://external-preview.redd.it/j1poy_35V_4aMxN-6_-gCz8m_0dYec9t6iEedWzCNs0.jpg?width=108&amp;crop=smart&amp;auto=webp&amp;s=5d183df0605e5527b331b6e617c37bba433bb274', 'width': 108}, {'height': 162, 'url': 'https://external-preview.redd.it/j1poy_35V_4aMxN-6_-gCz8m_0dYec9t6iEedWzCNs0.jpg?width=216&amp;crop=smart&amp;auto=webp&amp;s=ff3c20bba72a03f0ed42682857a60713c430f135', 'width': 216}, {'height': 240, 'url': 'https://external-preview.redd.it/j1poy_35V_4aMxN-6_-gCz8m_0dYec9t6iEedWzCNs0.jpg?width=320&amp;crop=smart&amp;auto=webp&amp;s=1a6dc7c544f49310719faacca3683c71ddc4c7fc', 'width': 320}], 'source': {'height': 360, 'url': 'https://external-preview.redd.it/j1poy_35V_4aMxN-6_-gCz8m_0dYec9t6iEedWzCNs0.jpg?auto=webp&amp;s=fbea433e96ccfea00442c9cab66689a85585cac6', 'width': 480}, 'variants': {}}]}",,,,
20,[],False,beacheytunez_,,[],,text,t2_xbcrwvs,False,False,False,[],False,False,1662869367,self.AskEngineers,https://www.reddit.com/r/AskEngineers/comments/xb8t3k/do_computers_that_use_multiple_distinct_voltage/,{},xb8t3k,False,True,False,False,False,True,True,False,,purple,[],6a68317a-c3cd-11e9-bf9c-0e2863fd7a72,Computer,dark,text,False,False,True,0,0,False,all_ads,/r/AskEngineers/comments/xb8t3k/do_computers_that_use_multiple_distinct_voltage/,False,6,1662869378,1,"I've been thinking about how much technology has been built on binary, where sequences of ONs and OFFs represent numbers and thus data. 

However, I'm curious whether computers capable of representing, for example, 10 digits (0-9) were ever conceived or exist(ed). I imagine that rather than using sequences of OFFs and ONs, they would use sequences using established voltage levels from reference voltages. 

I'm not sure how computer memory would work. Perhaps converting to binary and using flip flops would do, I imagine something like a deflected rotor or needle that reflects the voltage level applied holds some potential usefulness. 

Does anything like what I've described exist or has it ever been seriously considered or investigated?

&amp;#x200B;

Thanks in advance",True,False,False,AskEngineers,t5_2sebk,283526,public,self,Do computers that use multiple distinct voltage levels to represent different digits exist?,0,[],1.0,https://www.reddit.com/r/AskEngineers/comments/xb8t3k/do_computers_that_use_multiple_distinct_voltage/,all_ads,6,,,,,,,,,,
21,[],False,millerhb1015,,[],,text,t2_e1hu8rfu,False,False,False,[],False,False,1662868352,self.AskEngineers,https://www.reddit.com/r/AskEngineers/comments/xb8hek/if_i_obtain_my_mba_after_graduating_with_my/,{},xb8hek,False,False,False,False,False,False,True,False,,blue,[],b251a614-57f9-11e4-b47b-12313b0e9678,Discussion,dark,text,False,False,True,1,0,False,all_ads,/r/AskEngineers/comments/xb8hek/if_i_obtain_my_mba_after_graduating_with_my/,False,6,1662868363,1,[removed],True,False,False,AskEngineers,t5_2sebk,283522,public,self,"If I obtain my MBA after graduating with my undergrad engineering degree, would employers seek to hire me in a managerial position or would I still be offered engineering focused positions?",0,[],1.0,https://www.reddit.com/r/AskEngineers/comments/xb8hek/if_i_obtain_my_mba_after_graduating_with_my/,all_ads,6,moderator,,,,,,,,,
22,[],False,dmin67,,[],,text,t2_7us0d,False,False,False,[],False,False,1662865345,self.AskEngineers,https://www.reddit.com/r/AskEngineers/comments/xb7j2q/is_cathodeanode_mechanical_swapping_in_liion/,{},xb7j2q,False,True,False,False,False,True,True,False,,purple,[],3a6acd0c-fd28-11e6-ab41-0edc7e2b18fe,Electrical,dark,text,False,False,True,0,0,False,all_ads,/r/AskEngineers/comments/xb7j2q/is_cathodeanode_mechanical_swapping_in_liion/,False,6,1662865355,1,"

I’m not an engineer of any sort, but I’ve recently been hyper fixated on the inner workings of specifically li-ion batteries. 

I’m curious as to why there’s not an attempt to just flip the polarity in batteries to just swap a battery’s charge from empty to full. 

Now I know this could be dangerous if it’s a forced uncontrolled reaction, but I’m curious as to whether something like this would even be feasible. Possibly flipping the cathode and and anode while maintaining the side on which the lithium ions were drained to so that a cell can just be flipped from 0 to 1 and it would be full again.",True,False,False,AskEngineers,t5_2sebk,283523,public,self,Is cathode/anode mechanical swapping in li-ion batteries possible?,0,[],1.0,https://www.reddit.com/r/AskEngineers/comments/xb7j2q/is_cathodeanode_mechanical_swapping_in_liion/,all_ads,6,,,,,,,,,,
23,[],False,dmin67,,[],,text,t2_7us0d,False,False,False,[],False,False,1662865130,self.AskEngineers,https://www.reddit.com/r/AskEngineers/comments/xb7gcs/general_battery_question/,{},xb7gcs,False,False,False,False,False,False,True,False,,blue,[],b251a614-57f9-11e4-b47b-12313b0e9678,Discussion,dark,text,False,False,True,1,0,False,all_ads,/r/AskEngineers/comments/xb7gcs/general_battery_question/,False,6,1662865140,1,[removed],True,False,False,AskEngineers,t5_2sebk,283523,public,self,General Battery Question,0,[],1.0,https://www.reddit.com/r/AskEngineers/comments/xb7gcs/general_battery_question/,all_ads,6,moderator,,,,,,,,,
24,[],False,turnerspam,,[],,text,t2_8nvg67x1,False,False,False,[],False,False,1662860553,self.AskEngineers,https://www.reddit.com/r/AskEngineers/comments/xb5ybp/how_should_i_mark_sign_and_insert_things_into_my/,{},xb5ybp,False,False,False,False,False,False,True,False,,blue,[],b251a614-57f9-11e4-b47b-12313b0e9678,Discussion,dark,text,False,False,True,1,0,False,all_ads,/r/AskEngineers/comments/xb5ybp/how_should_i_mark_sign_and_insert_things_into_my/,False,6,1662860563,1,[removed],True,False,False,AskEngineers,t5_2sebk,283519,public,self,"How should I mark, sign, and insert things into my logbook?",0,[],1.0,https://www.reddit.com/r/AskEngineers/comments/xb5ybp/how_should_i_mark_sign_and_insert_things_into_my/,all_ads,6,moderator,,,,,,,,,
25,[],False,linuxman1929,,[],,text,t2_13g9il,False,False,False,[],False,False,1662860377,self.AskEngineers,https://www.reddit.com/r/AskEngineers/comments/xb5w7y/which_project_would_force_me_to_learn_physicsee/,{},xb5w7y,False,True,False,False,False,True,True,False,,purple,[],3a6acd0c-fd28-11e6-ab41-0edc7e2b18fe,Electrical,dark,text,False,False,True,0,0,False,all_ads,/r/AskEngineers/comments/xb5w7y/which_project_would_force_me_to_learn_physicsee/,False,6,1662860387,1,"I have a problem.

I want to learn physics and elect. engineering but I lack the self discipline to self-study it as though I were in college.

So  what is a project I can do that would force me to learn physics/EE as I  accomplish the project? I think this would be key to keeping my  motivation up.",True,False,False,AskEngineers,t5_2sebk,283519,public,self,Which project would force me to learn physics/EE?,0,[],1.0,https://www.reddit.com/r/AskEngineers/comments/xb5w7y/which_project_would_force_me_to_learn_physicsee/,all_ads,6,,,,,,,,,,
26,[],False,AllyUnion,,[],,text,t2_e4uv4,False,False,False,[],False,False,1662859087,self.AskEngineers,https://www.reddit.com/r/AskEngineers/comments/xb5h6k/has_anyone_tried_to_combine_an_omniwheel_and_a/,{},xb5h6k,False,True,False,False,False,True,True,False,,blue,[],90a1d45a-3f64-11e5-8667-0e60d8112001,Mechanical,dark,text,False,False,True,0,0,False,all_ads,/r/AskEngineers/comments/xb5h6k/has_anyone_tried_to_combine_an_omniwheel_and_a/,False,6,1662859098,1,"I was watching a video about how the monowheel motorcycle has issues and just wondered if the omniwheel was ever combined with a monowheel motorcycle.  My initial Google search was disappointing, has anyone attempted such a thing before?",True,False,False,AskEngineers,t5_2sebk,283517,public,self,Has anyone tried to combine an omniwheel and a monowheel before?,0,[],1.0,https://www.reddit.com/r/AskEngineers/comments/xb5h6k/has_anyone_tried_to_combine_an_omniwheel_and_a/,all_ads,6,,,,,,,,,,
27,[],False,csealine,,[],,text,t2_aeuh8,False,False,False,[],False,False,1662852892,self.AskEngineers,https://www.reddit.com/r/AskEngineers/comments/xb3dkn/location_vs_job_type/,{},xb3dkn,False,False,False,False,False,False,True,False,,blue,[],b251a614-57f9-11e4-b47b-12313b0e9678,Discussion,dark,text,False,False,True,1,0,False,all_ads,/r/AskEngineers/comments/xb3dkn/location_vs_job_type/,False,6,1662852902,1,[removed],True,False,False,AskEngineers,t5_2sebk,283514,public,self,Location vs Job Type?,0,[],1.0,https://www.reddit.com/r/AskEngineers/comments/xb3dkn/location_vs_job_type/,all_ads,6,moderator,,,,,,,,,
28,[],False,TeddyThreeSticks,,[],,text,t2_735qiflh,False,False,False,[],False,False,1662851988,self.AskEngineers,https://www.reddit.com/r/AskEngineers/comments/xb31qi/cheap_alternative_to_catia/,{},xb31qi,False,True,False,False,False,True,True,False,,blue,[],b251a614-57f9-11e4-b47b-12313b0e9678,Discussion,dark,text,False,False,True,0,0,False,all_ads,/r/AskEngineers/comments/xb31qi/cheap_alternative_to_catia/,False,6,1662851998,1,"I’ve used Catia for 3D modeling (solids and surfacing) for my entire career. I love it. I feel like I can do anything I want and if I can’t, there’s usually a work bench to load in that can do it. 

I’m looking for something to use personally though and Catia is definitely not in my budget. Does anybody know a cheap (or free) CAD software that is similar to Catia? I know it won’t be perfect, but just looking for close to ease the transition.  I’ve tried FreeCAD and it’s ok but I feel like it is not very intuitive.",True,False,False,AskEngineers,t5_2sebk,283514,public,self,Cheap Alternative to Catia?,0,[],1.0,https://www.reddit.com/r/AskEngineers/comments/xb31qi/cheap_alternative_to_catia/,all_ads,6,,,,,,,,,,
29,[],False,MCMack1234,,[],,text,t2_66j7aoyg,False,False,False,[],False,False,1662844486,self.AskEngineers,https://www.reddit.com/r/AskEngineers/comments/xb08wd/thinking_of_going_into_civil_engineering_when_im/,{},xb08wd,False,True,False,False,False,True,True,False,,blue,[],b251a614-57f9-11e4-b47b-12313b0e9678,Discussion,dark,text,False,False,True,0,0,False,all_ads,/r/AskEngineers/comments/xb08wd/thinking_of_going_into_civil_engineering_when_im/,False,6,1662844497,1,"I’m currently taking an engineering class in high school and thinking of pursuing it. I truly enjoy it and just wanted to know if there’s anything I should know. 

Also, hope this is okay with the rules of this subreddit.",True,False,False,AskEngineers,t5_2sebk,283512,public,self,Thinking of going into Civil engineering when I’m older. Any advice/things I should know?,0,[],1.0,https://www.reddit.com/r/AskEngineers/comments/xb08wd/thinking_of_going_into_civil_engineering_when_im/,all_ads,6,,,,,,,,,,
30,[],False,ShootToKill123,,[],,text,t2_62ft96v3,False,False,False,[],False,False,1662841675,self.AskEngineers,https://www.reddit.com/r/AskEngineers/comments/xaz6cs/is_quality_engineering_difficult/,{},xaz6cs,False,True,False,False,False,True,True,False,,blue,[],b251a614-57f9-11e4-b47b-12313b0e9678,Discussion,dark,text,False,False,True,0,0,False,all_ads,/r/AskEngineers/comments/xaz6cs/is_quality_engineering_difficult/,False,6,1662841686,1,Is a quality engineer position difficult/challenging and stressful? What’s the most difficult things you have to deal with?,True,False,False,AskEngineers,t5_2sebk,283508,public,self,Is quality engineering difficult?,0,[],1.0,https://www.reddit.com/r/AskEngineers/comments/xaz6cs/is_quality_engineering_difficult/,all_ads,6,,,,,,,,,,
31,[],False,JarvisTechTMH,,[],,text,t2_athpliet,False,False,False,[],False,False,1662841547,self.AskEngineers,https://www.reddit.com/r/AskEngineers/comments/xaz4lh/is_quality_engineering_difficult/,{},xaz4lh,False,False,False,False,False,False,True,False,,blue,[],b251a614-57f9-11e4-b47b-12313b0e9678,Discussion,dark,text,False,False,True,1,0,False,all_ads,/r/AskEngineers/comments/xaz4lh/is_quality_engineering_difficult/,False,6,1662841558,1,[removed],True,False,False,AskEngineers,t5_2sebk,283508,public,self,Is Quality Engineering difficult?,0,[],1.0,https://www.reddit.com/r/AskEngineers/comments/xaz4lh/is_quality_engineering_difficult/,all_ads,6,moderator,,,,,,,,,
32,[],False,CutiePapi,,[],,text,t2_24pzsg4e,False,False,False,[],False,False,1662833730,self.AskEngineers,https://www.reddit.com/r/AskEngineers/comments/xaw383/continuous_improvement_engineering_question/,{},xaw383,False,False,False,False,False,False,True,False,,blue,[],b251a614-57f9-11e4-b47b-12313b0e9678,Discussion,dark,text,False,False,True,1,0,False,all_ads,/r/AskEngineers/comments/xaw383/continuous_improvement_engineering_question/,False,6,1662833740,1,[removed],True,False,False,AskEngineers,t5_2sebk,283497,public,self,Continuous improvement engineering question,0,[],1.0,https://www.reddit.com/r/AskEngineers/comments/xaw383/continuous_improvement_engineering_question/,all_ads,6,moderator,,,,,,,,,
33,[],False,kimonczikonos,,[],,text,t2_2qvzsp93,False,False,False,[],False,False,1662830156,self.AskEngineers,https://www.reddit.com/r/AskEngineers/comments/xaunt4/hnc_in_electrical_engineering_online_courses/,{},xaunt4,False,True,False,False,False,True,True,False,,blue,[],b251a614-57f9-11e4-b47b-12313b0e9678,Discussion,dark,text,False,False,False,0,0,False,all_ads,/r/AskEngineers/comments/xaunt4/hnc_in_electrical_engineering_online_courses/,False,6,1662830166,1,"Hi, im based in UK been spark now for 8 years, I got my lvl3 for past 3 years depending from luck im either electrical site manager or electrical PM. I start to look for getting HNC/HND done.

&amp;#x200B;

I found below courses but I would like to find your own opinions about providers if any of you studied with them

* [Engineers.academy](https://Engineers.academy) \- offer their fait bit on YT
* tecol - cheapest of all
* unicourse",True,False,False,AskEngineers,t5_2sebk,283491,public,self,HNC in electrical engineering - online courses,0,[],1.0,https://www.reddit.com/r/AskEngineers/comments/xaunt4/hnc_in_electrical_engineering_online_courses/,all_ads,6,,,,,,,,,,
34,[],False,SnooFoxes6060,,[],,text,t2_6ypdwbf1,False,False,False,[],False,False,1662828738,self.AskEngineers,https://www.reddit.com/r/AskEngineers/comments/xau3j2/i_need_some_guidance/,{},xau3j2,False,True,False,False,False,True,True,False,,purple,[],6a68317a-c3cd-11e9-bf9c-0e2863fd7a72,Computer,dark,text,False,False,True,0,0,False,all_ads,/r/AskEngineers/comments/xau3j2/i_need_some_guidance/,False,6,1662828749,1,"Hey all, I’m in Engineering computer science, just finished my 3rd year, and I’m quite struggling.

I really dislike the academic structure, I keep on studying subjects that hardly correlate with the field, and mostly Impractical. I’ve double checked with many graduates and all they said “they never got to use what they studied”.

I’m embedded in a culture that doesn’t support working while studying(as families pay the tuition fees in my country) , it’s more of; focus on your studies and work after finishing your college. However,I started working jobs like; CRM, Sales, and teaching. still didn’t work on my engineering skills.
(PS: I love practical work, I don’t hate my degree, I just hate the poor education structure)

Honestly my grades are awful. sometimes I’m anxious about it, and other times, I just couldn’t care less. 

Yes, I’m gaining soft skills and knowledge, but since I’m jumping from one job to another, I’m not making any financial developments.

So, from a point of view from elder people who are up to date with the market, what advice you can give to a 21 y/o male?

1. Should I keep jumping from a job to another to gain experience? If yes, when should I stop?

2. Does the market really care about grades?

3. Do I have to work more in my field (still unsure what I want to do in the future 100%) and neglect any other opportunity?",True,False,False,AskEngineers,t5_2sebk,283490,public,self,I need some guidance,0,[],1.0,https://www.reddit.com/r/AskEngineers/comments/xau3j2/i_need_some_guidance/,all_ads,6,,,,,,,,,,
35,[],False,a5hr0nixa,,[],,text,t2_2axnsy36,False,False,False,[],False,False,1662828688,self.AskEngineers,https://www.reddit.com/r/AskEngineers/comments/xau2ux/is_ee_suited_to_me_if_i_only_love_maths_and_theory/,{},xau2ux,False,True,False,False,False,True,True,False,,purple,[],3a6acd0c-fd28-11e6-ab41-0edc7e2b18fe,Electrical,dark,text,False,False,True,0,0,False,all_ads,/r/AskEngineers/comments/xau2ux/is_ee_suited_to_me_if_i_only_love_maths_and_theory/,False,6,1662828698,1,"I did 6 months of university engineering and wasn’t too pleased due to the excessive amount of design, stakeholder analysis, writing reports, etc.

I need to make a decision ASAP. My current alternative is a double degree in CS + Maths/Stats. 

I really need some perspectives to help me decide?",True,False,False,AskEngineers,t5_2sebk,283490,public,self,Is EE suited to me if I only love maths and theory?,0,[],1.0,https://www.reddit.com/r/AskEngineers/comments/xau2ux/is_ee_suited_to_me_if_i_only_love_maths_and_theory/,all_ads,6,,,,,,,,,,
36,[],False,YourQuirk,,[],,text,t2_jwu5zxp,False,False,False,[],False,False,1662824718,self.AskEngineers,https://www.reddit.com/r/AskEngineers/comments/xasiu4/what_is_engineers_who_build_caves_and_bunkers/,{},xasiu4,False,True,False,False,False,True,True,False,,blue,[],b251a614-57f9-11e4-b47b-12313b0e9678,Discussion,dark,text,False,False,False,0,0,False,all_ads,/r/AskEngineers/comments/xasiu4/what_is_engineers_who_build_caves_and_bunkers/,False,6,1662824729,1,"Weird question but what is the name of someone who for example can do explody things to create caves and bunkers inside mountains and similar? I´ve tried looking it up but don´t even know what to google for.  


Thank you for your time!",True,False,False,AskEngineers,t5_2sebk,283490,public,self,What is engineers who build caves and bunkers called?,0,[],1.0,https://www.reddit.com/r/AskEngineers/comments/xasiu4/what_is_engineers_who_build_caves_and_bunkers/,all_ads,6,,,,,,,,,,
37,[],False,titebotine,,[],Hydraulic Engineer,text,t2_gggpb,False,False,False,[],False,False,1662822808,self.AskEngineers,https://www.reddit.com/r/AskEngineers/comments/xars79/what_does_this_symbol_on_a_power_outlet_adapter/,{},xars79,False,True,False,False,False,True,True,False,,purple,[],3a6acd0c-fd28-11e6-ab41-0edc7e2b18fe,Electrical,dark,text,False,False,True,0,0,False,all_ads,/r/AskEngineers/comments/xars79/what_does_this_symbol_on_a_power_outlet_adapter/,False,6,1662822818,1,https://i.imgur.com/PnxkLbe.jpg,True,False,False,AskEngineers,t5_2sebk,283488,public,self,What does this symbol on a power outlet adapter / transformer mean ?,0,[],1.0,https://www.reddit.com/r/AskEngineers/comments/xars79/what_does_this_symbol_on_a_power_outlet_adapter/,all_ads,6,,,,,self,"{'enabled': False, 'images': [{'id': 'QEXEgpm-hFncuANSXU-hnaf-m5s7wv6dQVG2LX2rXQk', 'resolutions': [{'height': 126, 'url': 'https://external-preview.redd.it/ej6OY4EPVtCpFKDYzSmVHzcm97G2m3WfvvS2xD6HsNw.jpg?width=108&amp;crop=smart&amp;auto=webp&amp;s=4b663da1f0769265f7561628d98800916ebf129a', 'width': 108}, {'height': 252, 'url': 'https://external-preview.redd.it/ej6OY4EPVtCpFKDYzSmVHzcm97G2m3WfvvS2xD6HsNw.jpg?width=216&amp;crop=smart&amp;auto=webp&amp;s=e904f16f07204d59a738dcc6f4618ce67b0c9c84', 'width': 216}, {'height': 373, 'url': 'https://external-preview.redd.it/ej6OY4EPVtCpFKDYzSmVHzcm97G2m3WfvvS2xD6HsNw.jpg?width=320&amp;crop=smart&amp;auto=webp&amp;s=3a6de6d5b335cbbc5d63aab606483daac865f60d', 'width': 320}, {'height': 747, 'url': 'https://external-preview.redd.it/ej6OY4EPVtCpFKDYzSmVHzcm97G2m3WfvvS2xD6HsNw.jpg?width=640&amp;crop=smart&amp;auto=webp&amp;s=550cb5d5e01ab3bb9318c79fd811e7e7adbfd2f0', 'width': 640}, {'height': 1121, 'url': 'https://external-preview.redd.it/ej6OY4EPVtCpFKDYzSmVHzcm97G2m3WfvvS2xD6HsNw.jpg?width=960&amp;crop=smart&amp;auto=webp&amp;s=1c57a74b844a96b63183f1189f84f3dc4457c229', 'width': 960}, {'height': 1262, 'url': 'https://external-preview.redd.it/ej6OY4EPVtCpFKDYzSmVHzcm97G2m3WfvvS2xD6HsNw.jpg?width=1080&amp;crop=smart&amp;auto=webp&amp;s=75d18f6d12b2602d18287ad1373451e351ea29bd', 'width': 1080}], 'source': {'height': 3590, 'url': 'https://external-preview.redd.it/ej6OY4EPVtCpFKDYzSmVHzcm97G2m3WfvvS2xD6HsNw.jpg?auto=webp&amp;s=65c14bdbf4a9572b17411ebf9524f7b69eafcd08', 'width': 3072}, 'variants': {}}]}",,dark,,
38,[],False,dongo24,,[],,text,t2_42b657fp,False,False,False,[],False,False,1662822548,self.AskEngineers,https://www.reddit.com/r/AskEngineers/comments/xarolr/maritime_engineers_what_is_this_and_what_did_it_do/,{},xarolr,False,False,False,False,False,False,True,False,,blue,[],b251a614-57f9-11e4-b47b-12313b0e9678,Discussion,dark,text,False,False,True,1,0,False,all_ads,/r/AskEngineers/comments/xarolr/maritime_engineers_what_is_this_and_what_did_it_do/,False,6,1662822558,1,[removed],True,False,False,AskEngineers,t5_2sebk,283487,public,self,Maritime Engineers - What is this and what did it do?,0,[],1.0,https://www.reddit.com/r/AskEngineers/comments/xarolr/maritime_engineers_what_is_this_and_what_did_it_do/,all_ads,6,moderator,,,,self,"{'enabled': False, 'images': [{'id': 'AXxLrQzSkN5ElH_fEo27vnj4FZHiFMKaBZDxLVyjqrw', 'resolutions': [{'height': 144, 'url': 'https://external-preview.redd.it/Q8WYDKH_ZRE4knR-raAs7gKfT9fN5cVAz21wFFT-4-g.jpg?width=108&amp;crop=smart&amp;auto=webp&amp;s=11dc18015215043b3992ca817365ec7680f3b9b5', 'width': 108}, {'height': 288, 'url': 'https://external-preview.redd.it/Q8WYDKH_ZRE4knR-raAs7gKfT9fN5cVAz21wFFT-4-g.jpg?width=216&amp;crop=smart&amp;auto=webp&amp;s=6e650eb2acaf68f64edd5d48853c23f0836366c1', 'width': 216}, {'height': 426, 'url': 'https://external-preview.redd.it/Q8WYDKH_ZRE4knR-raAs7gKfT9fN5cVAz21wFFT-4-g.jpg?width=320&amp;crop=smart&amp;auto=webp&amp;s=169f3a838d94855b669c4380c1da58a91815e0d6', 'width': 320}], 'source': {'height': 800, 'url': 'https://external-preview.redd.it/Q8WYDKH_ZRE4knR-raAs7gKfT9fN5cVAz21wFFT-4-g.jpg?auto=webp&amp;s=c5c4d64aa279e0be578daabbc540b39bc06dc54a', 'width': 600}, 'variants': {}}]}",,,,
39,[],False,kournworm,,[],,text,t2_r556szyw,False,False,False,[],False,False,1662822491,self.AskEngineers,https://www.reddit.com/r/AskEngineers/comments/xarntf/thoughts_on_wsp_as_a_first_company/,{},xarntf,False,True,False,False,False,True,True,False,,blue,[],b251a614-57f9-11e4-b47b-12313b0e9678,Discussion,dark,text,False,False,False,0,0,False,all_ads,/r/AskEngineers/comments/xarntf/thoughts_on_wsp_as_a_first_company/,False,6,1662822502,1,"Hi. I’ve been offered a job at wsp on the graduate programme. They seem fairly decent. And as they’re huge I’m hoping I’ll get opportunities to see different areas of the business and learn a lot for my career. 

Not sure entirely where I want my long term career to go yet. 

Anyone got any thoughts on them as a firm to start out with?",True,False,False,AskEngineers,t5_2sebk,283487,public,self,Thoughts on wsp as a first company?,0,[],1.0,https://www.reddit.com/r/AskEngineers/comments/xarntf/thoughts_on_wsp_as_a_first_company/,all_ads,6,,,,,,,,,,
40,[],False,dongo24,,[],,text,t2_42b657fp,False,False,False,[],False,False,1662822467,self.AskEngineers,https://www.reddit.com/r/AskEngineers/comments/xarnhk/maritime_enginners_what_is_this_and_what_did_it_do/,{},xarnhk,False,False,False,False,False,False,True,False,,blue,[],90a1d45a-3f64-11e5-8667-0e60d8112001,Mechanical,dark,text,False,False,True,1,0,False,all_ads,/r/AskEngineers/comments/xarnhk/maritime_enginners_what_is_this_and_what_did_it_do/,False,6,1662822478,1,[removed],True,False,False,AskEngineers,t5_2sebk,283487,public,self,Maritime Enginners - What is this and what did it do?,0,[],1.0,https://www.reddit.com/r/AskEngineers/comments/xarnhk/maritime_enginners_what_is_this_and_what_did_it_do/,all_ads,6,moderator,,,,self,"{'enabled': False, 'images': [{'id': 'AXxLrQzSkN5ElH_fEo27vnj4FZHiFMKaBZDxLVyjqrw', 'resolutions': [{'height': 144, 'url': 'https://external-preview.redd.it/Q8WYDKH_ZRE4knR-raAs7gKfT9fN5cVAz21wFFT-4-g.jpg?width=108&amp;crop=smart&amp;auto=webp&amp;s=11dc18015215043b3992ca817365ec7680f3b9b5', 'width': 108}, {'height': 288, 'url': 'https://external-preview.redd.it/Q8WYDKH_ZRE4knR-raAs7gKfT9fN5cVAz21wFFT-4-g.jpg?width=216&amp;crop=smart&amp;auto=webp&amp;s=6e650eb2acaf68f64edd5d48853c23f0836366c1', 'width': 216}, {'height': 426, 'url': 'https://external-preview.redd.it/Q8WYDKH_ZRE4knR-raAs7gKfT9fN5cVAz21wFFT-4-g.jpg?width=320&amp;crop=smart&amp;auto=webp&amp;s=169f3a838d94855b669c4380c1da58a91815e0d6', 'width': 320}], 'source': {'height': 800, 'url': 'https://external-preview.redd.it/Q8WYDKH_ZRE4knR-raAs7gKfT9fN5cVAz21wFFT-4-g.jpg?auto=webp&amp;s=c5c4d64aa279e0be578daabbc540b39bc06dc54a', 'width': 600}, 'variants': {}}]}",,,,
