,all_awardings,allow_live_comments,author,author_flair_css_class,author_flair_richtext,author_flair_text,author_flair_type,author_fullname,author_is_blocked,author_patreon_flair,author_premium,awarders,can_mod_post,contest_mode,created_utc,domain,full_link,gildings,id,is_created_from_ads_ui,is_crosspostable,is_meta,is_original_content,is_reddit_media_domain,is_robot_indexable,is_self,is_video,link_flair_background_color,link_flair_css_class,link_flair_richtext,link_flair_template_id,link_flair_text,link_flair_text_color,link_flair_type,locked,media_only,no_follow,num_comments,num_crossposts,over_18,parent_whitelist_status,permalink,pinned,pwls,removed_by_category,retrieved_on,score,selftext,send_replies,spoiler,stickied,subreddit,subreddit_id,subreddit_subscribers,subreddit_type,thumbnail,title,total_awards_received,treatment_tags,upvote_ratio,url,whitelist_status,wls,post_hint,preview,author_flair_background_color,author_flair_template_id,author_flair_text_color
22,[],False,Death_Star_,,[],,text,t2_box44,False,False,False,[],False,False,1659498799,self.AskEngineers,https://www.reddit.com/r/AskEngineers/comments/wew67u/ive_been_trying_to_keep_this_vertical_fixture/,{},wew67u,False,True,False,False,False,True,True,False,,orange,[],939137fa-3f64-11e5-b90e-0ef63926eacd,Civil,dark,text,False,False,True,0,0,False,all_ads,/r/AskEngineers/comments/wew67u/ive_been_trying_to_keep_this_vertical_fixture/,False,6,,1659498809,1,"So, I’ve been trying to keep this paper towel dispenser affixed to my bed post. It’s where I want it, it’s the dispenser I want, i don’t want to try doing anything else unless it has these two constraints. I’m open to changing other parts to make it work. Preferably I’d like to keep the paper towel roll aligned so that I pull from the left with my right hand, but I can pull from the right. 

Pics:

https://ibb.co/album/2g2VQr

My questions:

1. How should I be pulling to put the least amount of “pull force/strain” on the dispenser? (To maintain adhesion, I hate having to fix it every few months)

2. Does it matter if I’m also pulling slightly angled up or down vs. in a direction perfectly perpendicular to the post?

I’m using the strongest double-sided bonding tape available, I’d rather not gorilla glue it but I can do that if last resort. I am not drilling it. 


Note: this is completely sincere and not satire. I simply just want to understand what I’m doing wrong and what I should try instead. Also, please trust that I’ve read all the sub rules, very diligently, and I’ve done all the searching and self-learning on this, but literally my brain doesn’t have the knack or intuition on this. 

And to preempt any “why do you care so much to understand this, couldn’t you just __________ instead” remarks, I’m going to say that it should be encouraged for people to try understand things (esp STEM stuff), no matter how obvious it may be to others :)

Thanks!",True,False,False,AskEngineers,t5_2sebk,280275,public,self,"I’ve been trying to keep this vertical fixture attached to its foundation, but I can’t figure out what I’m doing wrong. Can any engineers help me here?",0,[],1.0,https://www.reddit.com/r/AskEngineers/comments/wew67u/ive_been_trying_to_keep_this_vertical_fixture/,all_ads,6,self,"{'enabled': False, 'images': [{'id': 'L45P01JMpDvVb7lPN1ZiR8Kj4nBw_KKDu5nBUqK0EfI', 'resolutions': [{'height': 209, 'url': 'https://external-preview.redd.it/g8K-Wb24ZZDAUf4vyInY9MeaHioZCZpJlS5fvCypRbk.jpg?width=108&amp;crop=smart&amp;auto=webp&amp;s=50a186ac2c9539c632efe4180b8557b078456009', 'width': 108}, {'height': 419, 'url': 'https://external-preview.redd.it/g8K-Wb24ZZDAUf4vyInY9MeaHioZCZpJlS5fvCypRbk.jpg?width=216&amp;crop=smart&amp;auto=webp&amp;s=587348e708a180f03654d02ed35f69035a212206', 'width': 216}, {'height': 621, 'url': 'https://external-preview.redd.it/g8K-Wb24ZZDAUf4vyInY9MeaHioZCZpJlS5fvCypRbk.jpg?width=320&amp;crop=smart&amp;auto=webp&amp;s=6268e9e75c83198919922d25a0fbea82ed33264f', 'width': 320}, {'height': 1242, 'url': 'https://external-preview.redd.it/g8K-Wb24ZZDAUf4vyInY9MeaHioZCZpJlS5fvCypRbk.jpg?width=640&amp;crop=smart&amp;auto=webp&amp;s=7438d66f98d87d087aea86fb274b1cf0f0825cd7', 'width': 640}], 'source': {'height': 1242, 'url': 'https://external-preview.redd.it/g8K-Wb24ZZDAUf4vyInY9MeaHioZCZpJlS5fvCypRbk.jpg?auto=webp&amp;s=39fe6c46da2fd9ba0beecb20e61f8a558cfce42e', 'width': 640}, 'variants': {}}]}",,,
23,[],False,Defiant-Travel8174,,[],,text,t2_jf621761,False,False,False,[],False,False,1659497732,self.AskEngineers,https://www.reddit.com/r/AskEngineers/comments/wevtt8/active_aero_for_down_force_mid_corner_on_a/,{},wevtt8,False,True,False,False,False,True,True,False,,blue,[],b251a614-57f9-11e4-b47b-12313b0e9678,Discussion,dark,text,False,False,True,0,0,False,all_ads,/r/AskEngineers/comments/wevtt8/active_aero_for_down_force_mid_corner_on_a/,False,6,,1659497743,1,"Let me start off with saying I'm just a uneducated idiot with a learning disability. But I was wondering if you could have winglets mounted on the lower side of the motorcycle. that deploy out on both sides when in a braking zone and retract on the inside of the bike during a corner, generating down force mid corner and retracting in the straits. I would love it if someone could do the math and show how much down force could be generated at a bikes max lean angle and if it would justify the increased weight and complexity.

Thank you for your time, 

Andrew",True,False,False,AskEngineers,t5_2sebk,280271,public,self,active aero for down force mid corner on a motorcycle,0,[],1.0,https://www.reddit.com/r/AskEngineers/comments/wevtt8/active_aero_for_down_force_mid_corner_on_a/,all_ads,6,,,,,
24,[],False,fiksum20,,[],,text,t2_7to90z4j,False,False,False,[],False,False,1659497161,self.AskEngineers,https://www.reddit.com/r/AskEngineers/comments/wevmo0/how_to_tactfully_convey_that_my_colleague_needs/,{},wevmo0,False,True,False,False,False,True,True,False,,blue,[],b251a614-57f9-11e4-b47b-12313b0e9678,Discussion,dark,text,False,False,True,0,0,False,all_ads,/r/AskEngineers/comments/wevmo0/how_to_tactfully_convey_that_my_colleague_needs/,False,6,,1659497172,1,"I have a very annoying colleague - gives a lot of excuses and tells things like ""I want to get the best expert opinion before I produce this work and I will set up a meeting with you"". This happened many times and the guy is basically a talker and not a doer. He has a different manager and this is an issue to my manager as well. How do we tactfully tell ""we need results"".",True,False,False,AskEngineers,t5_2sebk,280270,public,self,How to tactfully convey that my colleague needs to stick to his word,0,[],1.0,https://www.reddit.com/r/AskEngineers/comments/wevmo0/how_to_tactfully_convey_that_my_colleague_needs/,all_ads,6,,,,,
25,[],False,finsta,,[],,text,t2_3si17,False,False,False,[],False,False,1659496735,self.AskEngineers,https://www.reddit.com/r/AskEngineers/comments/wevhgv/cv_input_for_new_masters_xpost_from/,{},wevhgv,False,False,False,False,False,False,True,False,,red,[],a2e13d02-57f9-11e4-8c58-12313b0e9678,Career,dark,text,False,False,True,1,0,False,all_ads,/r/AskEngineers/comments/wevhgv/cv_input_for_new_masters_xpost_from/,False,6,moderator,1659496746,1,[removed],True,False,False,AskEngineers,t5_2sebk,280270,public,self,CV Input for New Masters (x-post from /r/electricalengineering),0,[],1.0,https://www.reddit.com/r/AskEngineers/comments/wevhgv/cv_input_for_new_masters_xpost_from/,all_ads,6,,,,,
26,[],False,77Diesel77,,[],,text,t2_4em66d9c,False,False,False,[],False,False,1659496619,self.AskEngineers,https://www.reddit.com/r/AskEngineers/comments/wevg1w/whats_components_would_i_need_to_pull_this_off/,{},wevg1w,False,True,False,False,False,True,True,False,,purple,[],3a6acd0c-fd28-11e6-ab41-0edc7e2b18fe,Electrical,dark,text,False,False,True,0,0,False,all_ads,/r/AskEngineers/comments/wevg1w/whats_components_would_i_need_to_pull_this_off/,False,6,,1659496629,1,"Id like to power 3 LED lights from USB. Only one of which will ever be on at a time. Press a button, light 1 goes on, press the same button again, light 2, again, light 3, again light 1.

Its been a loooong time since ive played with logic gates (mech eng). I know i could do this in about 20 seconds with an arduino, but that seems like overkill. It feels like i need some kind of memory here??? Maybe? 

Id like to wire this up with just some logic gates and protoboard.",True,False,False,AskEngineers,t5_2sebk,280269,public,self,Whats components would i need to pull this off?,0,[],1.0,https://www.reddit.com/r/AskEngineers/comments/wevg1w/whats_components_would_i_need_to_pull_this_off/,all_ads,6,,,,,
27,[],False,Neat_Trouble_7233,,[],,text,t2_i9a6a113,False,False,False,[],False,False,1659494582,self.AskEngineers,https://www.reddit.com/r/AskEngineers/comments/weuqoy/career_advice_dealing_with_a_harsh_manager/,{},weuqoy,False,False,False,False,False,False,True,False,,red,[],a2e13d02-57f9-11e4-8c58-12313b0e9678,Career,dark,text,False,False,True,1,0,False,all_ads,/r/AskEngineers/comments/weuqoy/career_advice_dealing_with_a_harsh_manager/,False,6,moderator,1659494593,1,[removed],True,False,False,AskEngineers,t5_2sebk,280269,public,self,Career Advice: Dealing with a harsh manager,0,[],1.0,https://www.reddit.com/r/AskEngineers/comments/weuqoy/career_advice_dealing_with_a_harsh_manager/,all_ads,6,,,,,
28,[],False,Goose_Season,,[],,text,t2_3d0gcth1,False,False,False,[],False,False,1659494332,self.AskEngineers,https://www.reddit.com/r/AskEngineers/comments/weunja/how_the_hecking_heck_do_i_increase_vibration/,{},weunja,False,True,False,False,False,True,True,False,,blue,[],90a1d45a-3f64-11e5-8667-0e60d8112001,Mechanical,dark,text,False,False,True,0,0,False,all_ads,/r/AskEngineers/comments/weunja/how_the_hecking_heck_do_i_increase_vibration/,False,6,,1659494343,1,"I'm performing vibration testing, or at least I'm trying to, on a barcode reader installed on a piece of machinery. A design change of a structural component brought up the possibility of failure of the barcode reader.  The machinery already has a compressor, what I want to do is amplify the vibration signals from the compressor and measure the vibration output at various points throughout the instrument,
 including where the reader mounts. Once I get failure, I can define that frequency / amplitude as the failure threshold for component of interest and state how well or how poorly any similar change would perform. 

To test the widest range possible, how could I either :

A)  Control the frequency and amplitude of compressor and amplify or


B) Simulate the compressor in a controlled manner without a massive and expensive shaker table? 


The vibration generators I'm seeing don't appear to have the range and / or amplitude desired. Thank you in advance!",True,False,False,AskEngineers,t5_2sebk,280268,public,self,How the hecking heck do I increase vibration?,0,[],1.0,https://www.reddit.com/r/AskEngineers/comments/weunja/how_the_hecking_heck_do_i_increase_vibration/,all_ads,6,,,,,
29,[],False,LowerThanAverage_0,,[],,text,t2_4qnuufvc,False,False,False,[],False,False,1659493443,self.AskEngineers,https://www.reddit.com/r/AskEngineers/comments/weuccw/if_the_floor_plan_is_is_scale_1150_a0_size_but/,{},weuccw,False,True,False,False,False,True,True,False,,blue,[],90a1d45a-3f64-11e5-8667-0e60d8112001,Mechanical,dark,text,False,False,True,0,0,False,all_ads,/r/AskEngineers/comments/weuccw/if_the_floor_plan_is_is_scale_1150_a0_size_but/,False,6,,1659493454,1,,True,False,False,AskEngineers,t5_2sebk,280264,public,self,"If the floor plan is is scale 1:150 (A0 size) but printed in A1 size paper, what ruler scale should I use",0,[],1.0,https://www.reddit.com/r/AskEngineers/comments/weuccw/if_the_floor_plan_is_is_scale_1150_a0_size_but/,all_ads,6,,,,,
30,[],False,lillyjb,,[],,text,t2_5eqja,False,False,False,[],False,False,1659493359,self.AskEngineers,https://www.reddit.com/r/AskEngineers/comments/weubba/is_it_normal_to_withhold_information_from_newer/,{},weubba,False,True,False,False,False,True,True,False,,blue,[],b251a614-57f9-11e4-b47b-12313b0e9678,Discussion,dark,text,False,False,True,0,0,False,all_ads,/r/AskEngineers/comments/weubba/is_it_normal_to_withhold_information_from_newer/,False,6,,1659493369,1,"I recently started a new position at a large company and I'm finding that many of the other engineers and/or management are reluctant to share even the most trivial information with me. Some of the withheld information is fairly critical to my job duties such as pressure monitoring locations, past project records, and customer data.

Someone at the company told me that this was a *right of passage* and that it's *job security* for existing employees to withhold information from newer ones.

Is this a normal practice? I've been in my industry for about 6 years as a consultant and have worked with a variety of companies but have never experienced this before. It seems to be a somewhat toxic work environment with a higher than normal turnover rate... Should I suck it up or run?",True,False,False,AskEngineers,t5_2sebk,280264,public,self,"Is it normal to withhold information from newer engineers to ""watch them struggle""?",0,[],1.0,https://www.reddit.com/r/AskEngineers/comments/weubba/is_it_normal_to_withhold_information_from_newer/,all_ads,6,,,,,
31,[],False,Harry-le-Roy,,[],,text,t2_16fv33,False,False,False,[],False,False,1659491115,self.AskEngineers,https://www.reddit.com/r/AskEngineers/comments/wetj2g/zeer_pots_what_does_the_sand_do/,{},wetj2g,False,True,False,False,False,True,True,False,,blue,[],90a1d45a-3f64-11e5-8667-0e60d8112001,Mechanical,dark,text,False,False,True,0,0,False,all_ads,/r/AskEngineers/comments/wetj2g/zeer_pots_what_does_the_sand_do/,False,6,,1659491125,1,"I'm thinking through a design for an evaporative-cooling project, based on [a zeer pot](https://en.m.wikipedia.org/wiki/Pot-in-pot_refrigerator). I'm looking for ways to save weight. I'm trying to think through the implications of foregoing sand, and simply creating a stable space for water between the outer and inner vessels. Is the sand doing anything in terms of capillarity, or as a thermal mass, or anything else. Ultimately, am I somehow interfering with its cooling properties by just filling the space with water?",True,False,False,AskEngineers,t5_2sebk,280260,public,self,Zeer pots: What does the sand do?,0,[],1.0,https://www.reddit.com/r/AskEngineers/comments/wetj2g/zeer_pots_what_does_the_sand_do/,all_ads,6,self,"{'enabled': False, 'images': [{'id': 'dbACVsZg2T8y0_tjkLBrseiI9xzuGigJIAALNv0CTOg', 'resolutions': [{'height': 81, 'url': 'https://external-preview.redd.it/_nlehgPDvCtjXYLyOEaR9nnC3fG8H4mX37P6RvNrheo.jpg?width=108&amp;crop=smart&amp;auto=webp&amp;s=029cab5b48bc4ce4838bd42e21d03e7466d8fffd', 'width': 108}, {'height': 162, 'url': 'https://external-preview.redd.it/_nlehgPDvCtjXYLyOEaR9nnC3fG8H4mX37P6RvNrheo.jpg?width=216&amp;crop=smart&amp;auto=webp&amp;s=bf795b982da2b1c4e9ae1eb984f5def5f1775d76', 'width': 216}, {'height': 240, 'url': 'https://external-preview.redd.it/_nlehgPDvCtjXYLyOEaR9nnC3fG8H4mX37P6RvNrheo.jpg?width=320&amp;crop=smart&amp;auto=webp&amp;s=c348251ccdb865de56c2221bf26885a571517395', 'width': 320}, {'height': 480, 'url': 'https://external-preview.redd.it/_nlehgPDvCtjXYLyOEaR9nnC3fG8H4mX37P6RvNrheo.jpg?width=640&amp;crop=smart&amp;auto=webp&amp;s=869c064cc6470452fccf793c8025867f8e2c900c', 'width': 640}, {'height': 720, 'url': 'https://external-preview.redd.it/_nlehgPDvCtjXYLyOEaR9nnC3fG8H4mX37P6RvNrheo.jpg?width=960&amp;crop=smart&amp;auto=webp&amp;s=f43092388a2a53d3ea614bf320ac262d670c780e', 'width': 960}, {'height': 810, 'url': 'https://external-preview.redd.it/_nlehgPDvCtjXYLyOEaR9nnC3fG8H4mX37P6RvNrheo.jpg?width=1080&amp;crop=smart&amp;auto=webp&amp;s=cfc2e20583e24a6505a173ca5cd635168663d3b1', 'width': 1080}], 'source': {'height': 900, 'url': 'https://external-preview.redd.it/_nlehgPDvCtjXYLyOEaR9nnC3fG8H4mX37P6RvNrheo.jpg?auto=webp&amp;s=5871ba3934b05cbd269fb5e3d7d5ed0aa8bb05d5', 'width': 1200}, 'variants': {}}]}",,,
32,[],False,AQUARIUS_Great,,[],,text,t2_8npi80c2,False,False,False,[],False,False,1659490461,self.AskEngineers,https://www.reddit.com/r/AskEngineers/comments/wetar7/contactor_wiring_on_custom_high_power_ebike_build/,{},wetar7,False,True,False,False,False,True,True,False,,purple,[],3a6acd0c-fd28-11e6-ab41-0edc7e2b18fe,Electrical,dark,text,False,False,False,0,0,False,all_ads,/r/AskEngineers/comments/wetar7/contactor_wiring_on_custom_high_power_ebike_build/,False,6,,1659490472,1," hello. so i am building a custom ebike project and it is coming along pretty good but i have a question about the contactor im gonna use which i have searched up on google but i couldn't find a definitive answer. basically i am using a TE Connectivity EV200AAANA Contactor. (DATASHEET BELOW). and i noticed that on the main terminals there is +A1 and -A2. On datasheet it says A1 ""+"" positive terminals and A2 ""-"" Negative terminal. i thought on relays polarity didn't matter on switching part. i thought i would hook up positive from battery to A1 and positive to controller on A2. Is this correct?[https://www.te.com/commerce/DocumentDelivery/DDEController?Action=showdoc&amp;DocId=Catalog+Section%7FEV200\_R\_TBD\_KILOVAC\_EV200\_Ser\_Contactors%7F0807%7Fpdf%7FEnglish%7FENG\_CS\_EV200\_R\_TBD\_KILOVAC\_EV200\_Ser\_Contactors\_0807.pdf%7F1618002-7](https://www.te.com/commerce/DocumentDelivery/DDEController?Action=showdoc&amp;DocId=Catalog+Section%7FEV200_R_TBD_KILOVAC_EV200_Ser_Contactors%7F0807%7Fpdf%7FEnglish%7FENG_CS_EV200_R_TBD_KILOVAC_EV200_Ser_Contactors_0807.pdf%7F1618002-7) DATASHEET

Specs - 72v nominal, 84v Max 150A max.",True,False,False,AskEngineers,t5_2sebk,280259,public,self,Contactor Wiring On Custom HIGH POWER Ebike Build,0,[],1.0,https://www.reddit.com/r/AskEngineers/comments/wetar7/contactor_wiring_on_custom_high_power_ebike_build/,all_ads,6,,,,,
33,[],False,Austins-Reddit,,[],,text,t2_5ak4fkae,False,False,False,[],False,False,1659489739,self.AskEngineers,https://www.reddit.com/r/AskEngineers/comments/wet1la/did_i_make_a_mistake_masters_engineering/,{},wet1la,False,True,False,False,False,True,True,False,,red,[],a2e13d02-57f9-11e4-8c58-12313b0e9678,Career,dark,text,False,False,True,0,0,False,all_ads,/r/AskEngineers/comments/wet1la/did_i_make_a_mistake_masters_engineering/,False,6,,1659489749,1,"I started a Masters degree at Duke this year and was accepted into their engineering management program (overall, \~65K for the program). My employer is paying for half of it. I have about 2.5 years of FT experience in an engineering technical role. 

Recently, I was promoted to an Engineering Supervisor at my company and manage a team of 15 which is great. The degree has ""enlightened"" me some, and I've made some connections, but I feel like I could do what I need to without this degree.. I'm sure I will learn some useful things, but nothing worth the price I couldn't figure out through experience..

Although the Duke name does carry weight, I get the feeling I shouldn't be putting son much tuition money towards it. The Engineering Management degree certainly does not carry as much weight as the Fuqua MBA. Just feeling a little down on it, I feel like I'm semi wasting my time and money. Would it even be worth to stop? I'm 25% of the way done.. probably not.

I enjoy the classes I am taking and have learned a lot so far, especially some electives I am interested in. I'm getting cold feet lol, losing my motivation at the moment because it feels slightly meaningless.

Things could be worse, not the worst problem to have I guess. :)",True,False,False,AskEngineers,t5_2sebk,280258,public,self,Did I Make a Mistake? Masters Engineering Management Degree,0,[],1.0,https://www.reddit.com/r/AskEngineers/comments/wet1la/did_i_make_a_mistake_masters_engineering/,all_ads,6,,,,,
34,[],False,Air_Uzair,,[],,text,t2_5hmks5ox,False,False,False,[],False,False,1659487501,self.AskEngineers,https://www.reddit.com/r/AskEngineers/comments/wes8r0/whats_the_difference_between_mechanical/,{},wes8r0,False,True,False,False,False,True,True,False,,red,[],a2e13d02-57f9-11e4-8c58-12313b0e9678,Career,dark,text,False,False,True,0,0,False,all_ads,/r/AskEngineers/comments/wes8r0/whats_the_difference_between_mechanical/,False,6,,1659487511,1,Currently switching majors from health sciences and would love to work in the automotive industry. I've always been below avg at math so I was considering MET which is ABET accredited at my college. Would it be harder landing a job with this degree or do employers not really care if they were looking for a ME degree?,True,False,False,AskEngineers,t5_2sebk,280253,public,self,What's the difference between Mechanical Engineering and Mechanical Engineering Technology?,0,[],1.0,https://www.reddit.com/r/AskEngineers/comments/wes8r0/whats_the_difference_between_mechanical/,all_ads,6,,,,,
35,[],False,Correct_Librarian_87,,[],,text,t2_qfewcjie,False,False,False,[],False,False,1659483170,self.AskEngineers,https://www.reddit.com/r/AskEngineers/comments/weqn1o/any_advice_for_whats_the_right_path_for_me/,{},weqn1o,False,False,False,False,False,False,True,False,,red,[],a2e13d02-57f9-11e4-8c58-12313b0e9678,Career,dark,text,False,False,True,1,0,False,all_ads,/r/AskEngineers/comments/weqn1o/any_advice_for_whats_the_right_path_for_me/,False,6,moderator,1659483181,1,[removed],True,False,False,AskEngineers,t5_2sebk,280257,public,self,Any advice for what's the right path for me? College student struggling to find my way.,0,[],1.0,https://www.reddit.com/r/AskEngineers/comments/weqn1o/any_advice_for_whats_the_right_path_for_me/,all_ads,6,,,,,
36,[],False,Haleakala1998,,[],Mechanical ,text,t2_q9shsiw,False,False,False,[],False,False,1659481870,self.AskEngineers,https://www.reddit.com/r/AskEngineers/comments/weq5bp/is_it_a_good_career_choice_to_move_to_the_us/,{},weq5bp,False,True,False,False,False,True,True,False,,red,[],a2e13d02-57f9-11e4-8c58-12313b0e9678,Career,dark,text,False,False,True,0,0,False,all_ads,/r/AskEngineers/comments/weq5bp/is_it_a_good_career_choice_to_move_to_the_us/,False,6,,1659481880,1,"I will graduate with a MSc in mechanical engineering soon from a European university. I have dual European/US citizenship but long term will stay in Europe I think. I know in general the pay for engineers is better in the US than Europe, is it a good idea to go there for a few years to get experience/save up money before returning to Europe? (Either biomedical or aerospace sector)",True,False,False,AskEngineers,t5_2sebk,280255,public,self,is it a good career choice to move to the us?,0,[],1.0,https://www.reddit.com/r/AskEngineers/comments/weq5bp/is_it_a_good_career_choice_to_move_to_the_us/,all_ads,6,,,#d3d6da,2238776c-d04a-11e6-8ad9-0eff92f5bd12,dark
37,[],False,New_Jammy,,[],,text,t2_lou08wo,False,False,False,[],False,False,1659480869,self.AskEngineers,https://www.reddit.com/r/AskEngineers/comments/weprjm/what_is_external_static_pressure_and_how_can_it/,{},weprjm,False,True,False,False,False,True,True,False,,blue,[],90a1d45a-3f64-11e5-8667-0e60d8112001,Mechanical,dark,text,False,False,True,0,0,False,all_ads,/r/AskEngineers/comments/weprjm/what_is_external_static_pressure_and_how_can_it/,False,6,,1659480880,1,,True,False,False,AskEngineers,t5_2sebk,280255,public,self,What is external static pressure? And how can it increase or decrease? HVAC,0,[],1.0,https://www.reddit.com/r/AskEngineers/comments/weprjm/what_is_external_static_pressure_and_how_can_it/,all_ads,6,,,,,
38,[],False,Defiant-Travel8174,,[],,text,t2_jf621761,False,False,False,[],False,False,1659477612,self.AskEngineers,https://www.reddit.com/r/AskEngineers/comments/weoh14/active_tire_pressure_system/,{},weoh14,False,True,False,False,False,True,True,False,,blue,[],b251a614-57f9-11e4-b47b-12313b0e9678,Discussion,dark,text,False,False,True,0,0,False,all_ads,/r/AskEngineers/comments/weoh14/active_tire_pressure_system/,False,6,,1659477624,1," 

HI! Let me start off with saying I'm just a uneducated idiot. But I have been wondering about using a system that would very the individual tire pressures during a corner to spread out the contact patch (not so much so it reduces traction) and on straits reduce the rolling resistance by increasing tire pressure. the pressure could be used to absorb race track imperfections and work in conjunction with the active suspension systems.

Its a fresh idea, so maybe some big brains can flush it out a little more or just say its a crap idea lol!

Thank you for your time

Andrew",True,False,False,AskEngineers,t5_2sebk,280252,public,self,active tire pressure system,0,[],1.0,https://www.reddit.com/r/AskEngineers/comments/weoh14/active_tire_pressure_system/,all_ads,6,,,,,
39,[],False,Defiant-Travel8174,,[],,text,t2_jf621761,False,False,False,[],False,False,1659477524,self.AskEngineers,https://www.reddit.com/r/AskEngineers/comments/weofmb/dynamic_tire_pressure/,{},weofmb,False,False,False,False,False,False,True,False,,blue,[],b251a614-57f9-11e4-b47b-12313b0e9678,Discussion,dark,text,False,False,True,1,0,False,all_ads,/r/AskEngineers/comments/weofmb/dynamic_tire_pressure/,False,6,moderator,1659477535,1,[removed],True,False,False,AskEngineers,t5_2sebk,280252,public,self,Dynamic tire pressure,0,[],1.0,https://www.reddit.com/r/AskEngineers/comments/weofmb/dynamic_tire_pressure/,all_ads,6,,,,,
