,all_awardings,allow_live_comments,author,author_flair_css_class,author_flair_richtext,author_flair_text,author_flair_type,author_fullname,author_is_blocked,author_patreon_flair,author_premium,awarders,can_mod_post,contest_mode,created_utc,domain,full_link,gildings,id,is_created_from_ads_ui,is_crosspostable,is_meta,is_original_content,is_reddit_media_domain,is_robot_indexable,is_self,is_video,link_flair_background_color,link_flair_css_class,link_flair_richtext,link_flair_template_id,link_flair_text,link_flair_text_color,link_flair_type,locked,media_only,no_follow,num_comments,num_crossposts,over_18,parent_whitelist_status,permalink,pinned,pwls,retrieved_on,score,selftext,send_replies,spoiler,stickied,subreddit,subreddit_id,subreddit_subscribers,subreddit_type,thumbnail,title,total_awards_received,treatment_tags,upvote_ratio,url,whitelist_status,wls,author_flair_background_color,author_flair_template_id,author_flair_text_color,post_hint,preview,removed_by_category
0,[],False,k-cooper252,,[],,text,t2_4yacijb9,False,False,False,[],False,False,1663898773,self.AskEngineers,https://www.reddit.com/r/AskEngineers/comments/xlkgoc/fm_quantity_take_off/,{},xlkgoc,False,True,False,False,False,True,True,False,,orange,[],939137fa-3f64-11e5-b90e-0ef63926eacd,Civil,dark,text,False,False,True,0,0,False,all_ads,/r/AskEngineers/comments/xlkgoc/fm_quantity_take_off/,False,6,1663898784,1,Ok I'm wondering if i forgot how to this properly. Linear feet of force main is only measuring on the horizontal? Even if they have to go deeper to maintain minimum cover it would only be the linear distance laid? Don't include vertical,True,False,False,AskEngineers,t5_2sebk,284353,public,self,Fm quantity take off,0,[],1.0,https://www.reddit.com/r/AskEngineers/comments/xlkgoc/fm_quantity_take_off/,all_ads,6,,,,,,
1,[],False,rauntun,,[],,text,t2_hs0fk,False,False,False,[],False,False,1663895888,self.AskEngineers,https://www.reddit.com/r/AskEngineers/comments/xljeak/is_it_hard_to_get_back_into_design_engineering/,{},xljeak,False,True,False,False,False,True,True,False,,blue,[],90a1d45a-3f64-11e5-8667-0e60d8112001,Mechanical,dark,text,False,False,True,0,0,False,all_ads,/r/AskEngineers/comments/xljeak/is_it_hard_to_get_back_into_design_engineering/,False,6,1663895899,1,"I have been working as an R&amp;D Mechanical Engineer for the past 3 years since college. I have been interviewing for an Systems Test Engineering position and I am hoping they will give me an offer. The pay raise would be significant (50%) and the work seems really interesting to me with a lot of data analysis and test design on an exciting new piece of technology. But, am I making a poor move in my career moving away from design engineering? Will it be hard to get back into design for my next role? Will I get paid less in the future as a result?",True,False,False,AskEngineers,t5_2sebk,284356,public,self,Is it hard to get back into design engineering after being in test engineering?,0,[],1.0,https://www.reddit.com/r/AskEngineers/comments/xljeak/is_it_hard_to_get_back_into_design_engineering/,all_ads,6,,,,,,
2,[],False,EngineeredCat,,[],Systems Engineering - Aerospace,text,t2_5nzu19s0,False,False,False,[],False,False,1663895713,self.AskEngineers,https://www.reddit.com/r/AskEngineers/comments/xljby5/how_to_find_fastener_reaction_loads_for_bolt/,{},xljby5,False,True,False,False,False,True,True,False,,blue,[],90a1d45a-3f64-11e5-8667-0e60d8112001,Mechanical,dark,text,False,False,True,0,0,False,all_ads,/r/AskEngineers/comments/xljby5/how_to_find_fastener_reaction_loads_for_bolt/,False,6,1663895724,1,"I have a tension fitting bolted to a heavy piece of backup structure using 4 protruding head  3/16"" fasteners shown in this diagram [https://imgur.com/a/ubkW41J](https://imgur.com/a/ubkW41J)

There is an applied load Py = 200 lb, Px = 300 lb, and Pz = 100 lb at the center of the hole bore at the top of the part. I need to get the fastener reaction loads, particularly the Rz reactions . I have 12 unknowns due each fastener having a Rx, Ry, Rz reaction component.   

Is there a quicker method than needing to put together a system of 12 equations and summing moments about each fastener to get the reaction loads?",True,False,False,AskEngineers,t5_2sebk,284356,public,self,How to find fastener reaction loads for bolt pattern by hand on this tension fitting?,0,[],1.0,https://www.reddit.com/r/AskEngineers/comments/xljby5/how_to_find_fastener_reaction_loads_for_bolt/,all_ads,6,#d3d6da,2238776c-d04a-11e6-8ad9-0eff92f5bd12,dark,self,"{'enabled': False, 'images': [{'id': 'pRhcHH0iAWjdQxJ2XlwBeBXISk1PUZp--ripnTY7D8o', 'resolutions': [{'height': 109, 'url': 'https://external-preview.redd.it/t56E2ve2HC3dJScRwgZw7r_pyAVKKgkGDvL0ta7dk20.jpg?width=108&amp;crop=smart&amp;auto=webp&amp;s=0fe55608a6b9523051ebd1ccba5fe2f33901f97e', 'width': 108}, {'height': 219, 'url': 'https://external-preview.redd.it/t56E2ve2HC3dJScRwgZw7r_pyAVKKgkGDvL0ta7dk20.jpg?width=216&amp;crop=smart&amp;auto=webp&amp;s=581cf0c7b3109bb711160f731037ca423f44130e', 'width': 216}, {'height': 325, 'url': 'https://external-preview.redd.it/t56E2ve2HC3dJScRwgZw7r_pyAVKKgkGDvL0ta7dk20.jpg?width=320&amp;crop=smart&amp;auto=webp&amp;s=97d92efd343ba3ac64248da47d9089e0b5bc9d1a', 'width': 320}], 'source': {'height': 640, 'url': 'https://external-preview.redd.it/t56E2ve2HC3dJScRwgZw7r_pyAVKKgkGDvL0ta7dk20.jpg?auto=webp&amp;s=d1d7f14d08ac2af22e2895f715011e914624085a', 'width': 630}, 'variants': {}}]}",
3,[],False,rauntun,,[],,text,t2_hs0fk,False,False,False,[],False,False,1663895609,self.AskEngineers,https://www.reddit.com/r/AskEngineers/comments/xljajg/is_it_a_bad_career_move_to_take_a_test/,{},xljajg,False,False,False,False,False,False,True,False,,blue,[],90a1d45a-3f64-11e5-8667-0e60d8112001,Mechanical,dark,text,False,False,True,1,0,False,all_ads,/r/AskEngineers/comments/xljajg/is_it_a_bad_career_move_to_take_a_test/,False,6,1663895619,1,[removed],True,False,False,AskEngineers,t5_2sebk,284355,public,self,Is it a bad career move to take a test engineering position for my second job?,0,[],1.0,https://www.reddit.com/r/AskEngineers/comments/xljajg/is_it_a_bad_career_move_to_take_a_test/,all_ads,6,,,,,,moderator
4,[],False,aedan929,,[],,text,t2_wpzlh,False,False,False,[],False,False,1663894747,self.AskEngineers,https://www.reddit.com/r/AskEngineers/comments/xliyer/stick_to_college_engineering_or_trades/,{},xliyer,False,True,False,False,False,True,True,False,,purple,[],3a6acd0c-fd28-11e6-ab41-0edc7e2b18fe,Electrical,dark,text,False,False,False,0,0,False,all_ads,/r/AskEngineers/comments/xliyer/stick_to_college_engineering_or_trades/,False,6,1663894758,1,"Hi all, I 19 years old am currently enrolled in college at Saint Louis University taking Electrical engineering.

This is quite embarrassing but I should be honest. For a while I've always wanted to be a lineman and electrician as a backup plan. However, things switched up last year for me, when I fell in love with a girl right before senior year in high school. This was dumb, but I followed my heart and ended up going to the same college as her, pursuing a degree in Electrical Engineering, something I found I would enjoy while still sticking to that Electrical niche.

As of a few days ago, we are no longer together, and things have been much different for me. It was quite damaging to me, but admittedly I feel like I am much happier now (lots of things about our relationship not appropriate for this sub). I feel that now I actually have to make a real decision again.

Currently, my academics here aren't great as I find myself struggling a lot in math whether it's in calculus, engineering, or chemistry, nor do I find too much interesting in these courses other than engineering. Part of it definitely has to do with my lack of motivation from situation but I feel as of now I can really change that up and improve much more. I do however, find myself overwhelmed by assignments, studying, and even the periods of doing nothing. I am very interested in hands on learning and thats where I specialize, physical labor and using my body a lot. Of course, that's right now and that could totally change in a few or even many years.

The school has offered me a few options as they are aware of my situation one of them includes leaving right now and being refunded, the other is a leave of absence where I can spend a year possibly starting in the trades not owing or getting any money back and still retain my enrollment, and the other would be staying but receiving the help I need to succeed.

I would really like to hear from others that faced similar situations or even just people who want to leave input as I am really stuck here in the middle with very little time left to make up my mind.

Thanks in advance.",True,False,False,AskEngineers,t5_2sebk,284353,public,self,Stick to College Engineering or Trades?,0,[],1.0,https://www.reddit.com/r/AskEngineers/comments/xliyer/stick_to_college_engineering_or_trades/,all_ads,6,,,,,,
5,[],False,aedan929,,[],,text,t2_wpzlh,False,False,False,[],False,False,1663894604,self.AskEngineers,https://www.reddit.com/r/AskEngineers/comments/xliwie/deciding_on_a_career_path_trades_or_college/,{},xliwie,False,False,False,False,False,False,True,False,,purple,[],3a6acd0c-fd28-11e6-ab41-0edc7e2b18fe,Electrical,dark,text,False,False,True,1,0,False,all_ads,/r/AskEngineers/comments/xliwie/deciding_on_a_career_path_trades_or_college/,False,6,1663894615,1,[removed],True,False,False,AskEngineers,t5_2sebk,284353,public,self,"Deciding on a Career Path, Trades or College",0,[],1.0,https://www.reddit.com/r/AskEngineers/comments/xliwie/deciding_on_a_career_path_trades_or_college/,all_ads,6,,,,,,moderator
6,[],False,lost_your_fill,,[],,text,t2_v8zd2,False,False,False,[],False,False,1663894422,self.AskEngineers,https://www.reddit.com/r/AskEngineers/comments/xlitx5/mech_engs_your_expertise_would_be_appreciated/,{},xlitx5,False,True,False,False,False,True,True,False,,blue,[],90a1d45a-3f64-11e5-8667-0e60d8112001,Mechanical,dark,text,False,False,True,0,0,False,all_ads,/r/AskEngineers/comments/xlitx5/mech_engs_your_expertise_would_be_appreciated/,False,6,1663894433,1,"Hi folks,

Looking to build a sandbox on wheels, but need some design/material/etc help.  I haven't looked at sizing, but the idea would be to make a mild steel tube/square tube frame, build the sandbox above, attach some wheels and add a DC motor to help move it.

Is this sounding very hard or straight impossible?  Any links to help understanding the structural requirements of both the frame and even the wheels would be awesome.

Thanks",True,False,False,AskEngineers,t5_2sebk,284353,public,self,mech engs: your expertise would be appreciated (building a sandbox on wheels),0,[],1.0,https://www.reddit.com/r/AskEngineers/comments/xlitx5/mech_engs_your_expertise_would_be_appreciated/,all_ads,6,,,,,,
7,[],False,final-sunset,,[],,text,t2_lu675385,False,False,False,[],False,False,1663892255,self.AskEngineers,https://www.reddit.com/r/AskEngineers/comments/xli0h7/finding_local_stem_clubs_to_donate_supplies_to/,{},xli0h7,False,False,False,False,False,False,True,False,,purple,[],6a68317a-c3cd-11e9-bf9c-0e2863fd7a72,Computer,dark,text,False,False,True,1,0,False,all_ads,/r/AskEngineers/comments/xli0h7/finding_local_stem_clubs_to_donate_supplies_to/,False,6,1663892265,1,[removed],True,False,False,AskEngineers,t5_2sebk,284350,public,self,Finding local STEM clubs to donate supplies to,0,[],1.0,https://www.reddit.com/r/AskEngineers/comments/xli0h7/finding_local_stem_clubs_to_donate_supplies_to/,all_ads,6,,,,,,moderator
8,[],False,Sheep_inAJeep,,[],,text,t2_bb60792,False,False,False,[],False,False,1663891789,self.AskEngineers,https://www.reddit.com/r/AskEngineers/comments/xlhu4u/engineers_of_reddit_what_are_the_best_colleges/,{},xlhu4u,False,False,False,False,False,False,True,False,,blue,[],90a1d45a-3f64-11e5-8667-0e60d8112001,Mechanical,dark,text,False,False,True,1,0,False,all_ads,/r/AskEngineers/comments/xlhu4u/engineers_of_reddit_what_are_the_best_colleges/,False,6,1663891800,1,[removed],True,False,False,AskEngineers,t5_2sebk,284350,public,self,"Engineers of reddit, what are the best colleges for someone wanting a mechanical engineering degree (2nd degree)",0,[],1.0,https://www.reddit.com/r/AskEngineers/comments/xlhu4u/engineers_of_reddit_what_are_the_best_colleges/,all_ads,6,,,,,,moderator
9,[],False,ThatOneGuy4378,,[],,text,t2_5v747iyg,False,False,False,[],False,False,1663891301,self.AskEngineers,https://www.reddit.com/r/AskEngineers/comments/xlhnnm/whats_the_easiest_way_to_achieve_fast_lowtorque/,{},xlhnnm,False,False,False,False,False,False,True,False,,blue,[],90a1d45a-3f64-11e5-8667-0e60d8112001,Mechanical,dark,text,False,False,True,1,0,False,all_ads,/r/AskEngineers/comments/xlhnnm/whats_the_easiest_way_to_achieve_fast_lowtorque/,False,6,1663891311,1,[removed],True,False,False,AskEngineers,t5_2sebk,284350,public,self,"What’s the Easiest Way to Achieve Fast, Low-Torque Linear Motion?",0,[],1.0,https://www.reddit.com/r/AskEngineers/comments/xlhnnm/whats_the_easiest_way_to_achieve_fast_lowtorque/,all_ads,6,,,,,,moderator
10,[],False,Danial434,,[],,text,t2_fkp5y98o,False,False,False,[],False,False,1663888478,self.AskEngineers,https://www.reddit.com/r/AskEngineers/comments/xlgko9/industrial_engineering_or_computer_engineering/,{},xlgko9,False,True,False,False,False,True,True,False,,blue,[],b251a614-57f9-11e4-b47b-12313b0e9678,Discussion,dark,text,False,False,True,0,0,False,all_ads,/r/AskEngineers/comments/xlgko9/industrial_engineering_or_computer_engineering/,False,6,1663888489,1,"Hi everyone. I've been really struggling lately about this and cannot decide which to choose.The thing is..I like both of them,I love computer and everything that are related to it and I also like Industrial engineering.
Now I have to choose between them for my future.Also I will try to immigrate to a better country in the future from mine(It's Iran if you're wondering) ...
So what is your opinion?
Which should I choose?",True,False,False,AskEngineers,t5_2sebk,284349,public,self,industrial engineering or computer engineering??,0,[],1.0,https://www.reddit.com/r/AskEngineers/comments/xlgko9/industrial_engineering_or_computer_engineering/,all_ads,6,,,,,,
11,[],False,RiddlecageMusic,,[],,text,t2_cs7xiph1,False,False,False,[],False,False,1663888467,self.AskEngineers,https://www.reddit.com/r/AskEngineers/comments/xlgkhn/a_what_if_question/,{},xlgkhn,False,False,False,False,False,False,True,False,,orange,[],939137fa-3f64-11e5-b90e-0ef63926eacd,Civil,dark,text,False,False,True,0,0,False,all_ads,/r/AskEngineers/comments/xlgkhn/a_what_if_question/,False,6,1663888477,1,[removed],True,False,False,AskEngineers,t5_2sebk,284349,public,self,A what if question,0,[],1.0,https://www.reddit.com/r/AskEngineers/comments/xlgkhn/a_what_if_question/,all_ads,6,,,,,,reddit
12,[],False,ahmad09kk,,[],,text,t2_88zw3wzr,False,False,False,[],False,False,1663887000,self.AskEngineers,https://www.reddit.com/r/AskEngineers/comments/xlfzbg/interview_advice_changing_industries_so_lack/,{},xlfzbg,False,True,False,False,False,True,True,False,,blue,[],90a1d45a-3f64-11e5-8667-0e60d8112001,Mechanical,dark,text,False,False,False,0,0,False,all_ads,/r/AskEngineers/comments/xlfzbg/interview_advice_changing_industries_so_lack/,False,6,1663887011,1,"Hello,

I currently work in the hvac industry as a mechanical designer. I have ~6 years of experience in this industry and have no experience in other industries

 I'm interviewing for a role in vehicle engineering. There's a segment of the interview that'll be technical. I can't really talk my way through that - I simply don't have the knowledge. I do have similar experience to what they're looking for though, which is what I imagine helped me get called in. For example, budgeting/project management/navigating difficult clients/etc.

I'm hoping for advice on how I navigate the technical portion of the interview. Should I straight up say ""hey, I don't have the technical knowledge you're looking for, but I started in those exact shoes 6 years ago with no knowledge of the HvAC industry and I managed to learn it. I can do it again. What I *DO* have that'll help me perform well in this role is xyz"" ? 

Or something else? I do really want this job!

TIA!",True,False,False,AskEngineers,t5_2sebk,284346,public,self,interview advice - changing industries so lack technical knowledge of the new industry,0,[],1.0,https://www.reddit.com/r/AskEngineers/comments/xlfzbg/interview_advice_changing_industries_so_lack/,all_ads,6,,,,,,
13,[],False,theredheadbitch,,[],,text,t2_rmqgem4,False,False,False,[],False,False,1663886983,self.AskEngineers,https://www.reddit.com/r/AskEngineers/comments/xlfz2o/i_am_trying_to_put_a_ups_into_a_small_air/,{},xlfz2o,False,True,False,False,False,True,True,False,,blue,[],90a1d45a-3f64-11e5-8667-0e60d8112001,Mechanical,dark,text,False,False,False,0,0,False,all_ads,/r/AskEngineers/comments/xlfz2o/i_am_trying_to_put_a_ups_into_a_small_air/,False,6,1663886994,1,"Because it’s going to be used in a cooling unit I figure it needs to be able to withstand hot/cold air and just being inside a small machine. The idea is that this small air conditioner can still work for a bit if the power goes out. Im looking for industrial suppliers where I can look for the individual parts needed. It’s a mechanical engineering project so while I don’t need to go into the actual UPS design(I can stick to suppliers), I need to ensure I have the right components for the UPS to function. NOTE : I cannot use a generator as part of this project. 

I figure I need 

- a battery (special for ups, I know I can find these on McMaster carr)
- mounting / casing for the battery 
- rectifier
- inverter 
- static bypass switch

Most info online about UPSs are more geared towards computers so I just want to make sure I’m taking the right approach. If anyone can suggest any suppliers or search terms that would be great. Thank you :)",True,False,False,AskEngineers,t5_2sebk,284346,public,self,"I am trying to put a UPS into a small air conditioner, what components do I need?",0,[],1.0,https://www.reddit.com/r/AskEngineers/comments/xlfz2o/i_am_trying_to_put_a_ups_into_a_small_air/,all_ads,6,,,,,,
14,[],False,SwimmingFox3530,,[],,text,t2_fqyfud17,False,False,False,[],False,False,1663885792,self.AskEngineers,https://www.reddit.com/r/AskEngineers/comments/xlfh73/does_mortar_adhere_to_wood_in_halftimber_houses/,{},xlfh73,False,True,False,False,False,True,True,False,,orange,[],939137fa-3f64-11e5-b90e-0ef63926eacd,Civil,dark,text,False,False,True,0,0,False,all_ads,/r/AskEngineers/comments/xlfh73/does_mortar_adhere_to_wood_in_halftimber_houses/,False,6,1663885803,1,,True,False,False,AskEngineers,t5_2sebk,284345,public,self,"Does mortar adhere to wood? In half-timber houses, is the brick infill directly mortared on the timber?",0,[],1.0,https://www.reddit.com/r/AskEngineers/comments/xlfh73/does_mortar_adhere_to_wood_in_halftimber_houses/,all_ads,6,,,,,,
15,[],False,UltronAge,,[],,text,t2_6ktwi8hl,False,False,False,[],False,False,1663885261,self.AskEngineers,https://www.reddit.com/r/AskEngineers/comments/xlf9ba/can_i_connect_my_solar_panels_to_the_public_grid/,{},xlf9ba,False,False,False,False,False,False,True,False,,orange,[],939137fa-3f64-11e5-b90e-0ef63926eacd,Civil,dark,text,False,False,True,1,0,False,all_ads,/r/AskEngineers/comments/xlf9ba/can_i_connect_my_solar_panels_to_the_public_grid/,False,6,1663885272,1,[removed],True,False,False,AskEngineers,t5_2sebk,284344,public,self,Can I connect my solar panels to the public grid? Let's say my house consumes only 100 watts but the batteries produce 3000 watts. Can I connect them to the mains so that they give 2900 watts to the network?,0,[],1.0,https://www.reddit.com/r/AskEngineers/comments/xlf9ba/can_i_connect_my_solar_panels_to_the_public_grid/,all_ads,6,,,,,,moderator
16,[],False,postkip,,[],,text,t2_m6k4f,False,False,False,[],False,False,1663881123,self.AskEngineers,https://www.reddit.com/r/AskEngineers/comments/xldi3e/company_wont_let_me_send_emails_without_being/,{},xldi3e,False,True,False,False,False,True,True,False,,blue,[],b251a614-57f9-11e4-b47b-12313b0e9678,Discussion,dark,text,False,False,True,0,0,False,all_ads,/r/AskEngineers/comments/xldi3e/company_wont_let_me_send_emails_without_being/,False,6,1663881134,1,"I'm a professional engineer with 7 years of experience.  In my last job I managed multiple projects totaling in the mid 8 figures. I recently switched jobs and recently sent an email asking for a CAD model from a contractor. I was taken aside and told that all external emails must be proofread prior to sending. Is this common? 

I feel like this is absolutely ridiculous.",True,False,False,AskEngineers,t5_2sebk,284344,public,self,Company won't let me send emails without being proofread.,0,[],1.0,https://www.reddit.com/r/AskEngineers/comments/xldi3e/company_wont_let_me_send_emails_without_being/,all_ads,6,,,,,,
17,[],False,RiddlecageMusic,,[],,text,t2_cs7xiph1,False,False,False,[],False,False,1663879027,self.AskEngineers,https://www.reddit.com/r/AskEngineers/comments/xlcl0v/question_regarding_a_random_thought_i_had/,{},xlcl0v,False,True,False,False,False,True,True,False,,orange,[],939137fa-3f64-11e5-b90e-0ef63926eacd,Civil,dark,text,False,False,True,0,0,False,all_ads,/r/AskEngineers/comments/xlcl0v/question_regarding_a_random_thought_i_had/,False,6,1663879038,1," If you were to build a dam/wall shaped as a complete circle in the middle of the ocean (which I think would be the best way to build it to maintain the pressure of the ocean on all sides), then drained it for its water inside to the point where the inside was somewhat a desert, how tall would the wall be from the bottom to top on the desert side and how thick would the wall/dam have to be to maintain the pressure?

For context, this is a dam that would be around 500 miles in diameter, enough to fit a country.

And finally, what would happen if it were to break?",True,False,False,AskEngineers,t5_2sebk,284343,public,self,Question regarding a random thought I had,0,[],1.0,https://www.reddit.com/r/AskEngineers/comments/xlcl0v/question_regarding_a_random_thought_i_had/,all_ads,6,,,,,,
18,[],False,PotatoWedgeAntilles,,[],,text,t2_kv8k3,False,False,False,[],False,False,1663878679,self.AskEngineers,https://www.reddit.com/r/AskEngineers/comments/xlcfnl/ignoring_cost_is_titanium_a_feasible_material_for/,{},xlcfnl,False,True,False,False,False,True,True,False,,blue,[],90a1d45a-3f64-11e5-8667-0e60d8112001,Mechanical,dark,text,False,False,False,0,0,False,all_ads,/r/AskEngineers/comments/xlcfnl/ignoring_cost_is_titanium_a_feasible_material_for/,False,6,1663878689,1,"Is there any properties of titanium that make is ill suited as a mold?

Thank you",True,False,False,AskEngineers,t5_2sebk,284343,public,self,"Ignoring cost, is titanium a feasible material for making the mold for die casting?",0,[],1.0,https://www.reddit.com/r/AskEngineers/comments/xlcfnl/ignoring_cost_is_titanium_a_feasible_material_for/,all_ads,6,,,,,,
19,[],False,Harsharya08,,[],,text,t2_8oblo,False,False,False,[],False,False,1663876427,self.AskEngineers,https://www.reddit.com/r/AskEngineers/comments/xlbg40/should_i_say_something_about_my_exaggerated/,{},xlbg40,False,False,False,False,False,False,True,False,,blue,[],b251a614-57f9-11e4-b47b-12313b0e9678,Discussion,dark,text,False,False,True,1,0,False,all_ads,/r/AskEngineers/comments/xlbg40/should_i_say_something_about_my_exaggerated/,False,6,1663876437,1,[removed],True,False,False,AskEngineers,t5_2sebk,284341,public,self,Should I say something about my exaggerated retail store title on my resume?,0,[],1.0,https://www.reddit.com/r/AskEngineers/comments/xlbg40/should_i_say_something_about_my_exaggerated/,all_ads,6,,,,,,moderator
20,[],False,funbuster45,,[],,text,t2_2gydzn1r,False,False,False,[],False,False,1663875627,self.AskEngineers,https://www.reddit.com/r/AskEngineers/comments/xlb3qq/is_there_a_reason_beyond_cost_why_nyc_sanitation/,{},xlb3qq,False,True,False,False,False,True,True,False,,blue,[],b251a614-57f9-11e4-b47b-12313b0e9678,Discussion,dark,text,False,False,True,0,0,False,all_ads,/r/AskEngineers/comments/xlb3qq/is_there_a_reason_beyond_cost_why_nyc_sanitation/,False,6,1663875638,1,I saw a post on IG recently that showed swaths of garbage piled on the streets and as I contemplated the idea of a sanitation strike causing that king of a problem it occurred to me that a city like that could REALLY benefit from one of those.,True,False,False,AskEngineers,t5_2sebk,284341,public,self,"Is there a reason beyond cost, why NYC sanitation doesn’t use a plasma waste converter?",0,[],1.0,https://www.reddit.com/r/AskEngineers/comments/xlb3qq/is_there_a_reason_beyond_cost_why_nyc_sanitation/,all_ads,6,,,,,,
21,[],False,Tricky-Engineering-3,,[],,text,t2_7wkscouk,False,False,False,[],False,False,1663875216,self.AskEngineers,https://www.reddit.com/r/AskEngineers/comments/xlax9m/is_electronics_and_telecom_engineering_for_my/,{},xlax9m,False,True,False,False,False,True,True,False,,purple,[],3a6acd0c-fd28-11e6-ab41-0edc7e2b18fe,Electrical,dark,text,False,False,False,0,0,False,all_ads,/r/AskEngineers/comments/xlax9m/is_electronics_and_telecom_engineering_for_my/,False,6,1663875227,1,Title,True,False,False,AskEngineers,t5_2sebk,284340,public,self,Is electronics and telecom engineering for my bachelor's a good major? Is it in demand abroad if i choose to do my masters in ECE (Electrical and Computer engineering) or Microelectronics?,0,[],1.0,https://www.reddit.com/r/AskEngineers/comments/xlax9m/is_electronics_and_telecom_engineering_for_my/,all_ads,6,,,,,,
