,all_awardings,allow_live_comments,author,author_flair_css_class,author_flair_richtext,author_flair_text,author_flair_type,author_fullname,author_is_blocked,author_patreon_flair,author_premium,awarders,can_mod_post,contest_mode,created_utc,domain,full_link,gildings,id,is_created_from_ads_ui,is_crosspostable,is_meta,is_original_content,is_reddit_media_domain,is_robot_indexable,is_self,is_video,link_flair_background_color,link_flair_css_class,link_flair_richtext,link_flair_template_id,link_flair_text,link_flair_text_color,link_flair_type,locked,media_only,no_follow,num_comments,num_crossposts,over_18,parent_whitelist_status,permalink,pinned,pwls,retrieved_on,score,selftext,send_replies,spoiler,stickied,subreddit,subreddit_id,subreddit_subscribers,subreddit_type,thumbnail,title,total_awards_received,treatment_tags,upvote_ratio,url,whitelist_status,wls,author_flair_background_color,author_flair_template_id,author_flair_text_color,post_hint,preview,removed_by_category
48,[],False,Apostieabroad,,[],,text,t2_2a942twb,False,False,False,[],False,False,1663819532,self.AskEngineers,https://www.reddit.com/r/AskEngineers/comments/xkqw74/bearing_with_internal_springs_for_suspension/,{},xkqw74,False,True,False,False,False,True,True,False,,blue,[],90a1d45a-3f64-11e5-8667-0e60d8112001,Mechanical,dark,text,False,False,False,0,0,False,all_ads,/r/AskEngineers/comments/xkqw74/bearing_with_internal_springs_for_suspension/,False,6,1663819543,1,"The following idea popped into my head this morning:

[https://imgur.com/a/XBlNJko](https://imgur.com/a/XBlNJko)

Essentially it's a bearing with an additional internal layer which houses some springs to act as a form of suspension. Travel distance would be pretty small but the application I had in mind was for mounting a bicycle wheel on its axel with the aim to be to provide a level of rider comfort comparable to that provided by the rubber tires. I'm not intending it to replace fork suspension or anything like that.

Would this work, would it achieve the desired effect, would it be durable, and would there be any negative consequences?",True,False,False,AskEngineers,t5_2sebk,284279,public,self,Bearing with internal springs for suspension?,0,[],1.0,https://www.reddit.com/r/AskEngineers/comments/xkqw74/bearing_with_internal_springs_for_suspension/,all_ads,6,,,,self,"{'enabled': False, 'images': [{'id': 'CWBkbgm1X2zulCheioFx114lJkOqvsP-h2Oolh050aI', 'resolutions': [{'height': 108, 'url': 'https://external-preview.redd.it/x8tm-iUUDfokjHZAkrgrWdxkspSMdlxF5u_JpmBX5CU.jpg?width=108&amp;crop=smart&amp;auto=webp&amp;s=5637baa88c0080e3a4c82660baa49bff3c6bd070', 'width': 108}, {'height': 216, 'url': 'https://external-preview.redd.it/x8tm-iUUDfokjHZAkrgrWdxkspSMdlxF5u_JpmBX5CU.jpg?width=216&amp;crop=smart&amp;auto=webp&amp;s=9e5d82c059a74c7ac04c8ca569d846300abd730a', 'width': 216}, {'height': 320, 'url': 'https://external-preview.redd.it/x8tm-iUUDfokjHZAkrgrWdxkspSMdlxF5u_JpmBX5CU.jpg?width=320&amp;crop=smart&amp;auto=webp&amp;s=55c4592d221e7923569dc6552238d0454006b271', 'width': 320}], 'source': {'height': 449, 'url': 'https://external-preview.redd.it/x8tm-iUUDfokjHZAkrgrWdxkspSMdlxF5u_JpmBX5CU.jpg?auto=webp&amp;s=fbf5f5a469e0a9d5e478127426ef46fe6188af75', 'width': 448}, 'variants': {}}]}",
49,[],False,SamWitch_Art,,[],,text,t2_iv4fr8kl,False,False,False,[],False,False,1663816034,self.AskEngineers,https://www.reddit.com/r/AskEngineers/comments/xkpnfq/is_it_me_or_is_it_impossible_to_find_work_after/,{},xkpnfq,False,True,False,False,False,True,True,False,,blue,[],b251a614-57f9-11e4-b47b-12313b0e9678,Discussion,dark,text,False,False,False,0,0,False,all_ads,/r/AskEngineers/comments/xkpnfq/is_it_me_or_is_it_impossible_to_find_work_after/,False,6,1663816045,1,"I graduated from UTSA with my bachelors for Mechanical engineering last year. Still 9 months later, I have applied to hundreds of positions online in and out of my field and still not getting any offers back. 
I see no updates on any of my attempts, I’d be happy to just be rejected even. 

I don’t know what I could be doing wrong to get such radio silence for my resume/degree or what I could be doing better to find opportunities for engineering in general. 

Note, I am a leg amputee and prefer to work from home if I can help it since my prosthetic wears me down the more I walk. 
I wouldn’t assume this would disqualify me from obtaining even a more basic job offer within my field, but felt it worth mentioning.

I have tried indeed, LinkedIn, monster and other job recruiting sites as well as Direct company websites looking for positions. 

Any advice on what I should do differently or where I can try next I would be forever grateful. Thank you so much for reading!",True,False,False,AskEngineers,t5_2sebk,284274,public,self,Is it me or is it impossible to find work after graduating in Mechanical Engineering?,0,[],1.0,https://www.reddit.com/r/AskEngineers/comments/xkpnfq/is_it_me_or_is_it_impossible_to_find_work_after/,all_ads,6,,,,,,
50,[],False,JohnQuincyAlias,,[],,text,t2_2gblvkgv,False,False,False,[],False,False,1663815786,self.AskEngineers,https://www.reddit.com/r/AskEngineers/comments/xkpk6h/what_bridgetunnel_has_shortened_commute_times_the/,{},xkpk6h,False,True,False,False,False,True,True,False,,orange,[],939137fa-3f64-11e5-b90e-0ef63926eacd,Civil,dark,text,False,False,True,0,0,False,all_ads,/r/AskEngineers/comments/xkpk6h/what_bridgetunnel_has_shortened_commute_times_the/,False,6,1663815797,1,"Is it necessarily the longest bridge in the world?

I just learned about the Fehmarn Belt tunnel, and the Wikipedia page says it reduces commute time from 45 min via ferry (excluding boarding/deboarding) to 7 minutes. Not too long ago I visited New River Gorge Park, and read a similar stat for that bridge.

I tried googling this question but couldn’t get an answer",True,False,False,AskEngineers,t5_2sebk,284273,public,self,What bridge/tunnel has shortened commute times the most?,0,[],1.0,https://www.reddit.com/r/AskEngineers/comments/xkpk6h/what_bridgetunnel_has_shortened_commute_times_the/,all_ads,6,,,,,,
51,[],False,SummoningRaziel,,[],,text,t2_8xrpx,False,False,False,[],False,False,1663814540,self.AskEngineers,https://www.reddit.com/r/AskEngineers/comments/xkp3lb/concept_elevated_platforms_of_crops_near_areas_of/,{},xkp3lb,False,True,False,False,False,True,True,False,,blue,[],b251a614-57f9-11e4-b47b-12313b0e9678,Discussion,dark,text,False,False,True,0,0,False,all_ads,/r/AskEngineers/comments/xkp3lb/concept_elevated_platforms_of_crops_near_areas_of/,False,6,1663814551,1,I'm be no means an engineer or a specialist any any field. I just have an idea that I would like to know if it would makes sense to ever implement. My thinking is essentially a structure  elevated above or near factories that produce a lot of CO2 emissions that is filled with cover crops. This would put the filter closer to the source of CO2 hopefully catching more in the process.  Would a regular dose of nitrogen to the crop help balance the over abundance in CO2? Is this even worth thinking about?? Idk. Might be nothing.,True,False,False,AskEngineers,t5_2sebk,284273,public,self,Concept: elevated platforms of crops near areas of high CO2 production.,0,[],1.0,https://www.reddit.com/r/AskEngineers/comments/xkp3lb/concept_elevated_platforms_of_crops_near_areas_of/,all_ads,6,,,,,,
52,[],False,hatsofftoeverything,,[],,text,t2_1ayh7j7m,False,False,False,[],False,False,1663813248,self.AskEngineers,https://www.reddit.com/r/AskEngineers/comments/xkom7n/centrifugal_pump_standards_resource/,{},xkom7n,False,True,False,False,False,True,True,False,,blue,[],90a1d45a-3f64-11e5-8667-0e60d8112001,Mechanical,dark,text,False,False,False,0,0,False,all_ads,/r/AskEngineers/comments/xkom7n/centrifugal_pump_standards_resource/,False,6,1663813258,1,"I'm fairly new to maintenance and I'm trying to learn. We work with a lot of centrifugal pumps on site and I'd love a one stop resource for learning about all the standards of centrifugal pumps. Like I learned today that most mechanical seals are standardized, no clue how! But they are for the most part. And the pump I'm rebuilding had 2 motor adapters available for it and I had no idea what they were until I googled jm210 which I guess is a standardized part. Don't get me wrong I'm not complaining, I'd just like to know what's a standardized part (in most cases) and what's not. Similar to like, apart from material a 3/8 threaded rod is a 3/8 threaded rod regardless of who you buy it from. I hope this makes sense and any help or info is appreciated!",True,False,False,AskEngineers,t5_2sebk,284272,public,self,centrifugal pump standards resource?,0,[],1.0,https://www.reddit.com/r/AskEngineers/comments/xkom7n/centrifugal_pump_standards_resource/,all_ads,6,,,,,,
53,[],False,Pandagineer,,[],,text,t2_cyw6pr3g,False,False,False,[],False,False,1663812776,self.AskEngineers,https://www.reddit.com/r/AskEngineers/comments/xkofpr/how_does_a_transistor_act_as_both_a_switch_and/,{},xkofpr,False,False,False,False,False,False,True,False,,purple,[],3a6acd0c-fd28-11e6-ab41-0edc7e2b18fe,Electrical,dark,text,False,False,True,1,0,False,all_ads,/r/AskEngineers/comments/xkofpr/how_does_a_transistor_act_as_both_a_switch_and/,False,6,1663812787,1,[removed],True,False,False,AskEngineers,t5_2sebk,284271,public,self,How does a transistor act as both a switch and amplifier?,0,[],1.0,https://www.reddit.com/r/AskEngineers/comments/xkofpr/how_does_a_transistor_act_as_both_a_switch_and/,all_ads,6,,,,,,moderator
54,[],False,bxsicallyjen,,[],,text,t2_5lrmu5zn,False,False,False,[],False,False,1663809359,self.AskEngineers,https://www.reddit.com/r/AskEngineers/comments/xkn54c/any_suggestions_on_what_to_use_on_the_random/,{},xkn54c,False,False,False,False,False,False,True,False,,green,[],1612b830-09c2-11ea-a8a8-0ea1f14b089b,Chemical,dark,text,False,False,True,1,0,False,all_ads,/r/AskEngineers/comments/xkn54c/any_suggestions_on_what_to_use_on_the_random/,False,6,1663809369,1,[removed],True,False,False,AskEngineers,t5_2sebk,284270,public,self,Any suggestions on what to use on the random packing area of acid fumes scrubber?,0,[],1.0,https://www.reddit.com/r/AskEngineers/comments/xkn54c/any_suggestions_on_what_to_use_on_the_random/,all_ads,6,,,,,,moderator
55,[],False,lovelylove_97,,[],,text,t2_jfckw8qp,False,False,False,[],False,False,1663807057,self.AskEngineers,https://www.reddit.com/r/AskEngineers/comments/xkm9pr/new_electrical_engineer_who_needs_advice/,{},xkm9pr,False,False,False,False,False,False,True,False,,blue,[],b251a614-57f9-11e4-b47b-12313b0e9678,Discussion,dark,text,False,False,True,1,0,False,all_ads,/r/AskEngineers/comments/xkm9pr/new_electrical_engineer_who_needs_advice/,False,6,1663807067,1,[removed],True,False,False,AskEngineers,t5_2sebk,284269,public,self,New Electrical Engineer who needs advice,0,[],1.0,https://www.reddit.com/r/AskEngineers/comments/xkm9pr/new_electrical_engineer_who_needs_advice/,all_ads,6,,,,,,moderator
56,[],False,Emilie_Evens,,[],,text,t2_14weezy2,False,False,False,[],False,False,1663806763,self.AskEngineers,https://www.reddit.com/r/AskEngineers/comments/xkm5n3/aluminium_pcb_as_capacitive_touch_sensor/,{},xkm5n3,False,True,False,False,False,True,True,False,,purple,[],3a6acd0c-fd28-11e6-ab41-0edc7e2b18fe,Electrical,dark,text,False,False,False,0,0,False,all_ads,/r/AskEngineers/comments/xkm5n3/aluminium_pcb_as_capacitive_touch_sensor/,False,6,1663806774,1,"From technical point of view using aluminium backed PCBs as touch sensor should be possible.
So the big question can I get multiple touch button on one aluminium surface/PCB? What IC would I choose?",True,False,False,AskEngineers,t5_2sebk,284269,public,self,Aluminium PCB as capacitive touch sensor?,0,[],1.0,https://www.reddit.com/r/AskEngineers/comments/xkm5n3/aluminium_pcb_as_capacitive_touch_sensor/,all_ads,6,,,,,,
57,[],False,itisyeetime,,[],,text,t2_haqbk3lx,False,False,False,[],False,False,1663806007,self.AskEngineers,https://www.reddit.com/r/AskEngineers/comments/xklv2h/how_is_the_power_from_both_the_electric_motor_and/,{},xklv2h,False,False,False,False,False,False,True,False,,blue,[],90a1d45a-3f64-11e5-8667-0e60d8112001,Mechanical,dark,text,False,False,True,1,0,False,all_ads,/r/AskEngineers/comments/xklv2h/how_is_the_power_from_both_the_electric_motor_and/,False,6,1663806018,1,[removed],True,False,False,AskEngineers,t5_2sebk,284269,public,self,How is the power from both the Electric Motor and Gas Engine combined and adjusted in the Gearbox and Drive Shaft in Electric Cars?,0,[],1.0,https://www.reddit.com/r/AskEngineers/comments/xklv2h/how_is_the_power_from_both_the_electric_motor_and/,all_ads,6,,,,,,moderator
58,[],False,itisyeetime,,[],,text,t2_haqbk3lx,False,False,False,[],False,False,1663805823,self.AskEngineers,https://www.reddit.com/r/AskEngineers/comments/xklshw/how_do_hybrid_cars_combine_the_power_from_both/,{},xklshw,False,False,False,False,False,False,True,False,,blue,[],90a1d45a-3f64-11e5-8667-0e60d8112001,Mechanical,dark,text,False,False,True,1,0,False,all_ads,/r/AskEngineers/comments/xklshw/how_do_hybrid_cars_combine_the_power_from_both/,False,6,1663805834,1,[removed],True,False,False,AskEngineers,t5_2sebk,284269,public,self,How do Hybrid Cars Combine the Power From Both the Electric Motor and Gas Engine?,0,[],1.0,https://www.reddit.com/r/AskEngineers/comments/xklshw/how_do_hybrid_cars_combine_the_power_from_both/,all_ads,6,,,,,,moderator
59,[],False,climbonapply24head,,[],,text,t2_bfe9s,False,False,False,[],False,False,1663804080,self.AskEngineers,https://www.reddit.com/r/AskEngineers/comments/xkl3f9/how_large_and_how_many_passive_thermosiphons_of/,{},xkl3f9,False,True,False,False,False,True,True,False,,blue,[],b251a614-57f9-11e4-b47b-12313b0e9678,Discussion,dark,text,False,False,True,0,0,False,all_ads,/r/AskEngineers/comments/xkl3f9/how_large_and_how_many_passive_thermosiphons_of/,False,6,1663804091,1,"I was thinking about thermosiphons the other day and how they can use the heat from hotter places to another passively.   


I think this has greater efficiencies or is readily done and possible when the temperature differences between one end of the siphon and the other have a great delta of Tempertaure (Delta T).   


depending on the refrigerant and the load inside the siphon; the system could be tuned to various temperatures and ranges.(?) Could a passive heat exchange system built in multiple stages change the rate at which heat is moved?

&amp;#x200B;

could a system of reasonable size be built to match the cooling ability of a small conventional AC? 

Or are we talking Icecubes?

&amp;#x200B;

Is this mechanical flair? Thermodynamics right?",True,False,False,AskEngineers,t5_2sebk,284266,public,self,How large and how many passive thermosiphons of reasonable size and number would it take to match the cooling ability of a 1500 watt AC?,0,[],1.0,https://www.reddit.com/r/AskEngineers/comments/xkl3f9/how_large_and_how_many_passive_thermosiphons_of/,all_ads,6,,,,,,
60,[],False,Zhanchiz,,[],,text,t2_ke3n6,False,False,False,[],False,False,1663801630,self.AskEngineers,https://www.reddit.com/r/AskEngineers/comments/xkk3yx/request_for_resources_on_the_manufacture_or/,{},xkk3yx,False,True,False,False,False,True,True,False,,blue,[],90a1d45a-3f64-11e5-8667-0e60d8112001,Mechanical,dark,text,False,False,True,0,0,False,all_ads,/r/AskEngineers/comments/xkk3yx/request_for_resources_on_the_manufacture_or/,False,6,1663801641,1," Does anybody have any good resources on design or manufacturing of sparkplugs?

I don't know if the information is mostly company secrets as only a handful of manufacturers exist and I can't seem to find anything beyond surface level details.

The biggest mysteries to me are:

1. How does the shell encompass the ceramic core?
2. How are the seals between the shell and core inserted into position?
3. How is the central electrode attached to the ceramic shell?
4. Any information of expected or acceptable tolerances.

That being said, any and all information would be extremely useful.",True,False,False,AskEngineers,t5_2sebk,284265,public,self,Request for resources on the manufacture or design of sparkplugs,0,[],1.0,https://www.reddit.com/r/AskEngineers/comments/xkk3yx/request_for_resources_on_the_manufacture_or/,all_ads,6,,,,,,
61,[],False,Puzzleheaded_Slip320,,[],,text,t2_81qe759g,False,False,False,[],False,False,1663801356,self.AskEngineers,https://www.reddit.com/r/AskEngineers/comments/xkjzzj/having_some_problems_iwth_room_acoustics/,{},xkjzzj,False,False,False,False,False,False,True,False,,blue,[],b251a614-57f9-11e4-b47b-12313b0e9678,Discussion,dark,text,False,False,True,1,0,False,all_ads,/r/AskEngineers/comments/xkjzzj/having_some_problems_iwth_room_acoustics/,False,6,1663801366,1,[removed],True,False,False,AskEngineers,t5_2sebk,284265,public,self,HAVING SOME PROBLEMS IWTH ROOM ACOUSTICS,0,[],1.0,https://www.reddit.com/r/AskEngineers/comments/xkjzzj/having_some_problems_iwth_room_acoustics/,all_ads,6,,,,,,moderator
62,[],False,Zhanchiz,,[],,text,t2_ke3n6,False,False,False,[],False,False,1663800292,self.AskEngineers,https://www.reddit.com/r/AskEngineers/comments/xkjkac/sparkplug_manufacturing/,{},xkjkac,False,False,False,False,False,False,True,False,,blue,[],90a1d45a-3f64-11e5-8667-0e60d8112001,Mechanical,dark,text,False,False,True,1,0,False,all_ads,/r/AskEngineers/comments/xkjkac/sparkplug_manufacturing/,False,6,1663800303,1,[removed],True,False,False,AskEngineers,t5_2sebk,284261,public,self,Sparkplug manufacturing,0,[],1.0,https://www.reddit.com/r/AskEngineers/comments/xkjkac/sparkplug_manufacturing/,all_ads,6,,,,,,moderator
63,[],False,theredheadbitch,,[],,text,t2_rmqgem4,False,False,False,[],False,False,1663799305,self.AskEngineers,https://www.reddit.com/r/AskEngineers/comments/xkj5pw/where_can_i_find_pricingcatalogues_for_small_air/,{},xkj5pw,False,True,False,False,False,True,True,False,,blue,[],90a1d45a-3f64-11e5-8667-0e60d8112001,Mechanical,dark,text,False,False,True,0,0,False,all_ads,/r/AskEngineers/comments/xkj5pw/where_can_i_find_pricingcatalogues_for_small_air/,False,6,1663799316,1,I am desiging a portable air conditioning unit and I have not been able to find a reliable website that lists the different types of compressors I can use. I am looking for something that would be for cooling a small room (max 5000BTU). Thank you!,True,False,False,AskEngineers,t5_2sebk,284261,public,self,Where can I find pricing/catalogues for small air compressors for an air conditioning unit?,0,[],1.0,https://www.reddit.com/r/AskEngineers/comments/xkj5pw/where_can_i_find_pricingcatalogues_for_small_air/,all_ads,6,,,,,,
64,[],False,Sharp-Cat2319,,[],,text,t2_5uuotrcl,False,False,False,[],False,False,1663797413,self.AskEngineers,https://www.reddit.com/r/AskEngineers/comments/xkichs/cant_understand_my_coworkers/,{},xkichs,False,False,False,False,False,False,True,False,,blue,[],b251a614-57f9-11e4-b47b-12313b0e9678,Discussion,dark,text,False,False,True,1,0,False,all_ads,/r/AskEngineers/comments/xkichs/cant_understand_my_coworkers/,False,6,1663797423,1,[removed],True,False,False,AskEngineers,t5_2sebk,284261,public,self,Can't understand my co-workers,0,[],1.0,https://www.reddit.com/r/AskEngineers/comments/xkichs/cant_understand_my_coworkers/,all_ads,6,,,,,,moderator
65,[],False,lovetoseeit1,,[],,text,t2_4s1kpyxr,False,False,False,[],False,False,1663796953,self.AskEngineers,https://www.reddit.com/r/AskEngineers/comments/xki5hd/i_want_out_of_engineering/,{},xki5hd,False,False,False,False,False,False,True,False,,blue,[],b251a614-57f9-11e4-b47b-12313b0e9678,Discussion,dark,text,False,False,True,1,0,False,all_ads,/r/AskEngineers/comments/xki5hd/i_want_out_of_engineering/,False,6,1663796964,1,[removed],True,False,False,AskEngineers,t5_2sebk,284260,public,self,I want out of engineering.,0,[],1.0,https://www.reddit.com/r/AskEngineers/comments/xki5hd/i_want_out_of_engineering/,all_ads,6,,,,,,moderator
66,[],False,gavin_branch,,[],,text,t2_64lf8t0y,False,False,False,[],False,False,1663793175,self.AskEngineers,https://www.reddit.com/r/AskEngineers/comments/xkghrn/laptop_recommendations/,{},xkghrn,False,False,False,False,False,False,True,False,,blue,[],b251a614-57f9-11e4-b47b-12313b0e9678,Discussion,dark,text,False,False,True,1,0,False,all_ads,/r/AskEngineers/comments/xkghrn/laptop_recommendations/,False,6,1663793186,1,[removed],True,False,False,AskEngineers,t5_2sebk,284254,public,self,Laptop recommendations,0,[],1.0,https://www.reddit.com/r/AskEngineers/comments/xkghrn/laptop_recommendations/,all_ads,6,,,,,,moderator
67,[],False,F1Gooru,,[],,text,t2_razobr5v,False,False,False,[],False,False,1663791486,self.AskEngineers,https://www.reddit.com/r/AskEngineers/comments/xkfqpp/is_the_primary_objective_of_engineers_to/,{},xkfqpp,False,False,False,False,False,False,True,False,,blue,[],b251a614-57f9-11e4-b47b-12313b0e9678,Discussion,dark,text,False,False,True,1,0,False,all_ads,/r/AskEngineers/comments/xkfqpp/is_the_primary_objective_of_engineers_to/,False,6,1663791497,1,[removed],True,False,False,AskEngineers,t5_2sebk,284252,public,self,Is the primary objective of engineers to contribute to the advancement of civilisation through solving problems? Or is there a deeper goal in the discipline?,0,[],1.0,https://www.reddit.com/r/AskEngineers/comments/xkfqpp/is_the_primary_objective_of_engineers_to/,all_ads,6,,,,,,moderator
68,[],False,indiansummer17,,[],,text,t2_9q350,False,False,False,[],False,False,1663788985,self.AskEngineers,https://www.reddit.com/r/AskEngineers/comments/xkemag/is_right_now_or_next_6_months_good_time_to_be_in/,{},xkemag,False,True,False,False,False,True,True,False,,blue,[],b251a614-57f9-11e4-b47b-12313b0e9678,Discussion,dark,text,False,False,True,0,0,False,all_ads,/r/AskEngineers/comments/xkemag/is_right_now_or_next_6_months_good_time_to_be_in/,False,6,1663788996,1,"With the news of companies laying off people lately and economic situation seemingly in dicey place (possible recession incoming), is working for a startup company a bad idea right now (or say next 6 months)? Or am I just over worrying? Would love to hear from people from startup world. Thanks",True,False,False,AskEngineers,t5_2sebk,284253,public,self,Is right now or next 6 months good time to be in start up?,0,[],1.0,https://www.reddit.com/r/AskEngineers/comments/xkemag/is_right_now_or_next_6_months_good_time_to_be_in/,all_ads,6,,,,,,
69,[],False,barrythesnail,,[],,text,t2_hd1i8,False,False,False,[],False,False,1663787330,self.AskEngineers,https://www.reddit.com/r/AskEngineers/comments/xkdwdl/electric_vehicle_build_question/,{},xkdwdl,False,True,False,False,False,True,True,False,,purple,[],3a6acd0c-fd28-11e6-ab41-0edc7e2b18fe,Electrical,dark,text,False,False,False,0,0,False,all_ads,/r/AskEngineers/comments/xkdwdl/electric_vehicle_build_question/,False,6,1663787341,1,"Hello!

I'm a complete novice and this is all theoretical but would like some guidance on the correct battery/motor/controller combination.

Say I had a 3000w 72v 20Ah battery and wanted to control 2 separate motors. Steering the vehicle would depend on the differential motor speeds rather than turning the wheel direction (Let me know if I explained that properly).

What would the specs be on the motors and would I need separate speed controllers for each?

I'll answer quickly if you need any additional info. Thanks a bunch!!",True,False,False,AskEngineers,t5_2sebk,284252,public,self,Electric Vehicle Build Question,0,[],1.0,https://www.reddit.com/r/AskEngineers/comments/xkdwdl/electric_vehicle_build_question/,all_ads,6,,,,,,
70,[],False,namesvincent,,[],,text,t2_fba7kzmh,False,False,False,[],False,False,1663786746,self.AskEngineers,https://www.reddit.com/r/AskEngineers/comments/xkdmty/electric_vehicle_build_question/,{},xkdmty,False,False,False,False,False,False,True,False,,purple,[],3a6acd0c-fd28-11e6-ab41-0edc7e2b18fe,Electrical,dark,text,False,False,True,1,0,False,all_ads,/r/AskEngineers/comments/xkdmty/electric_vehicle_build_question/,False,6,1663786757,1,[removed],True,False,False,AskEngineers,t5_2sebk,284251,public,self,Electric Vehicle Build Question,0,[],1.0,https://www.reddit.com/r/AskEngineers/comments/xkdmty/electric_vehicle_build_question/,all_ads,6,,,,,,moderator
71,[],False,hermittcrab24,,[],,text,t2_saou0ilv,False,False,False,[],False,False,1663785827,self.AskEngineers,https://www.reddit.com/r/AskEngineers/comments/xkd8og/electric_vehicle_build_question/,{},xkd8og,False,False,False,False,False,False,True,False,,blue,[],b251a614-57f9-11e4-b47b-12313b0e9678,Discussion,dark,text,False,False,True,1,0,False,all_ads,/r/AskEngineers/comments/xkd8og/electric_vehicle_build_question/,False,6,1663785837,1,[removed],True,False,False,AskEngineers,t5_2sebk,284249,public,self,Electric Vehicle Build Question,0,[],1.0,https://www.reddit.com/r/AskEngineers/comments/xkd8og/electric_vehicle_build_question/,all_ads,6,,,,,,moderator
