41,[],False,quitethepossibility,,[],,text,t2_nf2vd1bf,False,False,False,[],False,False,1662821209,self.AskEngineers,https://www.reddit.com/r/AskEngineers/comments/xar5ws/why_are_spacex_engine_not_like_lego/,{},xar5ws,False,True,False,False,False,True,True,False,,blue,[],b251a614-57f9-11e4-b47b-12313b0e9678,Discussion,dark,text,False,False,False,0,0,False,all_ads,/r/AskEngineers/comments/xar5ws/why_are_spacex_engine_not_like_lego/,False,6,1662821220,1,I read about Artemis launch and it costs 35 billion.  Space x launches satellites for a couple million. Why can't you just attach a couple of SpaceX engines? Seems like it would be way cheaper. Please get into as much detail as possible.,True,False,False,AskEngineers,t5_2sebk,283486,public,self,Why are SpaceX engine not like lego?,0,[],1.0,https://www.reddit.com/r/AskEngineers/comments/xar5ws/why_are_spacex_engine_not_like_lego/,all_ads,6,,,,,,,,,,
42,[],False,kournworm,,[],,text,t2_r556szyw,False,False,False,[],False,False,1662819798,self.AskEngineers,https://www.reddit.com/r/AskEngineers/comments/xaqmn8/as_a_mechanical_engineer_how_much_does_the/,{},xaqmn8,False,True,False,False,False,True,True,False,,blue,[],90a1d45a-3f64-11e5-8667-0e60d8112001,Mechanical,dark,text,False,False,True,0,0,False,all_ads,/r/AskEngineers/comments/xaqmn8/as_a_mechanical_engineer_how_much_does_the/,False,6,1662819809,1,"So I do a lot of thinking about the long term potential of my career. I’m about 2 years out of college so still fairly early on. 

Coming out of college I didn’t really know what I wanted to do. So I got a job in a big firm who do a multitude of things, thinking I could learn a lot and see different areas of business. 

I’m trying to position myself so I’m learning skills that are transferable. So I’m currently doing a job where I have to use rhino and energy sim software. I’m learning skills outside work. I’m networking to try get other business related work too. 

But then I had conversations with one of the higher ups. And he was warning me about pigeon holing and getting stuck. And now I’ve got really really anxious. 

So I guess I’m asking, how hard is it to move around industries? Say I wanted to go work in another industry after this one. As a mechanical engineer would I be able to get a job elsewhere doing other types of mech eng work? Even if I hadn’t used what I’d done in college for a few years. 

Thanks :)",True,False,False,AskEngineers,t5_2sebk,283484,public,self,"As a mechanical engineer, how much does the industry you start in matter?",0,[],1.0,https://www.reddit.com/r/AskEngineers/comments/xaqmn8/as_a_mechanical_engineer_how_much_does_the/,all_ads,6,,,,,,,,,,
43,[],False,Malalexander,,[],,text,t2_4dnxe5x1,False,False,False,[],False,False,1662812779,self.AskEngineers,https://www.reddit.com/r/AskEngineers/comments/xao58i/demisting_polycarbonate_protective_glasses_with/,{},xao58i,False,True,False,False,False,True,True,False,,blue,[],90a1d45a-3f64-11e5-8667-0e60d8112001,Mechanical,dark,text,False,False,True,0,0,False,all_ads,/r/AskEngineers/comments/xao58i/demisting_polycarbonate_protective_glasses_with/,False,6,1662812789,1,"Hello. 

I recently purchased a system for demisting polycarbonate protective goggles. The system uses a small 5v fan to force air through two 20cm long 8mm diameter vinyl pipes into a manifold that directs the air down over the goggles. I don't think the flow is great. 

I'm concerned that a fan is the wrong way to drive such a system. The outlet holes are small and the tubing only 8mm in diameter. Would a small compressor like that used in an aquarium bubbler produce a stronger flow of air?

I have done some research on the difference between fans and compressors but could really use some guidance before I start ordering parts and building a DIY solution. Thanks in advance.",True,False,False,AskEngineers,t5_2sebk,283479,public,self,Demisting polycarbonate protective glasses with remote source forced air.,0,[],1.0,https://www.reddit.com/r/AskEngineers/comments/xao58i/demisting_polycarbonate_protective_glasses_with/,all_ads,6,,,,,,,,,,
44,[],False,Specific_Ad_6869,,[],,text,t2_bez6xdkq,False,False,False,[],False,False,1662806051,self.AskEngineers,https://www.reddit.com/r/AskEngineers/comments/xam3m4/australia_need_help_with_a_design/,{},xam3m4,False,True,False,False,False,True,True,False,,blue,[],90a1d45a-3f64-11e5-8667-0e60d8112001,Mechanical,dark,text,False,False,True,0,0,False,all_ads,/r/AskEngineers/comments/xam3m4/australia_need_help_with_a_design/,False,6,1662806061,1,So I’m trying to make the murasama (jetstream Sam’s blade) from metal gear rising and I need help with making a mechanism that can shoot out the sword. I’ve thought of using a gel gun (Australia’s equivalent of a air soft gun) but I’m not sure how I would take it apart and add it the blade’s case,True,False,False,AskEngineers,t5_2sebk,283473,public,self,[Australia] Need help with a design,0,[],1.0,https://www.reddit.com/r/AskEngineers/comments/xam3m4/australia_need_help_with_a_design/,all_ads,6,,,,,,,,,,
45,[],False,Specific_Ad_6869,,[],,text,t2_bez6xdkq,False,False,False,[],False,False,1662805721,self.AskEngineers,https://www.reddit.com/r/AskEngineers/comments/xam03z/need_help_with_a_design/,{},xam03z,False,True,False,False,False,True,True,False,,blue,[],90a1d45a-3f64-11e5-8667-0e60d8112001,Mechanical,dark,text,False,False,True,0,0,False,all_ads,/r/AskEngineers/comments/xam03z/need_help_with_a_design/,False,6,1662805731,1,So I’m trying to make the murasama (jetstream Sam’s blade) from metal gear rising and I need help with making a mechanism that can shoot out the sword. I’ve thought of using a gel gun (Australia’s equivalent of a air soft gun) but I’m not sure how I would take it apart and add it the blade’s case.,True,False,False,AskEngineers,t5_2sebk,283473,public,self,Need help with a design,0,[],1.0,https://www.reddit.com/r/AskEngineers/comments/xam03z/need_help_with_a_design/,all_ads,6,,,,,,,,,,
46,[],False,Entire-Stretch-6731,,[],,text,t2_848g8hkg,False,False,False,[],False,False,1662804899,self.AskEngineers,https://www.reddit.com/r/AskEngineers/comments/xalrxn/material_number_for_propaneoxygen_gas_cylinder/,{},xalrxn,False,False,False,False,False,False,True,False,,blue,[],90a1d45a-3f64-11e5-8667-0e60d8112001,Mechanical,dark,text,False,False,True,1,0,False,all_ads,/r/AskEngineers/comments/xalrxn/material_number_for_propaneoxygen_gas_cylinder/,False,6,1662804910,1,[removed],True,False,False,AskEngineers,t5_2sebk,283473,public,self,Material number for propane/oxygen gas cylinder steel,0,[],1.0,https://www.reddit.com/r/AskEngineers/comments/xalrxn/material_number_for_propaneoxygen_gas_cylinder/,all_ads,6,moderator,,,,,,,,,
47,[],False,Chance_Paint_3157,,[],,text,t2_9wyndqaa,False,False,False,[],False,False,1662804133,self.AskEngineers,https://www.reddit.com/r/AskEngineers/comments/xalk8x/can_blockchain_be_implemented_in_the_mechanical/,{},xalk8x,False,True,False,False,False,True,True,False,,blue,[],b251a614-57f9-11e4-b47b-12313b0e9678,Discussion,dark,text,False,False,True,0,0,False,all_ads,/r/AskEngineers/comments/xalk8x/can_blockchain_be_implemented_in_the_mechanical/,False,6,1662804143,1,,True,False,False,AskEngineers,t5_2sebk,283472,public,self,can Blockchain be implemented in the mechanical engineering Field?,0,[],1.0,https://www.reddit.com/r/AskEngineers/comments/xalk8x/can_blockchain_be_implemented_in_the_mechanical/,all_ads,6,,,,,,,,,,
48,[],False,Chance_Paint_3157,,[],,text,t2_9wyndqaa,False,False,False,[],False,False,1662804075,self.AskEngineers,https://www.reddit.com/r/AskEngineers/comments/xaljmb/blockchain/,{},xaljmb,False,False,False,False,False,False,True,False,,blue,[],b251a614-57f9-11e4-b47b-12313b0e9678,Discussion,dark,text,False,False,True,1,0,False,all_ads,/r/AskEngineers/comments/xaljmb/blockchain/,False,6,1662804086,1,[removed],True,False,False,AskEngineers,t5_2sebk,283472,public,self,Blockchain,0,[],1.0,https://www.reddit.com/r/AskEngineers/comments/xaljmb/blockchain/,all_ads,6,moderator,,,,,,,,,
49,[],False,reflogaton,,[],,text,t2_i9xszjsh,False,False,False,[],False,False,1662798170,self.AskEngineers,https://www.reddit.com/r/AskEngineers/comments/xajwax/ive_heard_an_electrician_talk_about_how_you_could/,{},xajwax,False,True,False,False,False,True,True,False,,purple,[],3a6acd0c-fd28-11e6-ab41-0edc7e2b18fe,Electrical,dark,text,False,False,True,0,0,False,all_ads,/r/AskEngineers/comments/xajwax/ive_heard_an_electrician_talk_about_how_you_could/,False,6,1662798181,1,"I recently talked to an electrician who claimed that you could install a VFD in front of say a pump and turn down the Hz 20% and the power consumption would effectively drop to half of the original consumption. 

I'm curious how that is possible, or if it even is possible. I'd be grateful if someone could explain the physics / math behind it or point me in the right direction of a video or a ressource that explains how it works or if it's not possible.

Thank you in advance :)",True,False,False,AskEngineers,t5_2sebk,283471,public,self,"I've heard an electrician talk about how you could put a VFD in front of a motor, turn down the Hz by 20% and save 50% in power consumption. How is that possible?",0,[],1.0,https://www.reddit.com/r/AskEngineers/comments/xajwax/ive_heard_an_electrician_talk_about_how_you_could/,all_ads,6,,,,,,,,,,
50,[],False,jugnu_89,,[],,text,t2_bbyg3tgm,False,False,False,[],False,False,1662792717,self.AskEngineers,https://www.reddit.com/r/AskEngineers/comments/xaig61/im_building_a_3d_printer_i_saw_alot_of_videos_on/,{},xaig61,False,True,False,False,False,True,True,False,,blue,[],b251a614-57f9-11e4-b47b-12313b0e9678,Discussion,dark,text,False,False,False,0,0,False,all_ads,/r/AskEngineers/comments/xaig61/im_building_a_3d_printer_i_saw_alot_of_videos_on/,False,6,1662792728,1,,True,False,False,AskEngineers,t5_2sebk,283471,public,self,"I'm building a 3D printer I saw alot of videos on YouTube and they all used a Aurdino as the control chip, i wanted to know that if I can use a raspberry pi 3 in place of it and if I can where can I find the firmware for it",0,[],1.0,https://www.reddit.com/r/AskEngineers/comments/xaig61/im_building_a_3d_printer_i_saw_alot_of_videos_on/,all_ads,6,,,,,,,,,,
51,[],False,StressCavity,,[],,text,t2_9opg7,False,False,False,[],False,False,1662790165,self.AskEngineers,https://www.reddit.com/r/AskEngineers/comments/xahqr1/do_people_actually_use_solidworks_because_its_the/,{},xahqr1,False,True,False,False,False,True,True,False,,blue,[],b251a614-57f9-11e4-b47b-12313b0e9678,Discussion,dark,text,False,False,True,0,0,False,all_ads,/r/AskEngineers/comments/xahqr1/do_people_actually_use_solidworks_because_its_the/,False,6,1662790176,1,"Question is the topic title, and some context:

I've spent a couple years using FreeCAD, Solidworks, Fusion 360, etc. making a variety of assemblies of varying complexity. I've found quirks and odd-ends of each software, as well as their pros for sure, but I just can't see why people seem to flock to Solidworks.

In the scenario of not conforming to a company's preference, does Solidworks still come out on top for you? I'm looking at Creo, NX, and a few others to try next because I'm getting infuriated by 3DS's terrible license models, and I hate that Fusion360 is an always connected program (although I do like it for the most part).

I've noticed CAD programs just feel sluggish in general lately, and I'm on a 3970X threadripper + RTX 3090 machine so I really doubt it's the hardware. I really wish I could find something that felt quick and responsive to use, with strong parametric controls, and it feels like a fruitless search.

**Example sadness:**

FreeCAD:

* Tools are obviously limited without endless plugin/custom scripting compared to industrial programs
* Performance feels sluggish despite having a smaller tool-set
* Sometimes valid features won't work on seemingly arbitrary value boundaries!

Solidworks:

* Dassault Systemes is ass to deal with
* Program feels sluggish even for basic operations. Why does filleting an edge take more than a few ms to register? I shouldn't even see any frames of it having to compute a 1mm radius.
* Poor large-assembly performance
* Expensive

Please, any input helps! I desire thine knowledge masters of the CAD craft",True,False,False,AskEngineers,t5_2sebk,283471,public,self,"Do people actually use Solidworks because it's the best, or because their company requires it?",0,[],1.0,https://www.reddit.com/r/AskEngineers/comments/xahqr1/do_people_actually_use_solidworks_because_its_the/,all_ads,6,,,,,,,,,,
52,[],False,quintooo3,,[],,text,t2_2rhwq5q9,False,False,False,[],False,False,1662788983,self.AskEngineers,https://www.reddit.com/r/AskEngineers/comments/xaheuh/best_resource_to_learn_about_servo/,{},xaheuh,False,True,False,False,False,True,True,False,,blue,[],90a1d45a-3f64-11e5-8667-0e60d8112001,Mechanical,dark,text,False,False,True,0,0,False,all_ads,/r/AskEngineers/comments/xaheuh/best_resource_to_learn_about_servo/,False,6,1662788994,1,"Just had an idea in my head. Work as an EE but embarrassingly have never touched motors or the like (or anything mechanical really)

My project will be a conveyor belt of sorts. This conveyor belt needs to move in both directions on the horizontal axis. The movement must be precise (like 2-3 mm precise) and fast and handle 1-2 pounds of weight. 

Basically, imagine we are dropping balls randomly along the X-axis. The conveyor belt holds a bucket that will catch the balls. 

The bucket max horizontal movement is +/- 3 inches. 

I assume I'll need to learn about servo motors and gearing. Any good youtube channels or books you guys recommend? Lot's of resources and I don't know which is good",True,False,False,AskEngineers,t5_2sebk,283471,public,self,Best resource to learn about servo motors/torque/gearing?,0,[],1.0,https://www.reddit.com/r/AskEngineers/comments/xaheuh/best_resource_to_learn_about_servo/,all_ads,6,,,,,,,,,,
53,[],False,MrShables,,[],,text,t2_93nbb,False,False,False,[],False,False,1662788730,self.AskEngineers,https://www.reddit.com/r/AskEngineers/comments/xahce3/question_i_replace_vinyl_tiles_at_supermarkets/,{},xahce3,False,True,False,False,False,True,True,False,,blue,[],b251a614-57f9-11e4-b47b-12313b0e9678,Discussion,dark,text,False,False,True,0,0,False,all_ads,/r/AskEngineers/comments/xahce3/question_i_replace_vinyl_tiles_at_supermarkets/,False,6,1662788740,1,"Basically I do night flooring repairs at large supermarkets, and have been playing with the idea of instead of using a handheld propane burner to heat the tiles for take up, to create a device on wheels that could thoroughly heat tiles more efficiently. The tiles themselves are 400x400mm and are pretty standard vinyl tiles. I've been thinking of rigging up something like a toaster oven element or BBQ burners in a square configuration mounted to a moving trolley but not really sure what the safest way to go about that is. Any advice or ideas are appreciated!",True,False,False,AskEngineers,t5_2sebk,283471,public,self,[QUESTION] I replace vinyl tiles at supermarkets overnight and was wondering if this sub would have any advice or suggestions on creating a mobile electric/propane powered 400x400mm downward heater on wheels to melt tiles/loosen adhesive for easier take ups.,0,[],1.0,https://www.reddit.com/r/AskEngineers/comments/xahce3/question_i_replace_vinyl_tiles_at_supermarkets/,all_ads,6,,,,,,,,,,
54,[],False,criskla,,[],,text,t2_87mrlz59,False,False,False,[],False,False,1662786583,self.AskEngineers,https://www.reddit.com/r/AskEngineers/comments/xagphl/how_to_destroy_a_bluetooth_speaker/,{},xagphl,False,False,False,False,False,False,True,False,,purple,[],3a6acd0c-fd28-11e6-ab41-0edc7e2b18fe,Electrical,dark,text,False,False,True,1,0,False,all_ads,/r/AskEngineers/comments/xagphl/how_to_destroy_a_bluetooth_speaker/,False,6,1662786594,1,[removed],True,False,False,AskEngineers,t5_2sebk,283469,public,self,How to destroy a bluetooth speaker,0,[],1.0,https://www.reddit.com/r/AskEngineers/comments/xagphl/how_to_destroy_a_bluetooth_speaker/,all_ads,6,moderator,,,,,,,,,
55,[],False,SanctusSalieri,,[],,text,t2_37goz9go,False,False,False,[],False,False,1662781844,self.AskEngineers,https://www.reddit.com/r/AskEngineers/comments/xaf8og/at_what_point_does_low_humidity_become_a_danger/,{},xaf8og,False,True,False,False,False,True,True,False,,purple,[],3a6acd0c-fd28-11e6-ab41-0edc7e2b18fe,Electrical,dark,text,False,False,True,0,0,False,all_ads,/r/AskEngineers/comments/xaf8og/at_what_point_does_low_humidity_become_a_danger/,False,6,1662781858,1,"My city has very low humidity at the moment due to high winds (outdoor relative humidity will be below 20% for at least the next 24 hours).  My indoor humidity is at around 20% currently.

I can find plenty of advice online to run electronics between 30 and 60, and the warning that running them in low humidity can cause components to fail from static.  Is this a realistic worry for my situation?",True,False,False,AskEngineers,t5_2sebk,283465,public,self,At what point does low humidity become a danger to home electronics?,0,[],1.0,https://www.reddit.com/r/AskEngineers/comments/xaf8og/at_what_point_does_low_humidity_become_a_danger/,all_ads,6,,,,,,,,,,
56,[],False,SlightMeasurement583,,[],,text,t2_d9m0shqw,False,False,False,[],False,False,1662780704,self.AskEngineers,https://www.reddit.com/r/AskEngineers/comments/xaevqy/in_my_second_year_of_electrical_engineering_and_i/,{},xaevqy,False,False,False,False,False,False,True,False,,purple,[],3a6acd0c-fd28-11e6-ab41-0edc7e2b18fe,Electrical,dark,text,False,False,True,1,0,False,all_ads,/r/AskEngineers/comments/xaevqy/in_my_second_year_of_electrical_engineering_and_i/,False,6,1662780714,1,[removed],True,False,False,AskEngineers,t5_2sebk,283464,public,self,In my second year of Electrical Engineering and I don't know anything Need some tips,0,[],1.0,https://www.reddit.com/r/AskEngineers/comments/xaevqy/in_my_second_year_of_electrical_engineering_and_i/,all_ads,6,moderator,,,,,,,,,
57,[],False,Scenariodweller69,,[],,text,t2_9b1skt0e,False,False,False,[],False,False,1662776460,self.AskEngineers,https://www.reddit.com/r/AskEngineers/comments/xadh1v/ask_for_a_payrise_internship_programme/,{},xadh1v,False,True,False,False,False,True,True,False,,blue,[],b251a614-57f9-11e4-b47b-12313b0e9678,Discussion,dark,text,False,False,True,0,0,False,all_ads,/r/AskEngineers/comments/xadh1v/ask_for_a_payrise_internship_programme/,False,6,1662776470,1,"Hi all,
I’m currently participating in a 12 month full time internship programme and it will be ending in Jan. 

They will most likely offer me to stay on for a further 6 months whilst I finish my course. 

The pay is just above the minimum wage in Aus at $23ph but with cost of living it doesn’t go far at all.  Would it be appropriate to ask if I stay on for a small raise to 25/26ph? Personally for the amount of work and responsibility given to interns at this company I think it is fair but not sure what the etiquette is with these things. I am essentially a project manager for a field test and a main contact for the development team in China to develop the product. I’m appreciative of the experience I’ve gotten and I think overall it’s been amazing just the pay sucks, especially as my other job stacking shelves pay $40-50 ph overnight lol

Thanks for any feedback!",True,False,False,AskEngineers,t5_2sebk,283462,public,self,Ask for a payrise internship programme,0,[],1.0,https://www.reddit.com/r/AskEngineers/comments/xadh1v/ask_for_a_payrise_internship_programme/,all_ads,6,,,,,,,,,,
58,[],False,ThatDogStoleMyLunch,,[],,text,t2_kax40ys9,False,False,False,[],False,False,1662772941,self.AskEngineers,https://www.reddit.com/r/AskEngineers/comments/xac9p2/what_happens_if_you_have_a_grounded_leg_on_a/,{},xac9p2,False,True,False,False,False,True,True,False,,purple,[],3a6acd0c-fd28-11e6-ab41-0edc7e2b18fe,Electrical,dark,text,False,False,False,0,0,False,all_ads,/r/AskEngineers/comments/xac9p2/what_happens_if_you_have_a_grounded_leg_on_a/,False,6,1662772952,1,,True,False,False,AskEngineers,t5_2sebk,283458,public,self,What happens if you have a grounded leg on a 3-phase lighting contactor? Will the lights continue to run or will they turn off?,0,[],1.0,https://www.reddit.com/r/AskEngineers/comments/xac9p2/what_happens_if_you_have_a_grounded_leg_on_a/,all_ads,6,,,,,,,,,,
59,[],False,ThatDogStoleMyLunch,,[],,text,t2_kax40ys9,False,False,False,[],False,False,1662772035,self.AskEngineers,https://www.reddit.com/r/AskEngineers/comments/xaby8g/ground_fault_on_480v_3phase_lighting_circuit_but/,{},xaby8g,False,True,False,False,False,True,True,False,,purple,[],3a6acd0c-fd28-11e6-ab41-0edc7e2b18fe,Electrical,dark,text,False,False,True,0,0,False,all_ads,/r/AskEngineers/comments/xaby8g/ground_fault_on_480v_3phase_lighting_circuit_but/,False,6,1662772045,1,"Hello,

Sorry for the unusual question as this may be more geared for electricians. But I am having an issue with trying to understand a ground fault I am currently seeing. We noticed our C phase to ground has 0v reading while our A and B phases are reading around the 277 Volts as they should. What I’m trying to understand is that if the C phase is grounded, then why are the lights still on? I assumed that if one leg grounded then the lights not be working. Again, I apologize for the question I just wanted to understand.",True,False,False,AskEngineers,t5_2sebk,283457,public,self,"Ground fault on 480V, 3-phase lighting circuit, but lights are still on?",0,[],1.0,https://www.reddit.com/r/AskEngineers/comments/xaby8g/ground_fault_on_480v_3phase_lighting_circuit_but/,all_ads,6,,,,,,,,,,
60,[],False,-amotoma-,,[],,text,t2_3oyffp65,False,False,False,[],False,False,1662771969,self.AskEngineers,https://www.reddit.com/r/AskEngineers/comments/xabxfz/i_got_cheap_articulating_arms_to_use_for_51/,{},xabxfz,False,True,False,False,False,True,True,False,,blue,[],90a1d45a-3f64-11e5-8667-0e60d8112001,Mechanical,dark,text,False,False,False,0,0,False,all_ads,/r/AskEngineers/comments/xabxfz/i_got_cheap_articulating_arms_to_use_for_51/,False,6,1662771980,1,pic of the situation - https://i.imgur.com/pRBeevk.jpg,True,False,False,AskEngineers,t5_2sebk,283457,public,self,"I got cheap articulating arms to use for 5.1 speakers, is there a way to calculate the type of springs required to support the weight of the speakers so that they can be posable in folded and extended positions?",0,[],1.0,https://www.reddit.com/r/AskEngineers/comments/xabxfz/i_got_cheap_articulating_arms_to_use_for_51/,all_ads,6,,,,,self,"{'enabled': False, 'images': [{'id': 'vqIy_qcq_ufzBH4Y5bRL0UQshcp8a-CN4fzxTCj806o', 'resolutions': [{'height': 162, 'url': 'https://external-preview.redd.it/w927Ey2ufvVQCHEn0bkt2BlvuC1zWhpD1NCuGuN5sLg.jpg?width=108&amp;crop=smart&amp;auto=webp&amp;s=0a0b515778b2a0ece3292e1447b721b2ede8dbef', 'width': 108}, {'height': 324, 'url': 'https://external-preview.redd.it/w927Ey2ufvVQCHEn0bkt2BlvuC1zWhpD1NCuGuN5sLg.jpg?width=216&amp;crop=smart&amp;auto=webp&amp;s=16d62aa17610d76432395170d5b6c412ffa092ed', 'width': 216}, {'height': 480, 'url': 'https://external-preview.redd.it/w927Ey2ufvVQCHEn0bkt2BlvuC1zWhpD1NCuGuN5sLg.jpg?width=320&amp;crop=smart&amp;auto=webp&amp;s=8807f4e0704c4b7dbee819774cd59a41e5e054eb', 'width': 320}, {'height': 960, 'url': 'https://external-preview.redd.it/w927Ey2ufvVQCHEn0bkt2BlvuC1zWhpD1NCuGuN5sLg.jpg?width=640&amp;crop=smart&amp;auto=webp&amp;s=8d5478838e238411ec054de126e8b8203db41db8', 'width': 640}, {'height': 1440, 'url': 'https://external-preview.redd.it/w927Ey2ufvVQCHEn0bkt2BlvuC1zWhpD1NCuGuN5sLg.jpg?width=960&amp;crop=smart&amp;auto=webp&amp;s=4e3c3069709548f4a351ad8d2c78cf8ccc662323', 'width': 960}, {'height': 1620, 'url': 'https://external-preview.redd.it/w927Ey2ufvVQCHEn0bkt2BlvuC1zWhpD1NCuGuN5sLg.jpg?width=1080&amp;crop=smart&amp;auto=webp&amp;s=9946c90367d563b3c092fade989223b68db1b1ce', 'width': 1080}], 'source': {'height': 5184, 'url': 'https://external-preview.redd.it/w927Ey2ufvVQCHEn0bkt2BlvuC1zWhpD1NCuGuN5sLg.jpg?auto=webp&amp;s=daf3b84740aa1c689c134d40eda2dcd838d9dd76', 'width': 3456}, 'variants': {}}]}",,,,
61,[],False,boban2000,,[],,text,t2_7eodzuj2,False,False,False,[],False,False,1662769194,self.AskEngineers,https://www.reddit.com/r/AskEngineers/comments/xaay7g/from_safety_to_mechatronics/,{},xaay7g,False,True,False,False,False,True,True,False,,blue,[],b251a614-57f9-11e4-b47b-12313b0e9678,Discussion,dark,text,False,False,True,0,0,False,all_ads,/r/AskEngineers/comments/xaay7g/from_safety_to_mechatronics/,False,6,1662769205,1,"Hi all, i need a suggestion, and opinion from you guys. In 2020 i graduated as Occupational Safety Engineer (70% of the subjects we had were general engineering subjecs, mix of main mechanical and electrical subjects), i got into that college not knowing what i like and what to do with myself (in the 2nd year of college i started getting interest in elecronics, mechatronics and all machines in general). After graduating in 2020, i now finished masters degree in mechatronics eng (1 year program) which i wanted for years. In the last 3 years i've designed 30+ (hobby) PCBs because i gained a lot of interest in that area, also i worked as robotics technician for a year and a half. My question is, i am moving into a new city, how do you think employers will react (decide to give me a job) in engineering - mechatronics and electronics. Thank you, have a nice weekend!",True,False,False,AskEngineers,t5_2sebk,283457,public,self,From safety to mechatronics?,0,[],1.0,https://www.reddit.com/r/AskEngineers/comments/xaay7g/from_safety_to_mechatronics/,all_ads,6,,,,,,,,,,
