,all_awardings,allow_live_comments,author,author_flair_css_class,author_flair_richtext,author_flair_text,author_flair_type,author_fullname,author_is_blocked,author_patreon_flair,author_premium,awarders,can_mod_post,contest_mode,created_utc,domain,full_link,gildings,id,is_created_from_ads_ui,is_crosspostable,is_meta,is_original_content,is_reddit_media_domain,is_robot_indexable,is_self,is_video,link_flair_background_color,link_flair_css_class,link_flair_richtext,link_flair_template_id,link_flair_text,link_flair_text_color,link_flair_type,locked,media_only,no_follow,num_comments,num_crossposts,over_18,parent_whitelist_status,permalink,pinned,pwls,removed_by_category,retrieved_on,score,selftext,send_replies,spoiler,stickied,subreddit,subreddit_id,subreddit_subscribers,subreddit_type,thumbnail,title,total_awards_received,treatment_tags,upvote_ratio,url,whitelist_status,wls,post_hint,preview,author_flair_background_color,author_flair_template_id,author_flair_text_color
76,[],False,fortniteBot3000,,[],,text,t2_6861tb8e,False,False,False,[],False,False,1659414136,self.AskEngineers,https://www.reddit.com/r/AskEngineers/comments/we22kn/deciding_between_industrial_engineering_and/,{},we22kn,False,True,False,False,False,True,True,False,,red,[],a2e13d02-57f9-11e4-8c58-12313b0e9678,Career,dark,text,False,False,True,0,0,False,all_ads,/r/AskEngineers/comments/we22kn/deciding_between_industrial_engineering_and/,False,6,,1659414146,1,"Hey yall, I am currently a mechanical engineering major going into my third year. Later on, I will have to take four elective courses towards a certain career. The ones that I am deciding between are Industrial Engineering and Materials Engineering. I like the former because I am interested in seeing how economics and engineering meet and I am really interested in data sciences. I also like the latter because I am interested in material engineering's application to the semiconductor industry and I would find it to be cool to work on this groundbreaking technology. I was wondering if any industrial engineers and materials engineers could share their experiences in their workplaces and the pros and cons so I could come to a better decision as to what I want to become in the future.

Thank you!",True,False,False,AskEngineers,t5_2sebk,280201,public,self,Deciding between Industrial Engineering and Materials Engineering,0,[],1.0,https://www.reddit.com/r/AskEngineers/comments/we22kn/deciding_between_industrial_engineering_and/,all_ads,6,,,,,
77,[],False,chune20,,[],,text,t2_537bg7dy,False,False,False,[],False,False,1659413854,self.AskEngineers,https://www.reddit.com/r/AskEngineers/comments/we1z7s/as_an_me_interested_in_renewable_energy_what_are/,{},we1z7s,False,False,False,False,False,False,True,False,,red,[],a2e13d02-57f9-11e4-8c58-12313b0e9678,Career,dark,text,False,False,True,1,0,False,all_ads,/r/AskEngineers/comments/we1z7s/as_an_me_interested_in_renewable_energy_what_are/,False,6,moderator,1659413865,1,[removed],True,False,False,AskEngineers,t5_2sebk,280201,public,self,"As an ME interested in renewable energy, what are some good classes/skills to build before graduating?",0,[],1.0,https://www.reddit.com/r/AskEngineers/comments/we1z7s/as_an_me_interested_in_renewable_energy_what_are/,all_ads,6,,,,,
78,[],False,shoefixer,,[],,text,t2_285l1wp9,False,False,False,[],False,False,1659406374,self.AskEngineers,https://www.reddit.com/r/AskEngineers/comments/wdzfe0/whats_the_proper_name_of_a_twist_lock_quick/,{},wdzfe0,False,True,False,False,False,True,True,False,,blue,[],90a1d45a-3f64-11e5-8667-0e60d8112001,Mechanical,dark,text,False,False,True,0,0,False,all_ads,/r/AskEngineers/comments/wdzfe0/whats_the_proper_name_of_a_twist_lock_quick/,False,6,,1659406385,1,"Here's an example. [https://www.summitracing.com/parts/ear-je271103erl](https://www.summitracing.com/parts/ear-je271103erl)

Does the slotted/peg side of this connector have a standard name? I'm try to research the strength characteristics of this type of connector and I can't find anything. Thanks for the help!",True,False,False,AskEngineers,t5_2sebk,280195,public,self,What's the proper name of a twist lock quick connector?,0,[],1.0,https://www.reddit.com/r/AskEngineers/comments/wdzfe0/whats_the_proper_name_of_a_twist_lock_quick/,all_ads,6,,,,,
79,[],False,quitethepossibility,,[],,text,t2_nf2vd1bf,False,False,False,[],False,False,1659405049,self.AskEngineers,https://www.reddit.com/r/AskEngineers/comments/wdyyhi/most_sensitive_accelerometer_available_on_the/,{},wdyyhi,False,True,False,False,False,True,True,False,,purple,[],3a6acd0c-fd28-11e6-ab41-0edc7e2b18fe,Electrical,dark,text,False,False,True,0,0,False,all_ads,/r/AskEngineers/comments/wdyyhi/most_sensitive_accelerometer_available_on_the/,False,6,,1659405060,1,"hey guys, 

i want to make a diy project using accelerometer. I tried googling ' most accurate and sensitive accelerometer' and it landed me on some amazon pages with brands like HiLetGo..etc. 

How do I figure out what is the right one for me? My usecase is that I want to be able to detect the tiniest of movements.",True,False,False,AskEngineers,t5_2sebk,280195,public,self,Most sensitive accelerometer available on the market,0,[],1.0,https://www.reddit.com/r/AskEngineers/comments/wdyyhi/most_sensitive_accelerometer_available_on_the/,all_ads,6,,,,,
80,[],False,No_Engineer_6897,,[],,text,t2_ch0he8vo,False,False,False,[],False,False,1659404524,self.AskEngineers,https://www.reddit.com/r/AskEngineers/comments/wdyroh/can_i_make_piping_layout_drawing_from_pid/,{},wdyroh,False,True,False,False,False,True,True,False,,orange,[],939137fa-3f64-11e5-b90e-0ef63926eacd,Civil,dark,text,False,False,True,0,0,False,all_ads,/r/AskEngineers/comments/wdyroh/can_i_make_piping_layout_drawing_from_pid/,False,6,,1659404534,1,I am studying for an interview and learning autoCAD 3d Plant and can read a P&amp;ID. Am I able to create a plan for the sake of proving I can use the software based off of this P&amp;ID?,True,False,False,AskEngineers,t5_2sebk,280194,public,self,Can I make Piping Layout Drawing from P&amp;ID?,0,[],1.0,https://www.reddit.com/r/AskEngineers/comments/wdyroh/can_i_make_piping_layout_drawing_from_pid/,all_ads,6,,,,,
81,[],False,my_lands_is_near,,[],,text,t2_mlu2j6qk,False,False,False,[],False,False,1659404470,self.AskEngineers,https://www.reddit.com/r/AskEngineers/comments/wdyqyd/getting_eit_in_indiana_after_passing_fe_exam/,{},wdyqyd,False,True,False,False,False,True,True,False,,red,[],a2e13d02-57f9-11e4-8c58-12313b0e9678,Career,dark,text,False,False,True,0,0,False,all_ads,/r/AskEngineers/comments/wdyqyd/getting_eit_in_indiana_after_passing_fe_exam/,False,6,,1659404481,1,"Can somebody help me understand something from the list of requirements of EIT in Indiana. Specifically this line right here:

References - Upload 3 references unless the FE exam was completed before the date conferred of the degree. The references are to be completed by the reference on Form 15199. Please upload at the time of application or log back into your account and use the License Update option.

Does this mean I need 3 references if I completed the exam before I got my degree still? I passed the FE before I got my degree, do I still need to have 3 references?

https://www.in.gov/pla/professions/engineering-home/engineering-licensing-information/",True,False,False,AskEngineers,t5_2sebk,280195,public,self,Getting EIT in Indiana after passing FE Exam,0,[],1.0,https://www.reddit.com/r/AskEngineers/comments/wdyqyd/getting_eit_in_indiana_after_passing_fe_exam/,all_ads,6,self,"{'enabled': False, 'images': [{'id': 'iglK3YQSvqIRqQn1Ti-39Wjc1yMXCLEIsfvyQPyAfE0', 'resolutions': [{'height': 82, 'url': 'https://external-preview.redd.it/Xd66L3pqNq71J0klde5JqAIGIwp08lQ2aa8f8aB0t70.jpg?width=108&amp;crop=smart&amp;auto=webp&amp;s=33fa8efca094023fb20eae377ee2a61447fda5d4', 'width': 108}], 'source': {'height': 132, 'url': 'https://external-preview.redd.it/Xd66L3pqNq71J0klde5JqAIGIwp08lQ2aa8f8aB0t70.jpg?auto=webp&amp;s=53277f2fb616ad9423538c2fe4629464d0fb8891', 'width': 172}, 'variants': {}}]}",,,
82,[],False,No_Engineer_6897,,[],,text,t2_ch0he8vo,False,False,False,[],False,False,1659404446,self.AskEngineers,https://www.reddit.com/r/AskEngineers/comments/wdyqmn/piping_layout_drawing/,{},wdyqmn,False,False,False,False,False,False,True,False,,orange,[],939137fa-3f64-11e5-b90e-0ef63926eacd,Civil,dark,text,False,False,True,1,0,False,all_ads,/r/AskEngineers/comments/wdyqmn/piping_layout_drawing/,False,6,moderator,1659404457,1,[removed],True,False,False,AskEngineers,t5_2sebk,280195,public,self,Piping Layout Drawing,0,[],1.0,https://www.reddit.com/r/AskEngineers/comments/wdyqmn/piping_layout_drawing/,all_ads,6,,,,,
83,[],False,4EverEarthbound,,[],,text,t2_qfzi0wi,False,False,False,[],False,False,1659399959,self.AskEngineers,https://www.reddit.com/r/AskEngineers/comments/wdx405/how_do_i_negotiate_a_price_for_a_concrete/,{},wdx405,False,False,False,False,False,False,True,False,,blue,[],b251a614-57f9-11e4-b47b-12313b0e9678,Discussion,dark,text,False,False,True,1,0,False,all_ads,/r/AskEngineers/comments/wdx405/how_do_i_negotiate_a_price_for_a_concrete/,False,6,moderator,1659399970,1,[removed],True,False,False,AskEngineers,t5_2sebk,280193,public,self,How do I negotiate a price for a concrete foundation plan?,0,[],1.0,https://www.reddit.com/r/AskEngineers/comments/wdx405/how_do_i_negotiate_a_price_for_a_concrete/,all_ads,6,,,,,
84,[],False,Lalalalapz,,[],,text,t2_oo9z95yq,False,False,False,[],False,False,1659398620,self.AskEngineers,https://www.reddit.com/r/AskEngineers/comments/wdwmtk/can_a_computer_engineering_degree_give_me_the/,{},wdwmtk,False,True,False,False,False,True,True,False,,purple,[],6a68317a-c3cd-11e9-bf9c-0e2863fd7a72,Computer,dark,text,False,False,True,0,0,False,all_ads,/r/AskEngineers/comments/wdwmtk/can_a_computer_engineering_degree_give_me_the/,False,6,,1659398631,1,"I'm going in the industry for the money, but I wonder if this could be an added benefit of spending ~3years learning about computers and math",True,False,False,AskEngineers,t5_2sebk,280192,public,self,Can a computer engineering degree give me the necessary knowledge or make it easier to build my own gadgets?,0,[],1.0,https://www.reddit.com/r/AskEngineers/comments/wdwmtk/can_a_computer_engineering_degree_give_me_the/,all_ads,6,,,,,
85,[],False,TorturedCactus,,[],,text,t2_7097aht7,False,False,False,[],False,False,1659398555,self.AskEngineers,https://www.reddit.com/r/AskEngineers/comments/wdwlz0/ms_thesis_vs_phd/,{},wdwlz0,False,True,False,False,False,True,True,False,,red,[],a2e13d02-57f9-11e4-8c58-12313b0e9678,Career,dark,text,False,False,True,0,0,False,all_ads,/r/AskEngineers/comments/wdwlz0/ms_thesis_vs_phd/,False,6,,1659398565,1,"I'm going into my last year in undergrad and am currently completing an undergraduate research capstone. I'm looking into graduate schools and I don't know if I should do an MS with thesis or PhD. 

The schools I've looked at have some fantastic research laboratories but majority of the students seem to be PhD students. Would doing the MS make it harder for me to get into one of these labs for my thesis? Would it be in my best interest go apply straight for the doctoral degree?

Thanks in advance!",True,False,False,AskEngineers,t5_2sebk,280192,public,self,MS (Thesis) vs PhD,0,[],1.0,https://www.reddit.com/r/AskEngineers/comments/wdwlz0/ms_thesis_vs_phd/,all_ads,6,,,,,
86,[],False,holdmybeer2017,,[],,text,t2_jefx9iv2,False,False,False,[],False,False,1659394330,self.AskEngineers,https://www.reddit.com/r/AskEngineers/comments/wdv1hm/would_a_civil_court_case_show_up_on_a_background/,{},wdv1hm,False,True,False,False,False,True,True,False,,red,[],a2e13d02-57f9-11e4-8c58-12313b0e9678,Career,dark,text,False,False,True,0,0,False,all_ads,/r/AskEngineers/comments/wdv1hm/would_a_civil_court_case_show_up_on_a_background/,False,6,,1659394341,1,"I'm not an engineer but my friend is and I am asking for him. He is applying to jobs, including government jobs. Would a Civil court case (where he is the defendant) show up in a background check?",True,False,False,AskEngineers,t5_2sebk,280190,public,self,Would a civil court case show up on a background check?,0,[],1.0,https://www.reddit.com/r/AskEngineers/comments/wdv1hm/would_a_civil_court_case_show_up_on_a_background/,all_ads,6,,,,,
87,[],False,cool_guy8807,,[],,text,t2_iw736w2f,False,False,False,[],False,False,1659393745,self.AskEngineers,https://www.reddit.com/r/AskEngineers/comments/wduteu/question_about_a_rotating_electrical_component/,{},wduteu,False,True,False,False,False,True,True,False,,purple,[],3a6acd0c-fd28-11e6-ab41-0edc7e2b18fe,Electrical,dark,text,False,False,True,0,0,False,all_ads,/r/AskEngineers/comments/wduteu/question_about_a_rotating_electrical_component/,False,6,,1659393755,1,"Hi all, I’m not an engineer, so bear with me here. 

I’m trying to design a widget, and my concept is dependent on placing electrical components on a rotating part. The part where the electrical components will be mounted can rotate in either direction, and the source would be mounted inside a stationary housing, but separated from those parts. 

The electronics would be mounted eccentrically, on the edge of a ~3ft disk.

Is this doable? What sort of electrical components would make this work?

Thanks in advance!",True,False,False,AskEngineers,t5_2sebk,280189,public,self,Question about a rotating electrical component,0,[],1.0,https://www.reddit.com/r/AskEngineers/comments/wduteu/question_about_a_rotating_electrical_component/,all_ads,6,,,,,
88,[],False,No-Duck-3498,,[],,text,t2_7ylzszne,False,False,False,[],False,False,1659391407,self.AskEngineers,https://www.reddit.com/r/AskEngineers/comments/wdtw7n/pyramid_math_problem/,{},wdtw7n,False,False,False,False,False,False,True,False,,blue,[],90a1d45a-3f64-11e5-8667-0e60d8112001,Mechanical,dark,text,False,False,True,1,0,False,all_ads,/r/AskEngineers/comments/wdtw7n/pyramid_math_problem/,False,6,moderator,1659391418,1,[removed],True,False,False,AskEngineers,t5_2sebk,280185,public,self,Pyramid math problem,0,[],1.0,https://www.reddit.com/r/AskEngineers/comments/wdtw7n/pyramid_math_problem/,all_ads,6,,,,,
89,[],False,thugga511,,[],,text,t2_2gd16pux,False,False,False,[],False,False,1659389339,self.AskEngineers,https://www.reddit.com/r/AskEngineers/comments/wdt28p/looking_for_worksheets_with_problems_and/,{},wdt28p,False,True,False,False,False,True,True,False,,green,[],1612b830-09c2-11ea-a8a8-0ea1f14b089b,Chemical,dark,text,False,False,False,0,0,False,all_ads,/r/AskEngineers/comments/wdt28p/looking_for_worksheets_with_problems_and/,False,6,,1659389350,1,"Hello, incoming graduate student after a 6-year gap. I've been going through the reading material and I need to brush up on my math from differentiation, and integration to Laplace, and Fourier transformations with everything in between. If someone has a link bookmarked and can save me sifting through google searches, I'd appreciate it",True,False,False,AskEngineers,t5_2sebk,280183,public,self,Looking for worksheets with problems and solutions for engineering math!,0,[],1.0,https://www.reddit.com/r/AskEngineers/comments/wdt28p/looking_for_worksheets_with_problems_and/,all_ads,6,,,,,
90,[],False,Defiant-Travel8174,,[],,text,t2_jf621761,False,False,False,[],False,False,1659387498,self.AskEngineers,https://www.reddit.com/r/AskEngineers/comments/wdsbjd/carbon_nano_tubes_attached_to_buckyballs/,{},wdsbjd,False,True,False,False,False,True,True,False,,blue,[],b251a614-57f9-11e4-b47b-12313b0e9678,Discussion,dark,text,False,False,True,0,0,False,all_ads,/r/AskEngineers/comments/wdsbjd/carbon_nano_tubes_attached_to_buckyballs/,False,6,,1659387508,1,"Let me start off with saying I'm just a uneducated idiot. But I was wondering if you could creating a chain of bucky balls held together with carbon nano tubes. My theory if these where interwoven together you could have a rope that could hold itself together better.

This probably belongs in ask chemists

thank you for your time

Andrew.",True,False,False,AskEngineers,t5_2sebk,280183,public,self,carbon nano tubes attached to buckyballs,0,[],1.0,https://www.reddit.com/r/AskEngineers/comments/wdsbjd/carbon_nano_tubes_attached_to_buckyballs/,all_ads,6,,,,,
91,[],False,HaltFix,,[],,text,t2_ncb2dgz8,False,False,False,[],False,False,1659387464,self.AskEngineers,https://www.reddit.com/r/AskEngineers/comments/wdsb2f/how_to_negotiate_the_price_of_a_proposal_in_plant/,{},wdsb2f,False,True,False,False,False,True,True,False,,blue,[],b251a614-57f9-11e4-b47b-12313b0e9678,Discussion,dark,text,False,False,True,0,0,False,all_ads,/r/AskEngineers/comments/wdsb2f/how_to_negotiate_the_price_of_a_proposal_in_plant/,False,6,,1659387475,1,"So, let's start saying that I am a fresh engineer based in Germany, work for a small company and have no mentor or whatsoever. 

I am working on a project to build a small LNG filling station. We got a budget price from a constructor. It was way beyond our expectations but we extended our budget.

Now he sent the formal offer and we discovered that it doesn't include commissioning and start up work. 

How can I convince the contractor to include this work into their scope? 

We don't have another contractor as an alternative because most companies in the field doesn't seem interested in small projects. I sent several quotation requests with all the specifications and when they realise that the project is small, they disappear. 

Could you give advice about approaching contractors and  negotiating offers? It would help me a lot.

Thanks in advance!!",True,False,False,AskEngineers,t5_2sebk,280183,public,self,How to negotiate the price of a proposal in plant construction field?,0,[],1.0,https://www.reddit.com/r/AskEngineers/comments/wdsb2f/how_to_negotiate_the_price_of_a_proposal_in_plant/,all_ads,6,,,,,
92,[],False,dromance,,[],,text,t2_7qyi8,False,False,False,[],False,False,1659386381,self.AskEngineers,https://www.reddit.com/r/AskEngineers/comments/wdrv4e/how_can_i_use_a_plate_to_make_2_pieces_of_sheet/,{},wdrv4e,False,True,False,False,False,True,True,False,,blue,[],b251a614-57f9-11e4-b47b-12313b0e9678,Discussion,dark,text,False,False,False,0,0,False,all_ads,/r/AskEngineers/comments/wdrv4e/how_can_i_use_a_plate_to_make_2_pieces_of_sheet/,False,6,,1659386392,1,"I have two pieces of sheet metal that when aligned are not perfectly fit, there is a small gap in between. Maybe 1/32 or max 1/16. I want to connect a plate or 2 to them and have the tension draw them closer together. How would I do this ? I drew an image to demonstrate, hope its clear? Is it even possible?  My thought process was that if the bolts on the left are tightened more then the right, it will sort of pull on the loose side the more I drill in on the tight side. But maybe this is completely wrong?

[https://imgur.com/a/96YZ07i](https://imgur.com/a/96YZ07i)

&amp;#x200B;

&amp;#x200B;

Thank you!",True,False,False,AskEngineers,t5_2sebk,280183,public,self,How can I use a plate to make 2 pieces of sheet metal fit tightly together?,0,[],1.0,https://www.reddit.com/r/AskEngineers/comments/wdrv4e/how_can_i_use_a_plate_to_make_2_pieces_of_sheet/,all_ads,6,self,"{'enabled': False, 'images': [{'id': 'KcRKJnZlahvWMCCAurSqiwDbCc4oojT9S3hHmT9H3gg', 'resolutions': [{'height': 144, 'url': 'https://external-preview.redd.it/kvwOoGIluDNkKNMScxYpAWorm-ajyfTDutvJnEpNerM.jpg?width=108&amp;crop=smart&amp;auto=webp&amp;s=1495a0bcce01929dc9069383ebec336faab1b3ac', 'width': 108}, {'height': 288, 'url': 'https://external-preview.redd.it/kvwOoGIluDNkKNMScxYpAWorm-ajyfTDutvJnEpNerM.jpg?width=216&amp;crop=smart&amp;auto=webp&amp;s=96876aae9315fbd02ac1a7fb0a90193d24a43f4a', 'width': 216}, {'height': 426, 'url': 'https://external-preview.redd.it/kvwOoGIluDNkKNMScxYpAWorm-ajyfTDutvJnEpNerM.jpg?width=320&amp;crop=smart&amp;auto=webp&amp;s=b8ac832443cfe8fb465772f3478a6fd6a6b120fc', 'width': 320}, {'height': 853, 'url': 'https://external-preview.redd.it/kvwOoGIluDNkKNMScxYpAWorm-ajyfTDutvJnEpNerM.jpg?width=640&amp;crop=smart&amp;auto=webp&amp;s=a63a0ababb1aac846e5b2eba1d9de72ea60884b0', 'width': 640}, {'height': 1280, 'url': 'https://external-preview.redd.it/kvwOoGIluDNkKNMScxYpAWorm-ajyfTDutvJnEpNerM.jpg?width=960&amp;crop=smart&amp;auto=webp&amp;s=74c0b41c0c167600b0135ae596cd9fbf9f03194e', 'width': 960}, {'height': 1440, 'url': 'https://external-preview.redd.it/kvwOoGIluDNkKNMScxYpAWorm-ajyfTDutvJnEpNerM.jpg?width=1080&amp;crop=smart&amp;auto=webp&amp;s=66b4d653c83cdc84f9b0f24126e03c191b308ca8', 'width': 1080}], 'source': {'height': 4080, 'url': 'https://external-preview.redd.it/kvwOoGIluDNkKNMScxYpAWorm-ajyfTDutvJnEpNerM.jpg?auto=webp&amp;s=b792419c02c10674d52ea09dd678a92cdb151aef', 'width': 3060}, 'variants': {}}]}",,,
93,[],False,thismomentisall,,[],,text,t2_3xs3pdoz,False,False,False,[],False,False,1659386206,self.AskEngineers,https://www.reddit.com/r/AskEngineers/comments/wdrsjv/should_a_spec_call_out_a_licensed_plumber_to/,{},wdrsjv,False,True,False,False,False,True,True,False,,blue,[],90a1d45a-3f64-11e5-8667-0e60d8112001,Mechanical,dark,text,False,False,False,0,0,False,all_ads,/r/AskEngineers/comments/wdrsjv/should_a_spec_call_out_a_licensed_plumber_to/,False,6,,1659386216,1,"A small pump station has the specs call out a Licensed Plumber is to install diesel fuel piping? ~5k gallon fuel tank with 3/4"" lines running to three engines running some pumps.

I have not seen this type of language before. Searching through some example specs I didn't find anything similar. Is this correct? Talking to two of my coworkers I got contradictory responses.",True,False,False,AskEngineers,t5_2sebk,280183,public,self,Should a spec call out a Licensed Plumber to install diesel fuel piping?,0,[],1.0,https://www.reddit.com/r/AskEngineers/comments/wdrsjv/should_a_spec_call_out_a_licensed_plumber_to/,all_ads,6,,,,,
94,[],False,Dalbro95,,[],,text,t2_11t2vb,False,False,False,[],False,False,1659385528,self.AskEngineers,https://www.reddit.com/r/AskEngineers/comments/wdriiq/is_visual_basic_worth_it/,{},wdriiq,False,True,False,False,False,True,True,False,,blue,[],b251a614-57f9-11e4-b47b-12313b0e9678,Discussion,dark,text,False,False,False,0,0,False,all_ads,/r/AskEngineers/comments/wdriiq/is_visual_basic_worth_it/,False,6,,1659385539,1,"Hello everyone, Mechanical Engineer here.
My employer are willing to offer to his employees a basic course of 24h of Visual Basic mainly focused on creating Macros on excel. I will take the course obviously because free knowledge is always good and I love to create spreadsheets for myself and with macros they will be even more complete and user-friendly; but beyond that, are there any other valid application for VBA? Thanks",True,False,False,AskEngineers,t5_2sebk,280181,public,self,Is Visual Basic worth it?,0,[],1.0,https://www.reddit.com/r/AskEngineers/comments/wdriiq/is_visual_basic_worth_it/,all_ads,6,,,,,
95,[],False,jmos_81,,[],Systems Engineering / Integration & Test,text,t2_yaz98,False,False,False,[],False,False,1659384878,self.AskEngineers,https://www.reddit.com/r/AskEngineers/comments/wdr8u2/is_the_worklife_balance_in_the_space_industry_as/,{},wdr8u2,False,True,False,False,False,True,True,False,,blue,[],b251a614-57f9-11e4-b47b-12313b0e9678,Discussion,dark,text,False,False,True,0,0,False,all_ads,/r/AskEngineers/comments/wdr8u2/is_the_worklife_balance_in_the_space_industry_as/,False,6,,1659384889,1,"I'm an integration and test systems engineer for one of the big 4 aero/defense companies working on an airborne program. It's busy, but there is very little overtime for the program and that's only if we are doing specific tests. My ultimate goal has always been to work on space product, but I'm becoming a bit weary on wanting to enter the industry due to what I've heard via word of mouth. I know individuals from 3 different companies/NASA that informed me of crazy long shifts all the time. Everyone is aware of what it's like working at the SpaceX's/Blue Origins, but I was shocked to hear about the long hours even at the space divisions of the big 4 companies. The higher clearance and higher salary aren't convincing enough for me. 

There was a recent post on r/aerospace discussing the demands of the space industry, but that OP was a GNC engineer which is one of the most demanding roles I've heard of. One of the people I talked to was a GNC engineer, so I'm looking to hear from those in other roles. My question is are all roles this demanding in the space industry and more specifically are systems positions this demanding? This is my dream, but I won't give up my work life balance permanently to support this schedule and not see my wife.",True,False,False,AskEngineers,t5_2sebk,280181,public,self,Is the Work/Life balance in the space industry as bad as they say?,0,[],1.0,https://www.reddit.com/r/AskEngineers/comments/wdr8u2/is_the_worklife_balance_in_the_space_industry_as/,all_ads,6,,,#d3d6da,2238776c-d04a-11e6-8ad9-0eff92f5bd12,dark
96,[],False,naughty_valley_asker,,[],,text,t2_qrzdufov,False,False,False,[],False,False,1659384713,self.AskEngineers,https://www.reddit.com/r/AskEngineers/comments/wdr6fu/poaching_engineers_email/,{},wdr6fu,False,False,False,False,False,False,True,False,,red,[],a2e13d02-57f9-11e4-8c58-12313b0e9678,Career,dark,text,False,False,True,1,0,False,all_ads,/r/AskEngineers/comments/wdr6fu/poaching_engineers_email/,False,6,moderator,1659384724,1,[removed],True,False,False,AskEngineers,t5_2sebk,280181,public,self,Poaching engineers email,0,[],1.0,https://www.reddit.com/r/AskEngineers/comments/wdr6fu/poaching_engineers_email/,all_ads,6,,,,,
