20,[],False,alpacasu1tcase,,[],,text,t2_141w06,False,False,False,[],False,False,1660185751,self.AskEngineers,https://www.reddit.com/r/AskEngineers/comments/wlg7re/plexiglass_to_child_proof_loft/,{},wlg7re,False,True,False,False,False,True,True,False,,blue,[],90a1d45a-3f64-11e5-8667-0e60d8112001,Mechanical,dark,text,False,False,True,0,0,False,all_ads,/r/AskEngineers/comments/wlg7re/plexiglass_to_child_proof_loft/,False,6,1660185762,1,"We have a second floor loft in our house with a railing with traditional looking vertical spindles. There is a header right above the railing, it looks like drywall on the outside but I assume there is a beam in there. I am concerned about toddlers going over the railing and falling to the first floor. Do you think plexiglass from floor to ceiling is strong enough? Home Depot has 4x8’ panels of acrylic 1/4” or smaller thickness. I am thinking of screwing the panels to the header, not sure the best way to secure the bottom and also not sure if setting up vertical supports at the edges is needed. 

I don’t know if this is an engineering question, but I’m also wondering if limiting air flow to the loft will be a problem? I’ve thought of drilling holes in the plexiglass but this might weaken it. 

I appreciate any advice or suggestions! Thanks for your time.",True,False,False,AskEngineers,t5_2sebk,281052,public,self,Plexiglass to child proof loft?,0,[],1.0,https://www.reddit.com/r/AskEngineers/comments/wlg7re/plexiglass_to_child_proof_loft/,all_ads,6,,,,,,,,,
21,[],False,saint7412369,,[],,text,t2_bt8f5,False,False,False,[],False,False,1660185016,self.AskEngineers,https://www.reddit.com/r/AskEngineers/comments/wlfyp9/is_it_usual_to_get_to_a_point_in_your_career/,{},wlfyp9,False,True,False,False,False,True,True,False,,blue,[],b251a614-57f9-11e4-b47b-12313b0e9678,Discussion,dark,text,False,False,False,0,0,False,all_ads,/r/AskEngineers/comments/wlfyp9/is_it_usual_to_get_to_a_point_in_your_career/,False,6,1660185026,1,"Hi Everyone. When I was younger I had an intrinsic respect for my managers. I was young and inexperienced and they were experienced and could teach me things. It’s obvious in this scenario why their opinions matter and I should listen to them. 

As I’ve developed as an engineer I’ve realised that the executives (generally speaking) are actually worse engineers as they’ve focussed on ‘management’ instead of the finer points of the discipline and in general have far less product knowledge. 

It seems like these people get selected by chance (or because they’re friends with someone) and not because they are the most competent person for the role. Or even worse because they have ‘management’ experience. They then enter a position where their no longer answerable and become both arrogant and lazy. 

In short.. I’m finding it harder and harder to give two shits about what my boss says. I just want to complete my tasks to the best I can. This guy has adhd and tells me to make changes to projects based on spur of the moment thoughts and this almost always results in a worse solution. He has appointed myself and two other ‘team leads’ who are all responsible for 7 people, so he in effect, doesn’t have to do his job. 

I’m becoming increasingly frustrated with this. If anyone has any advice for dealing with a situation like this I’d love to hear it. Thanks",True,False,False,AskEngineers,t5_2sebk,281052,public,self,Is it usual to get to a point in your career where you no longer respect management?,0,[],1.0,https://www.reddit.com/r/AskEngineers/comments/wlfyp9/is_it_usual_to_get_to_a_point_in_your_career/,all_ads,6,,,,,,,,,
22,[],False,humble_ninja,,[],,text,t2_wex0n,False,False,False,[],False,False,1660184108,self.AskEngineers,https://www.reddit.com/r/AskEngineers/comments/wlfngw/what_should_an_in_process_part_be_identified_as/,{},wlfngw,False,True,False,False,False,True,True,False,,blue,[],b251a614-57f9-11e4-b47b-12313b0e9678,Discussion,dark,text,False,False,True,0,0,False,all_ads,/r/AskEngineers/comments/wlfngw/what_should_an_in_process_part_be_identified_as/,False,6,1660184120,1,"We had a debate at work today about what parts that are currently in WIP (work in progress) should be identified as. Let's see we have an assembly ""X"" that has has been pulled from stock and had an operation done to it to meet the product definition of assembly ""Y"", and is now bagged and awaiting the next operation to meet the full product definition of ""Y"". What would you identify the idle part as? Is it ""X"" until it fully meets the PD of ""Y""? Is it a synthetic part number? Should it already be identified as ""Y"", and is that not confusing because it's on the shop floor and wouldn't get stocked?",True,False,False,AskEngineers,t5_2sebk,281051,public,self,"What should an ""In Process"" part be identified as?",0,[],1.0,https://www.reddit.com/r/AskEngineers/comments/wlfngw/what_should_an_in_process_part_be_identified_as/,all_ads,6,,,,,,,,,
23,[],False,HETXOPOWO,,[],,text,t2_7wlf11q8,False,False,False,[],False,False,1660183815,self.AskEngineers,https://www.reddit.com/r/AskEngineers/comments/wlfjrk/ljungström_turbine_blade_profile/,{},wlfjrk,False,True,False,False,False,True,True,False,,blue,[],b251a614-57f9-11e4-b47b-12313b0e9678,Discussion,dark,text,False,False,False,0,0,False,all_ads,/r/AskEngineers/comments/wlfjrk/ljungström_turbine_blade_profile/,False,6,1660183826,1,"Greetings all, I've been fascinated with the ljungström steam turbine for quite a while and wanted to build (3D print) a small scale model but I cannot find any information readily available for what blade profile to use. Being a radial out turbine with counter rotating blades there is very little out there. Worst case I'll use a generic naca profile but some guidance would be appreciated!",True,False,False,AskEngineers,t5_2sebk,281051,public,self,Ljungström turbine blade profile,0,[],1.0,https://www.reddit.com/r/AskEngineers/comments/wlfjrk/ljungström_turbine_blade_profile/,all_ads,6,,,,,,,,,
24,[],False,wingedretriever,,[],,text,t2_6n8ih,False,False,False,[],False,False,1660180498,self.AskEngineers,https://www.reddit.com/r/AskEngineers/comments/wledfs/whats_the_best_thing_to_line_these_grate/,{},wledfs,False,False,False,False,False,False,True,False,,blue,[],90a1d45a-3f64-11e5-8667-0e60d8112001,Mechanical,dark,text,False,False,True,1,0,False,all_ads,/r/AskEngineers/comments/wledfs/whats_the_best_thing_to_line_these_grate/,False,6,1660180509,1,[removed],True,False,False,AskEngineers,t5_2sebk,281050,public,self,What's the best thing to line these grate industrial rack shelves for multiple fish tanks?,0,[],1.0,https://www.reddit.com/r/AskEngineers/comments/wledfs/whats_the_best_thing_to_line_these_grate/,all_ads,6,moderator,self,"{'enabled': False, 'images': [{'id': '_LGXqDHlQGeX5bkNIC7tDD9YB6Ryp311xHIbtzJtGwg', 'resolutions': [{'height': 98, 'url': 'https://external-preview.redd.it/KRZmO5xp2U6U162ZcZdNoAqyoTGOqISsqGvxk_K0T1g.jpg?width=108&amp;crop=smart&amp;auto=webp&amp;s=f11509c83a3a8d236c2442582c8e7fe57b2dd1cc', 'width': 108}, {'height': 196, 'url': 'https://external-preview.redd.it/KRZmO5xp2U6U162ZcZdNoAqyoTGOqISsqGvxk_K0T1g.jpg?width=216&amp;crop=smart&amp;auto=webp&amp;s=003ecd97bfad4bf4b250e04a26da81618aa92221', 'width': 216}, {'height': 290, 'url': 'https://external-preview.redd.it/KRZmO5xp2U6U162ZcZdNoAqyoTGOqISsqGvxk_K0T1g.jpg?width=320&amp;crop=smart&amp;auto=webp&amp;s=c97eb34ee57afb23d066285a278a778e2fa70ea1', 'width': 320}, {'height': 581, 'url': 'https://external-preview.redd.it/KRZmO5xp2U6U162ZcZdNoAqyoTGOqISsqGvxk_K0T1g.jpg?width=640&amp;crop=smart&amp;auto=webp&amp;s=2e7d6e2376bd827f5845cf155e9c8d37989d1f85', 'width': 640}], 'source': {'height': 739, 'url': 'https://external-preview.redd.it/KRZmO5xp2U6U162ZcZdNoAqyoTGOqISsqGvxk_K0T1g.jpg?auto=webp&amp;s=cf7bf774001180f72211d9ca0cbfa7a864666626', 'width': 814}, 'variants': {}}]}",,,,,,
25,[],False,slugninjas,,[],,text,t2_q1ycs3mj,False,False,False,[],False,False,1660179838,self.AskEngineers,https://www.reddit.com/r/AskEngineers/comments/wle569/mechanical_engineer_or_software_engineer/,{},wle569,False,False,False,False,False,False,True,False,,blue,[],b251a614-57f9-11e4-b47b-12313b0e9678,Discussion,dark,text,False,False,True,1,0,False,all_ads,/r/AskEngineers/comments/wle569/mechanical_engineer_or_software_engineer/,False,6,1660179848,1,[removed],True,False,False,AskEngineers,t5_2sebk,281050,public,self,Mechanical Engineer or Software Engineer?,0,[],1.0,https://www.reddit.com/r/AskEngineers/comments/wle569/mechanical_engineer_or_software_engineer/,all_ads,6,moderator,,,,,,,,
26,[],False,dbreidsbmw,,[],,text,t2_8eal8,False,False,False,[],False,False,1660178994,self.AskEngineers,https://www.reddit.com/r/AskEngineers/comments/wldup4/understanding_a_pid_set_up_or_vs_and_or_having_my/,{},wldup4,False,True,False,False,False,True,True,False,,purple,[],3a6acd0c-fd28-11e6-ab41-0edc7e2b18fe,Electrical,dark,text,False,False,True,0,0,False,all_ads,/r/AskEngineers/comments/wldup4/understanding_a_pid_set_up_or_vs_and_or_having_my/,False,6,1660179005,1,"So I am planing on installing this PID controller, [GL-102B_manual_PID](https://drive.google.com/file/d/1pL-OB6W7kDk_UGSXI9NbbBt_sA1GSuAm/view?usp=sharing) into my 3D printer's build chamber for a heatedresin Vat, to print in my garage. The chemical smell of the UV resin is too much for my house.


Can I run a heater like page 9 example 11.3 for resin vat heating, and run a heater + fan combo like page 8, example 11.1? Or Am I better off buying a 2zone controller or a second controller off the same model number?",True,False,False,AskEngineers,t5_2sebk,281049,public,self,"Understanding a PID set up; ""or"" vs ""and or"" (having my cake and eating it too)",0,[],1.0,https://www.reddit.com/r/AskEngineers/comments/wldup4/understanding_a_pid_set_up_or_vs_and_or_having_my/,all_ads,6,,self,"{'enabled': False, 'images': [{'id': '754D-cW9K0d_GQHr3FcLe6yCeIc-mXO5piZrY6rlma4', 'resolutions': [{'height': 56, 'url': 'https://external-preview.redd.it/f5yRiOfHdejlB2kvNkrUrHwiCaOFGT1h4rw7bTbpGaA.jpg?width=108&amp;crop=smart&amp;auto=webp&amp;s=b8c64ad96661cdcc2afabcedd71c51bf42a59ab9', 'width': 108}, {'height': 113, 'url': 'https://external-preview.redd.it/f5yRiOfHdejlB2kvNkrUrHwiCaOFGT1h4rw7bTbpGaA.jpg?width=216&amp;crop=smart&amp;auto=webp&amp;s=cf06a87e3950e84c273550ac8acbc9af2342bc78', 'width': 216}, {'height': 168, 'url': 'https://external-preview.redd.it/f5yRiOfHdejlB2kvNkrUrHwiCaOFGT1h4rw7bTbpGaA.jpg?width=320&amp;crop=smart&amp;auto=webp&amp;s=9174b8213d07707930922e77ce99584415c964b0', 'width': 320}, {'height': 336, 'url': 'https://external-preview.redd.it/f5yRiOfHdejlB2kvNkrUrHwiCaOFGT1h4rw7bTbpGaA.jpg?width=640&amp;crop=smart&amp;auto=webp&amp;s=7d8bdceaa687994d37c140635d2a6c08a96cee45', 'width': 640}, {'height': 504, 'url': 'https://external-preview.redd.it/f5yRiOfHdejlB2kvNkrUrHwiCaOFGT1h4rw7bTbpGaA.jpg?width=960&amp;crop=smart&amp;auto=webp&amp;s=8f9e55e75cb773064d5cd688fd5fa3262c981a03', 'width': 960}, {'height': 567, 'url': 'https://external-preview.redd.it/f5yRiOfHdejlB2kvNkrUrHwiCaOFGT1h4rw7bTbpGaA.jpg?width=1080&amp;crop=smart&amp;auto=webp&amp;s=db33a2823fc399fa8151582d94e7a0b52d5dde1b', 'width': 1080}], 'source': {'height': 630, 'url': 'https://external-preview.redd.it/f5yRiOfHdejlB2kvNkrUrHwiCaOFGT1h4rw7bTbpGaA.jpg?auto=webp&amp;s=f39b9e56cfe517dac6f127854938b4b37f2273e6', 'width': 1200}, 'variants': {}}]}",,,,,,
27,[],False,burner-7375839474,,[],,text,t2_4d94ftx8,False,False,False,[],False,False,1660178789,self.AskEngineers,https://www.reddit.com/r/AskEngineers/comments/wlds5e/a_question_about_backflow_prevents_for_irrigation/,{},wlds5e,False,False,False,False,False,False,True,False,,green,[],1612b830-09c2-11ea-a8a8-0ea1f14b089b,Chemical,dark,text,False,False,True,1,0,False,all_ads,/r/AskEngineers/comments/wlds5e/a_question_about_backflow_prevents_for_irrigation/,False,6,1660178800,1,[removed],True,False,False,AskEngineers,t5_2sebk,281049,public,self,A question about backflow prevents for irrigation,0,[],1.0,https://www.reddit.com/r/AskEngineers/comments/wlds5e/a_question_about_backflow_prevents_for_irrigation/,all_ads,6,moderator,,,,,,,,
28,[],False,jjamens,,[],,text,t2_1riiaql,False,False,False,[],False,False,1660178714,self.AskEngineers,https://www.reddit.com/r/AskEngineers/comments/wldr8r/help_with_thermoset_materials_and_low_voltage_cts/,{},wldr8r,False,True,False,False,False,True,True,False,,blue,[],b251a614-57f9-11e4-b47b-12313b0e9678,Discussion,dark,text,False,False,True,0,0,False,all_ads,/r/AskEngineers/comments/wldr8r/help_with_thermoset_materials_and_low_voltage_cts/,False,6,1660178725,1,"Hi everyone!

Right now I'm on a project where we want to develop low voltage resin CTs for our market in Colombia. In our  investigation regarding encapsulation materials, I have encountered that the main resins used for this application are the ones built upon Hydrogenated Bisphenol A, thanks to its great mechanical properties and UV resistance.

In Colombia there is a particular behavior in this regard, where local manufacturers will mostly use Unsaturated Polyester (UP) resin for this application. From my research, I haven't found any international company using this type of resin and that has puzzled me. I believe the decision here has been price but I still can't understand how the market accepts this lower quality product.

With this in mind, I would like to ask you guys if anyone has had experience in this subject and, if yes, what do you think is the technical reason not to use UP in electrical transformers? Is it more prone to leakage currents, is it its mechanical properties? Do you think the fact that low voltage has less risks associated during its operation than medium or high voltage has allowed local manufacturers to sell products under specification without sweating it? What are your thoughts on this subject?

A final question, how do you think the situation would change if we were talking about indoor transformers? For this type, I have even encountered injection molded cases (from international manufacturers) without encapsulation inside which work as a charm. So, would there be a reason not to go forward with UP in indoor models?

I hope I have been clear. I thank you in advance for any idea. I have tried to find more information in literature (why epoxy and not polyester?) but haven't been successful until now.

Greetings from Bogotá!",True,False,False,AskEngineers,t5_2sebk,281049,public,self,Help with thermoset materials and low voltage CTs,0,[],1.0,https://www.reddit.com/r/AskEngineers/comments/wldr8r/help_with_thermoset_materials_and_low_voltage_cts/,all_ads,6,,,,,,,,,
29,[],False,Lalalalapz,,[],,text,t2_oo9z95yq,False,False,False,[],False,False,1660178271,self.AskEngineers,https://www.reddit.com/r/AskEngineers/comments/wldlql/becoming_a_maritime_engineer_to_build_unorthodox/,{},wldlql,False,True,False,False,False,True,True,False,,blue,[],90a1d45a-3f64-11e5-8667-0e60d8112001,Mechanical,dark,text,False,False,True,0,0,False,all_ads,/r/AskEngineers/comments/wldlql/becoming_a_maritime_engineer_to_build_unorthodox/,False,6,1660178282,1,Would it be helpful to take a maritime engineering course to become capable of building anything that can float and travel on/under water?,True,False,False,AskEngineers,t5_2sebk,281048,public,self,Becoming a maritime engineer to build unorthodox boats?,0,[],1.0,https://www.reddit.com/r/AskEngineers/comments/wldlql/becoming_a_maritime_engineer_to_build_unorthodox/,all_ads,6,,,,,,,,,
30,[],False,AvrgBeaver,,[],Mechatronics,text,t2_xc2t3,False,False,False,[],False,False,1660176518,self.AskEngineers,https://www.reddit.com/r/AskEngineers/comments/wlczzl/whats_a_good_place_to_get_eo_insurance_for/,{},wlczzl,False,True,False,False,False,True,True,False,,blue,[],b251a614-57f9-11e4-b47b-12313b0e9678,Discussion,dark,text,False,False,True,0,0,False,all_ads,/r/AskEngineers/comments/wlczzl/whats_a_good_place_to_get_eo_insurance_for/,False,6,1660176529,1,I’m doing some contracting work and think it’s best to get E&amp;O coverage just in case. Can anyone recommend a good insurance policy? Thanks!,True,False,False,AskEngineers,t5_2sebk,281047,public,self,What’s a good place to get E&amp;O insurance for mechanical engineers in product design?,0,[],1.0,https://www.reddit.com/r/AskEngineers/comments/wlczzl/whats_a_good_place_to_get_eo_insurance_for/,all_ads,6,,,,#d3d6da,2238776c-d04a-11e6-8ad9-0eff92f5bd12,dark,,,
31,[],False,potattatop,,[],,text,t2_qcilwlsh,False,False,False,[],False,False,1660174524,self.AskEngineers,https://www.reddit.com/r/AskEngineers/comments/wlcaoe/can_a_townhouserowhouse_be_partially_demolished/,{},wlcaoe,False,False,False,False,False,False,True,False,,orange,[],939137fa-3f64-11e5-b90e-0ef63926eacd,Civil,dark,text,False,False,True,0,0,False,all_ads,/r/AskEngineers/comments/wlcaoe/can_a_townhouserowhouse_be_partially_demolished/,False,6,1660174534,1,[removed],True,False,False,AskEngineers,t5_2sebk,281045,public,self,"Can a townhouse/rowhouse be partially demolished? Double-brick, pre-1900 construction with stone crawlspace foundation",0,[],1.0,https://www.reddit.com/r/AskEngineers/comments/wlcaoe/can_a_townhouserowhouse_be_partially_demolished/,all_ads,6,reddit,,,,,,,,
32,[],False,jay_jay_abrahams,,[],,text,t2_jx2axz0,False,False,False,[],False,False,1660173320,self.AskEngineers,https://www.reddit.com/r/AskEngineers/comments/wlbv57/approximation_for_the_friction_of_bearings/,{},wlbv57,False,True,False,False,False,True,True,False,,blue,[],90a1d45a-3f64-11e5-8667-0e60d8112001,Mechanical,dark,text,False,False,True,0,0,False,all_ads,/r/AskEngineers/comments/wlbv57/approximation_for_the_friction_of_bearings/,False,6,1660173331,1,"I'm working on a project where I need to spin a 45-55Kg tube for several hours and in selecting the motor to be used for this I would like to know the friction that I can expect the bearings to produce.  


This seems like a Problem that google should be able to help me with, I know, but every page I find that explains the calculations requires values and information that bearing manufacturers apparently don't feel it necessary to include on their Product Pages (either that or I'm too blind to find them)  


So now I'm asking here if anyone has maybe a simplified formula or a good estimation range or even just a good resource where I can continue?  


Here's the setup:  
45kg tube with length \~1.3m, mounted on two bearings (most likely double row deep groove ball bearings) , one on either end, spinning at \~1000rpm driven by a belt drive on one side of the tube",True,False,False,AskEngineers,t5_2sebk,281044,public,self,Approximation for the friction of bearings?,0,[],1.0,https://www.reddit.com/r/AskEngineers/comments/wlbv57/approximation_for_the_friction_of_bearings/,all_ads,6,,,,,,,,,
33,[],False,friedmanchicago,,[],,text,t2_fdyaj3fr,False,False,False,[],False,False,1660172402,self.AskEngineers,https://www.reddit.com/r/AskEngineers/comments/wlbii8/what_are_some_things_you_should_consider_prior_to/,{},wlbii8,False,False,False,False,False,False,True,False,,blue,[],90a1d45a-3f64-11e5-8667-0e60d8112001,Mechanical,dark,text,False,False,True,1,0,False,all_ads,/r/AskEngineers/comments/wlbii8/what_are_some_things_you_should_consider_prior_to/,False,6,1660172412,1,[removed],True,False,False,AskEngineers,t5_2sebk,281043,public,self,What are some things you should consider prior to acquiring a manufacturing engineering company?,0,[],1.0,https://www.reddit.com/r/AskEngineers/comments/wlbii8/what_are_some_things_you_should_consider_prior_to/,all_ads,6,moderator,,,,,,,,
34,[],False,brooklynbest97,,[],,text,t2_4zrtgzus,False,False,False,[],False,False,1660171901,self.AskEngineers,https://www.reddit.com/r/AskEngineers/comments/wlbbr9/should_i_mention_current_job_in_phone_screening/,{},wlbbr9,False,True,False,False,False,True,True,False,,blue,[],b251a614-57f9-11e4-b47b-12313b0e9678,Discussion,dark,text,False,False,False,0,0,False,all_ads,/r/AskEngineers/comments/wlbbr9/should_i_mention_current_job_in_phone_screening/,False,6,1660171912,1,"Started a job about a month ago in defense as a systems engineer, as this was the only job I could get after graduation. The job is really not what I had hoped for, plus the commute is starting to get to me (1 hour one way). Today I was contacted by a company for a phone screen for a mechanical engineering position. The job is more focused on design and is much closer to home. During the phone screen, should I mention by current job. If so, what should I say. Thanks. 

P.S I know I shouldn’t leave my current job so soon, but I’m miserable and need a change.",True,False,False,AskEngineers,t5_2sebk,281041,public,self,Should I mention current job in phone screening,0,[],1.0,https://www.reddit.com/r/AskEngineers/comments/wlbbr9/should_i_mention_current_job_in_phone_screening/,all_ads,6,,,,,,,,,
35,[],False,b1123079,,[],,text,t2_a1k6ayj8,False,False,False,[],False,False,1660171755,self.AskEngineers,https://www.reddit.com/r/AskEngineers/comments/wlb9q4/what_is_best_what_is_your_day_to_day/,{},wlb9q4,False,True,False,False,False,True,True,False,,blue,[],b251a614-57f9-11e4-b47b-12313b0e9678,Discussion,dark,text,False,False,True,0,0,False,all_ads,/r/AskEngineers/comments/wlb9q4/what_is_best_what_is_your_day_to_day/,False,6,1660171766,1,"(M/20yo) I currently work at at retail knife store as a knife sharpener. With us moved into our new upgraded store we are planning to be an American OEM, with CNCs and other manufacturing in house. Ive found an interest in precision machinery and creating and fixing things. I am now wanting to take classes and certifications in the field but I’m not sure what would be best. I like being hands on and using the theory and the practice. I’ve considered of going into trade schools like welding, precision machinery  or going through an engineering program. I found that engineers work with the idea of a product where a machinist is repeatedly milling a product. Ideally I’d like something in the middle of the two. Does anyone one have any suggestions or maybe what to share their experience? I’d really like to know the day to day from all of you. :) thanks",True,False,False,AskEngineers,t5_2sebk,281041,public,self,What is best? What is your day to day?,0,[],1.0,https://www.reddit.com/r/AskEngineers/comments/wlb9q4/what_is_best_what_is_your_day_to_day/,all_ads,6,,,,,,,,,
36,[],False,Defiant-Travel8174,,[],,text,t2_jf621761,False,False,False,[],False,False,1660167906,self.AskEngineers,https://www.reddit.com/r/AskEngineers/comments/wl9qsv/car_radiator_that_uses_thermoacoustic_to_cool_it/,{},wl9qsv,False,True,False,False,False,True,True,False,,blue,[],b251a614-57f9-11e4-b47b-12313b0e9678,Discussion,dark,text,False,False,True,0,0,False,all_ads,/r/AskEngineers/comments/wl9qsv/car_radiator_that_uses_thermoacoustic_to_cool_it/,False,6,1660167917,1,"Let me start this off with saying I am just a uneducated idiot, But I am wondering if you could build a car radiator that uses thermoacoustics to further cool down the rad and improve engine thermal efficiency. I hope some smart people can chime in and either ya or nay my idea.

Thank you for your time,

Andrew",True,False,False,AskEngineers,t5_2sebk,281040,public,self,car radiator that uses thermoacoustic to cool it down,0,[],1.0,https://www.reddit.com/r/AskEngineers/comments/wl9qsv/car_radiator_that_uses_thermoacoustic_to_cool_it/,all_ads,6,,,,,,,,,
37,[],False,LongToeBoy,,[],,text,t2_cpwk6848,False,False,False,[],False,False,1660166950,self.AskEngineers,https://www.reddit.com/r/AskEngineers/comments/wl9d5x/jwst_made_me_thinking_is_it_possible_to_make_a/,{},wl9d5x,False,True,False,False,False,True,True,False,,blue,[],b251a614-57f9-11e4-b47b-12313b0e9678,Discussion,dark,text,False,False,True,0,0,False,all_ads,/r/AskEngineers/comments/wl9d5x/jwst_made_me_thinking_is_it_possible_to_make_a/,False,6,1660166960,1,,True,False,False,AskEngineers,t5_2sebk,281039,public,self,"JWST made me thinking. is it possible to make a telescope with multiple hexagonal mirrors but all of them being flat, but each of them still tilted to focus light in single point? would it work?",0,[],1.0,https://www.reddit.com/r/AskEngineers/comments/wl9d5x/jwst_made_me_thinking_is_it_possible_to_make_a/,all_ads,6,,,,,,,,,
38,[],False,liehewyounce,,[],,text,t2_114nqb,False,False,False,[],False,False,1660166632,self.AskEngineers,https://www.reddit.com/r/AskEngineers/comments/wl98kt/how_do_companies_prevent_machine_design_engineers/,{},wl98kt,False,True,False,False,False,True,True,False,,blue,[],90a1d45a-3f64-11e5-8667-0e60d8112001,Mechanical,dark,text,False,False,False,0,0,False,all_ads,/r/AskEngineers/comments/wl98kt/how_do_companies_prevent_machine_design_engineers/,False,6,1660166643,1,Example; Company X uses a belt conveyor to move product because it is 20% more efficient than a rotary table. Company Y uses the rotary table because they are unaware of belts being more efficient. What stops a machine maker from saying a belt conveyor would be better even though they learned that from another customer?,True,False,False,AskEngineers,t5_2sebk,281039,public,self,"How do companies prevent machine design engineers from using trade secrets on other companies machines without patents, etc?",0,[],1.0,https://www.reddit.com/r/AskEngineers/comments/wl98kt/how_do_companies_prevent_machine_design_engineers/,all_ads,6,,,,,,,,,
