,all_awardings,allow_live_comments,author,author_flair_css_class,author_flair_richtext,author_flair_text,author_flair_type,author_fullname,author_is_blocked,author_patreon_flair,author_premium,awarders,can_mod_post,contest_mode,created_utc,domain,full_link,gildings,id,is_created_from_ads_ui,is_crosspostable,is_meta,is_original_content,is_reddit_media_domain,is_robot_indexable,is_self,is_video,link_flair_background_color,link_flair_css_class,link_flair_richtext,link_flair_template_id,link_flair_text,link_flair_text_color,link_flair_type,locked,media_only,no_follow,num_comments,num_crossposts,over_18,parent_whitelist_status,permalink,pinned,pwls,retrieved_on,score,selftext,send_replies,spoiler,stickied,subreddit,subreddit_id,subreddit_subscribers,subreddit_type,thumbnail,title,total_awards_received,treatment_tags,upvote_ratio,url,whitelist_status,wls,removed_by_category,post_hint,preview,author_flair_background_color,author_flair_template_id,author_flair_text_color,crosspost_parent,crosspost_parent_list,url_overridden_by_dest
0,[],False,TheVoges27,,[],,text,t2_4jq8y13n,False,False,False,[],False,False,1660232589,self.AskEngineers,https://www.reddit.com/r/AskEngineers/comments/wluk09/are_there_any_air_quality_websites_that_take/,{},wluk09,False,True,False,False,False,True,True,False,,blue,[],b251a614-57f9-11e4-b47b-12313b0e9678,Discussion,dark,text,False,False,True,0,0,False,all_ads,/r/AskEngineers/comments/wluk09/are_there_any_air_quality_websites_that_take/,False,6,1660232600,1,,True,False,False,AskEngineers,t5_2sebk,281105,public,self,Are there any air quality websites that take unverified data?,0,[],1.0,https://www.reddit.com/r/AskEngineers/comments/wluk09/are_there_any_air_quality_websites_that_take/,all_ads,6,,,,,,,,,
1,[],False,LeverClever,,[],,text,t2_5jywya42,False,False,False,[],False,False,1660232152,self.AskEngineers,https://www.reddit.com/r/AskEngineers/comments/wludj5/will_employers_care_if_a_program_is_not_abet/,{},wludj5,False,True,False,False,False,True,True,False,,blue,[],b251a614-57f9-11e4-b47b-12313b0e9678,Discussion,dark,text,False,False,True,0,0,False,all_ads,/r/AskEngineers/comments/wludj5/will_employers_care_if_a_program_is_not_abet/,False,6,1660232162,1,I'm looking at Northeastern's college of professional studies to do a degree in mechatronics. Looks good on paper and I would be able to work and take classes at night. From the website it doesn't look ABET accredited though. Do you think employers will care?,True,False,False,AskEngineers,t5_2sebk,281103,public,self,Will employers care if a program is not ABET accredited?,0,[],1.0,https://www.reddit.com/r/AskEngineers/comments/wludj5/will_employers_care_if_a_program_is_not_abet/,all_ads,6,,,,,,,,,
2,[],False,username_bot_,,[],,text,t2_cduy4gz7,False,False,False,[],False,False,1660231807,self.AskEngineers,https://www.reddit.com/r/AskEngineers/comments/wlu8e1/high_school_build_a_spaghetti_bridge/,{},wlu8e1,False,False,False,False,False,False,True,False,,orange,[],939137fa-3f64-11e5-b90e-0ef63926eacd,Civil,dark,text,False,False,True,1,0,False,all_ads,/r/AskEngineers/comments/wlu8e1/high_school_build_a_spaghetti_bridge/,False,6,1660231818,1,[removed],True,False,False,AskEngineers,t5_2sebk,281102,public,self,[high school] build a spaghetti bridge,0,[],1.0,https://www.reddit.com/r/AskEngineers/comments/wlu8e1/high_school_build_a_spaghetti_bridge/,all_ads,6,moderator,,,,,,,,
3,[],False,Dr-ZAIN,,[],,text,t2_7cjp08rd,False,False,False,[],False,False,1660230843,self.AskEngineers,https://www.reddit.com/r/AskEngineers/comments/wltute/can_a_biomedical_engineer_be_like_shane_wighton/,{},wltute,False,False,False,False,False,False,True,False,,blue,[],90a1d45a-3f64-11e5-8667-0e60d8112001,Mechanical,dark,text,False,False,True,1,0,False,all_ads,/r/AskEngineers/comments/wltute/can_a_biomedical_engineer_be_like_shane_wighton/,False,6,1660230854,1,[removed],True,False,False,AskEngineers,t5_2sebk,281099,public,self,Can a Biomedical engineer be like Shane Wighton from stuff made here ?,0,[],1.0,https://www.reddit.com/r/AskEngineers/comments/wltute/can_a_biomedical_engineer_be_like_shane_wighton/,all_ads,6,moderator,,,,,,,,
4,[],False,TotalChaos7,,[],,text,t2_4lborn1l,False,False,False,[],False,False,1660230366,self.AskEngineers,https://www.reddit.com/r/AskEngineers/comments/wlto31/im_going_insane/,{},wlto31,False,False,False,False,False,False,True,False,,blue,[],b251a614-57f9-11e4-b47b-12313b0e9678,Discussion,dark,text,False,False,True,1,0,False,all_ads,/r/AskEngineers/comments/wlto31/im_going_insane/,False,6,1660230377,1,[removed],True,False,False,AskEngineers,t5_2sebk,281098,public,self,I'm going insane....,0,[],1.0,https://www.reddit.com/r/AskEngineers/comments/wlto31/im_going_insane/,all_ads,6,moderator,,,,,,,,
5,[],False,All_Seeing_Artist,,[],,text,t2_7e8j8244,False,False,False,[],False,False,1660229584,self.AskEngineers,https://www.reddit.com/r/AskEngineers/comments/wltcdw/what_is_your_day_to_day_like_as_an_engineer/,{},wltcdw,False,True,False,False,False,True,True,False,,blue,[],b251a614-57f9-11e4-b47b-12313b0e9678,Discussion,dark,text,False,False,True,0,0,False,all_ads,/r/AskEngineers/comments/wltcdw/what_is_your_day_to_day_like_as_an_engineer/,False,6,1660229594,1,"For context I'm a student studying Chemical and biological engineering. My specific areas of interest are genetics, nuclear energy and or biomaterials but I'd love to hear from anyone in any field/ specialization.
I've been thinking about switching my career because I don't really want the type of job where im just sitting at a computer all day working on diagrams, code, and or graphs. But that's probably a very shallow idea of what I might be doing so I'd love your insight.",True,False,False,AskEngineers,t5_2sebk,281096,public,self,what is your day to day like as an engineer?,0,[],1.0,https://www.reddit.com/r/AskEngineers/comments/wltcdw/what_is_your_day_to_day_like_as_an_engineer/,all_ads,6,,,,,,,,,
6,[],False,Determined_Cucumber,,[],,text,t2_79cqongl,False,False,False,[],False,False,1660228493,self.AskEngineers,https://www.reddit.com/r/AskEngineers/comments/wlswwb/from_an_engineers_perspective_what_electrical/,{},wlswwb,False,True,False,False,False,True,True,False,,blue,[],b251a614-57f9-11e4-b47b-12313b0e9678,Discussion,dark,text,False,False,True,0,0,False,all_ads,/r/AskEngineers/comments/wlswwb/from_an_engineers_perspective_what_electrical/,False,6,1660228504,1,"I was traveling around to several countries recently and forgot that the outlets/plugs in other countries are different from the US. There are so many variations it was surprising that there’s no global standard.

For sake of comparison, let’s make the electrical output (I think it’s 120V 60Hz) all the same even though some are designed to handle higher/lower output. I’m more focused on outlet/plug design 🔌.",True,False,False,AskEngineers,t5_2sebk,281093,public,self,From an Engineer’s perspective what electrical outlet/plug design is superior to the rest around the world?,0,[],1.0,https://www.reddit.com/r/AskEngineers/comments/wlswwb/from_an_engineers_perspective_what_electrical/,all_ads,6,,,,,,,,,
7,[],False,blazingthru,,[],,text,t2_jvvcn,False,False,False,[],False,False,1660226303,self.AskEngineers,https://www.reddit.com/r/AskEngineers/comments/wls23b/overinflating_small_tires/,{},wls23b,False,False,False,False,False,False,True,False,,blue,[],90a1d45a-3f64-11e5-8667-0e60d8112001,Mechanical,dark,text,False,False,True,1,0,False,all_ads,/r/AskEngineers/comments/wls23b/overinflating_small_tires/,False,6,1660226313,1,[removed],True,False,False,AskEngineers,t5_2sebk,281089,public,self,Overinflating small tires,0,[],1.0,https://www.reddit.com/r/AskEngineers/comments/wls23b/overinflating_small_tires/,all_ads,6,moderator,,,,,,,,
8,[],False,UltronAge,,[],,text,t2_6ktwi8hl,False,False,False,[],False,False,1660224461,self.AskEngineers,https://www.reddit.com/r/AskEngineers/comments/wlreh1/which_is_the_longest_way_from_new_york_to_san/,{},wlreh1,False,True,False,False,False,True,True,False,,blue,[],b251a614-57f9-11e4-b47b-12313b0e9678,Discussion,dark,text,False,False,False,0,0,False,all_ads,/r/AskEngineers/comments/wlreh1/which_is_the_longest_way_from_new_york_to_san/,False,6,1660224472,1,,True,False,False,AskEngineers,t5_2sebk,281086,public,self,Which is the longest way from New York to San Francisco. Sea path. Through 1. the Panama Canal or 2. through the northwest route?,0,[],1.0,https://www.reddit.com/r/AskEngineers/comments/wlreh1/which_is_the_longest_way_from_new_york_to_san/,all_ads,6,,,,,,,,,
9,[],False,StMarsz,,[],,text,t2_a4ci19v,False,False,False,[],False,False,1660222524,self.AskEngineers,https://www.reddit.com/r/AskEngineers/comments/wlqpw1/level_tool_accuracy_how_to_interpret_the_bubble/,{},wlqpw1,False,True,False,False,False,True,True,False,,blue,[],b251a614-57f9-11e4-b47b-12313b0e9678,Discussion,dark,text,False,False,True,0,0,False,all_ads,/r/AskEngineers/comments/wlqpw1/level_tool_accuracy_how_to_interpret_the_bubble/,False,6,1660222535,1,"Dear engineers, with reference to similar post, asking on how to read ruler, case closed fruitful comments were posted.

For reference:  [Sounds like a stupid question but....how do I read a ruler? : AskEngineers (reddit.com)](https://www.reddit.com/r/AskEngineers/comments/wl8qws/sounds_like_a_stupid_question_buthow_do_i_read_a/) 

&amp;#x200B;

I have similar question about using level. I was responsible some time ago for registering tools in company to be used in production process, related with ISO 9001 and came across topic of legalization  (not really sure if it is proper term in this case) for level tools. So in general we bought some ""certified"" levels to be used in later QC. 

Mentioned levels have some declaration of measurement accuracy, in e.g. mm/m. That seems reasonable. However how to interpret the measurements using level? I know it sounds basic and stupid but i have seen some fancy Leica levels which specify that when the bubble is within markings means that the measurement is e.g +0.1 deg or+0.2 deg off. From what i have seen 99% of levels do not have such marking. Therefore my question is, whether there is any interpretation for the bubble being between markings? Does it mean that your measurement is within declared tolerance (just by looking at the angle seems to be far off)? Or the user shall assess whether the bubble is in the middle... 

&amp;#x200B;

Looking forward to Your discussion, thanks",True,False,False,AskEngineers,t5_2sebk,281083,public,self,"Level tool accuracy, how to interpret the bubble position in vial with respect to tool accuracy.",0,[],1.0,https://www.reddit.com/r/AskEngineers/comments/wlqpw1/level_tool_accuracy_how_to_interpret_the_bubble/,all_ads,6,,,,,,,,,
10,[],False,bw-47,,[],,text,t2_6hw0r,False,False,False,[],False,False,1660218840,self.AskEngineers,https://www.reddit.com/r/AskEngineers/comments/wlpjdv/question_on_identifying_thread_sizes/,{},wlpjdv,False,True,False,False,False,True,True,False,,blue,[],90a1d45a-3f64-11e5-8667-0e60d8112001,Mechanical,dark,text,False,False,True,0,0,False,all_ads,/r/AskEngineers/comments/wlpjdv/question_on_identifying_thread_sizes/,False,6,1660218850,1,"I have two threaded bolts welded to an item used to keep something attached. The nuts have gone missing so I need replacements. I've measured the threads and they come out to 5/32"" or possibly 4mm. However I ordered M4 screws with 0.7 mm threads but they are too small. McMaster Carr doesn't carry 5/32"" as a size except as a special threaded item.

Is there a common size/TPI that I'm overlooking somehow? Any help is appreciated. I used a thread gauge and also measured the diameter of the threads.",True,False,False,AskEngineers,t5_2sebk,281079,public,self,Question on identifying thread sizes,0,[],1.0,https://www.reddit.com/r/AskEngineers/comments/wlpjdv/question_on_identifying_thread_sizes/,all_ads,6,,,,,,,,,
11,[],False,ElectronicEmployee46,,[],,text,t2_8pvyg4vb,False,False,False,[],False,False,1660217077,self.AskEngineers,https://www.reddit.com/r/AskEngineers/comments/wlp0qj/solidworks_simulation/,{},wlp0qj,False,False,False,False,False,False,True,False,,blue,[],90a1d45a-3f64-11e5-8667-0e60d8112001,Mechanical,dark,text,False,False,True,1,0,False,all_ads,/r/AskEngineers/comments/wlp0qj/solidworks_simulation/,False,6,1660217088,1,[removed],True,False,False,AskEngineers,t5_2sebk,281076,public,self,SolidWorks Simulation,0,[],1.0,https://www.reddit.com/r/AskEngineers/comments/wlp0qj/solidworks_simulation/,all_ads,6,moderator,,,,,,,,
12,[],False,Sultan_of_Steel,,[],,text,t2_a045ifjp,False,False,False,[],False,False,1660216588,self.AskEngineers,https://www.reddit.com/r/AskEngineers/comments/wlovqh/calculating_boom_deflection_for_a_hydraulic_or/,{},wlovqh,False,True,False,False,False,True,True,False,,blue,[],b251a614-57f9-11e4-b47b-12313b0e9678,Discussion,dark,text,False,False,True,0,0,False,all_ads,/r/AskEngineers/comments/wlovqh/calculating_boom_deflection_for_a_hydraulic_or/,False,6,1660216599,1,"Are there any publicly available resources or formulae for the calculation of boom deflection for a crane? I.e., to either calculate radius increase and height decrease, or bending moment (from which the former two can be calculated).

The computers in modern cranes calculate the radius and height of the boom in real time while taking into account the deflection of the boom as it is loaded (this is true of hydraulic booms, but it has been 15+ years since I have worked with a pin-jib so I am not 100% sure for those  it i would expect so). These computers are accurate enough that a hook can be centered over a load and the operator can luff up while watching the computer's displayed radius as they take a load and hold a load steady. Thus, I presume there must be a formula that exists to calculate these variables. 

Such a formula would clearly depend on crane model and boom configuration. But I would expect that a deflection factor variable for each configuration would exist that could be inserted into a formula for calculation. I recently reviewed the operators manual for a Liebherr LTM 1300-6.2 expecting to find such a factor variable listed with the load charts or configuration sections but was unsuccessful; an operator with 40 years experience told me he has not seen one in any of the manuals he has read.

The ability to calculate/estimate deflection effects would be very useful when planning lifts, especially on critical jobs near plant or other structures. I considered reverse engineering breaking strength from the structural/stability line on the load charts to try to get a feel for boom elasticity, but I would really need to know how much it can bend. Further, some configurations have superior lifting capacity that others at a particular length depending whether sections are fully or partially extended (e.g., 0, 46, 46, 92, 92 has superior lifting capacity than 0, 0, 92, 92, 92 when in the structural region of the load chart, but has less stability at lower boom angles despite being the same length).",True,False,False,AskEngineers,t5_2sebk,281074,public,self,Calculating boom deflection for a hydraulic or lattice boom crane,0,[],1.0,https://www.reddit.com/r/AskEngineers/comments/wlovqh/calculating_boom_deflection_for_a_hydraulic_or/,all_ads,6,,,,,,,,,
13,[],False,crepuscopoli,,[],,text,t2_2i2lwlb2,False,False,False,[],False,False,1660213976,self.AskEngineers,https://www.reddit.com/r/AskEngineers/comments/wlo59v/diy_hrv_fan_upgrade/,{},wlo59v,False,False,False,False,False,False,True,False,,blue,[],b251a614-57f9-11e4-b47b-12313b0e9678,Discussion,dark,text,False,False,True,0,0,False,all_ads,/r/AskEngineers/comments/wlo59v/diy_hrv_fan_upgrade/,False,6,1660213986,1,[removed],True,False,False,AskEngineers,t5_2sebk,281073,public,self,DIY: HRV Fan upgrade,0,[],1.0,https://www.reddit.com/r/AskEngineers/comments/wlo59v/diy_hrv_fan_upgrade/,all_ads,6,reddit,self,"{'enabled': False, 'images': [{'id': 'eAQ_hrsZJPJfdmWtBeK1rSB4fNAbC8_6QSZyrQVC19U', 'resolutions': [{'height': 56, 'url': 'https://external-preview.redd.it/3QoeAy5d6rEL7WrLuK9Z17HdTC8eWlWZI3kKk36NPKk.jpg?width=108&amp;crop=smart&amp;auto=webp&amp;s=610a67644afe622579733afe9b50d0ecf933476b', 'width': 108}, {'height': 113, 'url': 'https://external-preview.redd.it/3QoeAy5d6rEL7WrLuK9Z17HdTC8eWlWZI3kKk36NPKk.jpg?width=216&amp;crop=smart&amp;auto=webp&amp;s=fa2b9c900adf16bb2b1ced0b63b6ff80b10a185b', 'width': 216}, {'height': 168, 'url': 'https://external-preview.redd.it/3QoeAy5d6rEL7WrLuK9Z17HdTC8eWlWZI3kKk36NPKk.jpg?width=320&amp;crop=smart&amp;auto=webp&amp;s=6e598805dad9742b08dfe1534cdfcb2b27c2628b', 'width': 320}], 'source': {'height': 315, 'url': 'https://external-preview.redd.it/3QoeAy5d6rEL7WrLuK9Z17HdTC8eWlWZI3kKk36NPKk.jpg?auto=webp&amp;s=9216c0ea66e43b02896dafafffa0bbc842f6cd5e', 'width': 600}, 'variants': {}}]}",,,,,,
14,[],False,DRIZZYLMG,,[],,text,t2_12f2su,False,False,False,[],False,False,1660213975,self.AskEngineers,https://www.reddit.com/r/AskEngineers/comments/wlo59j/how_do_i_collect_maintenance_data/,{},wlo59j,False,True,False,False,False,True,True,False,,blue,[],b251a614-57f9-11e4-b47b-12313b0e9678,Discussion,dark,text,False,False,False,0,0,False,all_ads,/r/AskEngineers/comments/wlo59j/how_do_i_collect_maintenance_data/,False,6,1660213986,1,"Hello, I'm currently an intern at a factory and I basically have no tasks to do. I've read quite a bit about the types of maintenance (reactive, preventive, predictive etc.) and I wish to implement some of these methods.

Unfortunately the factory has literally no maintenance planning nor do they have any data on any previous maintenance operations.

How do I go on about collecting maintenance data? Do I walk around the factory and take notes of every single maintenance operation or are there alternatives?",True,False,False,AskEngineers,t5_2sebk,281073,public,self,How do I collect maintenance data?,0,[],1.0,https://www.reddit.com/r/AskEngineers/comments/wlo59j/how_do_i_collect_maintenance_data/,all_ads,6,,,,,,,,,
15,[],False,MidLifeHalfHouse,,[],,text,t2_pcjfwg3d,False,False,True,[],False,False,1660202148,self.AskEngineers,https://www.reddit.com/r/AskEngineers/comments/wll3ki/where_can_i_buy_the_whitest_paint_ive_been/,{},wll3ki,False,True,False,False,False,True,True,False,,green,[],1612b830-09c2-11ea-a8a8-0ea1f14b089b,Chemical,dark,text,False,False,True,0,0,False,all_ads,/r/AskEngineers/comments/wll3ki/where_can_i_buy_the_whitest_paint_ive_been/,False,6,1660202159,1,"This is the latest article with the prof name attached. Is it kosher to just email them to request? Any hidden direct purchase link?

I’m an artist and new home owner if matters. Looks like it is ME based but idk why not chemical. I am the farthest thing there is from an engineer. 

Thank you! 

https://greekreporter.com/2022/05/08/revolutionary-white-paint-cool-greek-island-buildings-better-than-ac/

https://engineering.purdue.edu/ME/People/ptProfile?resource_id=29343",False,False,False,AskEngineers,t5_2sebk,281067,public,self,Where can I buy the “whitest paint” I’ve been watching the media cover for like 3 years?,0,[],1.0,https://www.reddit.com/r/AskEngineers/comments/wll3ki/where_can_i_buy_the_whitest_paint_ive_been/,all_ads,6,,self,"{'enabled': False, 'images': [{'id': '8Dhpw8G3rlNp0r2iO_oXNe0poOHCt1Ra93KsS0Bmm6o', 'resolutions': [{'height': 81, 'url': 'https://external-preview.redd.it/cNIhbNP5DkACyoB9q-HXEXLCqumggbqFkXQMK3Bgooc.jpg?width=108&amp;crop=smart&amp;auto=webp&amp;s=57d0a148e4a47871a9cb4052d7380fd61cd7efad', 'width': 108}, {'height': 162, 'url': 'https://external-preview.redd.it/cNIhbNP5DkACyoB9q-HXEXLCqumggbqFkXQMK3Bgooc.jpg?width=216&amp;crop=smart&amp;auto=webp&amp;s=68b023421b538691c7c5b347e93cf57c59b8b862', 'width': 216}, {'height': 240, 'url': 'https://external-preview.redd.it/cNIhbNP5DkACyoB9q-HXEXLCqumggbqFkXQMK3Bgooc.jpg?width=320&amp;crop=smart&amp;auto=webp&amp;s=adb7a911b2abdced2fb67d54661df789e0f41d23', 'width': 320}, {'height': 480, 'url': 'https://external-preview.redd.it/cNIhbNP5DkACyoB9q-HXEXLCqumggbqFkXQMK3Bgooc.jpg?width=640&amp;crop=smart&amp;auto=webp&amp;s=1da7a31b24eb8614e22ab063b7f06c0f3d352142', 'width': 640}], 'source': {'height': 525, 'url': 'https://external-preview.redd.it/cNIhbNP5DkACyoB9q-HXEXLCqumggbqFkXQMK3Bgooc.jpg?auto=webp&amp;s=4b84efe3a7a3c775c30740534d0af7d3f38e3607', 'width': 700}, 'variants': {}}]}",,,,,,
16,[],False,Stalin1940,,[],,text,t2_3kvh6ut9,False,False,False,[],False,False,1660201283,self.AskEngineers,https://www.reddit.com/r/AskEngineers/comments/wlkve8/i_would_like_to_know_if_it_is_possible_to_produce/,{},wlkve8,False,False,False,False,False,False,True,False,,blue,[],b251a614-57f9-11e4-b47b-12313b0e9678,Discussion,dark,text,False,False,True,1,0,False,all_ads,/r/AskEngineers/comments/wlkve8/i_would_like_to_know_if_it_is_possible_to_produce/,False,6,1660201294,1,[removed],True,False,False,AskEngineers,t5_2sebk,281065,public,self,I would like to know if it is possible to produce a set of blueprints for a simi operational B-1 battle Droid using easily accessible parts.,0,[],1.0,https://www.reddit.com/r/AskEngineers/comments/wlkve8/i_would_like_to_know_if_it_is_possible_to_produce/,all_ads,6,moderator,,,,,,,,
17,[],False,mkutlutas,,[],,text,t2_324butka,False,False,False,[],False,False,1660198039,self.AskEngineers,https://www.reddit.com/r/AskEngineers/comments/wlk0p5/i_need_advice_to_choose_stepper_motors_and/,{},wlk0p5,False,True,False,False,False,True,True,False,,purple,[],3a6acd0c-fd28-11e6-ab41-0edc7e2b18fe,Electrical,dark,text,False,False,True,0,0,False,all_ads,/r/AskEngineers/comments/wlk0p5/i_need_advice_to_choose_stepper_motors_and/,False,6,1660198050,1,"Hi, me and few friends decided to begin a new project and we will make a industrial machine which uses stepper motors for some actions. We have excellent experience and information at mechanical side, however we have lack of knowledge at electronic and coding part. I'm into the coding side, I'll eventually figured it out like as always.  


So our problem is, we don't know how to control stepper motors without arduino or some basic motor drivers. Also, depends on our researches, we are confused because there is a lot of unexplained things like, there is a CNC controller but no explanations if we need motor driver or not etc.   


We wanted to make a durable machine, using PLC or other industrial type motor drives etc or whatever :D We can buy any necessary parts, we don't have any budget limitations, we have tons of financial support, so you can make suggestions without hesitations. We are ok for any ecosystem or any brand as long as it is quality.  


Most important 3 thing is, they should be durable and easy to coding or controlling, also easy to access and purchase in case of irreversible mistakes. Thanks in advance for you precious suggestions...",True,False,False,AskEngineers,t5_2sebk,281062,public,self,"I need advice to choose Stepper Motors and Drivers to industrial application, and maybe PLC/MCU",0,[],1.0,https://www.reddit.com/r/AskEngineers/comments/wlk0p5/i_need_advice_to_choose_stepper_motors_and/,all_ads,6,,,,,,,,,
18,[],False,Spread_Secret,,[],,text,t2_5yvwv2ra,False,False,False,[],False,False,1660197001,self.AskEngineers,https://www.reddit.com/r/AskEngineers/comments/wljq99/yaml_file_one_line_filled_with_null_characters/,{},wljq99,False,False,False,False,False,False,True,False,,purple,[],6a68317a-c3cd-11e9-bf9c-0e2863fd7a72,Computer,dark,text,False,False,True,1,0,False,all_ads,/r/AskEngineers/comments/wljq99/yaml_file_one_line_filled_with_null_characters/,False,6,1660197011,1,[removed],True,False,False,AskEngineers,t5_2sebk,281060,public,self,"YAML file one line filled with null characters, #0000 character not supported while reading",0,[],1.0,https://www.reddit.com/r/AskEngineers/comments/wljq99/yaml_file_one_line_filled_with_null_characters/,all_ads,6,moderator,,,,,,,,
19,[],False,OTOddity,,[],,text,t2_ltzfhm4a,False,False,False,[],False,False,1660194529,self.AskEngineers,https://www.reddit.com/r/AskEngineers/comments/wlj0sb/who_do_i_go_to_if_i_need_something_precision/,{},wlj0sb,False,True,False,False,False,True,True,False,,blue,[],90a1d45a-3f64-11e5-8667-0e60d8112001,Mechanical,dark,text,False,False,False,0,0,False,all_ads,/r/AskEngineers/comments/wlj0sb/who_do_i_go_to_if_i_need_something_precision/,False,6,1660194540,1,"I am looking to get something precision measured, so I can create a cad file for it (I need very accurate hole locations, and I don't trust myself with a caliper) if I wanted to get this measured, would I take it to an Engineering firm? Or a machine shop? I've genuinely tried finding this online but to no avail, sorry if this is a dumb question.",True,False,False,AskEngineers,t5_2sebk,281059,public,self,Who Do I Go To If I Need Something Precision Measured?,0,[],1.0,https://www.reddit.com/r/AskEngineers/comments/wlj0sb/who_do_i_go_to_if_i_need_something_precision/,all_ads,6,,,,,,,,,
