62,[],False,boban2000,,[],,text,t2_7eodzuj2,False,False,False,[],False,False,1662769100,self.AskEngineers,https://www.reddit.com/r/AskEngineers/comments/xaax0m/job_question/,{},xaax0m,False,False,False,False,False,False,True,False,,blue,[],b251a614-57f9-11e4-b47b-12313b0e9678,Discussion,dark,text,False,False,True,1,0,False,all_ads,/r/AskEngineers/comments/xaax0m/job_question/,False,6,1662769111,1,[removed],True,False,False,AskEngineers,t5_2sebk,283457,public,self,Job question,0,[],1.0,https://www.reddit.com/r/AskEngineers/comments/xaax0m/job_question/,all_ads,6,moderator,,,,,,,,,
63,[],False,Macknetic,,[],,text,t2_2r4qp0f9,False,False,False,[],False,False,1662766861,self.AskEngineers,https://www.reddit.com/r/AskEngineers/comments/xaa4a1/where_are_yall_finding_jobs/,{},xaa4a1,False,False,False,False,False,False,True,False,,blue,[],b251a614-57f9-11e4-b47b-12313b0e9678,Discussion,dark,text,False,False,True,1,0,False,all_ads,/r/AskEngineers/comments/xaa4a1/where_are_yall_finding_jobs/,False,6,1662766871,1,[removed],True,False,False,AskEngineers,t5_2sebk,283455,public,self,Where are y’all finding jobs?,0,[],1.0,https://www.reddit.com/r/AskEngineers/comments/xaa4a1/where_are_yall_finding_jobs/,all_ads,6,moderator,,,,,,,,,
64,[],False,alwayssomeonebetter,,[],,text,t2_jcg9c9v7,False,False,False,[],False,False,1662765471,self.AskEngineers,https://www.reddit.com/r/AskEngineers/comments/xa9mb5/quality_control_for_hand_calculation_tools_eg/,{},xa9mb5,False,False,False,False,False,False,True,False,,blue,[],b251a614-57f9-11e4-b47b-12313b0e9678,Discussion,dark,text,False,False,True,1,0,False,all_ads,/r/AskEngineers/comments/xa9mb5/quality_control_for_hand_calculation_tools_eg/,False,6,1662765481,1,[removed],True,False,False,AskEngineers,t5_2sebk,283453,public,self,Quality control for hand calculation tools (e.g. MathCAD or spreadsheets),0,[],1.0,https://www.reddit.com/r/AskEngineers/comments/xa9mb5/quality_control_for_hand_calculation_tools_eg/,all_ads,6,moderator,,,,,,,,,
65,[],False,Feeling_Grape4609,,[],,text,t2_9qjbe8oo,False,False,False,[],False,False,1662760008,self.AskEngineers,https://www.reddit.com/r/AskEngineers/comments/xa7ilo/where_do_mitstanfordberkley_etc_grads_go/,{},xa7ilo,False,False,False,False,False,False,True,False,,blue,[],b251a614-57f9-11e4-b47b-12313b0e9678,Discussion,dark,text,False,False,True,1,0,False,all_ads,/r/AskEngineers/comments/xa7ilo/where_do_mitstanfordberkley_etc_grads_go/,False,6,1662760019,1,[removed],True,False,False,AskEngineers,t5_2sebk,283450,public,self,Where do MIT/Stanford/Berkley etc grads go?,0,[],1.0,https://www.reddit.com/r/AskEngineers/comments/xa7ilo/where_do_mitstanfordberkley_etc_grads_go/,all_ads,6,moderator,,,,,,,,,
66,[],False,Puzzled_Evidence_376,,[],,text,t2_q9hn9ckf,False,False,False,[],False,False,1662756882,self.AskEngineers,https://www.reddit.com/r/AskEngineers/comments/xa6a3b/engineering_contractor_planning_benefits_and/,{},xa6a3b,False,False,False,False,False,False,True,False,,blue,[],b251a614-57f9-11e4-b47b-12313b0e9678,Discussion,dark,text,False,False,True,1,0,False,all_ads,/r/AskEngineers/comments/xa6a3b/engineering_contractor_planning_benefits_and/,False,6,1662756893,1,[removed],True,False,False,AskEngineers,t5_2sebk,283446,public,self,"Engineering Contractor Planning Benefits and retirement, healthcare",0,[],1.0,https://www.reddit.com/r/AskEngineers/comments/xa6a3b/engineering_contractor_planning_benefits_and/,all_ads,6,moderator,,,,,,,,,
67,[],False,BowSonic,,[],,text,t2_4qgdrofn,False,False,False,[],False,False,1662756242,self.AskEngineers,https://www.reddit.com/r/AskEngineers/comments/xa60to/what_site_might_i_try_if_i_want_to_potentially/,{},xa60to,False,True,False,False,False,True,True,False,,blue,[],b251a614-57f9-11e4-b47b-12313b0e9678,Discussion,dark,text,False,False,True,0,0,False,all_ads,/r/AskEngineers/comments/xa60to/what_site_might_i_try_if_i_want_to_potentially/,False,6,1662756252,1,"This might sound a little silly, and I apologizeif I'm not asling in the appropriate sub, but I really enjoy metalic/weighted tactile fidget devices.  Though oddly enough I've never really loved the basic ""fidget spinner"" design.

I've always wanted one with a specific mechanical action where a small center actuator causes the spinner body to spin when pressed.  I've asked around and it seems that this doesn't exist on the market.

I know next to nothing about mechanical design, CAD, CNC, 3D Printing or any of the things I'm guessing would go into a bespoke project.

It had come to mind that maybe there's a site (like Fivrr or Esty maybe?) where one might find a person or custom shop that would design and build this.

I have no clue what the cost might be, and if it's thousands of dollars then it's probably out of my budget, but I figured it couldn't hurt to ask around.  
Is there a site\place that it would make sense to look for this?

Thanks!

Just in case anyone's curious, here's where I asked if it already exists:
[Does a Push-to-Spin button spinner exist?](https://www.reddit.com/r/FidgetSpinners/comments/x8pgi3/does_a_pushtospin_button_spinner_exist/?utm_medium=android_app&amp;utm_source=share)",True,False,False,AskEngineers,t5_2sebk,283446,public,self,What site might I try if I want to potentially commission a fidget spinner design/build?,0,[],1.0,https://www.reddit.com/r/AskEngineers/comments/xa60to/what_site_might_i_try_if_i_want_to_potentially/,all_ads,6,,,,,,,,,,
68,[],False,HardCoper,,[],,text,t2_2eikjrqd,False,False,False,[],False,False,1662755828,self.AskEngineers,https://www.reddit.com/r/AskEngineers/comments/xa5uy7/quitting_first_job_after_6_months_without_new_job/,{},xa5uy7,False,False,False,False,False,False,True,False,,blue,[],b251a614-57f9-11e4-b47b-12313b0e9678,Discussion,dark,text,False,False,True,1,0,False,all_ads,/r/AskEngineers/comments/xa5uy7/quitting_first_job_after_6_months_without_new_job/,False,6,1662755839,1,[removed],True,False,False,AskEngineers,t5_2sebk,283445,public,self,Quitting first job after 6 months without new job lined up?,0,[],1.0,https://www.reddit.com/r/AskEngineers/comments/xa5uy7/quitting_first_job_after_6_months_without_new_job/,all_ads,6,moderator,,,,,,,,,
69,[],False,gringawn,,[],,text,t2_l1vn8lt,False,False,False,[],False,False,1662754562,self.AskEngineers,https://www.reddit.com/r/AskEngineers/comments/xa5cvh/is_the_costmwh_of_hydroelectric_usines_higher/,{},xa5cvh,False,True,False,False,False,True,True,False,,orange,[],939137fa-3f64-11e5-b90e-0ef63926eacd,Civil,dark,text,False,False,False,0,0,False,all_ads,/r/AskEngineers/comments/xa5cvh/is_the_costmwh_of_hydroelectric_usines_higher/,False,6,1662754573,1,"I am trying to find it online, but I only found a global research that points that solar &gt; wind offshore &gt; gas &gt; nuclear &gt; wind onshore = georhermal = coal

But I can't sources for hydro",True,False,False,AskEngineers,t5_2sebk,283444,public,self,Is the cost/MWh of hydroelectric usines higher than coal and gas?,0,[],1.0,https://www.reddit.com/r/AskEngineers/comments/xa5cvh/is_the_costmwh_of_hydroelectric_usines_higher/,all_ads,6,,,,,,,,,,
70,[],False,beigesun,,[],,text,t2_3xbgxf0u,False,False,False,[],False,False,1662754554,self.AskEngineers,https://www.reddit.com/r/AskEngineers/comments/xa5cr3/just_graduated_job_pays_ok_but_not_happy/,{},xa5cr3,False,False,False,False,False,False,True,False,,blue,[],b251a614-57f9-11e4-b47b-12313b0e9678,Discussion,dark,text,False,False,True,1,0,False,all_ads,/r/AskEngineers/comments/xa5cr3/just_graduated_job_pays_ok_but_not_happy/,False,6,1662754564,1,[removed],True,False,False,AskEngineers,t5_2sebk,283443,public,self,"Just graduated, job pays ok but not happy",0,[],1.0,https://www.reddit.com/r/AskEngineers/comments/xa5cr3/just_graduated_job_pays_ok_but_not_happy/,all_ads,6,moderator,,,,,,,,,
71,[],False,MotivatedKing,,[],,text,t2_yt8x3,False,False,False,[],False,False,1662753600,self.AskEngineers,https://www.reddit.com/r/AskEngineers/comments/xa4z1w/how_does_one_calculate_how_much_air_pressure_a/,{},xa4z1w,False,True,False,False,False,True,True,False,,blue,[],90a1d45a-3f64-11e5-8667-0e60d8112001,Mechanical,dark,text,False,False,True,0,0,False,all_ads,/r/AskEngineers/comments/xa4z1w/how_does_one_calculate_how_much_air_pressure_a/,False,6,1662753610,1,"Say you know the material, wall thickness, and all dimensions. How does one calculate how much air pressure an unmarked cylindrical tank can handle before failing.

So one could get an estimate to perform a pressure test.",True,False,False,AskEngineers,t5_2sebk,283443,public,self,How does one calculate how much air pressure a cylinder can withstand?,0,[],1.0,https://www.reddit.com/r/AskEngineers/comments/xa4z1w/how_does_one_calculate_how_much_air_pressure_a/,all_ads,6,,,,,,,,,,
72,[],False,firelizzard18,,[],,text,t2_oujza,False,False,False,[],False,False,1662751674,self.AskEngineers,https://www.reddit.com/r/AskEngineers/comments/xa488v/how_do_i_take_my_systems_engineering_skills_to/,{},xa488v,False,True,False,False,False,True,True,False,,purple,[],6a68317a-c3cd-11e9-bf9c-0e2863fd7a72,Computer,dark,text,False,False,True,0,0,False,all_ads,/r/AskEngineers/comments/xa488v/how_do_i_take_my_systems_engineering_skills_to/,False,6,1662751684,1,"I  am a software developer by trade, with a BS in CS and EE. As a  developer, my biggest strength is my skill at tackling large, complex  problems and breaking them down into more manageable pieces. However,  this is something I've taught myself and my process is to start writing  code and break it down as I go. Now that I am the lead developer of a  team working on a large project my usual process has become a  bottleneck. I need to be able to write roadmaps and implementation plans  for other developers to implement.

I  think this falls under the heading of systems engineering. Going back  to school to get a BS or MS in Systems Engineering is not an option. Are  there training courses or other continuing education style courses I  can take to improve my skills in this area?",True,False,False,AskEngineers,t5_2sebk,283440,public,self,How do I take my systems engineering skills to the next level?,0,[],1.0,https://www.reddit.com/r/AskEngineers/comments/xa488v/how_do_i_take_my_systems_engineering_skills_to/,all_ads,6,,,,,,,,,,
73,[],False,Static_Texas_Toast54,,[],,text,t2_jl9bp4ta,False,False,False,[],False,False,1662746978,self.AskEngineers,https://www.reddit.com/r/AskEngineers/comments/xa2d92/3m_versaflo_papr_tr600/,{},xa2d92,False,False,False,False,False,False,True,False,,green,[],1612b830-09c2-11ea-a8a8-0ea1f14b089b,Chemical,dark,text,False,False,True,1,0,False,all_ads,/r/AskEngineers/comments/xa2d92/3m_versaflo_papr_tr600/,False,6,1662746988,1,[removed],True,False,False,AskEngineers,t5_2sebk,283435,public,self,3M Versaflo PAPR TR-600,0,[],1.0,https://www.reddit.com/r/AskEngineers/comments/xa2d92/3m_versaflo_papr_tr600/,all_ads,6,moderator,,,,,,,,,
74,[],False,HX_man_1933,,[],,text,t2_jl9p61b2,False,False,False,[],False,False,1662746731,self.AskEngineers,https://www.reddit.com/r/AskEngineers/comments/xa29tu/3m_versaflo_papr_tr_600/,{},xa29tu,False,False,False,False,False,False,True,False,,green,[],1612b830-09c2-11ea-a8a8-0ea1f14b089b,Chemical,dark,text,False,False,True,1,0,False,all_ads,/r/AskEngineers/comments/xa29tu/3m_versaflo_papr_tr_600/,False,6,1662746742,1,[removed],True,False,False,AskEngineers,t5_2sebk,283434,public,self,3M Versaflo PAPR TR 600,0,[],1.0,https://www.reddit.com/r/AskEngineers/comments/xa29tu/3m_versaflo_papr_tr_600/,all_ads,6,moderator,,,,,,,,,
75,[],False,WillingnessEasy7042,,[],,text,t2_f2a5mlh7,False,False,False,[],False,False,1662746397,self.ChemicalEngineering,https://www.reddit.com/r/AskEngineers/comments/xa24me/job_prospects_that_dont_involve_og/,{},xa24me,False,False,False,False,False,False,False,False,,green,[],1612b830-09c2-11ea-a8a8-0ea1f14b089b,Chemical,dark,text,False,False,True,1,0,False,all_ads,/r/AskEngineers/comments/xa24me/job_prospects_that_dont_involve_og/,False,6,1662746407,1,,False,False,False,AskEngineers,t5_2sebk,283433,public,default,Job prospects that don’t involve O&amp;G?,0,[],1.0,/r/ChemicalEngineering/comments/xa23y7/job_prospects_that_dont_involve_og/,all_ads,6,moderator,t3_xa23y7,"[{'all_awardings': [], 'allow_live_comments': False, 'approved_at_utc': None, 'approved_by': None, 'archived': False, 'author': 'WillingnessEasy7042', 'author_flair_background_color': None, 'author_flair_css_class': None, 'author_flair_richtext': [], 'author_flair_template_id': None, 'author_flair_text': None, 'author_flair_text_color': None, 'author_flair_type': 'text', 'author_fullname': 't2_f2a5mlh7', 'author_is_blocked': False, 'author_patreon_flair': False, 'author_premium': False, 'awarders': [], 'banned_at_utc': None, 'banned_by': None, 'can_gild': True, 'can_mod_post': False, 'category': None, 'clicked': False, 'content_categories': None, 'contest_mode': False, 'created': 1662746348.0, 'created_utc': 1662746348.0, 'discussion_type': None, 'distinguished': None, 'domain': 'self.ChemicalEngineering', 'downs': 0, 'edited': False, 'gilded': 0, 'gildings': {}, 'hidden': False, 'hide_score': True, 'id': 'xa23y7', 'is_created_from_ads_ui': False, 'is_crosspostable': True, 'is_meta': False, 'is_original_content': False, 'is_reddit_media_domain': False, 'is_robot_indexable': True, 'is_self': True, 'is_video': False, 'likes': None, 'link_flair_background_color': '', 'link_flair_css_class': None, 'link_flair_richtext': [], 'link_flair_text': None, 'link_flair_text_color': 'dark', 'link_flair_type': 'text', 'locked': False, 'media': None, 'media_embed': {}, 'media_only': False, 'mod_note': None, 'mod_reason_by': None, 'mod_reason_title': None, 'mod_reports': [], 'name': 't3_xa23y7', 'no_follow': True, 'num_comments': 1, 'num_crossposts': 1, 'num_reports': None, 'over_18': False, 'parent_whitelist_status': 'all_ads', 'permalink': '/r/ChemicalEngineering/comments/xa23y7/job_prospects_that_dont_involve_og/', 'pinned': False, 'pwls': 6, 'quarantine': False, 'removal_reason': None, 'removed_by': None, 'removed_by_category': None, 'report_reasons': None, 'saved': False, 'score': 1, 'secure_media': None, 'secure_media_embed': {}, 'selftext': 'In a week I, 18f, will be starting my undergrad in chemical engineering at uni. What are some higher paying job options I can work towards that don’t involve going to remote places and dedicating my life to oil and gas? I know you can enter the pharmaceutical industry with this degree, but i don’t feel as though the job prospects in that industry are very promising when considering the effort put into the degree. For reference, my course is an integrated masters program with a year in industry placement, which should hopefully broaden my opportunities.', 'selftext_html': '&lt;!-- SC_OFF --&gt;&lt;div class=""md""&gt;&lt;p&gt;In a week I, 18f, will be starting my undergrad in chemical engineering at uni. What are some higher paying job options I can work towards that don’t involve going to remote places and dedicating my life to oil and gas? I know you can enter the pharmaceutical industry with this degree, but i don’t feel as though the job prospects in that industry are very promising when considering the effort put into the degree. For reference, my course is an integrated masters program with a year in industry placement, which should hopefully broaden my opportunities.&lt;/p&gt;\n&lt;/div&gt;&lt;!-- SC_ON --&gt;', 'send_replies': True, 'spoiler': False, 'stickied': False, 'subreddit': 'ChemicalEngineering', 'subreddit_id': 't5_2qwn7', 'subreddit_name_prefixed': 'r/ChemicalEngineering', 'subreddit_subscribers': 74701, 'subreddit_type': 'public', 'suggested_sort': None, 'thumbnail': 'self', 'thumbnail_height': None, 'thumbnail_width': None, 'title': 'Job prospects that don’t involve O&amp;G?', 'top_awarded_type': None, 'total_awards_received': 0, 'treatment_tags': [], 'ups': 1, 'upvote_ratio': 1.0, 'url': 'https://www.reddit.com/r/ChemicalEngineering/comments/xa23y7/job_prospects_that_dont_involve_og/', 'user_reports': [], 'view_count': None, 'visited': False, 'whitelist_status': 'all_ads', 'wls': 6}]",/r/ChemicalEngineering/comments/xa23y7/job_prospects_that_dont_involve_og/,,,,,,
76,[],False,scorcher214,,[],Tooling Engineer,text,t2_qndcw,False,False,True,[],False,False,1662744526,self.AskEngineers,https://www.reddit.com/r/AskEngineers/comments/xa1e3w/work_from_home_in_the_office_full_time_hybrid/,{},xa1e3w,False,False,False,False,False,False,True,False,,blue,[],b251a614-57f9-11e4-b47b-12313b0e9678,Discussion,dark,text,False,False,True,1,0,False,all_ads,/r/AskEngineers/comments/xa1e3w/work_from_home_in_the_office_full_time_hybrid/,False,6,1662744537,1,[removed],True,False,False,AskEngineers,t5_2sebk,283435,public,self,Work from home? In the office full time? Hybrid?,0,[],1.0,https://www.reddit.com/r/AskEngineers/comments/xa1e3w/work_from_home_in_the_office_full_time_hybrid/,all_ads,6,moderator,,,,,,#d3d6da,dark,2238776c-d04a-11e6-8ad9-0eff92f5bd12,
77,[],False,Legitimate_Ad_6670,,[],,text,t2_cfwoka4r,False,False,False,[],False,False,1662740465,self.AskEngineers,https://www.reddit.com/r/AskEngineers/comments/x9zr3c/medical_engineering_vs_biomedical_engineering_vs/,{},x9zr3c,False,False,False,False,False,False,True,False,,blue,[],b251a614-57f9-11e4-b47b-12313b0e9678,Discussion,dark,text,False,False,True,1,0,False,all_ads,/r/AskEngineers/comments/x9zr3c/medical_engineering_vs_biomedical_engineering_vs/,False,6,1662740476,1,[removed],True,False,False,AskEngineers,t5_2sebk,283431,public,self,Medical engineering vs Biomedical engineering vs Bio-engineering vs Bioscience Engineering,0,[],1.0,https://www.reddit.com/r/AskEngineers/comments/x9zr3c/medical_engineering_vs_biomedical_engineering_vs/,all_ads,6,moderator,,,,,,,,,
78,[],False,Afraid-Land-3719,,[],,text,t2_9v3mffl8,False,False,False,[],False,False,1662738840,self.AskEngineers,https://www.reddit.com/r/AskEngineers/comments/x9z2bk/jobs_in_humanitarianenvironmental_engineering/,{},x9z2bk,False,False,False,False,False,False,True,False,,blue,[],b251a614-57f9-11e4-b47b-12313b0e9678,Discussion,dark,text,False,False,True,1,0,False,all_ads,/r/AskEngineers/comments/x9z2bk/jobs_in_humanitarianenvironmental_engineering/,False,6,1662738850,1,[removed],True,False,False,AskEngineers,t5_2sebk,283429,public,self,Jobs in Humanitarian/Environmental Engineering,0,[],1.0,https://www.reddit.com/r/AskEngineers/comments/x9z2bk/jobs_in_humanitarianenvironmental_engineering/,all_ads,6,moderator,,,,,,,,,
79,[],False,TakesTooManyPictures,,[],,text,t2_1vo8axgp,False,False,False,[],False,False,1662733751,self.AskEngineers,https://www.reddit.com/r/AskEngineers/comments/x9wzhy/what_pneumatic_connector_is_this/,{},x9wzhy,False,False,False,False,False,False,True,False,,blue,[],90a1d45a-3f64-11e5-8667-0e60d8112001,Mechanical,dark,text,False,False,True,1,0,False,all_ads,/r/AskEngineers/comments/x9wzhy/what_pneumatic_connector_is_this/,False,6,1662733762,1,[removed],True,False,False,AskEngineers,t5_2sebk,283425,public,self,What pneumatic connector is this?,0,[],1.0,https://www.reddit.com/r/AskEngineers/comments/x9wzhy/what_pneumatic_connector_is_this/,all_ads,6,moderator,,,,self,"{'enabled': False, 'images': [{'id': 'ocICQUsNzu5SMZ7EGPxtAlRcikmxfYU8OrA0gpPsILs', 'resolutions': [{'height': 108, 'url': 'https://external-preview.redd.it/WdMf1HYPpgj4uaEVfdkx3z0nqWNKhbAPSdJ9ugmoN4I.jpg?width=108&amp;crop=smart&amp;auto=webp&amp;s=443d64e978ab89246530438b098cdb08af3a9ec5', 'width': 108}, {'height': 216, 'url': 'https://external-preview.redd.it/WdMf1HYPpgj4uaEVfdkx3z0nqWNKhbAPSdJ9ugmoN4I.jpg?width=216&amp;crop=smart&amp;auto=webp&amp;s=002cd347835d18577f886c841c986f757f7cfeea', 'width': 216}, {'height': 320, 'url': 'https://external-preview.redd.it/WdMf1HYPpgj4uaEVfdkx3z0nqWNKhbAPSdJ9ugmoN4I.jpg?width=320&amp;crop=smart&amp;auto=webp&amp;s=c2978b6066b8192ae5ab3fb498586b8d569da80c', 'width': 320}], 'source': {'height': 600, 'url': 'https://external-preview.redd.it/WdMf1HYPpgj4uaEVfdkx3z0nqWNKhbAPSdJ9ugmoN4I.jpg?auto=webp&amp;s=7b42ded630232d42f0e6cf9145737c375fd0ac71', 'width': 600}, 'variants': {}}]}",,,,
80,[],False,The_cooler_ArcSmith,,[],,text,t2_bn38hny,False,False,False,[],False,False,1662733434,self.AskEngineers,https://www.reddit.com/r/AskEngineers/comments/x9wv2u/how_should_i_use_a_teg_as_a_tec/,{},x9wv2u,False,True,False,False,False,True,True,False,,purple,[],3a6acd0c-fd28-11e6-ab41-0edc7e2b18fe,Electrical,dark,text,False,False,True,0,0,False,all_ads,/r/AskEngineers/comments/x9wv2u/how_should_i_use_a_teg_as_a_tec/,False,6,1662733445,1,"I want a peltier that can operate at ~145C (138C from the generic TECs won't cut it), but all I can find at that range are TEGs for power generation (specifically the SP1848 with a max operating temp of 150C). I'm assuming I can just run electricity into it and it will work the same, but what voltage should I put into it based on the datasheet (which only provides power generation values). 

Or is there a different peltier that can also operate at above 140C?

To clarify, I know they're super inefficient and I'm not wanting a temperature difference of 145C. For the application I'm intending they'll work best unless someone can recommend an ultra compact phase-change heatpump that can generate and survive 150C.",True,False,False,AskEngineers,t5_2sebk,283425,public,self,How should I use a TEG as a TEC?,0,[],1.0,https://www.reddit.com/r/AskEngineers/comments/x9wv2u/how_should_i_use_a_teg_as_a_tec/,all_ads,6,,,,,,,,,,
81,[],False,toxichydrowolf,,[],,text,t2_brfe5c90,False,False,False,[],False,False,1662733416,self.AskEngineers,https://www.reddit.com/r/AskEngineers/comments/x9wutq/mechanical_engineering_technology_jobs/,{},x9wutq,False,False,False,False,False,False,True,False,,blue,[],b251a614-57f9-11e4-b47b-12313b0e9678,Discussion,dark,text,False,False,True,1,0,False,all_ads,/r/AskEngineers/comments/x9wutq/mechanical_engineering_technology_jobs/,False,6,1662733427,1,[removed],True,False,False,AskEngineers,t5_2sebk,283425,public,self,mechanical engineering technology Jobs?,0,[],1.0,https://www.reddit.com/r/AskEngineers/comments/x9wutq/mechanical_engineering_technology_jobs/,all_ads,6,moderator,,,,,,,,,
82,[],False,Silent-Client-375,,[],,text,t2_9kuo0z4j,False,False,False,[],False,False,1662731436,self.AskEngineers,https://www.reddit.com/r/AskEngineers/comments/x9w2pn/cumulative_lightening_strike_map/,{},x9w2pn,False,True,False,False,False,True,True,False,,purple,[],3a6acd0c-fd28-11e6-ab41-0edc7e2b18fe,Electrical,dark,text,False,False,True,0,0,False,all_ads,/r/AskEngineers/comments/x9w2pn/cumulative_lightening_strike_map/,False,6,1662731447,1,Can something like this be accessed online?  Looking for a map that overlays ~5 years of strike data to determine which locations are a priority for grounding.  Looking for details within a few hundred feet (not just county totals).,True,False,False,AskEngineers,t5_2sebk,283426,public,self,Cumulative Lightening Strike Map,0,[],1.0,https://www.reddit.com/r/AskEngineers/comments/x9w2pn/cumulative_lightening_strike_map/,all_ads,6,,,,,,,,,,
