,all_awardings,allow_live_comments,author,author_flair_css_class,author_flair_richtext,author_flair_text,author_flair_type,author_fullname,author_is_blocked,author_patreon_flair,author_premium,awarders,can_mod_post,contest_mode,created_utc,domain,full_link,gildings,id,is_created_from_ads_ui,is_crosspostable,is_meta,is_original_content,is_reddit_media_domain,is_robot_indexable,is_self,is_video,link_flair_background_color,link_flair_css_class,link_flair_richtext,link_flair_template_id,link_flair_text,link_flair_text_color,link_flair_type,locked,media_only,no_follow,num_comments,num_crossposts,over_18,parent_whitelist_status,permalink,pinned,pwls,retrieved_on,score,selftext,send_replies,spoiler,stickied,subreddit,subreddit_id,subreddit_subscribers,subreddit_type,thumbnail,title,total_awards_received,treatment_tags,upvote_ratio,url,whitelist_status,wls,author_flair_background_color,author_flair_template_id,author_flair_text_color,post_hint,preview,removed_by_category
22,[],False,manlymanmanman925,,[],,text,t2_13cocdnt,False,False,False,[],False,False,1663874099,self.AskEngineers,https://www.reddit.com/r/AskEngineers/comments/xlafs6/would_trolly_tracks_on_an_interstate_really_mess/,{},xlafs6,False,True,False,False,False,True,True,False,,orange,[],939137fa-3f64-11e5-b90e-0ef63926eacd,Civil,dark,text,False,False,True,0,0,False,all_ads,/r/AskEngineers/comments/xlafs6/would_trolly_tracks_on_an_interstate_really_mess/,False,6,1663874110,1,If trolly tracks we installed parallel to the traffic how bad would the affect on the stability of a normal cars traveling over it be if they made a lane change crossing over them?,True,False,False,AskEngineers,t5_2sebk,284340,public,self,Would trolly tracks on an interstate really mess up the way cars drive?,0,[],1.0,https://www.reddit.com/r/AskEngineers/comments/xlafs6/would_trolly_tracks_on_an_interstate_really_mess/,all_ads,6,,,,,,
23,[],False,rasieelfozilov59,,[],,text,t2_ifizg6th,False,False,False,[],False,False,1663872728,self.AskEngineers,https://www.reddit.com/r/AskEngineers/comments/xl9u7w/boomers_are_the_reason_traditional_engineering/,{},xl9u7w,False,False,False,False,False,False,True,False,,blue,[],b251a614-57f9-11e4-b47b-12313b0e9678,Discussion,dark,text,False,False,True,1,0,False,all_ads,/r/AskEngineers/comments/xl9u7w/boomers_are_the_reason_traditional_engineering/,False,6,1663872738,1,[removed],True,False,False,AskEngineers,t5_2sebk,284339,public,self,Boomers are the reason traditional engineering roles have lack of WFH,0,[],1.0,https://www.reddit.com/r/AskEngineers/comments/xl9u7w/boomers_are_the_reason_traditional_engineering/,all_ads,6,,,,,,moderator
24,[],False,Tsuyomi201,,[],,text,t2_kinqbbm9,False,False,False,[],False,False,1663868691,self.AskEngineers,https://www.reddit.com/r/AskEngineers/comments/xl82cp/looking_for_a_biomechanical_internship/,{},xl82cp,False,True,False,False,False,True,True,False,,blue,[],b251a614-57f9-11e4-b47b-12313b0e9678,Discussion,dark,text,False,False,True,0,0,False,all_ads,/r/AskEngineers/comments/xl82cp/looking_for_a_biomechanical_internship/,False,6,1663868701,1,"So... I just started a biomechanical Master, and I'm looking for an internship... The thing is, aside from hospital and kinesist, I don't have a clue where to look... 
I was really interested in the lessons, that's why I chose tondo that, but I didn't far enough and know I really don't where and how to look for this kind of internship. 

Does anyone can give me tips on where and how to find an internship ? (I am French, but ready to go anywhere I can find one) 

I like prothese, robotics and I've got a Bachelor's in mechanical engineering.",True,False,False,AskEngineers,t5_2sebk,284332,public,self,Looking for a biomechanical internship,0,[],1.0,https://www.reddit.com/r/AskEngineers/comments/xl82cp/looking_for_a_biomechanical_internship/,all_ads,6,,,,,,
25,[],False,RiddlecageMusic,,[],,text,t2_cs7xiph1,False,False,False,[],False,False,1663863788,self.AskEngineers,https://www.reddit.com/r/AskEngineers/comments/xl5xmo/ive_been_thinking_about_this_totally_random_thing/,{},xl5xmo,False,False,False,False,False,False,True,False,,blue,[],b251a614-57f9-11e4-b47b-12313b0e9678,Discussion,dark,text,False,False,True,1,0,False,all_ads,/r/AskEngineers/comments/xl5xmo/ive_been_thinking_about_this_totally_random_thing/,False,6,1663863799,1,[removed],True,False,False,AskEngineers,t5_2sebk,284318,public,self,Ive been thinking about this totally random thing for a while,0,[],1.0,https://www.reddit.com/r/AskEngineers/comments/xl5xmo/ive_been_thinking_about_this_totally_random_thing/,all_ads,6,,,,,,moderator
26,[],False,thereal_batman21,,[],,text,t2_er7fp2oe,False,False,False,[],False,False,1663862715,self.AskEngineers,https://www.reddit.com/r/AskEngineers/comments/xl5gy4/engineers_have_you_ever_thought_about_getting_a/,{},xl5gy4,False,False,False,False,False,False,True,False,,blue,[],b251a614-57f9-11e4-b47b-12313b0e9678,Discussion,dark,text,False,False,True,1,0,False,all_ads,/r/AskEngineers/comments/xl5gy4/engineers_have_you_ever_thought_about_getting_a/,False,6,1663862725,1,[removed],True,False,False,AskEngineers,t5_2sebk,284317,public,self,"Engineers, have you ever thought about getting a part-time job or serving in the national guard/air national guard?",0,[],1.0,https://www.reddit.com/r/AskEngineers/comments/xl5gy4/engineers_have_you_ever_thought_about_getting_a/,all_ads,6,,,,,,moderator
27,[],False,Powerful_Test1288,,[],,text,t2_f6u7qgcr,False,False,False,[],False,False,1663859761,self.AskEngineers,https://www.reddit.com/r/AskEngineers/comments/xl46li/any_suggestions_about_research_title/,{},xl46li,False,False,False,False,False,False,True,False,,orange,[],939137fa-3f64-11e5-b90e-0ef63926eacd,Civil,dark,text,False,False,True,1,0,False,all_ads,/r/AskEngineers/comments/xl46li/any_suggestions_about_research_title/,False,6,1663859772,1,[removed],True,False,False,AskEngineers,t5_2sebk,284312,public,self,any suggestions about research title?,0,[],1.0,https://www.reddit.com/r/AskEngineers/comments/xl46li/any_suggestions_about_research_title/,all_ads,6,,,,,,moderator
28,[],False,nobbyv,,[],,text,t2_el92m,False,False,False,[],False,False,1663859714,self.AskEngineers,https://www.reddit.com/r/AskEngineers/comments/xl45v9/source_for_electrically_conductive_foam_in_tube/,{},xl45v9,False,True,False,False,False,True,True,False,,purple,[],3a6acd0c-fd28-11e6-ab41-0edc7e2b18fe,Electrical,dark,text,False,False,True,0,0,False,all_ads,/r/AskEngineers/comments/xl45v9/source_for_electrically_conductive_foam_in_tube/,False,6,1663859725,1,"At my previous job, we had a ""sample kit"" from a company that made electrically conductive foam. It had a number of different profiles: some thin pads, larger sheets, 12"" long pieces that were, say 1/4"" square in thickness, and rolls of round foam tube that were about the diameter of a pencil. I need to get my hands on some of the tube, but am struggling finding it and don't recall the company that made it. DigiKey is showing me the thin sheets of foam, which won't work for what I need to do. Does anyone know what this foam would typically be used for, or know a source?",False,False,False,AskEngineers,t5_2sebk,284312,public,self,Source for Electrically Conductive Foam in Tube Shape?,0,[],1.0,https://www.reddit.com/r/AskEngineers/comments/xl45v9/source_for_electrically_conductive_foam_in_tube/,all_ads,6,,,,,,
29,[],False,nobbyv,,[],,text,t2_el92m,False,False,False,[],False,False,1663859625,self.AskEngineers,https://www.reddit.com/r/AskEngineers/comments/xl44ib/electrically_conductive_foam/,{},xl44ib,False,False,False,False,False,False,True,False,,purple,[],3a6acd0c-fd28-11e6-ab41-0edc7e2b18fe,Electrical,dark,text,False,False,True,1,0,False,all_ads,/r/AskEngineers/comments/xl44ib/electrically_conductive_foam/,False,6,1663859637,1,[removed],False,False,False,AskEngineers,t5_2sebk,284312,public,self,Electrically Conductive Foam?,0,[],1.0,https://www.reddit.com/r/AskEngineers/comments/xl44ib/electrically_conductive_foam/,all_ads,6,,,,,,moderator
30,[],False,imsadgorl,,[],,text,t2_5f9bnbki,False,False,False,[],False,False,1663858439,self.AskEngineers,https://www.reddit.com/r/AskEngineers/comments/xl3ljc/meche_or_bioe_for_pharmaceutical_engineer_or/,{},xl3ljc,False,False,False,False,False,False,True,False,,blue,[],b251a614-57f9-11e4-b47b-12313b0e9678,Discussion,dark,text,False,False,True,1,0,False,all_ads,/r/AskEngineers/comments/xl3ljc/meche_or_bioe_for_pharmaceutical_engineer_or/,False,6,1663858450,1,[removed],True,False,False,AskEngineers,t5_2sebk,284311,public,self,mechE or bioE for pharmaceutical engineer or biotech,0,[],1.0,https://www.reddit.com/r/AskEngineers/comments/xl3ljc/meche_or_bioe_for_pharmaceutical_engineer_or/,all_ads,6,,,,,,moderator
31,[],False,SwimmingFox3530,,[],,text,t2_fqyfud17,False,False,False,[],False,False,1663857849,self.AskEngineers,https://www.reddit.com/r/AskEngineers/comments/xl3c8v/can_all_natural_occuring_material_be_in_theory/,{},xl3c8v,False,True,False,False,False,True,True,False,,blue,[],b251a614-57f9-11e4-b47b-12313b0e9678,Discussion,dark,text,False,False,True,0,0,False,all_ads,/r/AskEngineers/comments/xl3c8v/can_all_natural_occuring_material_be_in_theory/,False,6,1663857860,1,"I'm not asking if we are able to do this already, but do you think it is possible?  


I've also asked this over at r/askscience",True,False,False,AskEngineers,t5_2sebk,284309,public,self,"Can all natural occuring material be, in theory, artificially synthesized?",0,[],1.0,https://www.reddit.com/r/AskEngineers/comments/xl3c8v/can_all_natural_occuring_material_be_in_theory/,all_ads,6,,,,,,
32,[],False,JonathanHodgkins,,[],,text,t2_6oldjunf,False,False,False,[],False,False,1663857487,self.AskEngineers,https://www.reddit.com/r/AskEngineers/comments/xl36p7/friction_hinge_or_gas_strut_supplier_for_250_lb/,{},xl36p7,False,False,False,False,False,False,True,False,,blue,[],90a1d45a-3f64-11e5-8667-0e60d8112001,Mechanical,dark,text,False,False,True,1,0,False,all_ads,/r/AskEngineers/comments/xl36p7/friction_hinge_or_gas_strut_supplier_for_250_lb/,False,6,1663857498,1,[removed],True,False,False,AskEngineers,t5_2sebk,284308,public,self,Friction Hinge or Gas strut supplier for 250 lb in solution,0,[],1.0,https://www.reddit.com/r/AskEngineers/comments/xl36p7/friction_hinge_or_gas_strut_supplier_for_250_lb/,all_ads,6,,,,,,moderator
33,[],False,kaabes,,[],,text,t2_1mxgelj2,False,False,False,[],False,False,1663856945,self.AskEngineers,https://www.reddit.com/r/AskEngineers/comments/xl2y9g/kinematic_diagram_of_a_very_simple_robot_leg_made/,{},xl2y9g,False,False,False,False,False,False,True,False,,blue,[],90a1d45a-3f64-11e5-8667-0e60d8112001,Mechanical,dark,text,False,False,True,1,0,False,all_ads,/r/AskEngineers/comments/xl2y9g/kinematic_diagram_of_a_very_simple_robot_leg_made/,False,6,1663856956,1,[removed],True,False,False,AskEngineers,t5_2sebk,284307,public,self,Kinematic diagram of a very simple robot leg made by our engineering teacher this morning. Can anyone help me understand it please ? Link down below.,0,[],1.0,https://www.reddit.com/r/AskEngineers/comments/xl2y9g/kinematic_diagram_of_a_very_simple_robot_leg_made/,all_ads,6,,,,,,moderator
34,[],False,Terrible_Rice1163,,[],,text,t2_a6dy8hpq,False,False,False,[],False,False,1663851817,self.AskEngineers,https://www.reddit.com/r/AskEngineers/comments/xl0thv/how_much_weight_can_a_satellite_bracket_carry/,{},xl0thv,False,False,False,False,False,False,True,False,,blue,[],b251a614-57f9-11e4-b47b-12313b0e9678,Discussion,dark,text,False,False,True,1,0,False,all_ads,/r/AskEngineers/comments/xl0thv/how_much_weight_can_a_satellite_bracket_carry/,False,6,1663851828,1,[removed],True,False,False,AskEngineers,t5_2sebk,284303,public,self,how much weight can a satellite bracket carry?,0,[],1.0,https://www.reddit.com/r/AskEngineers/comments/xl0thv/how_much_weight_can_a_satellite_bracket_carry/,all_ads,6,,,,,,moderator
35,[],False,carlo96,,[],,text,t2_im7sydi,False,False,False,[],False,False,1663851283,self.AskEngineers,https://www.reddit.com/r/AskEngineers/comments/xl0lom/from_real_stucture_to_model/,{},xl0lom,False,False,False,False,False,False,True,False,,blue,[],90a1d45a-3f64-11e5-8667-0e60d8112001,Mechanical,dark,text,False,False,True,1,0,False,all_ads,/r/AskEngineers/comments/xl0lom/from_real_stucture_to_model/,False,6,1663851294,1,[removed],True,False,False,AskEngineers,t5_2sebk,284302,public,self,From real stucture to model,0,[],1.0,https://www.reddit.com/r/AskEngineers/comments/xl0lom/from_real_stucture_to_model/,all_ads,6,,,,,,moderator
36,[],False,Planetcaravansong,,[],,text,t2_cw2ujoid,False,False,False,[],False,False,1663849632,self.AskEngineers,https://www.reddit.com/r/AskEngineers/comments/xkzzr1/mining_methane_ice_using_sound_and_micro_waves/,{},xkzzr1,False,True,False,False,False,True,True,False,,blue,[],90a1d45a-3f64-11e5-8667-0e60d8112001,Mechanical,dark,text,False,False,True,0,0,False,all_ads,/r/AskEngineers/comments/xkzzr1/mining_methane_ice_using_sound_and_micro_waves/,False,6,1663849642,1,"I just posted this question [in another sub (including picture](https://www.reddit.com/r/NaturalGas/comments/xkzwe5/mining_methane_ice_with_sound_and_micro_waves/)), but they won't allow me to crosspost it. \*grmpf\*

**Here's an idea that I (a layman) had regarding the mining of methane ice from the ocean floors.**

Since most of the material is loosely embedded on the surface and the first few meters on the ocean floor, I thought that it might be relatively simple and successful to get it up by using sound and micro waves:

* The micro waves heat up the ground to around 20°C which is enough to get the methane ice to melt.
* The low sound waves (20-100Hz) shake up the ground and loosen the methane from the sediment.

The wave emitters are embedded in a big bell-shaped structure where the loosened methane is rising into. The bell itself is connected through a tube with a ship on the surface that both controls the mining operation and collects the methane.

The advantages are that you don't need drilling, no complex structures below water, it's relatively cheap and if you don't go on full blast immediately, then animals are chased away. In case they remain, most of them would survive the \~5 minutes of horror waves that it would take to mine the ice.

Overall, would be as minimally invasive as it can get. Question is though, whether it would also work.",True,False,False,AskEngineers,t5_2sebk,284301,public,self,Mining Methane Ice Using Sound And Micro Waves - Would That Be Feasible?,0,[],1.0,https://www.reddit.com/r/AskEngineers/comments/xkzzr1/mining_methane_ice_using_sound_and_micro_waves/,all_ads,6,,,,,,
37,[],False,sketchEightyFive,,[],,text,t2_ekaj5ceo,False,False,False,[],False,False,1663849008,self.AskEngineers,https://www.reddit.com/r/AskEngineers/comments/xkzrsy/is_there_really_a_hardest_discipline/,{},xkzrsy,False,True,False,False,False,True,True,False,,blue,[],b251a614-57f9-11e4-b47b-12313b0e9678,Discussion,dark,text,False,False,True,0,0,False,all_ads,/r/AskEngineers/comments/xkzrsy/is_there_really_a_hardest_discipline/,False,6,1663849019,1,"Lately I’ve seen a lot of people try to rank disciplines in terms of difficulty. I’m not sure if it was the same for everyone, but at my school, almost every discipline has their hardest year and and each program is held to the same standard &amp; rigour. I don’t necessarily think that one discipline requires more skill to study than the other, rather that its more or less the same thing in different flavours (but mechs and civs are the coolest)",True,False,False,AskEngineers,t5_2sebk,284300,public,self,Is there really a “hardest discipline”?,0,[],1.0,https://www.reddit.com/r/AskEngineers/comments/xkzrsy/is_there_really_a_hardest_discipline/,all_ads,6,,,,,,
38,[],False,BaldEagle2525,,[],,text,t2_3odn1jdh,False,False,False,[],False,False,1663847330,self.AskEngineers,https://www.reddit.com/r/AskEngineers/comments/xkz6ha/what_motor_should_i_buy/,{},xkz6ha,False,False,False,False,False,False,True,False,,purple,[],6a68317a-c3cd-11e9-bf9c-0e2863fd7a72,Computer,dark,text,False,False,True,1,0,False,all_ads,/r/AskEngineers/comments/xkz6ha/what_motor_should_i_buy/,False,6,1663847340,1,[removed],True,False,False,AskEngineers,t5_2sebk,284301,public,self,What motor should I buy?,0,[],1.0,https://www.reddit.com/r/AskEngineers/comments/xkz6ha/what_motor_should_i_buy/,all_ads,6,,,,,,moderator
39,[],False,ShoddyContribution51,,[],,text,t2_spsxdzd0,False,False,False,[],False,False,1663842341,self.AskEngineers,https://www.reddit.com/r/AskEngineers/comments/xkxkm7/how_strong_does_my_radar_sensor_need_to_be/,{},xkxkm7,False,False,False,False,False,False,True,False,,purple,[],3a6acd0c-fd28-11e6-ab41-0edc7e2b18fe,Electrical,dark,text,False,False,True,1,0,False,all_ads,/r/AskEngineers/comments/xkxkm7/how_strong_does_my_radar_sensor_need_to_be/,False,6,1663842351,1,[removed],True,False,False,AskEngineers,t5_2sebk,284294,public,self,How strong does my radar sensor need to be?,0,[],1.0,https://www.reddit.com/r/AskEngineers/comments/xkxkm7/how_strong_does_my_radar_sensor_need_to_be/,all_ads,6,,,,,,moderator
40,[],False,ShoddyContribution51,,[],,text,t2_spsxdzd0,False,False,False,[],False,False,1663842244,self.AskEngineers,https://www.reddit.com/r/AskEngineers/comments/xkxjkh/how_strong_of_a_radar_sensor_do_i_need/,{},xkxjkh,False,False,False,False,False,False,True,False,,purple,[],3a6acd0c-fd28-11e6-ab41-0edc7e2b18fe,Electrical,dark,text,False,False,True,1,0,False,all_ads,/r/AskEngineers/comments/xkxjkh/how_strong_of_a_radar_sensor_do_i_need/,False,6,1663842255,1,[removed],True,False,False,AskEngineers,t5_2sebk,284294,public,self,How Strong of a radar sensor do i need?,0,[],1.0,https://www.reddit.com/r/AskEngineers/comments/xkxjkh/how_strong_of_a_radar_sensor_do_i_need/,all_ads,6,,,,,,moderator
41,[],False,ShoddyContribution51,,[],,text,t2_spsxdzd0,False,False,False,[],False,False,1663842151,self.AskEngineers,https://www.reddit.com/r/AskEngineers/comments/xkxiof/doppler_radar_sensors/,{},xkxiof,False,False,False,False,False,False,True,False,,purple,[],3a6acd0c-fd28-11e6-ab41-0edc7e2b18fe,Electrical,dark,text,False,False,True,1,0,False,all_ads,/r/AskEngineers/comments/xkxiof/doppler_radar_sensors/,False,6,1663842162,1,[removed],True,False,False,AskEngineers,t5_2sebk,284294,public,self,Doppler Radar Sensors,0,[],1.0,https://www.reddit.com/r/AskEngineers/comments/xkxiof/doppler_radar_sensors/,all_ads,6,,,,,,moderator
42,[],False,tocmac,,[],,text,t2_rww1q3mo,False,False,False,[],False,False,1663838635,self.AskEngineers,https://www.reddit.com/r/AskEngineers/comments/xkwj03/i_found_the_best_engineers_jobs/,{},xkwj03,False,False,False,False,False,False,True,False,,purple,[],6a68317a-c3cd-11e9-bf9c-0e2863fd7a72,Computer,dark,text,False,False,True,1,0,False,all_ads,/r/AskEngineers/comments/xkwj03/i_found_the_best_engineers_jobs/,False,6,1663838645,1,[removed],True,False,False,AskEngineers,t5_2sebk,284292,public,self,i found the best engineers jobs .,0,[],1.0,https://www.reddit.com/r/AskEngineers/comments/xkwj03/i_found_the_best_engineers_jobs/,all_ads,6,,,,self,"{'enabled': False, 'images': [{'id': 'wyCA0HgCnl49rHGrBilQwmyrAQmbU-_HJerrb3soEGc', 'resolutions': [{'height': 108, 'url': 'https://external-preview.redd.it/VLRWTrfqg_fxJmVfqMnaYdEH7KKMJX7opL4c-1HS_8Y.jpg?width=108&amp;crop=smart&amp;auto=webp&amp;s=74ab4f163890ef2eb4eda2ada162e330b1ad951c', 'width': 108}, {'height': 216, 'url': 'https://external-preview.redd.it/VLRWTrfqg_fxJmVfqMnaYdEH7KKMJX7opL4c-1HS_8Y.jpg?width=216&amp;crop=smart&amp;auto=webp&amp;s=a33c238157c70593d1404d8974012fae6a19899b', 'width': 216}, {'height': 320, 'url': 'https://external-preview.redd.it/VLRWTrfqg_fxJmVfqMnaYdEH7KKMJX7opL4c-1HS_8Y.jpg?width=320&amp;crop=smart&amp;auto=webp&amp;s=c2fe6427972993da3f7283c11943015e6c182ba0', 'width': 320}], 'source': {'height': 350, 'url': 'https://external-preview.redd.it/VLRWTrfqg_fxJmVfqMnaYdEH7KKMJX7opL4c-1HS_8Y.jpg?auto=webp&amp;s=9b662533deb3c5a75fb221fb0d17b3992d8905d4', 'width': 350}, 'variants': {}}]}",moderator
43,[],False,CategoryHoliday9210,,[],,text,t2_ctrjpwd3,False,False,False,[],False,False,1663832809,self.AskEngineers,https://www.reddit.com/r/AskEngineers/comments/xkuy4g/jobs_requiring_experience_in_experimental_and/,{},xkuy4g,False,False,False,False,False,False,True,False,,blue,[],b251a614-57f9-11e4-b47b-12313b0e9678,Discussion,dark,text,False,False,True,1,0,False,all_ads,/r/AskEngineers/comments/xkuy4g/jobs_requiring_experience_in_experimental_and/,False,6,1663832819,1,[removed],True,False,False,AskEngineers,t5_2sebk,284287,public,self,Jobs requiring experience in experimental and computational sides,0,[],1.0,https://www.reddit.com/r/AskEngineers/comments/xkuy4g/jobs_requiring_experience_in_experimental_and/,all_ads,6,,,,,,moderator
44,[],False,gpu_melter,,[],,text,t2_hcfwd19l,False,False,False,[],False,False,1663831631,self.AskEngineers,https://www.reddit.com/r/AskEngineers/comments/xkumk9/what_is_the_best_way_to_convert_12v_220a_to_1011v/,{},xkumk9,False,True,False,False,False,True,True,False,,purple,[],3a6acd0c-fd28-11e6-ab41-0edc7e2b18fe,Electrical,dark,text,False,False,True,0,0,False,all_ads,/r/AskEngineers/comments/xkumk9/what_is_the_best_way_to_convert_12v_220a_to_1011v/,False,6,1663831642,1,"Hi engineers i am building a 3d printer and my heating element for the heated bed (i made myself from resistive Wire 0,3Ω/m 8*2*3(8 ""zones"" 2 paralel per zone and 3m in series) will draw to much current at 12v according to ohm's law i would need about 10-11v to make my 2400w PSU happy. So my question is how do I do this without spending a lot of money €20-30 and without losing much power as i am talking 200A range i would not want to much power in % being lost. Thanks for your recommendations.",True,False,False,AskEngineers,t5_2sebk,284286,public,self,what is the best way to convert 12v 220A to 10-11v 264-240A,0,[],1.0,https://www.reddit.com/r/AskEngineers/comments/xkumk9/what_is_the_best_way_to_convert_12v_220a_to_1011v/,all_ads,6,,,,,,
45,[],False,Lomecron,,[],,text,t2_igdp8,False,False,False,[],False,False,1663831113,self.AskEngineers,https://www.reddit.com/r/AskEngineers/comments/xkuhfq/is_a_nonelectronic_thermoregulator_possible/,{},xkuhfq,False,True,False,False,False,True,True,False,,blue,[],90a1d45a-3f64-11e5-8667-0e60d8112001,Mechanical,dark,text,False,False,True,0,0,False,all_ads,/r/AskEngineers/comments/xkuhfq/is_a_nonelectronic_thermoregulator_possible/,False,6,1663831123,1,"If you wanted to, for example, make a hot tub that self regulated the temperature. But were unable to use any electronic components, or rare elements i.e. no neodymium magnets or mercury filled tubes. Would it be possible to keep the hot tub at a comfortable temperature without getting to hot or too cold or manually adjusting the temperature?   


Or in other words, could a purely mechanical device change it's output based on temperature?",True,False,False,AskEngineers,t5_2sebk,284285,public,self,Is a non-electronic thermoregulator possible?,0,[],1.0,https://www.reddit.com/r/AskEngineers/comments/xkuhfq/is_a_nonelectronic_thermoregulator_possible/,all_ads,6,,,,,,
46,[],False,shayanmghd,,[],,text,t2_7g9nbrae,False,False,False,[],False,False,1663825970,self.AskEngineers,https://www.reddit.com/r/AskEngineers/comments/xksz2f/trying_to_figure_out_dimensions_of_an_insulator/,{},xksz2f,False,True,False,False,False,True,True,False,,blue,[],90a1d45a-3f64-11e5-8667-0e60d8112001,Mechanical,dark,text,False,False,False,0,0,False,all_ads,/r/AskEngineers/comments/xksz2f/trying_to_figure_out_dimensions_of_an_insulator/,False,6,1663825980,1,"How/with what equations do i design the dimensions of an insulator with known dielectric strength? Material is a ceramic and it has an annual cross sectional shape (like a long thick tube). Just trynna figure out how thick and long it needs to be. Thanks for your help ;)

It’s required to insulate abt 2 Kv without breaking down.",True,False,False,AskEngineers,t5_2sebk,284284,public,self,Trying to figure out dimensions of an insulator,0,[],1.0,https://www.reddit.com/r/AskEngineers/comments/xksz2f/trying_to_figure_out_dimensions_of_an_insulator/,all_ads,6,,,,,,
47,[],False,Jennyinator,,[],,text,t2_jie9c7q,False,False,False,[],False,False,1663820941,self.AskEngineers,https://www.reddit.com/r/AskEngineers/comments/xkrdf6/will_my_project_engineering_experience_as_an/,{},xkrdf6,False,False,False,False,False,False,True,False,,purple,[],3a6acd0c-fd28-11e6-ab41-0edc7e2b18fe,Electrical,dark,text,False,False,True,1,0,False,all_ads,/r/AskEngineers/comments/xkrdf6/will_my_project_engineering_experience_as_an/,False,6,1663820952,1,[removed],True,False,False,AskEngineers,t5_2sebk,284280,public,self,Will my project engineering experience (as an intern) assist in my future career of working in the microelectronic industry?,0,[],1.0,https://www.reddit.com/r/AskEngineers/comments/xkrdf6/will_my_project_engineering_experience_as_an/,all_ads,6,,,,,,moderator
