,all_awardings,allow_live_comments,author,author_flair_css_class,author_flair_richtext,author_flair_text,author_flair_type,author_fullname,author_is_blocked,author_patreon_flair,author_premium,awarders,can_mod_post,contest_mode,created_utc,domain,full_link,gildings,id,is_created_from_ads_ui,is_crosspostable,is_meta,is_original_content,is_reddit_media_domain,is_robot_indexable,is_self,is_video,link_flair_background_color,link_flair_css_class,link_flair_richtext,link_flair_template_id,link_flair_text,link_flair_text_color,link_flair_type,locked,media_only,no_follow,num_comments,num_crossposts,over_18,parent_whitelist_status,permalink,pinned,pwls,retrieved_on,score,selftext,send_replies,spoiler,stickied,subreddit,subreddit_id,subreddit_subscribers,subreddit_type,thumbnail,title,total_awards_received,treatment_tags,upvote_ratio,url,whitelist_status,wls,removed_by_category,crosspost_parent,crosspost_parent_list,url_overridden_by_dest,post_hint,preview,author_flair_background_color,author_flair_text_color,author_flair_template_id,collections
0,[],False,MallAdministrative,,[],,text,t2_71pye76e,False,False,False,[],False,False,1662919597,self.AskEngineers,https://www.reddit.com/r/AskEngineers/comments/xbp9vg/is_a_steam_engine_inside_a_volcano_possible_what/,{},xbp9vg,False,True,False,False,False,True,True,False,,blue,[],b251a614-57f9-11e4-b47b-12313b0e9678,Discussion,dark,text,False,False,True,0,0,False,all_ads,/r/AskEngineers/comments/xbp9vg/is_a_steam_engine_inside_a_volcano_possible_what/,False,6,1662919607,1,,True,False,False,AskEngineers,t5_2sebk,283564,public,self,Is a steam engine inside a volcano possible? what are major roadblocks etc,0,[],1.0,https://www.reddit.com/r/AskEngineers/comments/xbp9vg/is_a_steam_engine_inside_a_volcano_possible_what/,all_ads,6,,,,,,,,,,
1,[],False,fhrhtibr,,[],,text,t2_gw255ty8,False,False,False,[],False,False,1662914269,self.AskEngineers,https://www.reddit.com/r/AskEngineers/comments/xbn4el/what_is_supply_chain_engineering_like_and_what_is/,{},xbn4el,False,True,False,False,False,True,True,False,,blue,[],b251a614-57f9-11e4-b47b-12313b0e9678,Discussion,dark,text,False,False,True,0,0,False,all_ads,/r/AskEngineers/comments/xbn4el/what_is_supply_chain_engineering_like_and_what_is/,False,6,1662914280,1,"Let’s say that I’ve been offer an opportunity to go down that path with a very well known aerospace company. 

I’ve done projects involving supply chain engineering but not willing to pull the trigger because I don’t know if what the career path is like for that type of role. 

Like do I then go into consulting? Is there potential ways to make decent in the future? 

I’m right now pivoting into software engineering but this came up and I wonder if it’s worth it.",True,False,False,AskEngineers,t5_2sebk,283561,public,self,What is supply chain engineering like and what is the progression path?,0,[],1.0,https://www.reddit.com/r/AskEngineers/comments/xbn4el/what_is_supply_chain_engineering_like_and_what_is/,all_ads,6,,,,,,,,,,
2,[],False,bunky_bunk,,[],,text,t2_pv859,False,False,False,[],False,False,1662913297,self.AskEngineers,https://www.reddit.com/r/AskEngineers/comments/xbmqfl/information_on_caterpillar_d8_transmission_gear/,{},xbmqfl,False,True,False,False,False,True,True,False,,blue,[],90a1d45a-3f64-11e5-8667-0e60d8112001,Mechanical,dark,text,False,False,True,0,0,False,all_ads,/r/AskEngineers/comments/xbmqfl/information_on_caterpillar_d8_transmission_gear/,False,6,1662913308,1,"This is from the 1950s, 2 planetary gears for direction control, 3 planetaries for speed control.

it seems like a well known machine, but information on the transmission (number of teeth, what connects with what) seems to be not publicly available.

thanks",True,False,False,AskEngineers,t5_2sebk,283560,public,self,information on Caterpillar D8 transmission gear box?,0,[],1.0,https://www.reddit.com/r/AskEngineers/comments/xbmqfl/information_on_caterpillar_d8_transmission_gear/,all_ads,6,,,,,,,,,,
3,[],False,Ryano085,,[],,text,t2_74k4vczq,False,False,False,[],False,False,1662910024,self.AskEngineers,https://www.reddit.com/r/AskEngineers/comments/xblet7/psu_query_meanwell_psu_200w_24v/,{},xblet7,False,False,False,False,False,False,True,False,,blue,[],90a1d45a-3f64-11e5-8667-0e60d8112001,Mechanical,dark,text,False,False,True,1,0,False,all_ads,/r/AskEngineers/comments/xblet7/psu_query_meanwell_psu_200w_24v/,False,6,1662910034,1,[removed],True,False,False,AskEngineers,t5_2sebk,283554,public,self,PSU query Meanwell PSU 200w - 24v,0,[],1.0,https://www.reddit.com/r/AskEngineers/comments/xblet7/psu_query_meanwell_psu_200w_24v/,all_ads,6,moderator,,,,,,,,,
4,[],False,Doc-Brown1911,,[],,text,t2_1toy45f7,False,False,False,[],False,False,1662909014,self.AskEngineers,https://www.reddit.com/r/AskEngineers/comments/xbl01z/toroid_placement/,{},xbl01z,False,False,False,False,False,False,True,False,,purple,[],3a6acd0c-fd28-11e6-ab41-0edc7e2b18fe,Electrical,dark,text,False,False,True,1,0,False,all_ads,/r/AskEngineers/comments/xbl01z/toroid_placement/,False,6,1662909024,1,[removed],True,False,False,AskEngineers,t5_2sebk,283549,public,self,Toroid Placement,0,[],1.0,https://www.reddit.com/r/AskEngineers/comments/xbl01z/toroid_placement/,all_ads,6,moderator,,,,,,,,,
5,[],False,randomusername11222,,[],,text,t2_h8ks0svq,False,False,False,[],False,False,1662902808,self.AskEngineers,https://www.reddit.com/r/AskEngineers/comments/xbijqv/some_suggested_resources_for_dealing_with_lenses/,{},xbijqv,False,True,False,False,False,True,True,False,,blue,[],b251a614-57f9-11e4-b47b-12313b0e9678,Discussion,dark,text,False,False,True,0,0,False,all_ads,/r/AskEngineers/comments/xbijqv/some_suggested_resources_for_dealing_with_lenses/,False,6,1662902818,1,"I need to pick up some lenses for a project,
general physics bookshelf looks like isn't enough, so I might end up picking the wrong hardware

I googled opto physics and ended up being more confused than before

so anyone has any website, book or something to suggest?",True,False,False,AskEngineers,t5_2sebk,283545,public,self,some suggested resources for dealing with lenses?,0,[],1.0,https://www.reddit.com/r/AskEngineers/comments/xbijqv/some_suggested_resources_for_dealing_with_lenses/,all_ads,6,,,,,,,,,,
6,[],False,randomusername11222,,[],,text,t2_h8ks0svq,False,False,False,[],False,False,1662902106,self.AskEngineers,https://www.reddit.com/r/AskEngineers/comments/xbiaek/some_suggested_resources_for_dealing_with_lenses/,{},xbiaek,False,False,False,False,False,False,True,False,,blue,[],b251a614-57f9-11e4-b47b-12313b0e9678,Discussion,dark,text,False,False,True,0,0,False,all_ads,/r/AskEngineers/comments/xbiaek/some_suggested_resources_for_dealing_with_lenses/,False,6,1662902117,1,[removed],True,False,False,AskEngineers,t5_2sebk,283544,public,self,some suggested resources for dealing with lenses?,0,[],1.0,https://www.reddit.com/r/AskEngineers/comments/xbiaek/some_suggested_resources_for_dealing_with_lenses/,all_ads,6,reddit,,,,,,,,,
7,[],False,HelioKing,,[],,text,t2_137ozqg5,False,False,False,[],False,False,1662900765,self.AskEngineers,https://www.reddit.com/r/AskEngineers/comments/xbhsjh/is_it_ok_to_choose_the_field_you_find_most/,{},xbhsjh,False,True,False,False,False,True,True,False,,blue,[],b251a614-57f9-11e4-b47b-12313b0e9678,Discussion,dark,text,False,False,True,0,0,False,all_ads,/r/AskEngineers/comments/xbhsjh/is_it_ok_to_choose_the_field_you_find_most/,False,6,1662900776,1,"So, I'm a second-year engineering student at my uni. First-year was general engineering, so we all learned more or less the same things, with only 1 or 2 class differences. I found civil engineering, after a bit of research to be the most interesting program, so I decided to choose to major in it. I don't have any issue with Civil, but I feel like choosing it just because it looked interesting wasn't a good idea in the long term when there could be majors with more opportunities. I don't know whether I should switch to something else or just stick with it and it's been causing a lot of stress.",True,False,False,AskEngineers,t5_2sebk,283546,public,self,Is it ok to choose the Field you find most interesting?,0,[],1.0,https://www.reddit.com/r/AskEngineers/comments/xbhsjh/is_it_ok_to_choose_the_field_you_find_most/,all_ads,6,,,,,,,,,,
8,[],False,UlvenAsks,,[],,text,t2_5rh1iuei,False,False,False,[],False,False,1662894922,self.AskEngineers,https://www.reddit.com/r/AskEngineers/comments/xbfxde/what_material_collects_dust_automaticly/,{},xbfxde,False,False,False,False,False,False,True,False,,green,[],1612b830-09c2-11ea-a8a8-0ea1f14b089b,Chemical,dark,text,False,False,True,1,0,False,all_ads,/r/AskEngineers/comments/xbfxde/what_material_collects_dust_automaticly/,False,6,1662894932,1,[removed],True,False,False,AskEngineers,t5_2sebk,283543,public,self,What material collects dust automaticly?,0,[],1.0,https://www.reddit.com/r/AskEngineers/comments/xbfxde/what_material_collects_dust_automaticly/,all_ads,6,moderator,,,,,,,,,
9,[],False,wigglytails,,[],,text,t2_16adr5,False,False,True,[],False,False,1662893307,self.fea,https://www.reddit.com/r/AskEngineers/comments/xbfg6e/any_introductory_texts_to_phasefield_fracture/,{},xbfg6e,False,True,False,False,False,True,False,False,,blue,[],90a1d45a-3f64-11e5-8667-0e60d8112001,Mechanical,dark,text,False,False,True,0,0,False,all_ads,/r/AskEngineers/comments/xbfg6e/any_introductory_texts_to_phasefield_fracture/,False,6,1662893318,1,,True,False,False,AskEngineers,t5_2sebk,283542,public,default,Any introductory texts to phase-field fracture models? My background is in fluid mechanics,0,[],1.0,/r/fea/comments/x9yd3v/any_introductory_texts_to_phasefield_fracture/,all_ads,6,,t3_x9yd3v,"[{'all_awardings': [], 'allow_live_comments': False, 'approved_at_utc': None, 'approved_by': None, 'archived': False, 'author': 'wigglytails', 'author_flair_background_color': None, 'author_flair_css_class': None, 'author_flair_richtext': [], 'author_flair_template_id': None, 'author_flair_text': None, 'author_flair_text_color': None, 'author_flair_type': 'text', 'author_fullname': 't2_16adr5', 'author_is_blocked': False, 'author_patreon_flair': False, 'author_premium': True, 'awarders': [], 'banned_at_utc': None, 'banned_by': None, 'can_gild': True, 'can_mod_post': False, 'category': None, 'clicked': False, 'content_categories': None, 'contest_mode': False, 'created': 1662737129.0, 'created_utc': 1662737129.0, 'discussion_type': None, 'distinguished': None, 'domain': 'self.fea', 'downs': 0, 'edited': False, 'gilded': 0, 'gildings': {}, 'hidden': False, 'hide_score': False, 'id': 'x9yd3v', 'is_created_from_ads_ui': False, 'is_crosspostable': True, 'is_meta': False, 'is_original_content': False, 'is_reddit_media_domain': False, 'is_robot_indexable': True, 'is_self': True, 'is_video': False, 'likes': None, 'link_flair_background_color': '', 'link_flair_css_class': None, 'link_flair_richtext': [], 'link_flair_text': None, 'link_flair_text_color': 'dark', 'link_flair_type': 'text', 'locked': False, 'media': None, 'media_embed': {}, 'media_only': False, 'mod_note': None, 'mod_reason_by': None, 'mod_reason_title': None, 'mod_reports': [], 'name': 't3_x9yd3v', 'no_follow': False, 'num_comments': 3, 'num_crossposts': 1, 'num_reports': None, 'over_18': False, 'parent_whitelist_status': 'all_ads', 'permalink': '/r/fea/comments/x9yd3v/any_introductory_texts_to_phasefield_fracture/', 'pinned': False, 'pwls': 6, 'quarantine': False, 'removal_reason': None, 'removed_by': None, 'removed_by_category': None, 'report_reasons': None, 'saved': False, 'score': 3, 'secure_media': None, 'secure_media_embed': {}, 'selftext': '', 'selftext_html': None, 'send_replies': True, 'spoiler': False, 'stickied': False, 'subreddit': 'fea', 'subreddit_id': 't5_2rqj1', 'subreddit_name_prefixed': 'r/fea', 'subreddit_subscribers': 9045, 'subreddit_type': 'public', 'suggested_sort': None, 'thumbnail': 'self', 'thumbnail_height': None, 'thumbnail_width': None, 'title': 'Any introductory texts to phase-field fracture models? My background is in fluid mechanics', 'top_awarded_type': None, 'total_awards_received': 0, 'treatment_tags': [], 'ups': 3, 'upvote_ratio': 0.72, 'url': 'https://www.reddit.com/r/fea/comments/x9yd3v/any_introductory_texts_to_phasefield_fracture/', 'user_reports': [], 'view_count': None, 'visited': False, 'whitelist_status': 'all_ads', 'wls': 6}]",/r/fea/comments/x9yd3v/any_introductory_texts_to_phasefield_fracture/,,,,,,
10,[],False,iskahatedbycrs,,[],,text,t2_rj46z5b4,False,False,False,[],False,False,1662890827,self.ChemicalEngineering,https://www.reddit.com/r/AskEngineers/comments/xber6z/ethical_issuesdilemmas_in_chemical_engineering/,{},xber6z,False,False,False,False,False,False,False,False,,green,[],1612b830-09c2-11ea-a8a8-0ea1f14b089b,Chemical,dark,text,False,False,True,1,0,False,all_ads,/r/AskEngineers/comments/xber6z/ethical_issuesdilemmas_in_chemical_engineering/,False,6,1662890838,1,,False,False,False,AskEngineers,t5_2sebk,283541,public,default,Ethical issues/dilemmas in Chemical Engineering,0,[],1.0,/r/ChemicalEngineering/comments/xbeqgj/ethical_issuesdilemmas_in_chemical_engineering/,all_ads,6,moderator,t3_xbeqgj,"[{'all_awardings': [], 'allow_live_comments': False, 'approved_at_utc': None, 'approved_by': None, 'archived': False, 'author': 'iskahatedbycrs', 'author_flair_background_color': None, 'author_flair_css_class': None, 'author_flair_richtext': [], 'author_flair_template_id': None, 'author_flair_text': None, 'author_flair_text_color': None, 'author_flair_type': 'text', 'author_fullname': 't2_rj46z5b4', 'author_is_blocked': False, 'author_patreon_flair': False, 'author_premium': False, 'awarders': [], 'banned_at_utc': None, 'banned_by': None, 'can_gild': True, 'can_mod_post': False, 'category': None, 'clicked': False, 'content_categories': None, 'contest_mode': False, 'created': 1662890750.0, 'created_utc': 1662890750.0, 'discussion_type': None, 'distinguished': None, 'domain': 'self.ChemicalEngineering', 'downs': 0, 'edited': False, 'gilded': 0, 'gildings': {}, 'hidden': False, 'hide_score': True, 'id': 'xbeqgj', 'is_created_from_ads_ui': False, 'is_crosspostable': True, 'is_meta': False, 'is_original_content': False, 'is_reddit_media_domain': False, 'is_robot_indexable': True, 'is_self': True, 'is_video': False, 'likes': None, 'link_flair_background_color': '', 'link_flair_css_class': None, 'link_flair_richtext': [], 'link_flair_text': None, 'link_flair_text_color': 'dark', 'link_flair_type': 'text', 'locked': False, 'media': None, 'media_embed': {}, 'media_only': False, 'mod_note': None, 'mod_reason_by': None, 'mod_reason_title': None, 'mod_reports': [], 'name': 't3_xbeqgj', 'no_follow': True, 'num_comments': 0, 'num_crossposts': 1, 'num_reports': None, 'over_18': False, 'parent_whitelist_status': 'all_ads', 'permalink': '/r/ChemicalEngineering/comments/xbeqgj/ethical_issuesdilemmas_in_chemical_engineering/', 'pinned': False, 'pwls': 6, 'quarantine': False, 'removal_reason': None, 'removed_by': None, 'removed_by_category': None, 'report_reasons': None, 'saved': False, 'score': 1, 'secure_media': None, 'secure_media_embed': {}, 'selftext': ""Hello! I am a Chemical Engineering student and would need to write a paper on ethical issues/dilemmas in the Chemical Engineering industry. Could y'all list down some interesting ones? Thanks!"", 'selftext_html': '&lt;!-- SC_OFF --&gt;&lt;div class=""md""&gt;&lt;p&gt;Hello! I am a Chemical Engineering student and would need to write a paper on ethical issues/dilemmas in the Chemical Engineering industry. Could y&amp;#39;all list down some interesting ones? Thanks!&lt;/p&gt;\n&lt;/div&gt;&lt;!-- SC_ON --&gt;', 'send_replies': True, 'spoiler': False, 'stickied': False, 'subreddit': 'ChemicalEngineering', 'subreddit_id': 't5_2qwn7', 'subreddit_name_prefixed': 'r/ChemicalEngineering', 'subreddit_subscribers': 74728, 'subreddit_type': 'public', 'suggested_sort': None, 'thumbnail': 'self', 'thumbnail_height': None, 'thumbnail_width': None, 'title': 'Ethical issues/dilemmas in Chemical Engineering', 'top_awarded_type': None, 'total_awards_received': 0, 'treatment_tags': [], 'ups': 1, 'upvote_ratio': 1.0, 'url': 'https://www.reddit.com/r/ChemicalEngineering/comments/xbeqgj/ethical_issuesdilemmas_in_chemical_engineering/', 'user_reports': [], 'view_count': None, 'visited': False, 'whitelist_status': 'all_ads', 'wls': 6}]",/r/ChemicalEngineering/comments/xbeqgj/ethical_issuesdilemmas_in_chemical_engineering/,,,,,,
11,[],False,ShRiGh,,[],,text,t2_a2rysdjx,False,False,False,[],False,False,1662887617,self.AskEngineers,https://www.reddit.com/r/AskEngineers/comments/xbdwcu/is_there_a_major_that_includes_engineering_and/,{},xbdwcu,False,True,False,False,False,True,True,False,,blue,[],b251a614-57f9-11e4-b47b-12313b0e9678,Discussion,dark,text,False,False,True,0,0,False,all_ads,/r/AskEngineers/comments/xbdwcu/is_there_a_major_that_includes_engineering_and/,False,6,1662887627,1,"Long story short: I graduated like 2years ago with a bachelors degree in software engineering, have been working as iOS developer..quite happy with what I'm making but the work is getting repetitive and I'm loosing my interests. I don't want to be solving problems/maintaining  code bases for the rest of my life. And..I know more about human emotions that I know coding. Body language, hypnosis, behaviour profiling interest me and I've never stopped studying them. I've got to a point where last week I provided therapy sessions to my girlfriend's sister..later, when she visited her therapist, he saw 'significant improvements' and appreciated my work. But I don't want to change my career to clinical psychology...because I'll have to get a phd in the field before I start using it and I'll be making far less than my current job. I was wondering if there was any career path that would involve both engineering and psychology. What masters programs do you suggest? Any suggestions will work..thank you ☺️",True,False,False,AskEngineers,t5_2sebk,283538,public,self,Is there a major that includes engineering and psychology? -A iOS developer.,0,[],1.0,https://www.reddit.com/r/AskEngineers/comments/xbdwcu/is_there_a_major_that_includes_engineering_and/,all_ads,6,,,,,,,,,,
12,[],False,ThatWhichVerbs,,[],,text,t2_18ii90sm,False,False,False,[],False,False,1662886606,self.AskEngineers,https://www.reddit.com/r/AskEngineers/comments/xbdmhe/why_do_agricultural_and_construction_vehicles/,{},xbdmhe,False,True,False,False,False,True,True,False,,blue,[],90a1d45a-3f64-11e5-8667-0e60d8112001,Mechanical,dark,text,False,False,False,0,0,False,all_ads,/r/AskEngineers/comments/xbdmhe/why_do_agricultural_and_construction_vehicles/,False,6,1662886616,1,"Especially the vehicles that are called upon to slog through the muck, like wheel loaders and off-highway tippers. I would have expected a herringbone pattern to serve them as it does tractors and combine harvesters.",True,False,False,AskEngineers,t5_2sebk,283538,public,self,Why do agricultural and construction vehicles have different tread patterns?,0,[],1.0,https://www.reddit.com/r/AskEngineers/comments/xbdmhe/why_do_agricultural_and_construction_vehicles/,all_ads,6,,,,,,,,,,
13,[],False,weer_ka,,[],,text,t2_eb97kc0r,False,False,False,[],False,False,1662886587,self.AskEngineers,https://www.reddit.com/r/AskEngineers/comments/xbdma9/the_computers_are_unstable_in_some_places_due_to/,{},xbdma9,False,False,False,False,False,False,True,False,,purple,[],3a6acd0c-fd28-11e6-ab41-0edc7e2b18fe,Electrical,dark,text,False,False,True,1,0,False,all_ads,/r/AskEngineers/comments/xbdma9/the_computers_are_unstable_in_some_places_due_to/,False,6,1662886597,1,[removed],True,False,False,AskEngineers,t5_2sebk,283538,public,self,The computers are unstable in some places due to electricity.,0,[],1.0,https://www.reddit.com/r/AskEngineers/comments/xbdma9/the_computers_are_unstable_in_some_places_due_to/,all_ads,6,moderator,,,,,,,,,
14,[],False,Braeden151,,[],,text,t2_2pjcvmll,False,False,False,[],False,False,1662885752,self.AskEngineers,https://www.reddit.com/r/AskEngineers/comments/xbdegj/how_do_companies_aquire_the_knowledge_to_design/,{},xbdegj,False,True,False,False,False,True,True,False,,blue,[],b251a614-57f9-11e4-b47b-12313b0e9678,Discussion,dark,text,False,False,True,0,0,False,all_ads,/r/AskEngineers/comments/xbdegj/how_do_companies_aquire_the_knowledge_to_design/,False,6,1662885763,1,"For example you work at an ebike company and suddenly self balancing bikes are all the rage. Where would you start with the new tech. I know long term is building and testing. But that first step, what is it?",True,False,False,AskEngineers,t5_2sebk,283538,public,self,How do companies aquire the knowledge to design totally different things?,0,[],1.0,https://www.reddit.com/r/AskEngineers/comments/xbdegj/how_do_companies_aquire_the_knowledge_to_design/,all_ads,6,,,,,,,,,,
15,[],False,CorrectlyTrustworthy,,[],,text,t2_i1ksql5s,False,False,False,[],False,False,1662884157,self.AskEngineers,https://www.reddit.com/r/AskEngineers/comments/xbcz35/during_quarantine_ive_learned_how_to_use/,{},xbcz35,False,True,False,False,False,True,True,False,,blue,[],b251a614-57f9-11e4-b47b-12313b0e9678,Discussion,dark,text,False,False,True,0,0,False,all_ads,/r/AskEngineers/comments/xbcz35/during_quarantine_ive_learned_how_to_use/,False,6,1662884168,1,"I will always and forever recommend Autocad to anyone. It is versatile, robust, and the interface translates skills into other modeling programs like Revit and SolidWorks.

What did you learn? What should be the next resume builder? Website developing? Apps? Social media? Professional writing?

Edit: Started with personal website dev. I am also hosting an engineering competition. Check it out and submit! Website",True,False,False,AskEngineers,t5_2sebk,283538,public,self,"During quarantine I've learned how to use SolidWorks, Unreal Engine 4, Python, and how to edit videos. What's next?",0,[],1.0,https://www.reddit.com/r/AskEngineers/comments/xbcz35/during_quarantine_ive_learned_how_to_use/,all_ads,6,,,,,,,,,,
16,[],False,Brightboi2000,,[],,text,t2_gawpyau1,False,False,False,[],False,False,1662882701,self.AskEngineers,https://www.reddit.com/r/AskEngineers/comments/xbckv6/should_i_go_into_sales_and_marketing_alongside/,{},xbckv6,False,True,False,False,False,True,True,False,,blue,[],b251a614-57f9-11e4-b47b-12313b0e9678,Discussion,dark,text,False,False,True,0,0,False,all_ads,/r/AskEngineers/comments/xbckv6/should_i_go_into_sales_and_marketing_alongside/,False,6,1662882711,1,"My engineering job pays pretty well but the company I work at wants me to do sales pitches and get leads for commission. I'm a pretty good salesperson. But I'm not sure if moving into sales will ruin my resume and make it a hybrid that doesn't work for engineering positions or for sales positions.

I already face the dilemma of employers asking me if I'm a marketing person or an engineer, because I've done a lot of both.",True,False,False,AskEngineers,t5_2sebk,283538,public,self,Should I go into sales and marketing alongside engineering?,0,[],1.0,https://www.reddit.com/r/AskEngineers/comments/xbckv6/should_i_go_into_sales_and_marketing_alongside/,all_ads,6,,,,,,,,,,
17,[],False,NevaSmoove,,[],,text,t2_3f4c13rt,False,False,False,[],False,False,1662882383,self.AskEngineers,https://www.reddit.com/r/AskEngineers/comments/xbchsl/does_it_matter_to_which_beam_hor_or_ver_i_connect/,{},xbchsl,False,True,False,False,False,True,True,False,,blue,[],b251a614-57f9-11e4-b47b-12313b0e9678,Discussion,dark,text,False,False,False,0,0,False,all_ads,/r/AskEngineers/comments/xbchsl/does_it_matter_to_which_beam_hor_or_ver_i_connect/,False,6,1662882393,1,,True,False,False,AskEngineers,t5_2sebk,283537,public,self,Does it matter to which beam (hor or ver) I connect my diagonal supports?,0,[],1.0,https://www.reddit.com/r/AskEngineers/comments/xbchsl/does_it_matter_to_which_beam_hor_or_ver_i_connect/,all_ads,6,,,,,,,,,,
18,[],False,ApprehensiveMonk8290,,[],,text,t2_qbfo0sdl,False,False,False,[],False,False,1662873162,self.AskEngineers,https://www.reddit.com/r/AskEngineers/comments/xb9xvm/would_a_carrier_plate_made_with_layers_of/,{},xb9xvm,False,False,False,False,False,False,True,False,,blue,[],b251a614-57f9-11e4-b47b-12313b0e9678,Discussion,dark,text,False,False,True,1,0,False,all_ads,/r/AskEngineers/comments/xb9xvm/would_a_carrier_plate_made_with_layers_of/,False,6,1662873172,1,[removed],True,False,False,AskEngineers,t5_2sebk,283530,public,self,Would a carrier plate made with layers of materials with varying levels of density and rigidity stop a bullet better than a solid steel plate?,0,[],1.0,https://www.reddit.com/r/AskEngineers/comments/xb9xvm/would_a_carrier_plate_made_with_layers_of/,all_ads,6,moderator,,,,,,,,,
