77,[],False,Fun_Ad3442,,[],,text,t2_8p1k72ip,False,False,False,[],False,False,1660102842,self.ElectricalEngineering,https://www.reddit.com/r/AskEngineers/comments/wkn623/i_need_some_help_probably_a_simple_answer/,{},wkn623,False,True,False,False,False,True,False,False,,purple,[],3a6acd0c-fd28-11e6-ab41-0edc7e2b18fe,Electrical,dark,text,False,False,True,0,0,False,all_ads,/r/AskEngineers/comments/wkn623/i_need_some_help_probably_a_simple_answer/,False,6,1660102853,1,,False,False,False,AskEngineers,t5_2sebk,280968,public,default,I need some help probably a simple answer.,0,[],1.0,/r/ElectricalEngineering/comments/wkn3xo/i_need_some_help_probably_a_simple_answer/,all_ads,6,,,,,,,t3_wkn3xo,"[{'all_awardings': [], 'allow_live_comments': False, 'approved_at_utc': None, 'approved_by': None, 'archived': False, 'author': 'Fun_Ad3442', 'author_flair_background_color': None, 'author_flair_css_class': None, 'author_flair_richtext': [], 'author_flair_template_id': None, 'author_flair_text': None, 'author_flair_text_color': None, 'author_flair_type': 'text', 'author_fullname': 't2_8p1k72ip', 'author_is_blocked': False, 'author_patreon_flair': False, 'author_premium': False, 'awarders': [], 'banned_at_utc': None, 'banned_by': None, 'can_gild': True, 'can_mod_post': False, 'category': None, 'clicked': False, 'content_categories': None, 'contest_mode': False, 'created': 1660102659.0, 'created_utc': 1660102659.0, 'discussion_type': None, 'distinguished': None, 'domain': 'self.ElectricalEngineering', 'downs': 0, 'edited': False, 'gilded': 0, 'gildings': {}, 'hidden': False, 'hide_score': True, 'id': 'wkn3xo', 'is_created_from_ads_ui': False, 'is_crosspostable': True, 'is_meta': False, 'is_original_content': False, 'is_reddit_media_domain': False, 'is_robot_indexable': True, 'is_self': True, 'is_video': False, 'likes': None, 'link_flair_background_color': '#ffb000', 'link_flair_css_class': '', 'link_flair_richtext': [{'e': 'text', 't': 'Question'}], 'link_flair_template_id': '37f71a3e-acf8-11e5-a1c7-0ebccc2c5891', 'link_flair_text': 'Question', 'link_flair_text_color': 'dark', 'link_flair_type': 'richtext', 'locked': False, 'media': None, 'media_embed': {}, 'media_only': False, 'mod_note': None, 'mod_reason_by': None, 'mod_reason_title': None, 'mod_reports': [], 'name': 't3_wkn3xo', 'no_follow': True, 'num_comments': 0, 'num_crossposts': 1, 'num_reports': None, 'over_18': False, 'parent_whitelist_status': 'all_ads', 'permalink': '/r/ElectricalEngineering/comments/wkn3xo/i_need_some_help_probably_a_simple_answer/', 'pinned': False, 'pwls': 6, 'quarantine': False, 'removal_reason': None, 'removed_by': None, 'removed_by_category': None, 'report_reasons': None, 'saved': False, 'score': 1, 'secure_media': None, 'secure_media_embed': {}, 'selftext': 'I have a camera a7s3 that can be run on an NPfz100 battery they are 7.2v I also have an external monitor that is run by much larger sony npf750 batteries. The monitor has a dc 5.5mmx2.1mm 8.4v output. I have used this to run my old camera with a dummy battery plugged into that dc output and it worked great. My problem now is that the new a7s3 camera does not have a cut out for the dummy battery cable to come through. So the battery door must stay open at all times using a dummy. There is however a second way to run power to the new a7s3 camera and that is usbc so now i run into an issue. When I look for 8.4v 5.5x2.1mm dc to usbc I only find a few options. “The bling spot” has them on amazon, called power pipes. However most are rated for 11-12v and it says there is a chip that somehow communicates with the device and requests that 12v. This scares me as Idk if I need a specific 8.4v cable. The blind spot also carried an 8.4v version but its only 8 inches and the dc side is female so Id need an extension male to male dc 5.5x2.1mm and now i run into the same issue. Do i need that extension to also be rated for 8.4v or can I just get the 12v usb c to 5.5x2.1mm and since im only sending 8.4v the camera is good because it cant overdraw more than is being delivered?  Idk where to turn someone please help!! If you need video or photos to help explain I can add those thanks in advance everyone', 'selftext_html': '&lt;!-- SC_OFF --&gt;&lt;div class=""md""&gt;&lt;p&gt;I have a camera a7s3 that can be run on an NPfz100 battery they are 7.2v I also have an external monitor that is run by much larger sony npf750 batteries. The monitor has a dc 5.5mmx2.1mm 8.4v output. I have used this to run my old camera with a dummy battery plugged into that dc output and it worked great. My problem now is that the new a7s3 camera does not have a cut out for the dummy battery cable to come through. So the battery door must stay open at all times using a dummy. There is however a second way to run power to the new a7s3 camera and that is usbc so now i run into an issue. When I look for 8.4v 5.5x2.1mm dc to usbc I only find a few options. “The bling spot” has them on amazon, called power pipes. However most are rated for 11-12v and it says there is a chip that somehow communicates with the device and requests that 12v. This scares me as Idk if I need a specific 8.4v cable. The blind spot also carried an 8.4v version but its only 8 inches and the dc side is female so Id need an extension male to male dc 5.5x2.1mm and now i run into the same issue. Do i need that extension to also be rated for 8.4v or can I just get the 12v usb c to 5.5x2.1mm and since im only sending 8.4v the camera is good because it cant overdraw more than is being delivered?  Idk where to turn someone please help!! If you need video or photos to help explain I can add those thanks in advance everyone&lt;/p&gt;\n&lt;/div&gt;&lt;!-- SC_ON --&gt;', 'send_replies': True, 'spoiler': False, 'stickied': False, 'subreddit': 'ElectricalEngineering', 'subreddit_id': 't5_2sey9', 'subreddit_name_prefixed': 'r/ElectricalEngineering', 'subreddit_subscribers': 136077, 'subreddit_type': 'public', 'suggested_sort': 'top', 'thumbnail': 'self', 'thumbnail_height': None, 'thumbnail_width': None, 'title': 'I need some help probably a simple answer.', 'top_awarded_type': None, 'total_awards_received': 0, 'treatment_tags': [], 'ups': 1, 'upvote_ratio': 1.0, 'url': 'https://www.reddit.com/r/ElectricalEngineering/comments/wkn3xo/i_need_some_help_probably_a_simple_answer/', 'user_reports': [], 'view_count': None, 'visited': False, 'whitelist_status': 'all_ads', 'wls': 6}]",/r/ElectricalEngineering/comments/wkn3xo/i_need_some_help_probably_a_simple_answer/
78,[],False,kimberlitepipes,,[],,text,t2_9ayib,False,False,False,[],False,False,1660099867,self.AskEngineers,https://www.reddit.com/r/AskEngineers/comments/wkm6e0/steel_thickness_plate_to_hold_antique_spiral/,{},wkm6e0,False,True,False,False,False,True,True,False,,blue,[],b251a614-57f9-11e4-b47b-12313b0e9678,Discussion,dark,text,False,False,True,0,0,False,all_ads,/r/AskEngineers/comments/wkm6e0/steel_thickness_plate_to_hold_antique_spiral/,False,6,1660099878,1,"Hello - question - I am erecting an old cast iron spiral staircase (Duvinage from about 1920) - total weight of stairs will be about 600#. My house is on Pilings up in the air - I am in 16” joist centers, Gypcrete - and the pole for the spiral staircase ends up right dead center between 2 floor joists. I am going to put a 16” circular steel plate down with a flange welded to mount the pole. How thick does this steel (and what kind of steel) to support this weight ? Thanks for your time",True,False,False,AskEngineers,t5_2sebk,280963,public,self,Steel thickness plate to hold antique spiral staircase,0,[],1.0,https://www.reddit.com/r/AskEngineers/comments/wkm6e0/steel_thickness_plate_to_hold_antique_spiral/,all_ads,6,,,,,,,,,
79,[],False,Marinated_Fish619,,[],,text,t2_me54pl4h,False,False,False,[],False,False,1660098399,self.AskEngineers,https://www.reddit.com/r/AskEngineers/comments/wklp99/how_many_telematics_devices_can_be_embedded_on/,{},wklp99,False,True,False,False,False,True,True,False,,blue,[],90a1d45a-3f64-11e5-8667-0e60d8112001,Mechanical,dark,text,False,False,True,0,0,False,all_ads,/r/AskEngineers/comments/wklp99/how_many_telematics_devices_can_be_embedded_on/,False,6,1660098409,1,,True,False,False,AskEngineers,t5_2sebk,280959,public,self,How many telematics devices can be embedded on trucks? Are there any limitation?,0,[],1.0,https://www.reddit.com/r/AskEngineers/comments/wklp99/how_many_telematics_devices_can_be_embedded_on/,all_ads,6,,,,,,,,,
80,[],False,mostofit,,[],,text,t2_10u8sn,False,False,False,[],False,False,1660098063,self.AskEngineers,https://www.reddit.com/r/AskEngineers/comments/wkll90/interested_in_switching_career_to_engineering/,{},wkll90,False,True,False,False,False,True,True,False,,blue,[],b251a614-57f9-11e4-b47b-12313b0e9678,Discussion,dark,text,False,False,False,0,0,False,all_ads,/r/AskEngineers/comments/wkll90/interested_in_switching_career_to_engineering/,False,6,1660098074,1,"Hi all, title sums it up quickly. I always had a knack for math and science, but i was way too angsty of a teen and i ended up going to art school(no regrets) and since have done a variety of fabrication and construction jobs as well as jobs in museums and with artists.  I’m 28 and live in nyc…. it’s really expensive and working conditions suck. I’m fairly confident I could learn what i needed to to become an engineer, it’s been a while but I got a perfect score on my math sats, and always enjoyed physics.  I don’t have much money saved up but I could study with free online classes until I know enough to apply to a reputable degree. On the job site I tend to be the one to solve problems by looking at plans or figure out jigs and spatial reasoning in the wood shop. plus one of my siblings is a mathematician and the other is a biologists and i know they could help me study if need be. 

I considered a few years back going to medical school but the crazy hours for a decade made me decide against. 

the biggest thing stopping me now is not knowing what kind of jobs exactly I could get and what the hours, salary, benefits and general culture is, I don’t wanna uproot my life to find out I coulda just stayed a woodworker.  I’m also curious to know if you all are generally working on the computers all day long.

(i’m not interested in software engineering! also sick of construction so also not interested in structural engineering (i think))

I’m also interested in gender diversity Im a visibly queer person. 

sorry for the long post thanks for reading!",True,False,False,AskEngineers,t5_2sebk,280959,public,self,"interested in switching career to engineering from carpentry/woodworking, general fabrication and art background. thoughts?",0,[],1.0,https://www.reddit.com/r/AskEngineers/comments/wkll90/interested_in_switching_career_to_engineering/,all_ads,6,,,,,,,,,
81,[],False,smoothies-for-me,,[],,text,t2_8gvlmq0l,False,False,False,[],False,False,1660097341,self.AskEngineers,https://www.reddit.com/r/AskEngineers/comments/wklckd/is_traffic_engineering_really_as_simple_as_europe/,{},wklckd,False,True,False,False,False,True,True,False,,orange,[],939137fa-3f64-11e5-b90e-0ef63926eacd,Civil,dark,text,False,False,True,0,0,False,all_ads,/r/AskEngineers/comments/wklckd/is_traffic_engineering_really_as_simple_as_europe/,False,6,1660097352,1,"In my local area, there's a Facebook group post about a 2 lane road with like 5 stop signs at every other intersection as it goes through old neighborhood blocks. The post is about how people speed and race between stop signs, and how dangerous it is for children, how police should be there, how they should put up one of those radar signs that flashes your speed, etc... etc...

I also live on a rural road where it ends going down hill to an intersection, and right around that corner is a municipal beach park. I walk my dog there every day, the rural highway is fairly wide, but there are a lot of hills and blind crests, and cars absolutely fly by me at like 80 or 90km/h, then fly through the beach around the same where people are crossing the road, cars are pulling in and out, etc... It's very dangerous. The thing is when I drive these same roads I feel like I should be going that fast too, and people have always sped, and will always speed, it seems pointless to get angry with regular drivers for this.

Now to the question, it seems on YouTube and reddit, a popular consensus is that Europe has already figured out all of this, and that we need to curb driver behaviour with road design. Instead of 4 way stop signs, there should be roundabouts, or pillars on the road that force cars into a single lane so pedestrians can also get more visible before crossing the road. And in rural areas, the road needs to get narrower and things like trees, utility poles, etc... need to be closer to the road to trigger our brains into paying attention more and slowing down. But over here we have ""boomer"" mentality of making roads super wide, cutting things away from the roads so that cars that might go off the road don't hit them, but the result is that people feel 'safer' on wider roads with more visibility, so they subconsiously just drive faster.

Is it really this simple or is there more to it? If it is this simple why are we so hesitant to change things?",True,False,False,AskEngineers,t5_2sebk,280959,public,self,"Is traffic engineering really as simple as ""Europe has it figured out"" and North America is just stubborn?",0,[],1.0,https://www.reddit.com/r/AskEngineers/comments/wklckd/is_traffic_engineering_really_as_simple_as_europe/,all_ads,6,,,,,,,,,
82,[],False,Sabiancym,,[],,text,t2_5wgxf,False,False,False,[],False,False,1660095482,self.AskEngineers,https://www.reddit.com/r/AskEngineers/comments/wkkq9s/psi_on_pipe_after_releasing_a_vacuum/,{},wkkq9s,False,True,False,False,False,True,True,False,,blue,[],90a1d45a-3f64-11e5-8667-0e60d8112001,Mechanical,dark,text,False,False,True,0,0,False,all_ads,/r/AskEngineers/comments/wkkq9s/psi_on_pipe_after_releasing_a_vacuum/,False,6,1660095493,1,"I'm making a vacuum ping pong ball cannon.  Create a vacuum in the pipe, burst one end, air rushes in to launch the ball out of the other loosely sealed end.  For better performance, a vacuum accumulator is needed to keep the ball from hitting a cushion of air and slowing down before being able to exit.  
&amp;nbsp;  
My problem is I don't know what kind of pipe I should use for the accumulator.  I'm not worried about collapse, but I am worried about the pressure on the pipe as air rushes in.  
&amp;nbsp;  
The ball can get close to the speed of sound, but what kind of forces will the pipe experience?  How do I know which PSI rated pipe to get?",True,False,False,AskEngineers,t5_2sebk,280955,public,self,PSI on Pipe After Releasing a Vacuum?,0,[],1.0,https://www.reddit.com/r/AskEngineers/comments/wkkq9s/psi_on_pipe_after_releasing_a_vacuum/,all_ads,6,,,,,,,,,
83,[],False,ApolloHelp,,[],,text,t2_p034m5vm,False,False,False,[],False,False,1660095348,self.AskEngineers,https://www.reddit.com/r/AskEngineers/comments/wkkoiw/questions_for_pavlov_device/,{},wkkoiw,False,False,False,False,False,False,True,False,,blue,[],b251a614-57f9-11e4-b47b-12313b0e9678,Discussion,dark,text,False,False,True,1,0,False,all_ads,/r/AskEngineers/comments/wkkoiw/questions_for_pavlov_device/,False,6,1660095359,1,[removed],True,False,False,AskEngineers,t5_2sebk,280956,public,self,Questions for Pavlov Device,0,[],1.0,https://www.reddit.com/r/AskEngineers/comments/wkkoiw/questions_for_pavlov_device/,all_ads,6,moderator,,,,,,,,
84,[],False,ApolloHelp,,[],,text,t2_p034m5vm,False,False,False,[],False,False,1660095212,self.AskEngineers,https://www.reddit.com/r/AskEngineers/comments/wkkmuv/questions_for_shock_therapy_device/,{},wkkmuv,False,False,False,False,False,False,True,False,,blue,[],b251a614-57f9-11e4-b47b-12313b0e9678,Discussion,dark,text,False,False,True,1,0,False,all_ads,/r/AskEngineers/comments/wkkmuv/questions_for_shock_therapy_device/,False,6,1660095223,1,[removed],True,False,False,AskEngineers,t5_2sebk,280956,public,self,Questions for shock therapy device,0,[],1.0,https://www.reddit.com/r/AskEngineers/comments/wkkmuv/questions_for_shock_therapy_device/,all_ads,6,moderator,,,,,,,,
85,[],False,adeel0,,[],,text,t2_2sd7g4bj,False,False,False,[],False,False,1660094144,self.AskEngineers,https://www.reddit.com/r/AskEngineers/comments/wkk9fx/how_long_to_stay_at_a_job/,{},wkk9fx,False,True,False,False,False,True,True,False,,blue,[],b251a614-57f9-11e4-b47b-12313b0e9678,Discussion,dark,text,False,False,True,0,0,False,all_ads,/r/AskEngineers/comments/wkk9fx/how_long_to_stay_at_a_job/,False,6,1660094155,1,"Idk if this is the right subreddit, but I’m curious to know how long do you stay at your job? Do you stay for your whole life, until you get bored, 1 year?",True,False,False,AskEngineers,t5_2sebk,280952,public,self,How long to stay at a job?,0,[],1.0,https://www.reddit.com/r/AskEngineers/comments/wkk9fx/how_long_to_stay_at_a_job/,all_ads,6,,,,,,,,,
86,[],False,hibabygirl90,,[],,text,t2_bhgc4e0g,False,False,False,[],False,False,1660091803,self.AskEngineers,https://www.reddit.com/r/AskEngineers/comments/wkjg8e/how_likely_is_it_to_step_back_in_an_engineering/,{},wkjg8e,False,True,False,False,False,True,True,False,,blue,[],b251a614-57f9-11e4-b47b-12313b0e9678,Discussion,dark,text,False,False,True,0,0,False,all_ads,/r/AskEngineers/comments/wkjg8e/how_likely_is_it_to_step_back_in_an_engineering/,False,6,1660091813,1,"I worked as an engineer for about a year and a half and was fired last month. I got a job offer yesterday for a finance analyst role. The salary is a bit higher than my previous job , so I think I might make the transition. Important question though. Say I work here for 5-10 years and realise that I don’t want to work in finance since I hate it , how likely is it to get an entry level job in engineering so that I can merge back into stem? I just want to make sure that I am not destroying my engineering job prospects in the future in case I decide to change my mind. Has anyone been in this position before and ended up returning to engineering? Thanks.",True,False,False,AskEngineers,t5_2sebk,280950,public,self,How likely is it to step back in an engineering role after working in a different career path?,0,[],1.0,https://www.reddit.com/r/AskEngineers/comments/wkjg8e/how_likely_is_it_to_step_back_in_an_engineering/,all_ads,6,,,,,,,,,
87,[],False,ThatOneGuy4378,,[],,text,t2_5v747iyg,False,False,False,[],False,False,1660088564,self.AskEngineers,https://www.reddit.com/r/AskEngineers/comments/wkian2/where_to_school_myself_on_engineering_stuff/,{},wkian2,False,True,False,False,False,True,True,False,,blue,[],b251a614-57f9-11e4-b47b-12313b0e9678,Discussion,dark,text,False,False,True,0,0,False,all_ads,/r/AskEngineers/comments/wkian2/where_to_school_myself_on_engineering_stuff/,False,6,1660088574,1,"I’m a beginner hobbyist who doesn’t need a full, comprehensive engineering education. I just want some knowledge in the branches that interest me. Does anyone here know a good online resource for that, preferably a free one? Thanks",True,False,False,AskEngineers,t5_2sebk,280946,public,self,Where to School Myself on Engineering Stuff?,0,[],1.0,https://www.reddit.com/r/AskEngineers/comments/wkian2/where_to_school_myself_on_engineering_stuff/,all_ads,6,,,,,,,,,
88,[],False,ExplanationDazzling1,,[],,text,t2_8gf3w92e,False,False,False,[],False,False,1660087683,self.AskEngineers,https://www.reddit.com/r/AskEngineers/comments/wkhz83/working_with_engineers_when_youre_a_fresh_new/,{},wkhz83,False,True,False,False,False,True,True,False,,blue,[],b251a614-57f9-11e4-b47b-12313b0e9678,Discussion,dark,text,False,False,True,0,0,False,all_ads,/r/AskEngineers/comments/wkhz83/working_with_engineers_when_youre_a_fresh_new/,False,6,1660087694,1,I told them straight up if I ask you a question just answer it. Don’t question me about my question. Some people mentality is to not show you from A-Z. They use to following the steps and going fast. Completely ignoring the fact that you are just getting your feet wet. So your question to them may seem like it’s dumb but that’s just because the stuff they are doing now is second nature to them. See when it comes to me teaching someone a new thing I go slow and step by step. Not sure why some of our humans on this planet like to go fast but I ain’t having it.,True,False,False,AskEngineers,t5_2sebk,280947,public,self,Working with engineers when you’re a fresh new contractor…,0,[],1.0,https://www.reddit.com/r/AskEngineers/comments/wkhz83/working_with_engineers_when_youre_a_fresh_new/,all_ads,6,,,,,,,,,
89,[],False,Defiant-Travel8174,,[],,text,t2_jf621761,False,False,False,[],False,False,1660087441,self.AskEngineers,https://www.reddit.com/r/AskEngineers/comments/wkhw2i/pneumatic_valve_using_piezo_actuators/,{},wkhw2i,False,True,False,False,False,True,True,False,,blue,[],b251a614-57f9-11e4-b47b-12313b0e9678,Discussion,dark,text,False,False,True,0,0,False,all_ads,/r/AskEngineers/comments/wkhw2i/pneumatic_valve_using_piezo_actuators/,False,6,1660087453,1,"So I am trying to design a pneumatic valve that can rev higher then freevalve. Its my theory that a big limitation on this is the stepper motor used to open and close the valves to depress the main piston. my friend mentioned using piezo valves capable of operating at extremally high rpm's, I wonder wondering if there is any  substance to this idea. I don't know the range of motion would be anywhere enough to open and close a passageway that is a few mm in size.

Thank you for your time, Andrew.",True,False,False,AskEngineers,t5_2sebk,280946,public,self,pneumatic valve using piezo actuators,0,[],1.0,https://www.reddit.com/r/AskEngineers/comments/wkhw2i/pneumatic_valve_using_piezo_actuators/,all_ads,6,,,,,,,,,
90,[],False,Electrical-Ad3789,,[],,text,t2_8w54ykz5,False,False,False,[],False,False,1660085522,self.AskEngineers,https://www.reddit.com/r/AskEngineers/comments/wkh6qb/site_plan_design/,{},wkh6qb,False,False,False,False,False,False,True,False,,orange,[],939137fa-3f64-11e5-b90e-0ef63926eacd,Civil,dark,text,False,False,True,1,0,False,all_ads,/r/AskEngineers/comments/wkh6qb/site_plan_design/,False,6,1660085532,1,[removed],True,False,False,AskEngineers,t5_2sebk,280942,public,self,Site plan design,0,[],1.0,https://www.reddit.com/r/AskEngineers/comments/wkh6qb/site_plan_design/,all_ads,6,moderator,,,,,,,,
91,[],False,acvdk,,[],,text,t2_hu7ek,False,False,False,[],False,False,1660083983,self.AskEngineers,https://www.reddit.com/r/AskEngineers/comments/wkgljt/would_a_solar_panel_that_is_not_connected_to_a/,{},wkgljt,False,True,False,False,False,True,True,False,,purple,[],3a6acd0c-fd28-11e6-ab41-0edc7e2b18fe,Electrical,dark,text,False,False,True,0,0,False,all_ads,/r/AskEngineers/comments/wkgljt/would_a_solar_panel_that_is_not_connected_to_a/,False,6,1660083994,1,"I know this sounds a bit like a homework problem, but it was a discussion I was having with my boss today.

We were considering what happens to a solar PV array when it is providing load and if the load has a cooling effect on the panel surface. I framed this as a thought problem:

Imagine you had two identical closed systems each containing a solar PV array. One was connected to a resistance heater and one was connected to nothing. Each system receives the same amount of solar radiation so energy input is the same. Since heat input is the same, both systems should reach the same equilibrium temperature. However, for this to happen in the system running a resistance heater, the only reasonable explanation we could come up with is that the inactive array's surface temp is actually lower than the one that is powering the resistance heater.

Are we both missing something here? Does a working solar panel that is serving a load reduce the temperature of the panel surface?",True,False,False,AskEngineers,t5_2sebk,280942,public,self,Would a solar panel that is not connected to a load have a lower surface temperature than one that is providing load because of conservation of energy?,0,[],1.0,https://www.reddit.com/r/AskEngineers/comments/wkgljt/would_a_solar_panel_that_is_not_connected_to_a/,all_ads,6,,,,,,,,,
92,[],False,Cloned0,,[],,text,t2_gjlsxq5j,False,False,False,[],False,False,1660082298,self.AskEngineers,https://www.reddit.com/r/AskEngineers/comments/wkfxe2/simulating_acoustic_sound_monitoring_in/,{},wkfxe2,False,False,False,False,False,False,True,False,,purple,[],6a68317a-c3cd-11e9-bf9c-0e2863fd7a72,Computer,dark,text,False,False,True,1,0,False,all_ads,/r/AskEngineers/comments/wkfxe2/simulating_acoustic_sound_monitoring_in/,False,6,1660082309,1,[removed],True,False,False,AskEngineers,t5_2sebk,280936,public,self,Simulating acoustic ( sound) monitoring in healthcare using code,0,[],1.0,https://www.reddit.com/r/AskEngineers/comments/wkfxe2/simulating_acoustic_sound_monitoring_in/,all_ads,6,moderator,,,,,,,,
93,[],False,dread_pirate_humdaak,,[],,text,t2_ymrm09,False,False,False,[],False,False,1660082149,self.AskEngineers,https://www.reddit.com/r/AskEngineers/comments/wkfvd5/would_a_trustdriven_or_wheel_and_gearbox_driven/,{},wkfvd5,False,True,False,False,False,True,True,False,,blue,[],90a1d45a-3f64-11e5-8667-0e60d8112001,Mechanical,dark,text,False,False,False,0,0,False,all_ads,/r/AskEngineers/comments/wkfvd5/would_a_trustdriven_or_wheel_and_gearbox_driven/,False,6,1660082160,1,"The trust-driven car will surely win out on the salt flats, but what about the 1/4 mile?",True,False,False,AskEngineers,t5_2sebk,280936,public,self,Would a trust-driven or wheel and gearbox driven jet-powered dragster accelerate quicker?,0,[],1.0,https://www.reddit.com/r/AskEngineers/comments/wkfvd5/would_a_trustdriven_or_wheel_and_gearbox_driven/,all_ads,6,,,,,,,,,
