,all_awardings,allow_live_comments,author,author_flair_css_class,author_flair_richtext,author_flair_text,author_flair_type,author_fullname,author_is_blocked,author_patreon_flair,author_premium,awarders,can_mod_post,contest_mode,created_utc,domain,full_link,gildings,id,is_created_from_ads_ui,is_crosspostable,is_meta,is_original_content,is_reddit_media_domain,is_robot_indexable,is_self,is_video,link_flair_background_color,link_flair_css_class,link_flair_richtext,link_flair_template_id,link_flair_text,link_flair_text_color,link_flair_type,locked,media_only,no_follow,num_comments,num_crossposts,over_18,parent_whitelist_status,permalink,pinned,pwls,removed_by_category,retrieved_on,score,selftext,send_replies,spoiler,stickied,subreddit,subreddit_id,subreddit_subscribers,subreddit_type,thumbnail,title,total_awards_received,treatment_tags,upvote_ratio,url,whitelist_status,wls,post_hint,preview,author_flair_background_color,author_flair_template_id,author_flair_text_color
0,[],False,EngQuestion,,[],,text,t2_hk9ijt8e,False,False,False,[],False,False,1659537161,self.AskEngineers,https://www.reddit.com/r/AskEngineers/comments/wf85ud/clean_up_cut_to_estabish_datum_feature/,{},wf85ud,False,False,False,False,False,False,True,False,,blue,[],90a1d45a-3f64-11e5-8667-0e60d8112001,Mechanical,dark,text,False,False,True,1,0,False,all_ads,/r/AskEngineers/comments/wf85ud/clean_up_cut_to_estabish_datum_feature/,False,6,moderator,1659537171,1,[removed],True,False,False,AskEngineers,t5_2sebk,280310,public,self,Clean up cut to estabish datum feature?,0,[],1.0,https://www.reddit.com/r/AskEngineers/comments/wf85ud/clean_up_cut_to_estabish_datum_feature/,all_ads,6,,,,,
1,[],False,EngQuestion,,[],,text,t2_hk9ijt8e,False,False,False,[],False,False,1659536910,self.AskEngineers,https://www.reddit.com/r/AskEngineers/comments/wf8250/gd_t_question_cleaning_up_a_forging_to_create_a/,{},wf8250,False,False,False,False,False,False,True,False,,blue,[],90a1d45a-3f64-11e5-8667-0e60d8112001,Mechanical,dark,text,False,False,True,1,0,False,all_ads,/r/AskEngineers/comments/wf8250/gd_t_question_cleaning_up_a_forging_to_create_a/,False,6,moderator,1659536921,1,[removed],True,False,False,AskEngineers,t5_2sebk,280310,public,self,GD &amp; T Question. Cleaning up a forging to create a datum feature,0,[],1.0,https://www.reddit.com/r/AskEngineers/comments/wf8250/gd_t_question_cleaning_up_a_forging_to_create_a/,all_ads,6,self,"{'enabled': False, 'images': [{'id': 'l330JbspWAWrGZwt5pnmCUh3uhcDJOI_eHg0tQ6yucE', 'resolutions': [{'height': 66, 'url': 'https://external-preview.redd.it/KmL2ceMFq5Kerrzt8_M49UWY1fS7jh8c_u_kcABGd40.jpg?width=108&amp;crop=smart&amp;auto=webp&amp;s=b1d05ee239e9d39c730ccc8cde86d3855c4831ec', 'width': 108}, {'height': 133, 'url': 'https://external-preview.redd.it/KmL2ceMFq5Kerrzt8_M49UWY1fS7jh8c_u_kcABGd40.jpg?width=216&amp;crop=smart&amp;auto=webp&amp;s=572bc52802024c0529a85c49fe77a3994829a607', 'width': 216}, {'height': 197, 'url': 'https://external-preview.redd.it/KmL2ceMFq5Kerrzt8_M49UWY1fS7jh8c_u_kcABGd40.jpg?width=320&amp;crop=smart&amp;auto=webp&amp;s=1603247d5c42ca5f850b38782d24c9e55783f8de', 'width': 320}, {'height': 395, 'url': 'https://external-preview.redd.it/KmL2ceMFq5Kerrzt8_M49UWY1fS7jh8c_u_kcABGd40.jpg?width=640&amp;crop=smart&amp;auto=webp&amp;s=cd7f083daa961bc55cfa31725a4ebcde2c4dbaa8', 'width': 640}, {'height': 592, 'url': 'https://external-preview.redd.it/KmL2ceMFq5Kerrzt8_M49UWY1fS7jh8c_u_kcABGd40.jpg?width=960&amp;crop=smart&amp;auto=webp&amp;s=13d9bc434e193605d0ee51937793d7532f7c7553', 'width': 960}, {'height': 666, 'url': 'https://external-preview.redd.it/KmL2ceMFq5Kerrzt8_M49UWY1fS7jh8c_u_kcABGd40.jpg?width=1080&amp;crop=smart&amp;auto=webp&amp;s=ee103275b9a88c84aeef218b3cedfa1773cfdb1f', 'width': 1080}], 'source': {'height': 678, 'url': 'https://external-preview.redd.it/KmL2ceMFq5Kerrzt8_M49UWY1fS7jh8c_u_kcABGd40.jpg?auto=webp&amp;s=d6f433a0426a1d59c66d8fad72cb9fed46ba13ab', 'width': 1098}, 'variants': {}}]}",,,
2,[],False,mankyd,,[],,text,t2_34xzj,False,False,False,[],False,False,1659536811,self.AskEngineers,https://www.reddit.com/r/AskEngineers/comments/wf80pw/why_are_some_electric_motors_louder_than_others/,{},wf80pw,False,True,False,False,False,True,True,False,,purple,[],3a6acd0c-fd28-11e6-ab41-0edc7e2b18fe,Electrical,dark,text,False,False,True,0,0,False,all_ads,/r/AskEngineers/comments/wf80pw/why_are_some_electric_motors_louder_than_others/,False,6,,1659536822,1,"I know there are _many_ different types of electric motors: ac, dc, brushed, brushless, stepper, servo, and probably a hundred others. I have a reasonable understanding of what purpose they serve within those categories.

However, what I don't understand is why some motors sound like coffee grinders while others a virtually inaudible.

I assume some of it comes down to built-in gearing that many motors some with, but does that answer the whole question? How do I seek out a motor with certain performance characteristics and features that is _also_ quiet/silent?",True,False,False,AskEngineers,t5_2sebk,280310,public,self,Why are some electric motors louder than others?,0,[],1.0,https://www.reddit.com/r/AskEngineers/comments/wf80pw/why_are_some_electric_motors_louder_than_others/,all_ads,6,,,,,
3,[],False,salukikev,,[],,text,t2_4ituh,False,False,False,[],False,False,1659533741,self.AskEngineers,https://www.reddit.com/r/AskEngineers/comments/wf6sys/is_it_possible_to_include_a_low_bitrate_data/,{},wf6sys,False,True,False,False,False,True,True,False,,purple,[],3a6acd0c-fd28-11e6-ab41-0edc7e2b18fe,Electrical,dark,text,False,False,True,0,0,False,all_ads,/r/AskEngineers/comments/wf6sys/is_it_possible_to_include_a_low_bitrate_data/,False,6,,1659533752,1,I'm learning more about this in the context of radio control devices.  Somewhat surprised to see that often an RC vehicle will use an analog video feed on one antenna/frequency and then a separate system for the control data.   It doesn't seem like it should be too hard to just add a little extra bandwidth for a few extra data bits and keep it simplified on a single frequency?  I'm confused as to why this seems to be separated as a standard approach.  Can someone please explain this?,True,False,False,AskEngineers,t5_2sebk,280306,public,self,"Is it possible to include a low bitrate data stream into an analog video stream? If so, how?",0,[],1.0,https://www.reddit.com/r/AskEngineers/comments/wf6sys/is_it_possible_to_include_a_low_bitrate_data/,all_ads,6,,,,,
4,[],False,decadenza,,[],,text,t2_b12vg,False,False,False,[],False,False,1659532544,self.AskEngineers,https://www.reddit.com/r/AskEngineers/comments/wf6czf/why_do_we_not_grow_shadeloving_crops_under_the/,{},wf6czf,False,True,False,False,False,True,True,False,,blue,[],b251a614-57f9-11e4-b47b-12313b0e9678,Discussion,dark,text,False,False,True,0,0,False,all_ads,/r/AskEngineers/comments/wf6czf/why_do_we_not_grow_shadeloving_crops_under_the/,False,6,,1659532554,1,"Says it all. We are taking fairly flat arable land and turning it into electrical power generation, then paying someone to mow the effing grass that grows under the panels. Why are we not using that nice shady land for shade-loving crops? Seems the height of idiocy to waste this land.",True,False,False,AskEngineers,t5_2sebk,280304,public,self,Why do we not grow shade-loving crops under the panels of solar power 'farms'?,0,[],1.0,https://www.reddit.com/r/AskEngineers/comments/wf6czf/why_do_we_not_grow_shadeloving_crops_under_the/,all_ads,6,,,,,
5,[],False,Synt0p1c0n,,[],,text,t2_3ffe2qsp,False,False,False,[],False,False,1659531202,self.AskEngineers,https://www.reddit.com/r/AskEngineers/comments/wf5umb/battery_to_usbc_phonetablet_fast_charger/,{},wf5umb,False,True,False,False,False,True,True,False,,purple,[],3a6acd0c-fd28-11e6-ab41-0edc7e2b18fe,Electrical,dark,text,False,False,False,0,0,False,all_ads,/r/AskEngineers/comments/wf5umb/battery_to_usbc_phonetablet_fast_charger/,False,6,,1659531212,1,"Looking for a little help on a project. I have a  13-16.7VDC battery and would like to be able to use this to charge a phone/tablet. Preferably using fast charging. This would be used with Samsung brand devices.

I have a voltage regulator to step down the voltage to 5VDC. And I have a USBC Male plug with breakout board. 

I've tried connecting the CC1 pin to Gnd via a 5.1KOhm resistor. I've tried 56KOhm between VBUS and CC1. I've also tried 10KOhm between VBUS and CC1. All just give me .5A charging. 

I believe I just need to mimick a DFP/Source but am a little out of my element here. 

What am I missing?

Do I need a chip for power negotiation?",True,False,False,AskEngineers,t5_2sebk,280300,public,self,Battery to USB-C phone/tablet fast charger,0,[],1.0,https://www.reddit.com/r/AskEngineers/comments/wf5umb/battery_to_usbc_phonetablet_fast_charger/,all_ads,6,,,,,
6,[],False,exotic_islander,,[],,text,t2_4t5l715y,False,False,False,[],False,False,1659529439,self.AskEngineers,https://www.reddit.com/r/AskEngineers/comments/wf58l6/which_commissioning_certification_to_take/,{},wf58l6,False,True,False,False,False,True,True,False,,red,[],a2e13d02-57f9-11e4-8c58-12313b0e9678,Career,dark,text,False,False,True,0,0,False,all_ads,/r/AskEngineers/comments/wf58l6/which_commissioning_certification_to_take/,False,6,,1659529449,1,"Has anyone taken any commissioning certifications?

My job wants me to take one, and I see there's quite a few options for NY. They're familiar with the BCCP but I also see the ASHRAE BCxA and a few others. Any input
on which to take? There isn't really any study material I could find.",True,False,False,AskEngineers,t5_2sebk,280299,public,self,Which commissioning certification to take?,0,[],1.0,https://www.reddit.com/r/AskEngineers/comments/wf58l6/which_commissioning_certification_to_take/,all_ads,6,,,,,
7,[],False,exotic_islander,,[],,text,t2_4t5l715y,False,False,False,[],False,False,1659529344,self.AskEngineers,https://www.reddit.com/r/AskEngineers/comments/wf57i3/commissioning_certifications/,{},wf57i3,False,False,False,False,False,False,True,False,,red,[],a2e13d02-57f9-11e4-8c58-12313b0e9678,Career,dark,text,False,False,True,1,0,False,all_ads,/r/AskEngineers/comments/wf57i3/commissioning_certifications/,False,6,moderator,1659529355,1,[removed],True,False,False,AskEngineers,t5_2sebk,280299,public,self,Commissioning Certifications,0,[],1.0,https://www.reddit.com/r/AskEngineers/comments/wf57i3/commissioning_certifications/,all_ads,6,,,,,
8,[],False,tadm123,,[],EE,text,t2_664zg,False,False,False,[],False,False,1659526545,self.AskEngineers,https://www.reddit.com/r/AskEngineers/comments/wf49t3/what_does_a_software_integration_engineer_do/,{},wf49t3,False,True,False,False,False,True,True,False,,red,[],a2e13d02-57f9-11e4-8c58-12313b0e9678,Career,dark,text,False,False,True,0,0,False,all_ads,/r/AskEngineers/comments/wf49t3/what_does_a_software_integration_engineer_do/,False,6,,1659526556,1,"I'm an Electrical Engineer with some background in programming and had been applying to lots of companies, I finally got a response with a job offer for the position of ""Software Integration Engineer"".

Does anyone know what exactly they do? Just to not be completely blind-sighted in my first day.

Thanks",True,False,False,AskEngineers,t5_2sebk,280296,public,self,"What does a ""Software Integration Engineer"" do?",0,[],1.0,https://www.reddit.com/r/AskEngineers/comments/wf49t3/what_does_a_software_integration_engineer_do/,all_ads,6,,,#d3d6da,2238776c-d04a-11e6-8ad9-0eff92f5bd12,dark
9,[],False,Aquahemo,,[],,text,t2_1fl8ezuo,False,False,False,[],False,False,1659521261,self.AskEngineers,https://www.reddit.com/r/AskEngineers/comments/wf2nz5/could_911_have_been_much_worse/,{},wf2nz5,False,True,False,False,False,True,True,False,,blue,[],b251a614-57f9-11e4-b47b-12313b0e9678,Discussion,dark,text,False,False,True,0,0,False,all_ads,/r/AskEngineers/comments/wf2nz5/could_911_have_been_much_worse/,False,6,,1659521271,1,"Not sure if this is the best place to ask. 

\*Referring to the twin towers incident\* As horrible as 9/11 was, I imagine it could have been worse. In fact, it could have been easily worse. Couldn't those massive airplanes have done more damage if they  clipped a bunch of buildings and bounced from one building to the next? Maybe hit the side of the towers and fall onto other buildings?  Could they have gone through the towers and hit other buildings, or were the towers designed to absorb an airplane? I feel like the fact that they got caught dead-stop in the towers avoided a lot of collateral damage. 

&amp;#x200B;

It seems like a miracle that it wasn't worse.",True,False,False,AskEngineers,t5_2sebk,280293,public,self,Could 9/11 have been much worse?,0,[],1.0,https://www.reddit.com/r/AskEngineers/comments/wf2nz5/could_911_have_been_much_worse/,all_ads,6,,,,,
10,[],False,einekleine99,,[],,text,t2_cfr0zrd5,False,False,False,[],False,False,1659515293,self.AskEngineers,https://www.reddit.com/r/AskEngineers/comments/wf10sw/can_i_be_a_data_scientist_with_an_engineering/,{},wf10sw,False,True,False,False,False,True,True,False,,red,[],a2e13d02-57f9-11e4-8c58-12313b0e9678,Career,dark,text,False,False,False,0,0,False,all_ads,/r/AskEngineers/comments/wf10sw/can_i_be_a_data_scientist_with_an_engineering/,False,6,,1659515304,1,i jus kinda wanna be one also,True,False,False,AskEngineers,t5_2sebk,280291,public,self,Can I be a Data Scientist with an Engineering Degree?,0,[],1.0,https://www.reddit.com/r/AskEngineers/comments/wf10sw/can_i_be_a_data_scientist_with_an_engineering/,all_ads,6,,,,,
11,[],False,einekleine99,,[],,text,t2_cfr0zrd5,False,False,False,[],False,False,1659515239,self.AskEngineers,https://www.reddit.com/r/AskEngineers/comments/wf10a5/data_scientist/,{},wf10a5,False,False,False,False,False,False,True,False,,red,[],a2e13d02-57f9-11e4-8c58-12313b0e9678,Career,dark,text,False,False,True,1,0,False,all_ads,/r/AskEngineers/comments/wf10a5/data_scientist/,False,6,moderator,1659515249,1,[removed],True,False,False,AskEngineers,t5_2sebk,280291,public,self,data scientist,0,[],1.0,https://www.reddit.com/r/AskEngineers/comments/wf10a5/data_scientist/,all_ads,6,,,,,
12,[],False,Accurate_Medicine200,,[],,text,t2_jyneh1j6,False,False,False,[],False,False,1659511395,self.AskEngineers,https://www.reddit.com/r/AskEngineers/comments/wezy7p/whats_the_technology_behind_invisible_brackets_i/,{},wezy7p,False,True,False,False,False,True,True,False,,blue,[],b251a614-57f9-11e4-b47b-12313b0e9678,Discussion,dark,text,False,False,False,0,0,False,all_ads,/r/AskEngineers/comments/wezy7p/whats_the_technology_behind_invisible_brackets_i/,False,6,,1659511405,1,Any ideas? I guess it envolves a lot of mechanical engineering and computer science,True,False,False,AskEngineers,t5_2sebk,280288,public,self,"What's the technology behind invisible brackets? I just got invisalign, which is a set of retainers that move your teeth. I'm really curious about the engineering behind it and what the design process looked like.",0,[],1.0,https://www.reddit.com/r/AskEngineers/comments/wezy7p/whats_the_technology_behind_invisible_brackets_i/,all_ads,6,,,,,
13,[],False,blackpanda370,,[],,text,t2_gaos8xj0,False,False,False,[],False,False,1659508954,self.AskEngineers,https://www.reddit.com/r/AskEngineers/comments/wez9qg/is_it_possible_to_find_a_good_and_free_paper_on/,{},wez9qg,False,False,False,False,False,False,True,False,,blue,[],90a1d45a-3f64-11e5-8667-0e60d8112001,Mechanical,dark,text,False,False,True,1,0,False,all_ads,/r/AskEngineers/comments/wez9qg/is_it_possible_to_find_a_good_and_free_paper_on/,False,6,moderator,1659508964,1,[removed],True,False,False,AskEngineers,t5_2sebk,280287,public,self,Is it possible to find a good and free paper on how to design a cycloidal gear parametrically in SolidWorks? with good descriptions of all the different parameters? - Thanks.,0,[],1.0,https://www.reddit.com/r/AskEngineers/comments/wez9qg/is_it_possible_to_find_a_good_and_free_paper_on/,all_ads,6,,,,,
14,[],False,hahokily,,[],,text,t2_c61vw,False,False,False,[],False,False,1659501541,self.AskEngineers,https://www.reddit.com/r/AskEngineers/comments/wex2jn/what_are_some_mathphysicsequations_heavier/,{},wex2jn,False,True,False,False,False,True,True,False,,red,[],a2e13d02-57f9-11e4-8c58-12313b0e9678,Career,dark,text,False,False,True,0,0,False,all_ads,/r/AskEngineers/comments/wex2jn/what_are_some_mathphysicsequations_heavier/,False,6,,1659501552,1,"Went to school for aero and currently I'm an entry level Manufacturing/Quality Engineer and I'll be frank. It's not quite what I expected nor really for me. As of now I think I miss and would prefer to do more math/physics/equation crunching on the job.

My question is this more of a experience thing aka do paperwork stuff at lower levels and later on ascend to do more ""decision making""? Or is this just not really an option? Because I've also been asking around and unfortunately it seems like most engineering jobs in general won't have you doing too much math/number crunching on the job just because realistically it'd prolly already be automated through programs and or not be realistic for certain scenarios. Side addendum, friend said I could look into failure analysis jobs but I've yet to do too much research into that

TLDR: Miss math, what do",True,False,False,AskEngineers,t5_2sebk,280276,public,self,What are some math/physics/equations heavier engineering jobs?,0,[],1.0,https://www.reddit.com/r/AskEngineers/comments/wex2jn/what_are_some_mathphysicsequations_heavier/,all_ads,6,,,,,
15,[],False,hahokily,,[],,text,t2_c61vw,False,False,False,[],False,False,1659501426,self.AskEngineers,https://www.reddit.com/r/AskEngineers/comments/wex18x/mathphysicsequations_heavier_jobs/,{},wex18x,False,False,False,False,False,False,True,False,,red,[],a2e13d02-57f9-11e4-8c58-12313b0e9678,Career,dark,text,False,False,True,1,0,False,all_ads,/r/AskEngineers/comments/wex18x/mathphysicsequations_heavier_jobs/,False,6,moderator,1659501436,1,[removed],True,False,False,AskEngineers,t5_2sebk,280276,public,self,Math/physics/equations heavier jobs,0,[],1.0,https://www.reddit.com/r/AskEngineers/comments/wex18x/mathphysicsequations_heavier_jobs/,all_ads,6,,,,,
16,[],False,popolkadot,,[],,text,t2_qskfc,False,False,False,[],False,False,1659501339,self.AskEngineers,https://www.reddit.com/r/AskEngineers/comments/wex0ap/mechanical_engineering_jobs_in_canada/,{},wex0ap,False,True,False,False,False,True,True,False,,red,[],a2e13d02-57f9-11e4-8c58-12313b0e9678,Career,dark,text,False,False,True,0,0,False,all_ads,/r/AskEngineers/comments/wex0ap/mechanical_engineering_jobs_in_canada/,False,6,,1659501350,1,I'm a mechanical engineer in western Canada. I often see posts in this sub related to interesting sounding mech eng jobs (R&amp;D/product development type jobs). I feel like I never see job postings for these types of jobs here in Canada (mainly oil and gas). Does Canada just not have these types of industries?,True,False,False,AskEngineers,t5_2sebk,280276,public,self,Mechanical engineering jobs in Canada?,0,[],1.0,https://www.reddit.com/r/AskEngineers/comments/wex0ap/mechanical_engineering_jobs_in_canada/,all_ads,6,,,,,
17,[],False,AirBendingNopon,,[],,text,t2_6yiz2yp0,False,False,False,[],False,False,1659500881,self.AskEngineers,https://www.reddit.com/r/AskEngineers/comments/wewuxl/considering_taking_a_short_term_contract_role/,{},wewuxl,False,True,False,False,False,True,True,False,,red,[],a2e13d02-57f9-11e4-8c58-12313b0e9678,Career,dark,text,False,False,True,0,0,False,all_ads,/r/AskEngineers/comments/wewuxl/considering_taking_a_short_term_contract_role/,False,6,,1659500891,1,"Hello. I have been applying for roles since graduation and have finally received an offer through a contractor. However, the role itself is very short term (about 3 to 4 months), I'm currently thinking the job could be an opportunity for growth since I haven't had a role other than an internship before but I've had some doubts if I should take the role. 

For one, I am unsure what I could accomplish in a short amount of time. The responsibilities are new to me somewhat so I feel by the time I finally get used to the role and environment, I will already be let go. Second, they want to know in a very short amount of time to accept the role which for some reason is stressing me out since I feel conflicted mentally on whether this would be the best route to take.

A part of me wants to take the short term contract role since I've  been applying for other full time roles to no avail and I could use more experience (as well as see if the engineering field is something I should do long term). While it is oddly stressing me out, I also feel that the discomfort is also showing me that I should take the role to be able to grow and learn as much as I can for the future.

Does anyone have any input on whether or not I should take a contract role or decline it and keep it looking? I feel conflicted and don't have many people to talk this over with. Any advice is appreciated",True,False,False,AskEngineers,t5_2sebk,280275,public,self,Considering Taking a Short Term Contract Role,0,[],1.0,https://www.reddit.com/r/AskEngineers/comments/wewuxl/considering_taking_a_short_term_contract_role/,all_ads,6,,,,,
18,[],False,malaya100,,[],,text,t2_14e8l2,False,False,False,[],False,False,1659500024,self.AskEngineers,https://www.reddit.com/r/AskEngineers/comments/wewkrx/which_career_path_would_be_a_better_choice_rd_or/,{},wewkrx,False,True,False,False,False,True,True,False,,blue,[],b251a614-57f9-11e4-b47b-12313b0e9678,Discussion,dark,text,False,False,True,0,0,False,all_ads,/r/AskEngineers/comments/wewkrx/which_career_path_would_be_a_better_choice_rd_or/,False,6,,1659500034,1,"Hi All,

I am currently working for a medical device company and have the choice between two career paths: R&amp;D or Regulatory affairs. I was wondering which one is more lucrative, stable, vertical growth, just overall a better choice long term",True,False,False,AskEngineers,t5_2sebk,280275,public,self,Which career path would be a better choice R&amp;D or Regulatory Affairs?,0,[],1.0,https://www.reddit.com/r/AskEngineers/comments/wewkrx/which_career_path_would_be_a_better_choice_rd_or/,all_ads,6,,,,,
19,[],False,snugtux,,[],,text,t2_qo5i1c2,False,False,False,[],False,False,1659499792,self.AskEngineers,https://www.reddit.com/r/AskEngineers/comments/wewhzt/how_easy_and_common_is_it_for_engineers_to_do/,{},wewhzt,False,True,False,False,False,True,True,False,,green,[],1612b830-09c2-11ea-a8a8-0ea1f14b089b,Chemical,dark,text,False,False,True,0,0,False,all_ads,/r/AskEngineers/comments/wewhzt/how_easy_and_common_is_it_for_engineers_to_do/,False,6,,1659499802,1,I'm doing chemical (considering switching into mech) and interested in physics for grad school,True,False,False,AskEngineers,t5_2sebk,280275,public,self,How easy (and common) is it for engineers to do graduate studies in physics?,0,[],1.0,https://www.reddit.com/r/AskEngineers/comments/wewhzt/how_easy_and_common_is_it_for_engineers_to_do/,all_ads,6,,,,,
20,[],False,snugtux,,[],,text,t2_qo5i1c2,False,False,False,[],False,False,1659499701,self.AskEngineers,https://www.reddit.com/r/AskEngineers/comments/wewgya/how_easy_and_common_is_it_for_engineers_to_do/,{},wewgya,False,True,False,False,False,True,True,False,,blue,[],90a1d45a-3f64-11e5-8667-0e60d8112001,Mechanical,dark,text,False,False,True,0,0,False,all_ads,/r/AskEngineers/comments/wewgya/how_easy_and_common_is_it_for_engineers_to_do/,False,6,,1659499712,1,I'm doing chemical (considering switching into mech) and interested in physics for grad school,True,False,False,AskEngineers,t5_2sebk,280275,public,self,How easy and common is it for engineers to do graduate studies in physics?,0,[],1.0,https://www.reddit.com/r/AskEngineers/comments/wewgya/how_easy_and_common_is_it_for_engineers_to_do/,all_ads,6,,,,,
21,[],False,snugtux,,[],,text,t2_qo5i1c2,False,False,False,[],False,False,1659499186,self.AskEngineers,https://www.reddit.com/r/AskEngineers/comments/wewan5/engineering_to_physics/,{},wewan5,False,False,False,False,False,False,True,False,,red,[],a2e13d02-57f9-11e4-8c58-12313b0e9678,Career,dark,text,False,False,True,1,0,False,all_ads,/r/AskEngineers/comments/wewan5/engineering_to_physics/,False,6,moderator,1659499196,1,[removed],True,False,False,AskEngineers,t5_2sebk,280275,public,self,Engineering to physics?,0,[],1.0,https://www.reddit.com/r/AskEngineers/comments/wewan5/engineering_to_physics/,all_ads,6,,,,,
