,all_awardings,allow_live_comments,author,author_flair_css_class,author_flair_richtext,author_flair_text,author_flair_type,author_fullname,author_is_blocked,author_patreon_flair,author_premium,awarders,can_mod_post,contest_mode,created_utc,domain,full_link,gildings,id,is_created_from_ads_ui,is_crosspostable,is_meta,is_original_content,is_reddit_media_domain,is_robot_indexable,is_self,is_video,link_flair_background_color,link_flair_css_class,link_flair_richtext,link_flair_template_id,link_flair_text,link_flair_text_color,link_flair_type,locked,media_only,no_follow,num_comments,num_crossposts,over_18,parent_whitelist_status,permalink,pinned,pwls,retrieved_on,score,selftext,send_replies,spoiler,stickied,subreddit,subreddit_id,subreddit_subscribers,subreddit_type,thumbnail,title,total_awards_received,treatment_tags,upvote_ratio,url,whitelist_status,wls,author_flair_background_color,author_flair_template_id,author_flair_text_color,post_hint,preview,removed_by_category
72,[],False,AkaliUWU,,[],,text,t2_2xmhgsfa,False,False,False,[],False,False,1663784268,self.AskEngineers,https://www.reddit.com/r/AskEngineers/comments/xkck4i/is_it_ok_to_be_a_bit_picky_when_looking_for_an/,{},xkck4i,False,True,False,False,False,True,True,False,,blue,[],90a1d45a-3f64-11e5-8667-0e60d8112001,Mechanical,dark,text,False,False,True,0,0,False,all_ads,/r/AskEngineers/comments/xkck4i/is_it_ok_to_be_a_bit_picky_when_looking_for_an/,False,6,1663784278,1,"To preface I am a 3rd Year Mech Engg. looking for internships. I live in Canada, AB where most of the surrounding industry is based around Oil and Gas, something im not too found about, so I wanted to try and look for an intership in anything but Oil and Gas, my question is if this is something that is okay to do or should I just accept whatever I can get into (which is what most of my peers are planning on doing). Any tips or advice would be greatly appreciated.",True,False,False,AskEngineers,t5_2sebk,284247,public,self,Is it ok to be a bit picky when looking for an internship?,0,[],1.0,https://www.reddit.com/r/AskEngineers/comments/xkck4i/is_it_ok_to_be_a_bit_picky_when_looking_for_an/,all_ads,6,,,,,,
73,[],False,Radiant-Specialist58,,[],,text,t2_9jcoknwo,False,False,False,[],False,False,1663784005,self.AskEngineers,https://www.reddit.com/r/AskEngineers/comments/xkcg31/which_is_better_cse_csbs_ece_or_cse_and_its/,{},xkcg31,False,False,False,False,False,False,True,False,,purple,[],6a68317a-c3cd-11e9-bf9c-0e2863fd7a72,Computer,dark,text,False,False,True,1,0,False,all_ads,/r/AskEngineers/comments/xkcg31/which_is_better_cse_csbs_ece_or_cse_and_its/,False,6,1663784015,1,[removed],True,False,False,AskEngineers,t5_2sebk,284247,public,self,"Which is better CSE, CSBS, ECE or CSE and its specializations in India?",0,[],1.0,https://www.reddit.com/r/AskEngineers/comments/xkcg31/which_is_better_cse_csbs_ece_or_cse_and_its/,all_ads,6,,,,,,moderator
74,[],False,Fats_Runyan2020,,[],,text,t2_533p25nr,False,False,False,[],False,False,1663783156,self.AskEngineers,https://www.reddit.com/r/AskEngineers/comments/xkc2a3/what_additional_engineering_degrees_compliments/,{},xkc2a3,False,True,False,False,False,True,True,False,,blue,[],b251a614-57f9-11e4-b47b-12313b0e9678,Discussion,dark,text,False,False,True,0,0,False,all_ads,/r/AskEngineers/comments/xkc2a3/what_additional_engineering_degrees_compliments/,False,6,1663783167,1,"What are some branches of engineering that ""goes with"" or compliments industrial and systems engineering degree?

So I am a 3rd year college student, and starting this upcoming winter semester (if there are any openings) I can enroll in professional level courses for my major, which is currently Industrial and Systems engineering B.S.E. However I have not yet decided on what I wanna do. I do know that I want 1-2 master degrees and 1-2 bachelor degrees from either mechanical, industrial, or electrical engineering.
So a possible choice could be this: Bachelor of mechanical engineering with specialization in manufacturing + bachelor of industrial and systems engineering + masters of industrial and systems engineering 
Or what about electrical engineering with specialization in robotics?
Or match mechanical and electrical engineering, etc...
I am full of different ideas, but by end of this fall semester I need to make a decision on my major.
I am 99.999% certain I want some kind of degree in industrial and systems engineering, either a bachelor's or masters degree or possibly both. But what goes with industrial and systems engineering? Would it make sense to have a double bachelor's degree in industrial engineering and mechanical? Would it be better to not have a bachelor's in industrial, and just have a masters, and get a bachelor's in either mechanical or electrical?

Some background with mechanical and electrical engineering:
With a mechanical engineering degree I can choose if I want a specialization, such as automotive, energy, manufacturing. Which basically just means that when I take my professional elective courses, they are all in the same category. 
Same concept in electrical engineering except choices are like computer engineering, communications, robotics, electronics, power systems etc... I dont remember all of the choices

So some advice would be helpful if anyone has some work experiences with these fields or experienced the same problem as me years ago",True,False,False,AskEngineers,t5_2sebk,284245,public,self,What additional engineering degrees compliments Industrial and Systems engineering?,0,[],1.0,https://www.reddit.com/r/AskEngineers/comments/xkc2a3/what_additional_engineering_degrees_compliments/,all_ads,6,,,,,,
75,[],False,diceblue,,[],,text,t2_we1o2,False,False,False,[],False,False,1663782743,self.AskEngineers,https://www.reddit.com/r/AskEngineers/comments/xkbvyw/dad_with_a_modular_swing_idea/,{},xkbvyw,False,True,False,False,False,True,True,False,,blue,[],b251a614-57f9-11e4-b47b-12313b0e9678,Discussion,dark,text,False,False,False,0,0,False,all_ads,/r/AskEngineers/comments/xkbvyw/dad_with_a_modular_swing_idea/,False,6,1663782754,1,"Hello, I have this idea to build a backyard rope swing for my kids that is modular, that is it is a single rope that will end in metal clip or locking hook and I could swap out a standard swing for a trapeze triangle or any number of attachments. I have surprisingly not found anything like this online at all. Anyone have tips on how to do this? I'm thinking 1/2 braided rope is the way, but not sure on how to set up the clip part",True,False,False,AskEngineers,t5_2sebk,284243,public,self,Dad with a Modular Swing Idea,0,[],1.0,https://www.reddit.com/r/AskEngineers/comments/xkbvyw/dad_with_a_modular_swing_idea/,all_ads,6,,,,,,
76,[],False,Engineeringstudent87,,[],,text,t2_91ryy99k,False,False,False,[],False,False,1663779015,self.AskEngineers,https://www.reddit.com/r/AskEngineers/comments/xka8go/has_anyone_moved_into_private_equityconsulting/,{},xka8go,False,False,False,False,False,False,True,False,,blue,[],b251a614-57f9-11e4-b47b-12313b0e9678,Discussion,dark,text,False,False,True,1,0,False,all_ads,/r/AskEngineers/comments/xka8go/has_anyone_moved_into_private_equityconsulting/,False,6,1663779026,1,[removed],True,False,False,AskEngineers,t5_2sebk,284236,public,self,Has anyone moved into private equity/consulting from engineering?,0,[],1.0,https://www.reddit.com/r/AskEngineers/comments/xka8go/has_anyone_moved_into_private_equityconsulting/,all_ads,6,,,,,,moderator
77,[],False,StraightToVideo,,[],,text,t2_3l4bl,False,False,False,[],False,False,1663778830,self.AskEngineers,https://www.reddit.com/r/AskEngineers/comments/xka5jk/how_could_you_catch_a_cheating_player_via_rf/,{},xka5jk,False,False,False,False,False,False,True,False,,blue,[],b251a614-57f9-11e4-b47b-12313b0e9678,Discussion,dark,text,False,False,True,1,0,False,all_ads,/r/AskEngineers/comments/xka5jk/how_could_you_catch_a_cheating_player_via_rf/,False,6,1663778841,1,[removed],True,False,False,AskEngineers,t5_2sebk,284236,public,self,"How could you catch a cheating player via RF scanning, other tools?",0,[],1.0,https://www.reddit.com/r/AskEngineers/comments/xka5jk/how_could_you_catch_a_cheating_player_via_rf/,all_ads,6,,,,self,"{'enabled': False, 'images': [{'id': 'jqkx_VQPXyuAOIxnMYJNB4EGSmH-UFmTL5RkY7AP9QY', 'resolutions': [{'height': 60, 'url': 'https://external-preview.redd.it/1fOaFK_aI6OanuqyjsSGQjpz3M6ckecfKm509s28Go8.jpg?width=108&amp;crop=smart&amp;auto=webp&amp;s=60e84fbaba3ff1328a18cff5cda968629b81fb05', 'width': 108}, {'height': 121, 'url': 'https://external-preview.redd.it/1fOaFK_aI6OanuqyjsSGQjpz3M6ckecfKm509s28Go8.jpg?width=216&amp;crop=smart&amp;auto=webp&amp;s=d4994a02fc87758ddc6d5517ff7024edace2f416', 'width': 216}, {'height': 179, 'url': 'https://external-preview.redd.it/1fOaFK_aI6OanuqyjsSGQjpz3M6ckecfKm509s28Go8.jpg?width=320&amp;crop=smart&amp;auto=webp&amp;s=3582319ebd03ddd5f48566a95ac182350f299d90', 'width': 320}, {'height': 359, 'url': 'https://external-preview.redd.it/1fOaFK_aI6OanuqyjsSGQjpz3M6ckecfKm509s28Go8.jpg?width=640&amp;crop=smart&amp;auto=webp&amp;s=82c335569481871f2f3807ffd860b88389994e9a', 'width': 640}, {'height': 539, 'url': 'https://external-preview.redd.it/1fOaFK_aI6OanuqyjsSGQjpz3M6ckecfKm509s28Go8.jpg?width=960&amp;crop=smart&amp;auto=webp&amp;s=9cfb3f4c35af6987c59c04dde13b169cedcb5e0e', 'width': 960}, {'height': 607, 'url': 'https://external-preview.redd.it/1fOaFK_aI6OanuqyjsSGQjpz3M6ckecfKm509s28Go8.jpg?width=1080&amp;crop=smart&amp;auto=webp&amp;s=fa285a4980060b2be07432cdb7a94b0378ed4329', 'width': 1080}], 'source': {'height': 787, 'url': 'https://external-preview.redd.it/1fOaFK_aI6OanuqyjsSGQjpz3M6ckecfKm509s28Go8.jpg?auto=webp&amp;s=ea102ec096c8de96477a4ee601eeb94dc671075b', 'width': 1400}, 'variants': {}}]}",moderator
78,[],False,Engineeringstudent87,,[],,text,t2_91ryy99k,False,False,False,[],False,False,1663778754,self.AskEngineers,https://www.reddit.com/r/AskEngineers/comments/xka4c1/engineering_career_progression_uk/,{},xka4c1,False,False,False,False,False,False,True,False,,blue,[],b251a614-57f9-11e4-b47b-12313b0e9678,Discussion,dark,text,False,False,True,1,0,False,all_ads,/r/AskEngineers/comments/xka4c1/engineering_career_progression_uk/,False,6,1663778764,1,[removed],True,False,False,AskEngineers,t5_2sebk,284236,public,self,Engineering career progression UK,0,[],1.0,https://www.reddit.com/r/AskEngineers/comments/xka4c1/engineering_career_progression_uk/,all_ads,6,,,,,,moderator
79,[],False,andrewy99,,[],,text,t2_sozjlu2n,False,False,False,[],False,False,1663775804,self.AskEngineers,https://www.reddit.com/r/AskEngineers/comments/xk8ror/boeing_interview/,{},xk8ror,False,False,False,False,False,False,True,False,,blue,[],b251a614-57f9-11e4-b47b-12313b0e9678,Discussion,dark,text,False,False,True,1,0,False,all_ads,/r/AskEngineers/comments/xk8ror/boeing_interview/,False,6,1663775814,1,[removed],True,False,False,AskEngineers,t5_2sebk,284236,public,self,Boeing Interview,0,[],1.0,https://www.reddit.com/r/AskEngineers/comments/xk8ror/boeing_interview/,all_ads,6,,,,,,moderator
80,[],False,IRekBerries,,[],,text,t2_2hmrykfh,False,False,False,[],False,False,1663775594,self.AskEngineers,https://www.reddit.com/r/AskEngineers/comments/xk8o9y/looking_for_good_resources_on_hydraulics/,{},xk8o9y,False,True,False,False,False,True,True,False,,blue,[],90a1d45a-3f64-11e5-8667-0e60d8112001,Mechanical,dark,text,False,False,True,0,0,False,all_ads,/r/AskEngineers/comments/xk8o9y/looking_for_good_resources_on_hydraulics/,False,6,1663775604,1,"Hi there, I'm new into the engineering industry out of uni and want to start learning about hydraulics. What good books/resources are there to start this?

Thanks",True,False,False,AskEngineers,t5_2sebk,284236,public,self,Looking for good resources on Hydraulics,0,[],1.0,https://www.reddit.com/r/AskEngineers/comments/xk8o9y/looking_for_good_resources_on_hydraulics/,all_ads,6,,,,,,
81,[],False,IRekBerries,,[],,text,t2_2hmrykfh,False,False,False,[],False,False,1663775546,self.AskEngineers,https://www.reddit.com/r/AskEngineers/comments/xk8njn/learning_about_hydraulics/,{},xk8njn,False,False,False,False,False,False,True,False,,blue,[],90a1d45a-3f64-11e5-8667-0e60d8112001,Mechanical,dark,text,False,False,True,1,0,False,all_ads,/r/AskEngineers/comments/xk8njn/learning_about_hydraulics/,False,6,1663775557,1,[removed],True,False,False,AskEngineers,t5_2sebk,284236,public,self,Learning about hydraulics,0,[],1.0,https://www.reddit.com/r/AskEngineers/comments/xk8njn/learning_about_hydraulics/,all_ads,6,,,,,,moderator
82,[],False,kenveer,,[],,text,t2_999xxqhh,False,False,False,[],False,False,1663774759,self.AskEngineers,https://www.reddit.com/r/AskEngineers/comments/xk8b4d/does_ultimate_strength_value_have_any_relation_to/,{},xk8b4d,False,True,False,False,False,True,True,False,,blue,[],b251a614-57f9-11e4-b47b-12313b0e9678,Discussion,dark,text,False,False,False,0,0,False,all_ads,/r/AskEngineers/comments/xk8b4d/does_ultimate_strength_value_have_any_relation_to/,False,6,1663774770,1,"If a homogeneous ductile material were to be in for a simple tensile stress test, it would follow the stress-strain diagram and would have a value for ultimate tensile strength for that specimen.

On the other hand, if a identical specimen were to be tested for cyclic stress test of tensile nature, but the condition is that at no point the force being exerted on to the specimen will exceed its ultimate tensile strength value. Will this material fail due to Fatigue even though the force exerted is within its limit?

p.s. for the sake of argument, let the specimen material be mild steel.",True,False,False,AskEngineers,t5_2sebk,284235,public,self,Does Ultimate Strength value have any relation to fatigue failure?,0,[],1.0,https://www.reddit.com/r/AskEngineers/comments/xk8b4d/does_ultimate_strength_value_have_any_relation_to/,all_ads,6,,,,,,
83,[],False,dolphinbutsex,,[],,text,t2_1gqkamxe,False,False,False,[],False,False,1663771202,self.AskEngineers,https://www.reddit.com/r/AskEngineers/comments/xk6rcf/have_you_given_feedback_as_a_new_grad_on_the_job/,{},xk6rcf,False,False,False,False,False,False,True,False,,blue,[],b251a614-57f9-11e4-b47b-12313b0e9678,Discussion,dark,text,False,False,True,1,0,False,all_ads,/r/AskEngineers/comments/xk6rcf/have_you_given_feedback_as_a_new_grad_on_the_job/,False,6,1663771213,1,[removed],True,False,False,AskEngineers,t5_2sebk,284231,public,self,Have you given feedback as a new grad on the job?,0,[],1.0,https://www.reddit.com/r/AskEngineers/comments/xk6rcf/have_you_given_feedback_as_a_new_grad_on_the_job/,all_ads,6,,,,,,moderator
84,[],False,cons013,,[],,text,t2_i1x0j,False,False,False,[],False,False,1663766231,self.AskEngineers,https://www.reddit.com/r/AskEngineers/comments/xk4oiz/undergraduate_job_offer_but_ive_already_graduated/,{},xk4oiz,False,False,False,False,False,False,True,False,,blue,[],90a1d45a-3f64-11e5-8667-0e60d8112001,Mechanical,dark,text,False,False,True,1,0,False,all_ads,/r/AskEngineers/comments/xk4oiz/undergraduate_job_offer_but_ive_already_graduated/,False,6,1663766242,1,[removed],True,False,False,AskEngineers,t5_2sebk,284223,public,self,'Undergraduate' job offer but I've already graduated?,0,[],1.0,https://www.reddit.com/r/AskEngineers/comments/xk4oiz/undergraduate_job_offer_but_ive_already_graduated/,all_ads,6,,,,,,moderator
85,[],False,SnooMacarons53,,[],,text,t2_7jsy5nxr,False,False,False,[],False,False,1663765698,self.AskEngineers,https://www.reddit.com/r/AskEngineers/comments/xk4guo/how_do_i_ask_for_a_raise/,{},xk4guo,False,False,False,False,False,False,True,False,,blue,[],b251a614-57f9-11e4-b47b-12313b0e9678,Discussion,dark,text,False,False,True,1,0,False,all_ads,/r/AskEngineers/comments/xk4guo/how_do_i_ask_for_a_raise/,False,6,1663765709,1,[removed],True,False,False,AskEngineers,t5_2sebk,284223,public,self,How do I ask for a raise?,0,[],1.0,https://www.reddit.com/r/AskEngineers/comments/xk4guo/how_do_i_ask_for_a_raise/,all_ads,6,,,,,,moderator
86,[],False,Inner-Reference4807,,[],,text,t2_cuml20su,False,False,False,[],False,False,1663761404,self.AskEngineers,https://www.reddit.com/r/AskEngineers/comments/xk2ule/mem_worth/,{},xk2ule,False,False,False,False,False,False,True,False,,blue,[],b251a614-57f9-11e4-b47b-12313b0e9678,Discussion,dark,text,False,False,True,1,0,False,all_ads,/r/AskEngineers/comments/xk2ule/mem_worth/,False,6,1663761414,1,[removed],True,False,False,AskEngineers,t5_2sebk,284222,public,self,MEM worth?,0,[],1.0,https://www.reddit.com/r/AskEngineers/comments/xk2ule/mem_worth/,all_ads,6,,,,,,moderator
87,[],False,Sand-Personal,,[],,text,t2_9fiy2ie0,False,False,False,[],False,False,1663760844,self.AskEngineers,https://www.reddit.com/r/AskEngineers/comments/xk2npr/has_anyone_studied_a_hnc_via_distance_learning/,{},xk2npr,False,True,False,False,False,True,True,False,,blue,[],90a1d45a-3f64-11e5-8667-0e60d8112001,Mechanical,dark,text,False,False,False,0,0,False,all_ads,/r/AskEngineers/comments/xk2npr/has_anyone_studied_a_hnc_via_distance_learning/,False,6,1663760855,1,I have just started a HNC in Mech Engineering at teeside University and I'm wondering if anyone else has completed this or is currently?,True,False,False,AskEngineers,t5_2sebk,284222,public,self,Has anyone studied a HNC via Distance Learning?,0,[],1.0,https://www.reddit.com/r/AskEngineers/comments/xk2npr/has_anyone_studied_a_hnc_via_distance_learning/,all_ads,6,,,,,,
88,[],False,Sand-Personal,,[],,text,t2_9fiy2ie0,False,False,False,[],False,False,1663760711,self.AskEngineers,https://www.reddit.com/r/AskEngineers/comments/xk2m57/distance_learning/,{},xk2m57,False,False,False,False,False,False,True,False,,blue,[],90a1d45a-3f64-11e5-8667-0e60d8112001,Mechanical,dark,text,False,False,True,1,0,False,all_ads,/r/AskEngineers/comments/xk2m57/distance_learning/,False,6,1663760722,1,[removed],True,False,False,AskEngineers,t5_2sebk,284222,public,self,Distance Learning,0,[],1.0,https://www.reddit.com/r/AskEngineers/comments/xk2m57/distance_learning/,all_ads,6,,,,,,moderator
89,[],False,Sea-Reason3002,,[],,text,t2_rrlcgnmn,False,False,False,[],False,False,1663754085,self.AskEngineers,https://www.reddit.com/r/AskEngineers/comments/xk0hr5/do_some_people_regret_taking_the_engineering_route/,{},xk0hr5,False,False,False,False,False,False,True,False,,blue,[],b251a614-57f9-11e4-b47b-12313b0e9678,Discussion,dark,text,False,False,True,0,0,False,all_ads,/r/AskEngineers/comments/xk0hr5/do_some_people_regret_taking_the_engineering_route/,False,6,1663754095,1,[removed],True,False,False,AskEngineers,t5_2sebk,284217,public,self,do some people regret taking the engineering route?,0,[],1.0,https://www.reddit.com/r/AskEngineers/comments/xk0hr5/do_some_people_regret_taking_the_engineering_route/,all_ads,6,,,,,,reddit
90,[],False,Altruistic-Carpet-43,,[],,text,t2_agssz3ne,False,False,False,[],False,False,1663751984,self.AskEngineers,https://www.reddit.com/r/AskEngineers/comments/xjzwdf/which_electrical_engineering_fields_have_the_most/,{},xjzwdf,False,True,False,False,False,True,True,False,,purple,[],3a6acd0c-fd28-11e6-ab41-0edc7e2b18fe,Electrical,dark,text,False,False,True,0,0,False,all_ads,/r/AskEngineers/comments/xjzwdf/which_electrical_engineering_fields_have_the_most/,False,6,1663751994,1,,True,False,False,AskEngineers,t5_2sebk,284213,public,self,Which Electrical Engineering fields have the most variety and opportunities to learn new things?,0,[],1.0,https://www.reddit.com/r/AskEngineers/comments/xjzwdf/which_electrical_engineering_fields_have_the_most/,all_ads,6,,,,,,
91,[],False,love2jump,,[],,text,t2_rswavi,False,False,False,[],False,False,1663750418,self.AskEngineers,https://www.reddit.com/r/AskEngineers/comments/xjzgoe/bend_sensors_that_return_where_the_bend_is_does/,{},xjzgoe,False,True,False,False,False,True,True,False,,blue,[],b251a614-57f9-11e4-b47b-12313b0e9678,Discussion,dark,text,False,False,True,0,0,False,all_ads,/r/AskEngineers/comments/xjzgoe/bend_sensors_that_return_where_the_bend_is_does/,False,6,1663750428,1,"&amp;#x200B;

tldr: looking for a bend sensor that gives position of bend rather than amount of bend over entire area.

Hi Engineers,

I'm looking to measure the positions of where bends happen in a 15-meter deep hole. The angle is not important --- even a binary ""bent / not bent"" would suffice --- but in 1 to 2cm intervals.

Context: as part of climate research on the inland ice in Greenland, my team has been using this method to measure how much ice is melting off the surface in the areas where we have weather stations. We currently drill 15-meter deep holes (5cm diameter) and put heavy-duty garden hoses filled with antifreeze installed vertically directly into the ice. The bottom of these hoses contain pressure sensors. As the ice starts to melt at the top, the hoses start to coil around the surface, meaning there is a shorter vertical column, and the pressure decreases at the bottom of the hose. This is suprisingly accurate! We get about 2cm resolution this way.

drawing and photo here (hose is filled with blue antifreeze) [https://imgur.com/a/XLtbbGH](https://imgur.com/a/XLtbbGH)

The issue is that it's very heavy, very messy, and very difficult to repair.

My colleague and I (both EE) have done some experiments with TDR, inclinometer arrays, custom flex-PCBs with conductive ink, and even making geophones at the station to locate a transducer at the bottom of the hole. The main takeaway is that the simplest solutions usually work best. Putting a bend sensor in the hole and returning where it bends requires zero analysis and real-time results at low weight and power consumption.

Any thoughts or discussion points much appreciated!

Many thanks.",True,False,False,AskEngineers,t5_2sebk,284213,public,self,Bend sensors that return * where * the bend is --- does this exist?,0,[],1.0,https://www.reddit.com/r/AskEngineers/comments/xjzgoe/bend_sensors_that_return_where_the_bend_is_does/,all_ads,6,,,,self,"{'enabled': False, 'images': [{'id': 'Sn_ZD7zTTvyM_41Up6YohBcw0SQh9olnTc-q5Rhvj-I', 'resolutions': [{'height': 85, 'url': 'https://external-preview.redd.it/8FrCAiAWHqrdT1xIHw1AOua-ocYO_lChrfOiOP_p_NY.jpg?width=108&amp;crop=smart&amp;auto=webp&amp;s=d38fb8f7239b71f440fdb7f487ee190d4b8e0f37', 'width': 108}, {'height': 170, 'url': 'https://external-preview.redd.it/8FrCAiAWHqrdT1xIHw1AOua-ocYO_lChrfOiOP_p_NY.jpg?width=216&amp;crop=smart&amp;auto=webp&amp;s=8449ed657bc138f699897c166168da6472d641fd', 'width': 216}, {'height': 252, 'url': 'https://external-preview.redd.it/8FrCAiAWHqrdT1xIHw1AOua-ocYO_lChrfOiOP_p_NY.jpg?width=320&amp;crop=smart&amp;auto=webp&amp;s=c74d3dbf0a8d735758e4ab81027c849c47f16100', 'width': 320}, {'height': 504, 'url': 'https://external-preview.redd.it/8FrCAiAWHqrdT1xIHw1AOua-ocYO_lChrfOiOP_p_NY.jpg?width=640&amp;crop=smart&amp;auto=webp&amp;s=cf783aa46e33db086e1d844b0e74fa1e63305b7b', 'width': 640}, {'height': 756, 'url': 'https://external-preview.redd.it/8FrCAiAWHqrdT1xIHw1AOua-ocYO_lChrfOiOP_p_NY.jpg?width=960&amp;crop=smart&amp;auto=webp&amp;s=26acf03fbe6c6e859edaf52ce9d7ba23c9b2f289', 'width': 960}, {'height': 851, 'url': 'https://external-preview.redd.it/8FrCAiAWHqrdT1xIHw1AOua-ocYO_lChrfOiOP_p_NY.jpg?width=1080&amp;crop=smart&amp;auto=webp&amp;s=bd494a720fb07f363fd8f3e639523c9aa20a187b', 'width': 1080}], 'source': {'height': 1800, 'url': 'https://external-preview.redd.it/8FrCAiAWHqrdT1xIHw1AOua-ocYO_lChrfOiOP_p_NY.jpg?auto=webp&amp;s=183389970525ea4310e85626d307094a7a4d93b8', 'width': 2284}, 'variants': {}}]}",
92,[],False,In_Classics,,[],,text,t2_5d7f2cmr,False,False,False,[],False,False,1663745358,self.AskEngineers,https://www.reddit.com/r/AskEngineers/comments/xjy3fy/little_mechanical_challenge/,{},xjy3fy,False,False,False,False,False,False,True,False,,blue,[],90a1d45a-3f64-11e5-8667-0e60d8112001,Mechanical,dark,text,False,False,True,1,0,False,all_ads,/r/AskEngineers/comments/xjy3fy/little_mechanical_challenge/,False,6,1663745368,1,[removed],True,False,False,AskEngineers,t5_2sebk,284209,public,self,Little Mechanical Challenge,0,[],1.0,https://www.reddit.com/r/AskEngineers/comments/xjy3fy/little_mechanical_challenge/,all_ads,6,,,,self,"{'enabled': False, 'images': [{'id': 'KyO9UWImDASouXtX9i7h_qpi7bfOHW9XgfTDSTfWcqQ', 'resolutions': [{'height': 56, 'url': 'https://external-preview.redd.it/O6OMwCzefPLXxXpKjFxFBzVfoJM8jstIZSvBd_BlkmI.jpg?width=108&amp;crop=smart&amp;auto=webp&amp;s=eb2122eb0d045622c99f95271cea8bea16583787', 'width': 108}, {'height': 113, 'url': 'https://external-preview.redd.it/O6OMwCzefPLXxXpKjFxFBzVfoJM8jstIZSvBd_BlkmI.jpg?width=216&amp;crop=smart&amp;auto=webp&amp;s=5299485e17f5938398bc77e771dfe92c2356f3ae', 'width': 216}, {'height': 168, 'url': 'https://external-preview.redd.it/O6OMwCzefPLXxXpKjFxFBzVfoJM8jstIZSvBd_BlkmI.jpg?width=320&amp;crop=smart&amp;auto=webp&amp;s=2895b0bdb309b42065f8a2cd8f7b731f84cac49d', 'width': 320}], 'source': {'height': 315, 'url': 'https://external-preview.redd.it/O6OMwCzefPLXxXpKjFxFBzVfoJM8jstIZSvBd_BlkmI.jpg?auto=webp&amp;s=218e10b8359e8e077096b3ebbe8499c92e763df5', 'width': 600}, 'variants': {}}]}",moderator
93,[],False,JupiterNotebook,,[],,text,t2_9bzt9h5f,False,False,False,[],False,False,1663743034,self.AskEngineers,https://www.reddit.com/r/AskEngineers/comments/xjxfs3/need_some_job_advice/,{},xjxfs3,False,False,False,False,False,False,True,False,,blue,[],b251a614-57f9-11e4-b47b-12313b0e9678,Discussion,dark,text,False,False,True,1,0,False,all_ads,/r/AskEngineers/comments/xjxfs3/need_some_job_advice/,False,6,1663743045,1,[removed],True,False,False,AskEngineers,t5_2sebk,284208,public,self,Need some Job Advice,0,[],1.0,https://www.reddit.com/r/AskEngineers/comments/xjxfs3/need_some_job_advice/,all_ads,6,,,,,,moderator
