,all_awardings,allow_live_comments,author,author_flair_css_class,author_flair_richtext,author_flair_text,author_flair_type,author_fullname,author_is_blocked,author_patreon_flair,author_premium,awarders,can_mod_post,contest_mode,created_utc,domain,full_link,gildings,id,is_created_from_ads_ui,is_crosspostable,is_meta,is_original_content,is_reddit_media_domain,is_robot_indexable,is_self,is_video,link_flair_background_color,link_flair_css_class,link_flair_richtext,link_flair_template_id,link_flair_text,link_flair_text_color,link_flair_type,locked,media_only,no_follow,num_comments,num_crossposts,over_18,parent_whitelist_status,permalink,pinned,pwls,removed_by_category,retrieved_on,score,selftext,send_replies,spoiler,stickied,subreddit,subreddit_id,subreddit_subscribers,subreddit_type,thumbnail,title,total_awards_received,treatment_tags,upvote_ratio,url,whitelist_status,wls,post_hint,preview,author_flair_background_color,author_flair_template_id,author_flair_text_color
40,[],False,AmbitiousENGR,,[],,text,t2_6b1ybqq0,False,False,False,[],False,False,1659474830,self.AskEngineers,https://www.reddit.com/r/AskEngineers/comments/wenbjk/does_tube_id_affect_pump_speed/,{},wenbjk,False,True,False,False,False,True,True,False,,blue,[],90a1d45a-3f64-11e5-8667-0e60d8112001,Mechanical,dark,text,False,False,True,0,0,False,all_ads,/r/AskEngineers/comments/wenbjk/does_tube_id_affect_pump_speed/,False,6,,1659474841,1,"I’m designing a pump system for a vacuum chamber I have. The vacuum chamber port I want to connect the pump to is a DN35 ConFlat flange 2.75” OD. The pump is a turbo molecular pump with a DN63 ConFlat flange 4.5” OD. I plan on using some sort of adapter/metal tubing to connect the two ports. I’ve read online that the connection port should be at least the same diameter as the inlet port of my turbo pump. 
Will this decrease in pipe size affect my pump speed? If so, what can I do to solve this problem? I have 4 DN35 ports and I thought about connect two of them in parallel to increase the total surface 
My pump is 685L/s. My chamber is roughly 17L. I know the pump is a bit overkill but it is supposed to get my down to ultra high vacuum. I also have a rotary vane pump as my coarse vacuum pump",True,False,False,AskEngineers,t5_2sebk,280252,public,self,Does tube ID affect pump speed?,0,[],1.0,https://www.reddit.com/r/AskEngineers/comments/wenbjk/does_tube_id_affect_pump_speed/,all_ads,6,,,,,
41,[],False,Boomflag13,,[],,text,t2_24r3pgqn,False,False,False,[],False,False,1659473918,self.AskEngineers,https://www.reddit.com/r/AskEngineers/comments/wemxj5/quitting_engineering_job_after_first_week/,{},wemxj5,False,True,False,False,False,True,True,False,,red,[],a2e13d02-57f9-11e4-8c58-12313b0e9678,Career,dark,text,False,False,True,0,0,False,all_ads,/r/AskEngineers/comments/wemxj5/quitting_engineering_job_after_first_week/,False,6,,1659473929,1,"Just for context, I received a job interview and job offer pretty much same day of which I accepted. They asked me to start next week. The pay is $28 per hour for a Civil EIT role.

Not even 2 days later after accepting, I received another interview and they are offering $38 per hour for a Process EIT role. They have yet to make a starting date offer, but they contacted several of my references and one of them asked if I had a chance. They told him I have a very high chance of being hired and they will contact me next week.

The thing is I will be starting an engineering job next week. If they contact me next week offering me a job, what the heck should I do? The contract they had me sign says I will be 3 months probationary. 

Do I give a 2 week notice the first week I am there? Or should I just quit? Does anyone have any experience like this? Is this considered unprofessional? I am honestly so nervous, I have no idea what to do.",True,False,False,AskEngineers,t5_2sebk,280253,public,self,Quitting engineering job after first week?,0,[],1.0,https://www.reddit.com/r/AskEngineers/comments/wemxj5/quitting_engineering_job_after_first_week/,all_ads,6,,,,,
42,[],False,olivelamp4,,[],,text,t2_3dbcswh5,False,False,False,[],False,False,1659472004,self.AskEngineers,https://www.reddit.com/r/AskEngineers/comments/wem5ek/do_i_need_a_gpu_for_my_laptop_as_a_first_year/,{},wem5ek,False,False,False,False,False,False,True,False,,blue,[],90a1d45a-3f64-11e5-8667-0e60d8112001,Mechanical,dark,text,False,False,True,1,0,False,all_ads,/r/AskEngineers/comments/wem5ek/do_i_need_a_gpu_for_my_laptop_as_a_first_year/,False,6,moderator,1659472014,1,[removed],True,False,False,AskEngineers,t5_2sebk,280253,public,self,Do I need a GPU for my laptop as a first year mech eng student?,0,[],1.0,https://www.reddit.com/r/AskEngineers/comments/wem5ek/do_i_need_a_gpu_for_my_laptop_as_a_first_year/,all_ads,6,,,,,
43,[],False,aerlenbach,,[],P.E. Environmental Engineering,text,t2_6euie,False,False,False,[],False,False,1659470923,self.AskEngineers,https://www.reddit.com/r/AskEngineers/comments/welp9k/florida_must_digitally_sign_and_seal_plans/,{},welp9k,False,True,False,False,False,True,True,False,,blue,[],b251a614-57f9-11e4-b47b-12313b0e9678,Discussion,dark,text,False,False,True,0,0,False,all_ads,/r/AskEngineers/comments/welp9k/florida_must_digitally_sign_and_seal_plans/,False,6,,1659470934,1,"Trying to digitally sign and seal plans in Florida. I've searched other posts about it who've recommended some companies, but none of the engineers were from Florida and the FBPE specifies things in a particular way. Namely: 

&gt;A digital signature must be unique to the Professional Engineer using it, **obtained from a third-party certification authority, and capable of verification. The certification authority will vet the PE and provide a password-protected digital signature file**. (FBPE does not approve or provide a list of authorities.)

  (emphasis added) [Source](https://fbpe.org/legal/signing-and-sealing-engineering-documents/)

It goes on to call out Adobe specifically...

&gt;You may not use the digital signature option provided in Adobe Acrobat, since it is self-authenticated and does not use a third party. However, you may use Adobe Acrobat in conjunction with the digital signature provided from a proper certification authority. 

So I looked into Revu Bluebeam, which I already have access too, but [it appears that](https://support.bluebeam.com/online-help/revu2018/Content/RevuHelp/Menus/Tools/Signature/Certifying-a-Document.htm) their method is ""self-authenticated"" same as Adobe Acrobat. I think I need to use a 3rd-party company in conjunction with Adobe or Bluebeam. I found [this list accepted by the City of Miami](https://www.miamigov.com/Permits-Construction/All-things-ePlan/Resource-Page-for-Digital-Signatures#section-5). 

Wondering what Engineers in Florida do specifically when they want to digitally sign and seal their plans. 

Thanks!",True,False,False,AskEngineers,t5_2sebk,280254,public,self,"Florida - Must digitally sign and seal plans properly, need software recommendations",0,[],1.0,https://www.reddit.com/r/AskEngineers/comments/welp9k/florida_must_digitally_sign_and_seal_plans/,all_ads,6,self,"{'enabled': False, 'images': [{'id': 'IzSQ56lQugQu4zZsMBpFPUcVuEwFFiK8dmVzwsa6ZpM', 'resolutions': [{'height': 72, 'url': 'https://external-preview.redd.it/QoNURUXZaJFKtcZ_YYZ2CFOuYwsQshileQjJMi4ulIU.jpg?width=108&amp;crop=smart&amp;auto=webp&amp;s=97d38a05907ba7575943d7362ec1453f2f6f2da9', 'width': 108}, {'height': 144, 'url': 'https://external-preview.redd.it/QoNURUXZaJFKtcZ_YYZ2CFOuYwsQshileQjJMi4ulIU.jpg?width=216&amp;crop=smart&amp;auto=webp&amp;s=95c9298aa5b2b5de2b030054297157cbf11674c6', 'width': 216}, {'height': 213, 'url': 'https://external-preview.redd.it/QoNURUXZaJFKtcZ_YYZ2CFOuYwsQshileQjJMi4ulIU.jpg?width=320&amp;crop=smart&amp;auto=webp&amp;s=3fcef6352f076c1be68d3f6f97f7ba6759d24295', 'width': 320}, {'height': 426, 'url': 'https://external-preview.redd.it/QoNURUXZaJFKtcZ_YYZ2CFOuYwsQshileQjJMi4ulIU.jpg?width=640&amp;crop=smart&amp;auto=webp&amp;s=bb74ab9c270d26faf0fcbb626dad30ca8ad45a6a', 'width': 640}, {'height': 640, 'url': 'https://external-preview.redd.it/QoNURUXZaJFKtcZ_YYZ2CFOuYwsQshileQjJMi4ulIU.jpg?width=960&amp;crop=smart&amp;auto=webp&amp;s=acf61e0530a038264b38e961662199a42d7fb2ee', 'width': 960}, {'height': 720, 'url': 'https://external-preview.redd.it/QoNURUXZaJFKtcZ_YYZ2CFOuYwsQshileQjJMi4ulIU.jpg?width=1080&amp;crop=smart&amp;auto=webp&amp;s=f44bc15063d00f7004e742db345b824a4157cefd', 'width': 1080}], 'source': {'height': 1000, 'url': 'https://external-preview.redd.it/QoNURUXZaJFKtcZ_YYZ2CFOuYwsQshileQjJMi4ulIU.jpg?auto=webp&amp;s=34d70877091ac4733f520430742cae5df898366c', 'width': 1500}, 'variants': {}}]}",#d3d6da,2238776c-d04a-11e6-8ad9-0eff92f5bd12,dark
44,[],False,LewisAy,,[],,text,t2_ekyd34w,False,False,False,[],False,False,1659469552,self.AskEngineers,https://www.reddit.com/r/AskEngineers/comments/wel4bp/does_anyone_know_the_source_of_fastener/,{},wel4bp,False,True,False,False,False,True,True,False,,blue,[],90a1d45a-3f64-11e5-8667-0e60d8112001,Mechanical,dark,text,False,False,True,0,0,False,all_ads,/r/AskEngineers/comments/wel4bp/does_anyone_know_the_source_of_fastener/,False,6,,1659469563,1,"I see these numbers quoted all the time in relation to accuracy of achieving target preload in a fastener with various tightening methods:

Feel +/- 35%
Torque wrench +/- 25%
Turn of the nut +/- 15%
etc…

Does anyone know the original source of where this came from? I’d love to know more details of the research they did.",True,False,False,AskEngineers,t5_2sebk,280252,public,self,Does anyone know the source of fastener tightening accuracy numbers??,0,[],1.0,https://www.reddit.com/r/AskEngineers/comments/wel4bp/does_anyone_know_the_source_of_fastener/,all_ads,6,,,,,
45,[],False,Electrical_Rest99,,[],,text,t2_qozrog4z,False,False,False,[],False,False,1659467497,self.AskEngineers,https://www.reddit.com/r/AskEngineers/comments/wek9dm/what_is_a_bushing/,{},wek9dm,False,False,False,False,False,False,True,False,,blue,[],90a1d45a-3f64-11e5-8667-0e60d8112001,Mechanical,dark,text,False,False,True,1,0,False,all_ads,/r/AskEngineers/comments/wek9dm/what_is_a_bushing/,False,6,moderator,1659467507,1,[removed],True,False,False,AskEngineers,t5_2sebk,280248,public,self,What is a bushing?,0,[],1.0,https://www.reddit.com/r/AskEngineers/comments/wek9dm/what_is_a_bushing/,all_ads,6,,,,,
46,[],False,Jabberwocky918,,[],,text,t2_hszpi,False,False,False,[],False,False,1659466053,self.AskEngineers,https://www.reddit.com/r/AskEngineers/comments/wejoch/hydraulic_cylinder_to_replace_threaded_jackscrew/,{},wejoch,False,True,False,False,False,True,True,False,,blue,[],90a1d45a-3f64-11e5-8667-0e60d8112001,Mechanical,dark,text,False,False,True,0,0,False,all_ads,/r/AskEngineers/comments/wejoch/hydraulic_cylinder_to_replace_threaded_jackscrew/,False,6,,1659466064,1,"I'm trying to figure out what size hydraulic cylinder I would need to replace a threaded jackscrew.

The jackscrew sits vertically. Half of it is 1¾"" - 4 TPI right hand, and the other half is 1½"" - 4 TPI left hand.

When using a nutrunner that generates 82 ft-lbs, how much force is the jackscrew applying?

When using a hydraulic system at 1,500 psi, what size cylinder will generate about the same amount of force as the jackscrew?

This is for a piece of equipment on a steel tube mill.

Thanks!",True,False,False,AskEngineers,t5_2sebk,280246,public,self,Hydraulic cylinder to replace threaded jackscrew?,0,[],1.0,https://www.reddit.com/r/AskEngineers/comments/wejoch/hydraulic_cylinder_to_replace_threaded_jackscrew/,all_ads,6,,,,,
47,[],False,MasterpieceHairy1859,,[],,text,t2_7ohzap67,False,False,False,[],False,False,1659465501,self.AskEngineers,https://www.reddit.com/r/AskEngineers/comments/wejgav/need_help_with_project_for_school/,{},wejgav,False,False,False,False,False,False,True,False,,orange,[],939137fa-3f64-11e5-b90e-0ef63926eacd,Civil,dark,text,False,False,True,1,0,False,all_ads,/r/AskEngineers/comments/wejgav/need_help_with_project_for_school/,False,6,moderator,1659465512,1,[removed],True,False,False,AskEngineers,t5_2sebk,280244,public,self,Need help with project. For school🥹,0,[],1.0,https://www.reddit.com/r/AskEngineers/comments/wejgav/need_help_with_project_for_school/,all_ads,6,,,,,
48,[],False,grubtron,,[],,text,t2_9c78r,False,False,False,[],False,False,1659465481,self.AskEngineers,https://www.reddit.com/r/AskEngineers/comments/wejg01/us_made_rodless_actuator/,{},wejg01,False,True,False,False,False,True,True,False,,blue,[],90a1d45a-3f64-11e5-8667-0e60d8112001,Mechanical,dark,text,False,False,True,0,0,False,all_ads,/r/AskEngineers/comments/wejg01/us_made_rodless_actuator/,False,6,,1659465492,1,"Hey all,

I'm in a bit of a bind. Does the reddit engineering HIVEMIND know of a US based RODLESS linear actuator manufacturer that ships in under 6 weeks? Only real hard limits are:

* needs to be able to move 1200 lbs when mounted vertically
* needs to be able to be configured to have a stroke around 24""

I ask because the two suppliers I've dealt with (tolomatic and Norgren/Bimba) recently have greatly increased their lead times to 8-16 weeks.

&amp;#x200B;

Thanks for the help.",True,False,False,AskEngineers,t5_2sebk,280244,public,self,US made rodless actuator?,0,[],1.0,https://www.reddit.com/r/AskEngineers/comments/wejg01/us_made_rodless_actuator/,all_ads,6,,,,,
49,[],False,andrewdm63,,[],,text,t2_edn93a87,False,False,False,[],False,False,1659464937,self.AskEngineers,https://www.reddit.com/r/AskEngineers/comments/wej7w9/flow_through_a_2inch_sch80_steel_pipe_and_rubber/,{},wej7w9,False,True,False,False,False,True,True,False,,blue,[],90a1d45a-3f64-11e5-8667-0e60d8112001,Mechanical,dark,text,False,False,False,0,0,False,all_ads,/r/AskEngineers/comments/wej7w9/flow_through_a_2inch_sch80_steel_pipe_and_rubber/,False,6,,1659464947,1,hi everyone. need some professional opinions here. i have a 4inch pipe that reduces down to 2 inch for about 3 feet and then through a 10ft long 2 inch rubber hose. will i have problems getting 150gpm through the 2inch sections of this pipe? thanks,True,False,False,AskEngineers,t5_2sebk,280243,public,self,flow through a 2inch SCH80 steel pipe and rubber hose,0,[],1.0,https://www.reddit.com/r/AskEngineers/comments/wej7w9/flow_through_a_2inch_sch80_steel_pipe_and_rubber/,all_ads,6,,,,,
50,[],False,dxjaguar,,[],,text,t2_5isf9si3,False,False,False,[],False,False,1659463609,self.AskEngineers,https://www.reddit.com/r/AskEngineers/comments/weinyu/career_advice_risks_of_not_taking_an_engineering/,{},weinyu,False,True,False,False,False,True,True,False,,red,[],a2e13d02-57f9-11e4-8c58-12313b0e9678,Career,dark,text,False,False,True,0,0,False,all_ads,/r/AskEngineers/comments/weinyu/career_advice_risks_of_not_taking_an_engineering/,False,6,,1659463619,1,"Here I am again looking for your advice and expertise. This may be a little long so please bear with me. TL;DR at the end.

I am in my late twenties and in my senior year in mechanical engineering. I got a degree in business management before studying engineering and have been working full time as a director in a non-engineering company while I complete my MechE degree. The pay is good at my current job and the benefits are good as well. I thoroughly enjoy my job but engineering is my passion and I want to ultimately work as an engineer. I am married and have a child. My wife is also a full time student and will be finishing a graduate degree in the summer of 2024 (no stipend and currently not working). I will graduate in the spring of 2023. I have been looking at different MechE jobs and the pay would be about the same as my current job. However, at my current job I get free health insurance and they are extremely flexible with schedules (work whenever, as long as you finish your work) and my job is 100% remote. I am thinking I should stay in this job until my wife graduates in 2024 so I can help her while she gets through school. Think things like dropping off and picking up my daughter at school, helping around the house, etc. Additionally, any potential pay increase I may get from an engineering job will likely go straight to commuting costs, before and after school care and health insurance as I would have to commute, someone will need to watch our child and most companies have an employee-paid insurance premium. So a pay increase wouldn't necessarily put me in a better financial position, it could even make it worse. 

My question is, how damaging would it be to my career if I wait about a year or so after graduation to get an engineering job? Would it be harder to get a job if I do this? Do hiring managers look down on this or skip these resumes? I wouldn't necessarily have a gap as I will still be employed. I have 10 years of non-engineering experience (have worked the whole time while going to college). What do you honestly recommend? I plan on spending that year building a strong portfolio (Solidworks, 3D printing, Comsol projects, etc.) and getting a CAPM certificate from the Project Management Institute. Eventually I won't mind the switch and the potential pay cut/additional expenses because engineering is my passion and I need to start somewhere but I want to do that once my wife is done with school and has started her own career as well so that can offset any changes. I would really appreciate any advice you have. 

Thank you all!

**TL;DR.** I work in a field not related to engineering. My job is very flexible, 100% remote and I get free health insurance. I'm married and have a child. I am graduating in Spring 2023 and I am thinking I won't change jobs (switch fields to engineering) until after my wife finishes her graduate degree in the summer of 2024. This is because I want to help her get through school and my current job pays about the same as a MechE job so any pay increase I get, if at all, will go to commuting costs, daycare expenses and health insurance. How damaging would it be to my career if I wait about a year or so after graduation to get an engineering job? Would it be harder to get a job if I do this? Do hiring managers look down on this or skip these resumes?",True,False,False,AskEngineers,t5_2sebk,280241,public,self,Career Advice: Risks of not taking an engineering job right after graduating (Non-traditional student),0,[],1.0,https://www.reddit.com/r/AskEngineers/comments/weinyu/career_advice_risks_of_not_taking_an_engineering/,all_ads,6,,,,,
51,[],False,Majestic-Ladder5498,,[],,text,t2_8g4l9rqm,False,False,False,[],False,False,1659461576,self.AskEngineers,https://www.reddit.com/r/AskEngineers/comments/weht1q/would_the_the_las_vegas_convention_center_loop/,{},weht1q,False,True,False,False,False,True,True,False,,blue,[],b251a614-57f9-11e4-b47b-12313b0e9678,Discussion,dark,text,False,False,True,0,0,False,all_ads,/r/AskEngineers/comments/weht1q/would_the_the_las_vegas_convention_center_loop/,False,6,,1659461587,1,"I am not trolling promise, just curius and this seams like the right thread to ask to get a non-biast answer, but I might be a lost redditor and I appologise for that.

So a youtubber called a tesla a chemical inferno on wheels and my first reaction to it was bff... do not exaggerate, but it got me wondering how bad it can be.

So I looked up that Li batteries can burn at ~2000 C and if a catestrofic runnaway effect would happen the pack could go up very quickly... the article I read said it could happen in seconds, but I imagine they meant for small batteries and a car battery would take longer.

The scary part is that most advice on a Li battey fire is to simply let it burn itself out when ever possible, because Li batteries essentialy create their own O2 when burning among other fun stuff.

Anyway then I remembered the Las Vegas loop and how tiny it is, the tesla barely fits and has a ~3.6m diameter or 12ft and in that small space the heat can't dissapate to anything but the concrete or what am I missing?

Anyway then I though well concrete is basically a rock surly it can hande extreme heat? I googled it and no... it starts to degrade at 100C (scary in its own way) and if the temp raises fast enough it basically explodes into bits. I think its called spalling.

On top steal melts at ~1400C. But I imagine that the concrete would have given away and the tunnel would be already collapsed before anything serious can happen with the rebarb.

I do not know, but to my laymans understanding if a tesla should have a catestrofic runaway fire in the loop then yes the tunnel would collapse almost inevitably? What am I missing? I must be missing something big. I am guessing the battery will burn itself out faster then I think and wont be as bad as I imagine. I am thinking it can last ~30-60min, but the following article said it can take up to 24h if not taken care off and I cant see any firefighter going into the loop so maybe I am actually lowballing it...

https://wildfiretoday.com/2018/05/18/electric-vehicle-fires-can-take-3000-gallons-and-24-hours-to-extinguish/",True,False,False,AskEngineers,t5_2sebk,280235,public,self,Would the The Las Vegas Convention Center loop collapse if even 1 tesla would burn down in a runaway effect?,0,[],1.0,https://www.reddit.com/r/AskEngineers/comments/weht1q/would_the_the_las_vegas_convention_center_loop/,all_ads,6,self,"{'enabled': False, 'images': [{'id': 'zcdx0TWR1fivY7WGmi7qPfjwGHElCkBAwfN6LKl3p48', 'resolutions': [{'height': 43, 'url': 'https://external-preview.redd.it/PAG5Q-pRrHqtEPx1Z-cMtDpYPr7KJsLo88PBvI0Dy7o.jpg?width=108&amp;crop=smart&amp;auto=webp&amp;s=7123ced9372d498487788413232c292e9d5e5b08', 'width': 108}, {'height': 86, 'url': 'https://external-preview.redd.it/PAG5Q-pRrHqtEPx1Z-cMtDpYPr7KJsLo88PBvI0Dy7o.jpg?width=216&amp;crop=smart&amp;auto=webp&amp;s=7d7fab055b7abd9c309fef0217fd1474cf13c798', 'width': 216}, {'height': 128, 'url': 'https://external-preview.redd.it/PAG5Q-pRrHqtEPx1Z-cMtDpYPr7KJsLo88PBvI0Dy7o.jpg?width=320&amp;crop=smart&amp;auto=webp&amp;s=933dd9d310f57c94b8dacd69f95ffe765c935fd5', 'width': 320}, {'height': 256, 'url': 'https://external-preview.redd.it/PAG5Q-pRrHqtEPx1Z-cMtDpYPr7KJsLo88PBvI0Dy7o.jpg?width=640&amp;crop=smart&amp;auto=webp&amp;s=c31460368741f44611f25040246e5815894a45b1', 'width': 640}, {'height': 384, 'url': 'https://external-preview.redd.it/PAG5Q-pRrHqtEPx1Z-cMtDpYPr7KJsLo88PBvI0Dy7o.jpg?width=960&amp;crop=smart&amp;auto=webp&amp;s=e7ff01273bb19c85edb2469ba312370c023b336c', 'width': 960}], 'source': {'height': 399, 'url': 'https://external-preview.redd.it/PAG5Q-pRrHqtEPx1Z-cMtDpYPr7KJsLo88PBvI0Dy7o.jpg?auto=webp&amp;s=c49676549bd644a6aebcd04212d1ca24b64ee751', 'width': 995}, 'variants': {}}]}",,,
52,[],False,mightydart,,[],,text,t2_8wbg4d9e,False,False,False,[],False,False,1659460715,self.AskEngineers,https://www.reddit.com/r/AskEngineers/comments/wehg66/openvsp/,{},wehg66,False,False,False,False,False,False,True,False,,blue,[],b251a614-57f9-11e4-b47b-12313b0e9678,Discussion,dark,text,False,False,True,1,0,False,all_ads,/r/AskEngineers/comments/wehg66/openvsp/,False,6,moderator,1659460725,1,[removed],True,False,False,AskEngineers,t5_2sebk,280235,public,self,OPENVSP,0,[],1.0,https://www.reddit.com/r/AskEngineers/comments/wehg66/openvsp/,all_ads,6,,,,,
53,[],False,vaguelystem,,[],,text,t2_9p255zoy,False,False,False,[],False,False,1659459685,self.AskEngineers,https://www.reddit.com/r/AskEngineers/comments/weh0lm/what_are_the_downsides_of_consumer_battery/,{},weh0lm,False,True,False,False,False,True,True,False,,green,[],1612b830-09c2-11ea-a8a8-0ea1f14b089b,Chemical,dark,text,False,False,True,0,0,False,all_ads,/r/AskEngineers/comments/weh0lm/what_are_the_downsides_of_consumer_battery/,False,6,,1659459696,1,,True,False,False,AskEngineers,t5_2sebk,280234,public,self,"What are the downsides of consumer battery chemistries with lower voltage sag? (E.G., zinc-air)",0,[],1.0,https://www.reddit.com/r/AskEngineers/comments/weh0lm/what_are_the_downsides_of_consumer_battery/,all_ads,6,,,,,
54,[],False,elmoptimistic,,[],,text,t2_4ff39qhj,False,False,False,[],False,False,1659458398,self.AskEngineers,https://www.reddit.com/r/AskEngineers/comments/weggz7/how_to_deal_with_my_boss_assigning_me_my/,{},weggz7,False,True,False,False,False,True,True,False,,red,[],a2e13d02-57f9-11e4-8c58-12313b0e9678,Career,dark,text,False,False,True,0,0,False,all_ads,/r/AskEngineers/comments/weggz7/how_to_deal_with_my_boss_assigning_me_my/,False,6,,1659458408,1,"In order to get them to quit, my boss assigned me my colleague's duties, in addition to my other duties. Actually, we have very similar duties but on different projects. I don't know how to deal with it.",True,False,False,AskEngineers,t5_2sebk,280231,public,self,How to deal with my boss assigning me my coworker's duties?,0,[],1.0,https://www.reddit.com/r/AskEngineers/comments/weggz7/how_to_deal_with_my_boss_assigning_me_my/,all_ads,6,,,,,
55,[],False,Impossiblygoodlookin,,[],,text,t2_7c4hvoey,False,False,False,[],False,False,1659458161,self.AskEngineers,https://www.reddit.com/r/AskEngineers/comments/wegddx/recommendations_for_free_aerospace_engineering/,{},wegddx,False,True,False,False,False,True,True,False,,blue,[],90a1d45a-3f64-11e5-8667-0e60d8112001,Mechanical,dark,text,False,False,True,0,0,False,all_ads,/r/AskEngineers/comments/wegddx/recommendations_for_free_aerospace_engineering/,False,6,,1659458172,1,"I am ME working as Reliability Engineer. I’m also a hanggliding pilot. 

I want to understand different wings performance better and expand my knowledge. Does anyone have good recommendations for free courses that focuses on aircraft performance and design? I took CFD elective 10 years ago.",True,False,False,AskEngineers,t5_2sebk,280230,public,self,Recommendations for free aerospace engineering courses related to free flight?,0,[],1.0,https://www.reddit.com/r/AskEngineers/comments/wegddx/recommendations_for_free_aerospace_engineering/,all_ads,6,,,,,
