,all_awardings,allow_live_comments,author,author_flair_css_class,author_flair_richtext,author_flair_text,author_flair_type,author_fullname,author_is_blocked,author_patreon_flair,author_premium,awarders,can_mod_post,contest_mode,created_utc,domain,full_link,gildings,id,is_created_from_ads_ui,is_crosspostable,is_meta,is_original_content,is_reddit_media_domain,is_robot_indexable,is_self,is_video,link_flair_background_color,link_flair_css_class,link_flair_richtext,link_flair_template_id,link_flair_text,link_flair_text_color,link_flair_type,locked,media_only,no_follow,num_comments,num_crossposts,over_18,parent_whitelist_status,permalink,pinned,pwls,removed_by_category,retrieved_on,score,selftext,send_replies,spoiler,stickied,subreddit,subreddit_id,subreddit_subscribers,subreddit_type,thumbnail,title,total_awards_received,treatment_tags,upvote_ratio,url,whitelist_status,wls,author_flair_background_color,author_flair_text_color,collections,post_hint,preview,author_flair_template_id
25,[],False,UnnamedGoatMan,,[],,text,t2_71onxfek,False,False,False,[],False,False,1660572479,self.AskEngineers,https://www.reddit.com/r/AskEngineers/comments/wp0lps/what_backupsredundancies_in_electrical_grids_have/,{},wp0lps,False,True,False,False,False,True,True,False,,blue,[],b251a614-57f9-11e4-b47b-12313b0e9678,Discussion,dark,text,False,False,True,0,0,False,all_ads,/r/AskEngineers/comments/wp0lps/what_backupsredundancies_in_electrical_grids_have/,False,6,,1660572490,1,"If there was a large CME/Carrington event (From my understanding) that hit earth it would likely shut off and permanently damage just about any electronic device or system. This could have the potential to completely disable electrical grids as well as isolated electrical systems.

I'd assume if this were to happen, the entire human population would be severely threatened, as supply chains would collapse and be unable to transport essential food, medical supplies and resources to recover. Presumably even pumped and filtered tap water may become unavailable, and obviously any form of transport aside from a bicycle would be unusable. 

Am I understanding the potential effects of such an event correctly?

What sort of protections are in place should this happen? How vulnerable is modern life to such an event, aside from the obvious loss of internet and communications.

I'm very curious to hear your thoughts, particularly those working in power systems and grid scale power distribution.",True,False,False,AskEngineers,t5_2sebk,281451,public,self,What backups/redundancies in electrical grids have been created in the event of a global CME/Carrington event situation?,0,[],1.0,https://www.reddit.com/r/AskEngineers/comments/wp0lps/what_backupsredundancies_in_electrical_grids_have/,all_ads,6,,,,,,
26,[],False,AutoModerator,,[],,text,t2_6l4z3,False,False,True,[],False,True,1660572311,self.AskEngineers,https://www.reddit.com/r/AskEngineers/comments/wp0jec/career_monday_15_aug_2022_have_a_question_about/,{},wp0jec,False,True,False,False,False,True,True,False,,blue,[],b251a614-57f9-11e4-b47b-12313b0e9678,Discussion,dark,text,False,False,True,0,0,False,all_ads,/r/AskEngineers/comments/wp0jec/career_monday_15_aug_2022_have_a_question_about/,False,6,,1660572321,1,"As a reminder, /r/AskEngineers normal restrictions for career related posts are severely relaxed for this thread, so feel free to ask about intra-office politics, salaries, or just about anything else related to your job!",False,False,True,AskEngineers,t5_2sebk,281451,public,self,"Career Monday (15 Aug 2022): Have a question about your job, office, or pay? Post it here!",0,[],1.0,https://www.reddit.com/r/AskEngineers/comments/wp0jec/career_monday_15_aug_2022_have_a_question_about/,all_ads,6,,,"[{'author_id': 't2_a6432', 'author_name': 'NineCrimes', 'collection_id': '2effbd15-0c41-486e-b18e-d89b3062cd8a', 'created_at_utc': 1650636548.404, 'description': '', 'display_layout': None, 'last_update_utc': 1659967217.065, 'link_ids': ['t3_ubkloq', 't3_ugp3rs', 't3_ulqp0l', 't3_uqvf3n', 't3_uvzndq', 't3_v0zopv', 't3_v62zn1', 't3_vbbo6j', 't3_vgkyz5', 't3_vluymr', 't3_vr6wby', 't3_vwhvcv', 't3_w1yrwi', 't3_w7odec', 't3_wdgwgl', 't3_wj9kyh'], 'permalink': 'https://www.reddit.com/r/AskEngineers/collection/2effbd15-0c41-486e-b18e-d89b3062cd8a', 'subreddit_id': 't5_2sebk', 'title': 'Monday Career Megathreads'}]",,,
27,[],False,Stunning_Ear5321,,[],,text,t2_5rclfcv7,False,False,False,[],False,False,1660571023,self.AskEngineers,https://www.reddit.com/r/AskEngineers/comments/wp01fm/graduate_with_a_22_or_resit_my_exam_for_a_third/,{},wp01fm,False,False,False,False,False,False,True,False,,blue,[],90a1d45a-3f64-11e5-8667-0e60d8112001,Mechanical,dark,text,False,False,True,1,0,False,all_ads,/r/AskEngineers/comments/wp01fm/graduate_with_a_22_or_resit_my_exam_for_a_third/,False,6,moderator,1660571034,1,[removed],True,False,False,AskEngineers,t5_2sebk,281453,public,self,Graduate with a 2:2 or resit my exam for a third time?,0,[],1.0,https://www.reddit.com/r/AskEngineers/comments/wp01fm/graduate_with_a_22_or_resit_my_exam_for_a_third/,all_ads,6,,,,,,
28,[],False,Aggressive-Deer7432,,[],,text,t2_gdosir4b,False,False,False,[],False,False,1660570831,self.AskEngineers,https://www.reddit.com/r/AskEngineers/comments/wozywu/graduate_with_a_22_or_resit_my_exam_for_the_third/,{},wozywu,False,False,False,False,False,False,True,False,,blue,[],90a1d45a-3f64-11e5-8667-0e60d8112001,Mechanical,dark,text,False,False,True,1,0,False,all_ads,/r/AskEngineers/comments/wozywu/graduate_with_a_22_or_resit_my_exam_for_the_third/,False,6,moderator,1660570842,1,[removed],True,False,False,AskEngineers,t5_2sebk,281453,public,self,Graduate with a 2:2 or resit my exam for the third time?,0,[],1.0,https://www.reddit.com/r/AskEngineers/comments/wozywu/graduate_with_a_22_or_resit_my_exam_for_the_third/,all_ads,6,,,,,,
29,[],False,Michaltoobkreslil2,,[],,text,t2_80oj3sve,False,False,False,[],False,False,1660570653,self.AskEngineers,https://www.reddit.com/r/AskEngineers/comments/wozwj4/steam_engine_generate_electricity/,{},wozwj4,False,True,False,False,False,True,True,False,,blue,[],90a1d45a-3f64-11e5-8667-0e60d8112001,Mechanical,dark,text,False,False,True,0,0,False,all_ads,/r/AskEngineers/comments/wozwj4/steam_engine_generate_electricity/,False,6,,1660570663,1,"Hi, i would like to know if this would somehow work. I imagine that like this: in the middle there would be a fire and around it copper tube in spiral which would heat up and make steam and on the end of the tube release the steam into turbine. Well i dont really know what type of “turbine”, but i liked the idea of using the thing inside of the turbo - [turbine](https://www.turbotechnika.cz/nahradni-dily/dmychadlove-kolo-kkk-200-00267-200/?gclid=Cj0KCQjw3eeXBhD7ARIsAHjssr9UzQSU0WTYH8pXlQLYAflLYs5FIXhk8wlFuO4yXLiEPW-JV4QWQg8aAnsKEALw_wcB)
This would be attached to a rod and then with belt/gears into a probably alternator and into battery. Well is it somehow realistic to make like 1kWh?",True,False,False,AskEngineers,t5_2sebk,281453,public,self,Steam engine - generate electricity,0,[],1.0,https://www.reddit.com/r/AskEngineers/comments/wozwj4/steam_engine_generate_electricity/,all_ads,6,,,,self,"{'enabled': False, 'images': [{'id': 'G9irmqLgEg_a9JALxZbGcw0BGt0qcII4VAARSM61-Qo', 'resolutions': [{'height': 81, 'url': 'https://external-preview.redd.it/4XzH_OBsjctBUsjjR-1TvO4zow8pb4XoVQi8oD-uzzE.jpg?width=108&amp;crop=smart&amp;auto=webp&amp;s=90634e7b6567a71392eb70eea07fa53820c7b814', 'width': 108}, {'height': 162, 'url': 'https://external-preview.redd.it/4XzH_OBsjctBUsjjR-1TvO4zow8pb4XoVQi8oD-uzzE.jpg?width=216&amp;crop=smart&amp;auto=webp&amp;s=0e41eecdb5f6513841bac1f1943429f6049db87f', 'width': 216}, {'height': 240, 'url': 'https://external-preview.redd.it/4XzH_OBsjctBUsjjR-1TvO4zow8pb4XoVQi8oD-uzzE.jpg?width=320&amp;crop=smart&amp;auto=webp&amp;s=a4a8220a1c42edcb78dd25080ce1baf6a7bcad92', 'width': 320}, {'height': 480, 'url': 'https://external-preview.redd.it/4XzH_OBsjctBUsjjR-1TvO4zow8pb4XoVQi8oD-uzzE.jpg?width=640&amp;crop=smart&amp;auto=webp&amp;s=dd6a851b3534f59de35a9838612ed4b32d554a49', 'width': 640}, {'height': 720, 'url': 'https://external-preview.redd.it/4XzH_OBsjctBUsjjR-1TvO4zow8pb4XoVQi8oD-uzzE.jpg?width=960&amp;crop=smart&amp;auto=webp&amp;s=33375c2f50ee299517d6f7ed62c97f4763067179', 'width': 960}], 'source': {'height': 768, 'url': 'https://external-preview.redd.it/4XzH_OBsjctBUsjjR-1TvO4zow8pb4XoVQi8oD-uzzE.jpg?auto=webp&amp;s=806f87ae7c57ff670ff991944bf1434bb4ab4a3a', 'width': 1024}, 'variants': {}}]}",
30,[],False,Michaltoobkreslil2,,[],,text,t2_80oj3sve,False,False,False,[],False,False,1660570623,self.AskEngineers,https://www.reddit.com/r/AskEngineers/comments/wozw45/steam_generator/,{},wozw45,False,False,False,False,False,False,True,False,,blue,[],90a1d45a-3f64-11e5-8667-0e60d8112001,Mechanical,dark,text,False,False,True,1,0,False,all_ads,/r/AskEngineers/comments/wozw45/steam_generator/,False,6,moderator,1660570633,1,[removed],True,False,False,AskEngineers,t5_2sebk,281453,public,self,Steam generator,0,[],1.0,https://www.reddit.com/r/AskEngineers/comments/wozw45/steam_generator/,all_ads,6,,,,self,"{'enabled': False, 'images': [{'id': 'G9irmqLgEg_a9JALxZbGcw0BGt0qcII4VAARSM61-Qo', 'resolutions': [{'height': 81, 'url': 'https://external-preview.redd.it/4XzH_OBsjctBUsjjR-1TvO4zow8pb4XoVQi8oD-uzzE.jpg?width=108&amp;crop=smart&amp;auto=webp&amp;s=90634e7b6567a71392eb70eea07fa53820c7b814', 'width': 108}, {'height': 162, 'url': 'https://external-preview.redd.it/4XzH_OBsjctBUsjjR-1TvO4zow8pb4XoVQi8oD-uzzE.jpg?width=216&amp;crop=smart&amp;auto=webp&amp;s=0e41eecdb5f6513841bac1f1943429f6049db87f', 'width': 216}, {'height': 240, 'url': 'https://external-preview.redd.it/4XzH_OBsjctBUsjjR-1TvO4zow8pb4XoVQi8oD-uzzE.jpg?width=320&amp;crop=smart&amp;auto=webp&amp;s=a4a8220a1c42edcb78dd25080ce1baf6a7bcad92', 'width': 320}, {'height': 480, 'url': 'https://external-preview.redd.it/4XzH_OBsjctBUsjjR-1TvO4zow8pb4XoVQi8oD-uzzE.jpg?width=640&amp;crop=smart&amp;auto=webp&amp;s=dd6a851b3534f59de35a9838612ed4b32d554a49', 'width': 640}, {'height': 720, 'url': 'https://external-preview.redd.it/4XzH_OBsjctBUsjjR-1TvO4zow8pb4XoVQi8oD-uzzE.jpg?width=960&amp;crop=smart&amp;auto=webp&amp;s=33375c2f50ee299517d6f7ed62c97f4763067179', 'width': 960}], 'source': {'height': 768, 'url': 'https://external-preview.redd.it/4XzH_OBsjctBUsjjR-1TvO4zow8pb4XoVQi8oD-uzzE.jpg?auto=webp&amp;s=806f87ae7c57ff670ff991944bf1434bb4ab4a3a', 'width': 1024}, 'variants': {}}]}",
31,[],False,Michaltoobkreslil2,,[],,text,t2_80oj3sve,False,False,False,[],False,False,1660570600,self.AskEngineers,https://www.reddit.com/r/AskEngineers/comments/wozvu0/steam_generator/,{},wozvu0,False,False,False,False,False,False,True,False,,blue,[],90a1d45a-3f64-11e5-8667-0e60d8112001,Mechanical,dark,text,False,False,True,1,0,False,all_ads,/r/AskEngineers/comments/wozvu0/steam_generator/,False,6,moderator,1660570610,1,[removed],True,False,False,AskEngineers,t5_2sebk,281453,public,self,Steam generator,0,[],1.0,https://www.reddit.com/r/AskEngineers/comments/wozvu0/steam_generator/,all_ads,6,,,,self,"{'enabled': False, 'images': [{'id': 'G9irmqLgEg_a9JALxZbGcw0BGt0qcII4VAARSM61-Qo', 'resolutions': [{'height': 81, 'url': 'https://external-preview.redd.it/4XzH_OBsjctBUsjjR-1TvO4zow8pb4XoVQi8oD-uzzE.jpg?width=108&amp;crop=smart&amp;auto=webp&amp;s=90634e7b6567a71392eb70eea07fa53820c7b814', 'width': 108}, {'height': 162, 'url': 'https://external-preview.redd.it/4XzH_OBsjctBUsjjR-1TvO4zow8pb4XoVQi8oD-uzzE.jpg?width=216&amp;crop=smart&amp;auto=webp&amp;s=0e41eecdb5f6513841bac1f1943429f6049db87f', 'width': 216}, {'height': 240, 'url': 'https://external-preview.redd.it/4XzH_OBsjctBUsjjR-1TvO4zow8pb4XoVQi8oD-uzzE.jpg?width=320&amp;crop=smart&amp;auto=webp&amp;s=a4a8220a1c42edcb78dd25080ce1baf6a7bcad92', 'width': 320}, {'height': 480, 'url': 'https://external-preview.redd.it/4XzH_OBsjctBUsjjR-1TvO4zow8pb4XoVQi8oD-uzzE.jpg?width=640&amp;crop=smart&amp;auto=webp&amp;s=dd6a851b3534f59de35a9838612ed4b32d554a49', 'width': 640}, {'height': 720, 'url': 'https://external-preview.redd.it/4XzH_OBsjctBUsjjR-1TvO4zow8pb4XoVQi8oD-uzzE.jpg?width=960&amp;crop=smart&amp;auto=webp&amp;s=33375c2f50ee299517d6f7ed62c97f4763067179', 'width': 960}], 'source': {'height': 768, 'url': 'https://external-preview.redd.it/4XzH_OBsjctBUsjjR-1TvO4zow8pb4XoVQi8oD-uzzE.jpg?auto=webp&amp;s=806f87ae7c57ff670ff991944bf1434bb4ab4a3a', 'width': 1024}, 'variants': {}}]}",
32,[],False,Michaltoobkreslil2,,[],,text,t2_80oj3sve,False,False,False,[],False,False,1660570552,self.AskEngineers,https://www.reddit.com/r/AskEngineers/comments/wozv78/steam_generator/,{},wozv78,False,False,False,False,False,False,True,False,,blue,[],90a1d45a-3f64-11e5-8667-0e60d8112001,Mechanical,dark,text,False,False,True,1,0,False,all_ads,/r/AskEngineers/comments/wozv78/steam_generator/,False,6,moderator,1660570563,1,[removed],True,False,False,AskEngineers,t5_2sebk,281453,public,self,Steam generator,0,[],1.0,https://www.reddit.com/r/AskEngineers/comments/wozv78/steam_generator/,all_ads,6,,,,self,"{'enabled': False, 'images': [{'id': 'G9irmqLgEg_a9JALxZbGcw0BGt0qcII4VAARSM61-Qo', 'resolutions': [{'height': 81, 'url': 'https://external-preview.redd.it/4XzH_OBsjctBUsjjR-1TvO4zow8pb4XoVQi8oD-uzzE.jpg?width=108&amp;crop=smart&amp;auto=webp&amp;s=90634e7b6567a71392eb70eea07fa53820c7b814', 'width': 108}, {'height': 162, 'url': 'https://external-preview.redd.it/4XzH_OBsjctBUsjjR-1TvO4zow8pb4XoVQi8oD-uzzE.jpg?width=216&amp;crop=smart&amp;auto=webp&amp;s=0e41eecdb5f6513841bac1f1943429f6049db87f', 'width': 216}, {'height': 240, 'url': 'https://external-preview.redd.it/4XzH_OBsjctBUsjjR-1TvO4zow8pb4XoVQi8oD-uzzE.jpg?width=320&amp;crop=smart&amp;auto=webp&amp;s=a4a8220a1c42edcb78dd25080ce1baf6a7bcad92', 'width': 320}, {'height': 480, 'url': 'https://external-preview.redd.it/4XzH_OBsjctBUsjjR-1TvO4zow8pb4XoVQi8oD-uzzE.jpg?width=640&amp;crop=smart&amp;auto=webp&amp;s=dd6a851b3534f59de35a9838612ed4b32d554a49', 'width': 640}, {'height': 720, 'url': 'https://external-preview.redd.it/4XzH_OBsjctBUsjjR-1TvO4zow8pb4XoVQi8oD-uzzE.jpg?width=960&amp;crop=smart&amp;auto=webp&amp;s=33375c2f50ee299517d6f7ed62c97f4763067179', 'width': 960}], 'source': {'height': 768, 'url': 'https://external-preview.redd.it/4XzH_OBsjctBUsjjR-1TvO4zow8pb4XoVQi8oD-uzzE.jpg?auto=webp&amp;s=806f87ae7c57ff670ff991944bf1434bb4ab4a3a', 'width': 1024}, 'variants': {}}]}",
33,[],False,treboy123,,[],,text,t2_20rbq5am,False,False,False,[],False,False,1660569330,self.AskEngineers,https://www.reddit.com/r/AskEngineers/comments/wozf4q/what_if_gas_stations_started_replacing/,{},wozf4q,False,True,False,False,False,True,True,False,,blue,[],90a1d45a-3f64-11e5-8667-0e60d8112001,Mechanical,dark,text,False,False,True,0,0,False,all_ads,/r/AskEngineers/comments/wozf4q/what_if_gas_stations_started_replacing/,False,6,,1660569341,1,"From my understanding, gas cars can run (roughly as well?) on fossil-gas as they can on bio-gas, and diesel cars can run (roughly as well?) on fossil-diesel as they can on bio-diesel.  Would it make sense for a gas station, in an attempt to be environmentally sustainable, to keep selling gas and diesel, but to only sell bio-gas and bio-diesel (i.e., replace the fossil-gas pumps with bio-gas and replace fossil-diesel pumps with bio-diesel)?",True,False,False,AskEngineers,t5_2sebk,281451,public,self,What if gas stations started replacing fossil-derived gas and diesel with biomass-derived gas and diesel?,0,[],1.0,https://www.reddit.com/r/AskEngineers/comments/wozf4q/what_if_gas_stations_started_replacing/,all_ads,6,,,,,,
34,[],False,Toadally_Rad98,,[],,text,t2_297bg9tk,False,False,False,[],False,False,1660568676,self.AskEngineers,https://www.reddit.com/r/AskEngineers/comments/woz6jy/how_deeply_do_i_need_to_understand_standards_of/,{},woz6jy,False,True,False,False,False,True,True,False,,blue,[],b251a614-57f9-11e4-b47b-12313b0e9678,Discussion,dark,text,False,False,True,0,0,False,all_ads,/r/AskEngineers/comments/woz6jy/how_deeply_do_i_need_to_understand_standards_of/,False,6,,1660568687,1,"I just started my first job at a new company, currently I am being trained and have been given lots of standards of practice and other documents to read and acknowledge that I understand. Like hundreds. Some of which have modules and tests which I just get through with the find function or general logic  on some of the easy questions.

Initially I was just scanning through them and in some cases just opening the doc and acknowledging I read it to get through it with my logic being that I will have to go back through this anyway in the future what’s the point in delaying training by reading a 40 page document I’ll internalize none of until I actually have a reason to use it. 

I’ve had mixed reactions to this and haven’t had the nerve to ask coworkers or my boss for obvious reasons but like I wanted to come and ask on here as anonymously as possible if I’m making a mistake and if I should slow down and go back through the documents I blew through. Most of the documents I have left to review aren’t technically due for another 3 months or so, so I could technically.

I just don’t want to immediately start off poorly at my brand new place of employment. Any and all advice would be appreciated, I’ve been really worried I might be messing up for a while now. Thank you!",True,False,False,AskEngineers,t5_2sebk,281451,public,self,How deeply do I need to understand Standards of Practice from my training?,0,[],1.0,https://www.reddit.com/r/AskEngineers/comments/woz6jy/how_deeply_do_i_need_to_understand_standards_of/,all_ads,6,,,,,,
35,[],False,SMtheEIT,,[],Mechanical,text,t2_n872px98,False,False,False,[],False,False,1660564174,self.AskEngineers,https://www.reddit.com/r/AskEngineers/comments/woxlii/ideas_to_increase_probability_of_getting_first_me/,{},woxlii,False,True,False,False,False,True,True,False,,blue,[],90a1d45a-3f64-11e5-8667-0e60d8112001,Mechanical,dark,text,False,False,True,0,0,False,all_ads,/r/AskEngineers/comments/woxlii/ideas_to_increase_probability_of_getting_first_me/,False,6,,1660564185,1,"I am an older graduate (42) who went back to school just before Covid and graduated this spring. I passed the Thermo and Fluid Systems PE exam less than 3wks after graduating so that's out of the way. My medium term goal (4yrs) is become a PE but I need 4 yrs of experience. Due to my wife's job I cannot commute or have a fixed schedule - we have 2 young kids and I'm supposed to be the stay at home person when necessary. So I want to figure out what I should be doing to increase the chances I land a remote position under a ME PE so I can get my license in 4 years (I'm in FL.) Give me your best ideas for things to accomplish while I job hunt to put on my resume and/or talk about in interviews. I can't do everything at once, so I need to whittle it down to one or two things at a time. (In the meantime I'm starting my Phd in the fall, part time.) I had no internships/coops and my previous background is in residential remodeling (basically self-employed for the last 20 years.) Should I:

Learn Creo (A friend who owns a firm said they use it, I've seen many larger companies use it or list it in job searches, and most people hate it) or some other CAD/CAE (we used SW in school)?

Become fluent in Fluent?

Learn a specific coding language / get certified in one / improve coding / prove my current level of proficiency somehow?

Create a small engineering project of some sort (Specific ideas? Rough ideas?)

Other ideas here...

Throw out any thoughts you have, the more the better. I want to pick one or two things to focus on while I undertake a job search - there aren't a lot of positions like this. Having really good grades doesn't seem to be enough (I earned a 4.0 in ME.)",True,False,False,AskEngineers,t5_2sebk,281447,public,self,Ideas to increase probability of getting first ME job (under a ME PE) that is remote as an older graduate?,0,[],1.0,https://www.reddit.com/r/AskEngineers/comments/woxlii/ideas_to_increase_probability_of_getting_first_me/,all_ads,6,#d3d6da,dark,,,,2238776c-d04a-11e6-8ad9-0eff92f5bd12
36,[],False,WhichAd7833,,[],,text,t2_a9dv2tpa,False,False,False,[],False,False,1660561830,self.AskEngineers,https://www.reddit.com/r/AskEngineers/comments/wowvco/admission/,{},wowvco,False,False,False,False,False,False,True,False,,blue,[],b251a614-57f9-11e4-b47b-12313b0e9678,Discussion,dark,text,False,False,True,1,0,False,all_ads,/r/AskEngineers/comments/wowvco/admission/,False,6,moderator,1660561840,1,[removed],True,False,False,AskEngineers,t5_2sebk,281445,public,self,Admission,0,[],1.0,https://www.reddit.com/r/AskEngineers/comments/wowvco/admission/,all_ads,6,,,,,,
37,[],False,AlarmingAffect0,,[],,text,t2_6ao4xmb7,False,False,False,[],False,False,1660561404,self.AskEngineers,https://www.reddit.com/r/AskEngineers/comments/wowquw/whats_the_state_of_theoretical_research_on/,{},wowquw,False,True,False,False,False,True,True,False,,blue,[],90a1d45a-3f64-11e5-8667-0e60d8112001,Mechanical,dark,text,False,False,True,0,0,False,all_ads,/r/AskEngineers/comments/wowquw/whats_the_state_of_theoretical_research_on/,False,6,,1660561415,1,"Marjorie Taylor Greene's new idiotic half-true comment on Solar and Wind not working at night had me wondering about ""solar power at night"", and I remember reading something about generation in sattellites followed by transmitting the energy via microwaves to receiving power stations on the groud. There's a lot that's intriguing about that idea, though I can't imagine it's more cost-effective than what we're doing now.

[Also how come we don't have aerospace, industrial, materials, etc. flairs?]",True,False,False,AskEngineers,t5_2sebk,281441,public,self,What's the state of theoretical research on gathering solar power via sattellite?,0,[],1.0,https://www.reddit.com/r/AskEngineers/comments/wowquw/whats_the_state_of_theoretical_research_on/,all_ads,6,,,,,,
38,[],False,Neither_Storage7619,,[],,text,t2_7hk8i0sw,False,False,False,[],False,False,1660560420,self.AskEngineers,https://www.reddit.com/r/AskEngineers/comments/wowg6r/anyone_notice_that_bridges_are_generally/,{},wowg6r,False,True,False,False,False,True,True,False,,blue,[],b251a614-57f9-11e4-b47b-12313b0e9678,Discussion,dark,text,False,False,True,0,0,False,all_ads,/r/AskEngineers/comments/wowg6r/anyone_notice_that_bridges_are_generally/,False,6,,1660560430,1,Is it an economical thing or a structural thing? What are your thoughts.,True,False,False,AskEngineers,t5_2sebk,281436,public,self,"Anyone notice that bridges are generally constructed using precast panels running parallels to the flow of traffic, where as boat ramps are perpendicular to traffic flow. Why are these instances of precast panels orientated differently between bridges and boat ramps?",0,[],1.0,https://www.reddit.com/r/AskEngineers/comments/wowg6r/anyone_notice_that_bridges_are_generally/,all_ads,6,,,,,,
39,[],False,BandicootTemporary67,,[],,text,t2_fi1ciqjf,False,False,False,[],False,False,1660559790,self.AskEngineers,https://www.reddit.com/r/AskEngineers/comments/wow9si/iet_ceng_competency/,{},wow9si,False,False,False,False,False,False,True,False,,blue,[],90a1d45a-3f64-11e5-8667-0e60d8112001,Mechanical,dark,text,False,False,True,1,0,False,all_ads,/r/AskEngineers/comments/wow9si/iet_ceng_competency/,False,6,moderator,1660559800,1,[removed],True,False,False,AskEngineers,t5_2sebk,281438,public,self,IET CENG COMPETENCY,0,[],1.0,https://www.reddit.com/r/AskEngineers/comments/wow9si/iet_ceng_competency/,all_ads,6,,,,,,
40,[],False,Giffnt,,[],,text,t2_5s97ooiv,False,False,False,[],False,False,1660557218,self.AskEngineers,https://www.reddit.com/r/AskEngineers/comments/wovjxc/what_level_of_engineering_understanding_would_be/,{},wovjxc,False,True,False,False,False,True,True,False,,blue,[],b251a614-57f9-11e4-b47b-12313b0e9678,Discussion,dark,text,False,False,True,0,0,False,all_ads,/r/AskEngineers/comments/wovjxc/what_level_of_engineering_understanding_would_be/,False,6,,1660557229,1,"Hi all, I’m a product design student looking to upskill in the more technical side of the subject. I understand how to prepare models for FEA but at this stage would not be entirely confident locating forces on the model that had been provided by an engineer. What areas of engineering should I look to understand to help me locate predetermined forces on a design? Any advice or reference material appreciated.",True,False,False,AskEngineers,t5_2sebk,281433,public,self,What level of engineering understanding would be sufficient for working with engineers on FEA for product design?,0,[],1.0,https://www.reddit.com/r/AskEngineers/comments/wovjxc/what_level_of_engineering_understanding_would_be/,all_ads,6,,,,,,
41,[],False,muhammad_the_zephyr,,[],,text,t2_5pjm0ekq,False,False,False,[],False,False,1660550961,self.AskEngineers,https://www.reddit.com/r/AskEngineers/comments/wotwxi/respiratory_hazards_related_to_printing/,{},wotwxi,False,True,False,False,False,True,True,False,,blue,[],b251a614-57f9-11e4-b47b-12313b0e9678,Discussion,dark,text,False,False,True,0,0,False,all_ads,/r/AskEngineers/comments/wotwxi/respiratory_hazards_related_to_printing/,False,6,,1660550971,1,What are fumes or respiratory hazards related to printing generally and rotogravure specifically? What safeguards should be placed on these hazards?,True,False,False,AskEngineers,t5_2sebk,281429,public,self,Respiratory hazards related to printing &amp; precautions,0,[],1.0,https://www.reddit.com/r/AskEngineers/comments/wotwxi/respiratory_hazards_related_to_printing/,all_ads,6,,,,,,
