,all_awardings,allow_live_comments,author,author_flair_css_class,author_flair_richtext,author_flair_text,author_flair_type,author_fullname,author_is_blocked,author_patreon_flair,author_premium,awarders,can_mod_post,contest_mode,created_utc,domain,full_link,gildings,id,is_created_from_ads_ui,is_crosspostable,is_meta,is_original_content,is_reddit_media_domain,is_robot_indexable,is_self,is_video,link_flair_background_color,link_flair_css_class,link_flair_richtext,link_flair_template_id,link_flair_text,link_flair_text_color,link_flair_type,locked,media_only,no_follow,num_comments,num_crossposts,over_18,parent_whitelist_status,permalink,pinned,pwls,removed_by_category,retrieved_on,score,selftext,send_replies,spoiler,stickied,subreddit,subreddit_id,subreddit_subscribers,subreddit_type,thumbnail,title,total_awards_received,treatment_tags,upvote_ratio,url,whitelist_status,wls,author_flair_background_color,author_flair_text_color,collections,post_hint,preview,author_flair_template_id
0,[],False,pochiga,,[],,text,t2_a2phwj1u,False,False,False,[],False,False,1660606567,self.AskEngineers,https://www.reddit.com/r/AskEngineers/comments/wpejkd/is_selfreplicating_robotics_possible_to_make_in/,{},wpejkd,False,False,False,False,False,False,True,False,,blue,[],90a1d45a-3f64-11e5-8667-0e60d8112001,Mechanical,dark,text,False,False,True,1,0,False,all_ads,/r/AskEngineers/comments/wpejkd/is_selfreplicating_robotics_possible_to_make_in/,False,6,moderator,1660606578,1,[removed],True,False,False,AskEngineers,t5_2sebk,281490,public,self,Is self-replicating robotics possible to make in real life ?,0,[],1.0,https://www.reddit.com/r/AskEngineers/comments/wpejkd/is_selfreplicating_robotics_possible_to_make_in/,all_ads,6,,,,,,
1,[],False,waterhero,,[],,text,t2_72qie8mi,False,False,False,[],False,False,1660604503,self.AskEngineers,https://www.reddit.com/r/AskEngineers/comments/wpdrgj/what_are_some_misconceptions_scientists_have/,{},wpdrgj,False,True,False,False,False,True,True,False,,blue,[],b251a614-57f9-11e4-b47b-12313b0e9678,Discussion,dark,text,False,False,False,0,0,False,all_ads,/r/AskEngineers/comments/wpdrgj/what_are_some_misconceptions_scientists_have/,False,6,,1660604514,1,There has been articles discussing misconceptions the general public has about science and engineering but I thought it would be interesting to focus on a community that is knowledge science hence the science community,True,False,False,AskEngineers,t5_2sebk,281486,public,self,What are some misconceptions scientists have about engineers?,0,[],1.0,https://www.reddit.com/r/AskEngineers/comments/wpdrgj/what_are_some_misconceptions_scientists_have/,all_ads,6,,,,,,
2,[],False,Warm_Construction_51,,[],,text,t2_5v0jzfe1,False,False,False,[],False,False,1660601469,self.AskEngineers,https://www.reddit.com/r/AskEngineers/comments/wpcjpz/phase_phase_shorts_on_pdus/,{},wpcjpz,False,False,False,False,False,False,True,False,,purple,[],3a6acd0c-fd28-11e6-ab41-0edc7e2b18fe,Electrical,dark,text,False,False,True,1,0,False,all_ads,/r/AskEngineers/comments/wpcjpz/phase_phase_shorts_on_pdus/,False,6,moderator,1660601480,1,[removed],True,False,False,AskEngineers,t5_2sebk,281485,public,self,Phase / phase shorts on PDUs,0,[],1.0,https://www.reddit.com/r/AskEngineers/comments/wpcjpz/phase_phase_shorts_on_pdus/,all_ads,6,,,,,,
3,[],False,mktg_mktg,,[],,text,t2_j1ytxyib,False,False,False,[],False,False,1660598689,self.AskEngineers,https://www.reddit.com/r/AskEngineers/comments/wpbeq0/what_nonengineering_roles_can_someone_with_a_bsee/,{},wpbeq0,False,False,False,False,False,False,True,False,,purple,[],3a6acd0c-fd28-11e6-ab41-0edc7e2b18fe,Electrical,dark,text,False,False,True,1,0,False,all_ads,/r/AskEngineers/comments/wpbeq0/what_nonengineering_roles_can_someone_with_a_bsee/,False,6,moderator,1660598700,1,[removed],True,False,False,AskEngineers,t5_2sebk,281479,public,self,What non-engineering roles can someone with a BSEE pursue?,0,[],1.0,https://www.reddit.com/r/AskEngineers/comments/wpbeq0/what_nonengineering_roles_can_someone_with_a_bsee/,all_ads,6,,,,,,
4,[],False,mktg_mktg,,[],,text,t2_j1ytxyib,False,False,False,[],False,False,1660598636,self.AskEngineers,https://www.reddit.com/r/AskEngineers/comments/wpbdy4/iso_help_partner_has_bsee_and_realized_they_hate/,{},wpbdy4,False,False,False,False,False,False,True,False,,purple,[],3a6acd0c-fd28-11e6-ab41-0edc7e2b18fe,Electrical,dark,text,False,False,True,1,0,False,all_ads,/r/AskEngineers/comments/wpbdy4/iso_help_partner_has_bsee_and_realized_they_hate/,False,6,moderator,1660598647,1,[removed],True,False,False,AskEngineers,t5_2sebk,281479,public,self,"ISO Help: Partner has BSEE and realized they hate engineering, wants to seek new career.",0,[],1.0,https://www.reddit.com/r/AskEngineers/comments/wpbdy4/iso_help_partner_has_bsee_and_realized_they_hate/,all_ads,6,,,,,,
5,[],False,uniqueusername1176,,[],,text,t2_14fm3a,False,False,False,[],False,False,1660598096,self.AskEngineers,https://www.reddit.com/r/AskEngineers/comments/wpb5wb/senior_project_engineer_expected_pay/,{},wpb5wb,False,True,False,False,False,True,True,False,,blue,[],b251a614-57f9-11e4-b47b-12313b0e9678,Discussion,dark,text,False,False,True,0,0,False,all_ads,/r/AskEngineers/comments/wpb5wb/senior_project_engineer_expected_pay/,False,6,,1660598107,1,"Hi all, 

Just trying to get a gage. What would you say should be an expected or reasonable salary for a senior project engineer (5 years experience) living in NJ (High cost of living area)?

Let me know if more information is needed",True,False,False,AskEngineers,t5_2sebk,281479,public,self,Senior project engineer expected pay?,0,[],1.0,https://www.reddit.com/r/AskEngineers/comments/wpb5wb/senior_project_engineer_expected_pay/,all_ads,6,,,,,,
6,[],False,AztecAutomation,,[],,text,t2_lpwl4hyn,False,False,False,[],False,False,1660594420,self.AskEngineers,https://www.reddit.com/r/AskEngineers/comments/wp9mbp/does_deltawye_concept_only_apply_to_a_3phase/,{},wp9mbp,False,True,False,False,False,True,True,False,,purple,[],3a6acd0c-fd28-11e6-ab41-0edc7e2b18fe,Electrical,dark,text,False,False,True,0,0,False,all_ads,/r/AskEngineers/comments/wp9mbp/does_deltawye_concept_only_apply_to_a_3phase/,False,6,,1660594430,1," I'm trying to figure out how a 200A- 120/240V panel would connect to a 480 VAC - 50A breaker via a transformer. I'm used to seeing a 3-phase delta-wye transformer but what if I want the transformer to be single phase so that it can feed the single phase 200A panel?

I'm guessing that only two wires (one 480V phase) would connect from the 480V/50Amp breaker to the single phase transformer on the delta side. Then the wye side would feed the 200A panel using 2 hot wires (120V) and a neutral wire.",True,False,False,AskEngineers,t5_2sebk,281472,public,self,Does delta/wye concept only apply to a 3-phase transformers but not single phase?,0,[],1.0,https://www.reddit.com/r/AskEngineers/comments/wp9mbp/does_deltawye_concept_only_apply_to_a_3phase/,all_ads,6,,,,,,
7,[],False,Goulbourne604,,[],,text,t2_ig8ri7pu,False,False,False,[],False,False,1660593289,self.AskEngineers,https://www.reddit.com/r/AskEngineers/comments/wp94xq/outsourcing_fea_extrusion_beam_design/,{},wp94xq,False,False,False,False,False,False,True,False,,blue,[],90a1d45a-3f64-11e5-8667-0e60d8112001,Mechanical,dark,text,False,False,True,1,0,False,all_ads,/r/AskEngineers/comments/wp94xq/outsourcing_fea_extrusion_beam_design/,False,6,moderator,1660593299,1,[removed],True,False,False,AskEngineers,t5_2sebk,281472,public,self,Outsourcing - FEA / Extrusion Beam Design,0,[],1.0,https://www.reddit.com/r/AskEngineers/comments/wp94xq/outsourcing_fea_extrusion_beam_design/,all_ads,6,,,,,,
8,[],False,giantgreenslime,,[],,text,t2_cj1u9,False,False,False,[],False,False,1660590600,self.AskEngineers,https://www.reddit.com/r/AskEngineers/comments/wp811z/how_to_determine_full_scale_range/,{},wp811z,False,True,False,False,False,True,True,False,,blue,[],90a1d45a-3f64-11e5-8667-0e60d8112001,Mechanical,dark,text,False,False,False,0,0,False,all_ads,/r/AskEngineers/comments/wp811z/how_to_determine_full_scale_range/,False,6,,1660590611,1,"I'm working with a system which allows the user to set a temperature setpoint, and uses a PID to control the feedback as it approaches that setpoint. I'd like to define an acceptable amount of overshoot as a % Full Scale, since I have multiple systems each with a unique max operating temperature limit.

However, if one of my systems has a max control limit of 100C, and lets say I choose my acceptable overshoot to be 5% of Full Scale, would I calculate 5% of 100C = 5C? But since my system can never get below room temperature, and only ever heats up, should I define my operating window as 5% of 77 (100-23) = 3.85C? Or is it necessary to define a 'minimum controllable temperature' and use 100 minus that value as my range?

I can't find anything online to clarify this, any help appreciated!",True,False,False,AskEngineers,t5_2sebk,281470,public,self,How to determine Full Scale Range?,0,[],1.0,https://www.reddit.com/r/AskEngineers/comments/wp811z/how_to_determine_full_scale_range/,all_ads,6,,,,,,
9,[],False,No-Marzipan-2423,,[],,text,t2_bened382,False,False,False,[],False,False,1660590422,self.AskEngineers,https://www.reddit.com/r/AskEngineers/comments/wp7yda/looking_for_a_battery_that_would_be_a_good_fit/,{},wp7yda,False,True,False,False,False,True,True,False,,purple,[],3a6acd0c-fd28-11e6-ab41-0edc7e2b18fe,Electrical,dark,text,False,False,True,0,0,False,all_ads,/r/AskEngineers/comments/wp7yda/looking_for_a_battery_that_would_be_a_good_fit/,False,6,,1660590432,1,"[https://www.digikey.com/en/products/detail/samsung-semiconductor,-inc./SPMWHD32AMH1XAH0S0/12083751](https://www.digikey.com/en/products/detail/samsung-semiconductor,-inc./SPMWHD32AMH1XAH0S0/12083751)

Ideally would be able to be directly connected to the LED doesn't have to run at full power and would like it to run for a long time. Rechargeable options a plus.",True,False,False,AskEngineers,t5_2sebk,281470,public,self,Looking for a battery that would be a good fit for a singe LM301H LED,0,[],1.0,https://www.reddit.com/r/AskEngineers/comments/wp7yda/looking_for_a_battery_that_would_be_a_good_fit/,all_ads,6,,,,,,
10,[],False,dsl101,,[],,text,t2_ym2no,False,False,False,[],False,False,1660589511,self.AskEngineers,https://www.reddit.com/r/AskEngineers/comments/wp7kub/do_largescale_wind_turbines_all_rotate_in_the/,{},wp7kub,False,True,False,False,False,True,True,False,,blue,[],90a1d45a-3f64-11e5-8667-0e60d8112001,Mechanical,dark,text,False,False,False,0,0,False,all_ads,/r/AskEngineers/comments/wp7kub/do_largescale_wind_turbines_all_rotate_in_the/,False,6,,1660589522,1,"If so, Is this convention, or is there some reason to pick one direction over the other?

Related question—if there’s no ‘preferred’ direction, would being able to reverse direction have any benefit such as equalising wear and tear on the drive train?",True,False,False,AskEngineers,t5_2sebk,281468,public,self,Do large-scale wind turbines all rotate in the same direction?,0,[],1.0,https://www.reddit.com/r/AskEngineers/comments/wp7kub/do_largescale_wind_turbines_all_rotate_in_the/,all_ads,6,,,,,,
11,[],False,AverageAntique3160,,[],,text,t2_ang0wl1o,False,False,False,[],False,False,1660589410,self.AskEngineers,https://www.reddit.com/r/AskEngineers/comments/wp7jc7/utility_blades/,{},wp7jc7,False,False,False,False,False,False,True,False,,purple,[],3a6acd0c-fd28-11e6-ab41-0edc7e2b18fe,Electrical,dark,text,False,False,True,1,0,False,all_ads,/r/AskEngineers/comments/wp7jc7/utility_blades/,False,6,moderator,1660589421,1,[removed],True,False,False,AskEngineers,t5_2sebk,281468,public,self,utility blades,0,[],1.0,https://www.reddit.com/r/AskEngineers/comments/wp7jc7/utility_blades/,all_ads,6,,,,,,
12,[],False,iulajfr,,[],,text,t2_179hwl,False,False,True,[],False,False,1660588870,self.AskEngineers,https://www.reddit.com/r/AskEngineers/comments/wp7bko/looking_for_advice_on_getting_an_engineering/,{},wp7bko,False,True,False,False,False,True,True,False,,blue,[],90a1d45a-3f64-11e5-8667-0e60d8112001,Mechanical,dark,text,False,False,True,0,0,False,all_ads,/r/AskEngineers/comments/wp7bko/looking_for_advice_on_getting_an_engineering/,False,6,,1660588881,1,Currently employed with a medtech company in Manhattan focusing on spine. Have a great career in sales with them(over 7 years experience)but looking to get more involved. I do not have any previous engineering courses that I took in college. Looking for the best route to pursue a degree and eventually masters.,True,False,False,AskEngineers,t5_2sebk,281467,public,self,Looking for advice on getting an engineering degree with a focus in medical devices.,0,[],1.0,https://www.reddit.com/r/AskEngineers/comments/wp7bko/looking_for_advice_on_getting_an_engineering/,all_ads,6,,,,,,
13,[],False,Unanamouse,,[],,text,t2_3oxdoa4b,False,False,False,[],False,False,1660588609,self.AskEngineers,https://www.reddit.com/r/AskEngineers/comments/wp77kq/engineers_with_a_phd_was_it_worth_it_why_why_not/,{},wp77kq,False,True,False,False,False,True,True,False,,blue,[],b251a614-57f9-11e4-b47b-12313b0e9678,Discussion,dark,text,False,False,True,0,0,False,all_ads,/r/AskEngineers/comments/wp77kq/engineers_with_a_phd_was_it_worth_it_why_why_not/,False,6,,1660588620,1,,True,False,False,AskEngineers,t5_2sebk,281466,public,self,"engineers with a PhD, was it worth it? why (why not)?",0,[],1.0,https://www.reddit.com/r/AskEngineers/comments/wp77kq/engineers_with_a_phd_was_it_worth_it_why_why_not/,all_ads,6,,,,,,
14,[],False,MisterReigns,,[],,text,t2_ea1uhwsg,False,False,False,[],False,False,1660588578,self.AskEngineers,https://www.reddit.com/r/AskEngineers/comments/wp772v/how_can_i_use_a_wheel_to_make_something_go_up_and/,{},wp772v,False,False,False,False,False,False,True,False,,blue,[],90a1d45a-3f64-11e5-8667-0e60d8112001,Mechanical,dark,text,False,False,True,1,0,False,all_ads,/r/AskEngineers/comments/wp772v/how_can_i_use_a_wheel_to_make_something_go_up_and/,False,6,moderator,1660588589,1,[removed],True,False,False,AskEngineers,t5_2sebk,281466,public,self,How can I use a wheel to make something go up and down?,0,[],1.0,https://www.reddit.com/r/AskEngineers/comments/wp772v/how_can_i_use_a_wheel_to_make_something_go_up_and/,all_ads,6,,,,,,
15,[],False,Neil-Er,,[],,text,t2_cqn7oheh,False,False,False,[],False,False,1660587725,self.AskEngineers,https://www.reddit.com/r/AskEngineers/comments/wp6ueb/hi/,{},wp6ueb,False,False,False,False,False,False,True,False,,blue,[],90a1d45a-3f64-11e5-8667-0e60d8112001,Mechanical,dark,text,False,False,True,1,0,False,all_ads,/r/AskEngineers/comments/wp6ueb/hi/,False,6,moderator,1660587736,1,[removed],True,False,False,AskEngineers,t5_2sebk,281465,public,self,Hi,0,[],1.0,https://www.reddit.com/r/AskEngineers/comments/wp6ueb/hi/,all_ads,6,,,,,,
16,[],False,d0s4gw,,[],Software Engineering - Management,text,t2_3l5at,False,False,False,[],False,False,1660586095,self.AskEngineers,https://www.reddit.com/r/AskEngineers/comments/wp65r3/connecting_light_rail_to_traditional_rail/,{},wp65r3,False,True,False,False,False,True,True,False,,orange,[],939137fa-3f64-11e5-b90e-0ef63926eacd,Civil,dark,text,False,False,True,0,0,False,all_ads,/r/AskEngineers/comments/wp65r3/connecting_light_rail_to_traditional_rail/,False,6,,1660586106,1,"In downtown Pittsburgh, there is a light rail station at Steel Plaza Station, only a few blocks away from Pittsburgh Union Station which is used by Amtrak. Assuming it were possible to get agreements from the track owners and build the track to connect the light rail lines to the traditional rail line and build whichever stations would be useful along the track, could this technically work? Or are the components too different to interact?",True,False,False,AskEngineers,t5_2sebk,281463,public,self,Connecting light rail to traditional rail,0,[],1.0,https://www.reddit.com/r/AskEngineers/comments/wp65r3/connecting_light_rail_to_traditional_rail/,all_ads,6,,dark,,,,
17,[],False,LongToeBoy,,[],,text,t2_cpwk6848,False,False,False,[],False,False,1660585364,self.AskEngineers,https://www.reddit.com/r/AskEngineers/comments/wp5uvf/suggestion_about_communication_rf_sound_light/,{},wp5uvf,False,True,False,False,False,True,True,False,,purple,[],3a6acd0c-fd28-11e6-ab41-0edc7e2b18fe,Electrical,dark,text,False,False,True,0,0,False,all_ads,/r/AskEngineers/comments/wp5uvf/suggestion_about_communication_rf_sound_light/,False,6,,1660585374,1,"so, i want to make something like a short range (&lt;10meters) tracking device. i want to have one central modem and multiple tracking devices. modem needs to be able to measure distance between itself and each of the trackers. so i was thinking each of the trackers would send signal on different frequencies and modem will have like a SDR module to detect each of the signal and measure strength. but i dont know how smart is this approach. anything to suggest? just a modem that measures distance to multiple trackers",True,False,False,AskEngineers,t5_2sebk,281463,public,self,"suggestion about communication RF, sound, light, bluetooth, etc...",0,[],1.0,https://www.reddit.com/r/AskEngineers/comments/wp5uvf/suggestion_about_communication_rf_sound_light/,all_ads,6,,,,,,
18,[],False,OldBagOfCheetos,,[],,text,t2_at823bxb,False,False,False,[],False,False,1660583463,self.AskEngineers,https://www.reddit.com/r/AskEngineers/comments/wp522y/question_about_ac_and_dc_motors/,{},wp522y,False,True,False,False,False,True,True,False,,purple,[],3a6acd0c-fd28-11e6-ab41-0edc7e2b18fe,Electrical,dark,text,False,False,True,0,0,False,all_ads,/r/AskEngineers/comments/wp522y/question_about_ac_and_dc_motors/,False,6,,1660583474,1,"
I’m trying to build a mini food processor but am having trouble narrowing down what type of motor I should use. To start with, I’m trying to narrow down if I should use AC or DC? Brushed or brushless (DC) or induction (AC)? I’m trying to get around 100-200W of power and an rpm of at least 1,500. I’m also curious if I should opt for a motor that uses a high voltage (like 120v) with a low current or use a motor with a low voltage (like 12v) and a high current. I’m not sure what the difference is if it achieves the same power (other than working with low voltage high current is safer)",True,False,False,AskEngineers,t5_2sebk,281462,public,self,Question about AC and DC motors,0,[],1.0,https://www.reddit.com/r/AskEngineers/comments/wp522y/question_about_ac_and_dc_motors/,all_ads,6,,,,,,
19,[],False,Ok_Dragonfruit4197,,[],,text,t2_7nkkwfya,False,False,False,[],False,False,1660582866,self.AskEngineers,https://www.reddit.com/r/AskEngineers/comments/wp4t3g/question_about_motors_electronics/,{},wp4t3g,False,False,False,False,False,False,True,False,,purple,[],3a6acd0c-fd28-11e6-ab41-0edc7e2b18fe,Electrical,dark,text,False,False,True,1,0,False,all_ads,/r/AskEngineers/comments/wp4t3g/question_about_motors_electronics/,False,6,moderator,1660582876,1,[removed],True,False,False,AskEngineers,t5_2sebk,281461,public,self,Question about motors (electronics),0,[],1.0,https://www.reddit.com/r/AskEngineers/comments/wp4t3g/question_about_motors_electronics/,all_ads,6,,,,,,
20,[],False,LieutenantZucc,,[],,text,t2_ya6ce2u,False,False,False,[],False,False,1660581303,self.AskEngineers,https://www.reddit.com/r/AskEngineers/comments/wp45c8/calculating_output_force_of_solenoid/,{},wp45c8,False,True,False,False,False,True,True,False,,blue,[],90a1d45a-3f64-11e5-8667-0e60d8112001,Mechanical,dark,text,False,False,True,0,0,False,all_ads,/r/AskEngineers/comments/wp45c8/calculating_output_force_of_solenoid/,False,6,,1660581314,1,"I'm currently trying to calculate the output force of a plunger at different positions within a solenoid. I found this article online that explains the theory behind the calculations.

[https://citeseerx.ist.psu.edu/viewdoc/download?doi=10.1.1.428.9647&amp;rep=rep1&amp;type=pdf](https://citeseerx.ist.psu.edu/viewdoc/download?doi=10.1.1.428.9647&amp;rep=rep1&amp;type=pdf)

I'm using equation 22 from this article and running a loop for all x-positions in the coil. However, my output forces make no sense as it does not exponentially decay.

Below is the code that I have to compute the calculation:

x = 0:0.1e-3:sol\_l;

for ii = 1:length(x)

  F(ii) = -Wf\*(V\^2\*relmu\_fe\*mu\_o\*alpha\*exp(-(alpha\*sol\_l)/x(ii))/(8\*pi\*gamma\^2\*sol\_l\^2));

end

&amp;#x200B;

Not sure what I could be doing wrong but any help is appreciated.",True,False,False,AskEngineers,t5_2sebk,281461,public,self,Calculating output force of solenoid,0,[],1.0,https://www.reddit.com/r/AskEngineers/comments/wp45c8/calculating_output_force_of_solenoid/,all_ads,6,,,,,,
21,[],False,BadderBanana,,[],Welding Engineering,text,t2_gcvo7,False,False,False,[],False,False,1660578096,self.AskEngineers,https://www.reddit.com/r/AskEngineers/comments/wp2t3v/is_there_an_end_or_lifeservice_plan_for_windmills/,{},wp2t3v,False,True,False,False,False,True,True,False,,orange,[],939137fa-3f64-11e5-b90e-0ef63926eacd,Civil,dark,text,False,False,True,0,0,False,all_ads,/r/AskEngineers/comments/wp2t3v/is_there_an_end_or_lifeservice_plan_for_windmills/,False,6,,1660578106,1,"Working in Detroit I’m all to familiar with abandon buildings and decay.  What happens to these windmills or even solar farms if/when companies go bankrupt?   At some point these won’t be worth operating/maintaining, and they certainly won’t be worth taking down.

My dad has abandoned oil rigs and tanks on his property.   The company was bought out and seemed to forget about their leases.   In another city there’s even an derelict hydro dam.",True,False,False,AskEngineers,t5_2sebk,281459,public,self,Is there an end or life/service plan for windmills?,0,[],1.0,https://www.reddit.com/r/AskEngineers/comments/wp2t3v/is_there_an_end_or_lifeservice_plan_for_windmills/,all_ads,6,,dark,,,,
22,[],False,DrPhill01,,[],,text,t2_8w2c7a6n,False,False,False,[],False,False,1660576545,self.AskEngineers,https://www.reddit.com/r/AskEngineers/comments/wp26va/pump_hydraulics/,{},wp26va,False,False,False,False,False,False,True,False,,blue,[],90a1d45a-3f64-11e5-8667-0e60d8112001,Mechanical,dark,text,False,False,True,1,0,False,all_ads,/r/AskEngineers/comments/wp26va/pump_hydraulics/,False,6,moderator,1660576555,1,[removed],True,False,False,AskEngineers,t5_2sebk,281457,public,self,Pump Hydraulics,0,[],1.0,https://www.reddit.com/r/AskEngineers/comments/wp26va/pump_hydraulics/,all_ads,6,,,,,,
23,[],False,nomberte,,[],,text,t2_cq8rclb3,False,False,False,[],False,False,1660575886,self.AskEngineers,https://www.reddit.com/r/AskEngineers/comments/wp1xya/looking_for_resources_video_online_classes_books/,{},wp1xya,False,True,False,False,False,True,True,False,,blue,[],b251a614-57f9-11e4-b47b-12313b0e9678,Discussion,dark,text,False,False,True,0,0,False,all_ads,/r/AskEngineers/comments/wp1xya/looking_for_resources_video_online_classes_books/,False,6,,1660575897,1,"After being woken up for yet another late night technical drawing/design crisis, I need more help. Teenager needs help getting design ideas out of his head and onto paper. He primarily builds metal (forging and welding) and wood construction projects. I can find him online or in person classes for CAD and other software, but he only wants to do it by hand at this point.",True,False,False,AskEngineers,t5_2sebk,281457,public,self,"Looking for resources (video, online classes, books, etc) to teach basic technical drawing (by pencil, not computer aided) to a bright, very neurodiverse teenager. He refuses to learn any computer aided design systems.",0,[],1.0,https://www.reddit.com/r/AskEngineers/comments/wp1xya/looking_for_resources_video_online_classes_books/,all_ads,6,,,,,,
24,[],False,nomberte,,[],,text,t2_cq8rclb3,False,False,False,[],False,False,1660573204,self.AskEngineers,https://www.reddit.com/r/AskEngineers/comments/wp0w4p/technical_drawing_pencil/,{},wp0w4p,False,False,False,False,False,False,True,False,,blue,[],b251a614-57f9-11e4-b47b-12313b0e9678,Discussion,dark,text,False,False,True,1,0,False,all_ads,/r/AskEngineers/comments/wp0w4p/technical_drawing_pencil/,False,6,moderator,1660573215,1,[removed],True,False,False,AskEngineers,t5_2sebk,281453,public,self,Technical drawing (pencil),0,[],1.0,https://www.reddit.com/r/AskEngineers/comments/wp0w4p/technical_drawing_pencil/,all_ads,6,,,,,,
