,all_awardings,allow_live_comments,author,author_flair_css_class,author_flair_richtext,author_flair_text,author_flair_type,author_fullname,author_is_blocked,author_patreon_flair,author_premium,awarders,can_mod_post,contest_mode,created_utc,domain,full_link,gildings,id,is_created_from_ads_ui,is_crosspostable,is_meta,is_original_content,is_reddit_media_domain,is_robot_indexable,is_self,is_video,link_flair_background_color,link_flair_css_class,link_flair_richtext,link_flair_template_id,link_flair_text,link_flair_text_color,link_flair_type,locked,media_only,no_follow,num_comments,num_crossposts,over_18,parent_whitelist_status,permalink,pinned,pwls,removed_by_category,retrieved_on,score,selftext,send_replies,spoiler,stickied,subreddit,subreddit_id,subreddit_subscribers,subreddit_type,thumbnail,title,total_awards_received,treatment_tags,upvote_ratio,url,whitelist_status,wls,author_flair_background_color,author_flair_text_color,collections,post_hint,preview,author_flair_template_id
42,[],False,Xeroll,,[],,text,t2_bxfdi,False,False,False,[],False,False,1660550524,self.AskEngineers,https://www.reddit.com/r/AskEngineers/comments/wotszd/what_timeline_do_you_have_for_designs/,{},wotszd,False,True,False,False,False,True,True,False,,blue,[],b251a614-57f9-11e4-b47b-12313b0e9678,Discussion,dark,text,False,False,True,0,0,False,all_ads,/r/AskEngineers/comments/wotszd/what_timeline_do_you_have_for_designs/,False,6,,1660550534,1,"I'm in the semiconductor industry. It's fast paced and constantly in motion. As a designer I'm always under pressure to deliver solutions as quick as possible. We have systems for maintaining design quality and feasibility, but since that process takes up part of the time given to produce a solution, I'm only given a few weeks to come up with and present on solutions. Novel and unique ideas aren't possible because they require so much time to work out, and they may not even be feasible meaning wasted time. I maybe have a month to go from being given a problem to ordering parts. I've always been curious how more commoditized industries work through the design process where changes mqy seem minimal to the consumer but may be more revolutionary to industry.",True,False,False,AskEngineers,t5_2sebk,281429,public,self,What timeline do you have for designs?,0,[],1.0,https://www.reddit.com/r/AskEngineers/comments/wotszd/what_timeline_do_you_have_for_designs/,all_ads,6,,,,,,
43,[],False,sortbypatrick,,[],,text,t2_817a5vku,False,False,False,[],False,False,1660549190,self.AskEngineers,https://www.reddit.com/r/AskEngineers/comments/wotg6y/my_fellow_engineers_any_thoughts_about/,{},wotg6y,False,True,False,False,False,True,True,False,,blue,[],b251a614-57f9-11e4-b47b-12313b0e9678,Discussion,dark,text,False,False,True,0,0,False,all_ads,/r/AskEngineers/comments/wotg6y/my_fellow_engineers_any_thoughts_about/,False,6,,1660549200,1,"I'm thinking about studying engineering physics at college, any advice would be appreciated.",True,False,False,AskEngineers,t5_2sebk,281429,public,self,My fellow engineers any thoughts about engineering physics?,0,[],0.99,https://www.reddit.com/r/AskEngineers/comments/wotg6y/my_fellow_engineers_any_thoughts_about/,all_ads,6,,,,,,
44,[],False,yMn_,,[],,text,t2_3lx7z6ge,False,False,True,[],False,False,1660546206,self.AskEngineers,https://www.reddit.com/r/AskEngineers/comments/woso0t/my_fellow_engineers_any_thoughts_about/,{},woso0t,False,False,False,False,False,False,True,False,,blue,[],b251a614-57f9-11e4-b47b-12313b0e9678,Discussion,dark,text,False,False,True,1,0,False,all_ads,/r/AskEngineers/comments/woso0t/my_fellow_engineers_any_thoughts_about/,False,6,moderator,1660546216,1,[removed],True,False,False,AskEngineers,t5_2sebk,281426,public,self,My fellow engineers any thoughts about engineering physics ?,0,[],1.0,https://www.reddit.com/r/AskEngineers/comments/woso0t/my_fellow_engineers_any_thoughts_about/,all_ads,6,,,,,,
45,[],False,GiberyGlish,,[],,text,t2_eiy3feev,False,False,False,[],False,False,1660541218,self.AskEngineers,https://www.reddit.com/r/AskEngineers/comments/wor967/what_dont_you_like_about_your_engineering/,{},wor967,False,True,False,False,False,True,True,False,,blue,[],b251a614-57f9-11e4-b47b-12313b0e9678,Discussion,dark,text,False,False,True,0,0,False,all_ads,/r/AskEngineers/comments/wor967/what_dont_you_like_about_your_engineering/,False,6,,1660541229,1,"So I’ve been chatting with some students recently about their disciplines to see what they like and don’t like (I myself am a second year student). I think the most defining question I’ve come up with is that in the title, and I really want to hear from as many people as possible about this!

So what do you dislike about your branch of engineering? Is it lonely, tiresome, repetitive, etc? Do you manage to still have a passion for your branch of engineering at the end of the day, and if so how do you manage that? Be as specific as you’d like I’ll read every answer carefully :)",True,False,False,AskEngineers,t5_2sebk,281427,public,self,"What don’t you like about your engineering discipline, and how do you overcome this with passion (or do you manage to at all)?",0,[],1.0,https://www.reddit.com/r/AskEngineers/comments/wor967/what_dont_you_like_about_your_engineering/,all_ads,6,,,,,,
46,[],False,skeever89,,[],,text,t2_4bfqaer6,False,False,False,[],False,False,1660539596,self.AskEngineers,https://www.reddit.com/r/AskEngineers/comments/woqqyg/i_like_handson_work_but_moving_parts_like_pistons/,{},woqqyg,False,True,False,False,False,True,True,False,,blue,[],b251a614-57f9-11e4-b47b-12313b0e9678,Discussion,dark,text,False,False,True,0,0,False,all_ads,/r/AskEngineers/comments/woqqyg/i_like_handson_work_but_moving_parts_like_pistons/,False,6,,1660539606,1,"I am also not interested in too much circuitry, programming, or hardware. I think that if the moving parts were in the context of \*space\*craft and related machines, then I would be highly interested, but for moving parts that are connected to other areas like cars, home appliances, or even planes, I have no interest whatsoever. 

Everything besides the space industry is boring to me, I don't want to graduate and become a ceiling fan designer or something. Should I still choose mechE even with a very specific area of interest that I cannot do without? Does mechE prepare someone for advanced industries like aerospace?I am also considering job prospects, but maybe I shouldn't and just go with aero?",True,False,False,AskEngineers,t5_2sebk,281427,public,self,"I like hands-on work, but moving parts like pistons, gears, and levers don't interest me when applied in many contexts. Is mechE good for me?",0,[],1.0,https://www.reddit.com/r/AskEngineers/comments/woqqyg/i_like_handson_work_but_moving_parts_like_pistons/,all_ads,6,,,,,,
47,[],False,100kOnACoupe,,[],,text,t2_9d1z5hfa,False,False,False,[],False,False,1660539332,self.AskEngineers,https://www.reddit.com/r/AskEngineers/comments/woqo7z/i_like_handson_work_but_im_not_interested_in/,{},woqo7z,False,False,False,False,False,False,True,False,,blue,[],b251a614-57f9-11e4-b47b-12313b0e9678,Discussion,dark,text,False,False,True,1,0,False,all_ads,/r/AskEngineers/comments/woqo7z/i_like_handson_work_but_im_not_interested_in/,False,6,moderator,1660539343,1,[removed],True,False,False,AskEngineers,t5_2sebk,281427,public,self,"I like hands-on work, but I'm not interested in moving parts like pistons, gears, and levers. Is MechE good for me?",0,[],1.0,https://www.reddit.com/r/AskEngineers/comments/woqo7z/i_like_handson_work_but_im_not_interested_in/,all_ads,6,,,,,,
48,[],False,toonietuesdays_24,,[],,text,t2_fcd3kjnm,False,False,False,[],False,False,1660536887,self.AskEngineers,https://www.reddit.com/r/AskEngineers/comments/wopx5x/what_car_do_yall_drive/,{},wopx5x,False,False,False,False,False,False,True,False,,blue,[],b251a614-57f9-11e4-b47b-12313b0e9678,Discussion,dark,text,False,False,True,1,0,False,all_ads,/r/AskEngineers/comments/wopx5x/what_car_do_yall_drive/,False,6,moderator,1660536897,1,[removed],True,False,False,AskEngineers,t5_2sebk,281425,public,self,What car do y’all drive,0,[],1.0,https://www.reddit.com/r/AskEngineers/comments/wopx5x/what_car_do_yall_drive/,all_ads,6,,,,,,
49,[],False,toonietuesdays_24,,[],,text,t2_fcd3kjnm,False,False,False,[],False,False,1660536615,self.AskEngineers,https://www.reddit.com/r/AskEngineers/comments/wopu04/engineers_cars/,{},wopu04,False,False,False,False,False,False,True,False,,blue,[],b251a614-57f9-11e4-b47b-12313b0e9678,Discussion,dark,text,False,False,True,1,0,False,all_ads,/r/AskEngineers/comments/wopu04/engineers_cars/,False,6,moderator,1660536626,1,[removed],True,False,False,AskEngineers,t5_2sebk,281425,public,self,Engineers Cars,0,[],1.0,https://www.reddit.com/r/AskEngineers/comments/wopu04/engineers_cars/,all_ads,6,,,,,,
50,[],False,OshuSupreme,,[],,text,t2_g5scdzi,False,False,False,[],False,False,1660535657,self.AskEngineers,https://www.reddit.com/r/AskEngineers/comments/wopixq/i_want_to_think_like_an_engineer_at_all_times/,{},wopixq,False,True,False,False,False,True,True,False,,blue,[],b251a614-57f9-11e4-b47b-12313b0e9678,Discussion,dark,text,False,False,True,0,0,False,all_ads,/r/AskEngineers/comments/wopixq/i_want_to_think_like_an_engineer_at_all_times/,False,6,,1660535668,1,So excited to finally start an engineering class and I just want to be so ready/so prepared for my classes. But I also don’t want to be ignorant and allow my excitement blind me from truly being an engineer. How do I begin the process of thinking like an engineer. What small projects can I work on or even people I can talk to?,True,False,False,AskEngineers,t5_2sebk,281420,public,self,I want to think like an Engineer at all times. Where do I start.,0,[],1.0,https://www.reddit.com/r/AskEngineers/comments/wopixq/i_want_to_think_like_an_engineer_at_all_times/,all_ads,6,,,,,,
51,[],False,ahappyphonemannon,,[],,text,t2_aa1sx44h,False,False,False,[],False,False,1660535490,self.AskEngineers,https://www.reddit.com/r/AskEngineers/comments/woph1f/wireless_door_lockunlock/,{},woph1f,False,False,False,False,False,False,True,False,,blue,[],90a1d45a-3f64-11e5-8667-0e60d8112001,Mechanical,dark,text,False,False,True,1,0,False,all_ads,/r/AskEngineers/comments/woph1f/wireless_door_lockunlock/,False,6,moderator,1660535500,1,[removed],True,False,False,AskEngineers,t5_2sebk,281420,public,self,Wireless Door Lock/Unlock,0,[],1.0,https://www.reddit.com/r/AskEngineers/comments/woph1f/wireless_door_lockunlock/,all_ads,6,,,,,,
52,[],False,ahappyphonemannon,,[],,text,t2_aa1sx44h,False,False,False,[],False,False,1660535245,self.AskEngineers,https://www.reddit.com/r/AskEngineers/comments/wope75/test/,{},wope75,False,False,False,False,False,False,True,False,,blue,[],b251a614-57f9-11e4-b47b-12313b0e9678,Discussion,dark,text,False,False,True,1,0,False,all_ads,/r/AskEngineers/comments/wope75/test/,False,6,moderator,1660535256,1,[removed],True,False,False,AskEngineers,t5_2sebk,281421,public,self,Test,0,[],1.0,https://www.reddit.com/r/AskEngineers/comments/wope75/test/,all_ads,6,,,,,,
53,[],False,sjamesparsonsjr,,[],,text,t2_166ufi,False,False,False,[],False,False,1660532614,self.AskEngineers,https://www.reddit.com/r/AskEngineers/comments/wooigv/how_to_make_a_collapsible_refrigerator_so_the/,{},wooigv,False,True,False,False,False,True,True,False,,blue,[],90a1d45a-3f64-11e5-8667-0e60d8112001,Mechanical,dark,text,False,False,False,0,0,False,all_ads,/r/AskEngineers/comments/wooigv/how_to_make_a_collapsible_refrigerator_so_the/,False,6,,1660532625,1,"Hello my fellow engineers and Redditors, I’m building a machine that works in a temperature-controlled box. The box is 60cm x 60cm. I’d like to make the box collapsable for shipping, and I’m trying to design it green so it can be easily dismantled for its raw materials. My prototype works well, it uses a .040 aluminum sheet for the outside and inside filled with 1-inch insulated foam. Here is a model of the box. Any ideas would be appreciated.

[https://imgur.com/a/U4sH7Oh](https://imgur.com/a/U4sH7Oh)

My idea is to cut the corners at 45° (Red line). Then the inside and outside aluminum have a 25mm flange (blue). The top overlap will have holes and the bottom overlap will have threaded rivets which will allow for screws to fasten the refrigerator together. I'm concerned about heat traveling through the cut insulation.",True,False,False,AskEngineers,t5_2sebk,281417,public,self,How to make a collapsible refrigerator so the seams don’t leak heat?,0,[],1.0,https://www.reddit.com/r/AskEngineers/comments/wooigv/how_to_make_a_collapsible_refrigerator_so_the/,all_ads,6,,,,self,"{'enabled': False, 'images': [{'id': 'y95lLlvzq3a_ZAqpP5tQHPp9WY0nF2vvNspfTZKy8NU', 'resolutions': [{'height': 73, 'url': 'https://external-preview.redd.it/6eEuJI0ua_LJcPcuAC1qthErQPcgE4UVu3yxYiyJ3yc.jpg?width=108&amp;crop=smart&amp;auto=webp&amp;s=ed67757ddf88f030d81fceea3788fc181c93d523', 'width': 108}, {'height': 147, 'url': 'https://external-preview.redd.it/6eEuJI0ua_LJcPcuAC1qthErQPcgE4UVu3yxYiyJ3yc.jpg?width=216&amp;crop=smart&amp;auto=webp&amp;s=72cdbdad84e8b5a16b5af87f1e009ecc719af686', 'width': 216}, {'height': 219, 'url': 'https://external-preview.redd.it/6eEuJI0ua_LJcPcuAC1qthErQPcgE4UVu3yxYiyJ3yc.jpg?width=320&amp;crop=smart&amp;auto=webp&amp;s=7e962c9a5acbf6efaf5c75bea35a6f4e376b3131', 'width': 320}, {'height': 438, 'url': 'https://external-preview.redd.it/6eEuJI0ua_LJcPcuAC1qthErQPcgE4UVu3yxYiyJ3yc.jpg?width=640&amp;crop=smart&amp;auto=webp&amp;s=533f3a907249a1be2a73e0d5d8127810396b41e8', 'width': 640}], 'source': {'height': 508, 'url': 'https://external-preview.redd.it/6eEuJI0ua_LJcPcuAC1qthErQPcgE4UVu3yxYiyJ3yc.jpg?auto=webp&amp;s=f110b654d5a649f803e938122fc88e0d9fc44b7b', 'width': 742}, 'variants': {}}]}",
54,[],False,johncheng0809,,[],,text,t2_qqsfble,False,False,False,[],False,False,1660530874,self.AskEngineers,https://www.reddit.com/r/AskEngineers/comments/wonwhy/vba_marco_python/,{},wonwhy,False,False,False,False,False,False,True,False,,purple,[],6a68317a-c3cd-11e9-bf9c-0e2863fd7a72,Computer,dark,text,False,False,True,1,0,False,all_ads,/r/AskEngineers/comments/wonwhy/vba_marco_python/,False,6,moderator,1660530885,1,[removed],True,False,False,AskEngineers,t5_2sebk,281416,public,self,VBA marco &amp; Python,0,[],1.0,https://www.reddit.com/r/AskEngineers/comments/wonwhy/vba_marco_python/,all_ads,6,,,,,,
55,[],False,morgibin,,[],,text,t2_6qdk8zr2,False,False,False,[],False,False,1660528603,self.AskEngineers,https://www.reddit.com/r/AskEngineers/comments/won3eh/why_is_my_apartment_shaking_constantly/,{},won3eh,False,True,False,False,False,True,True,False,,blue,[],b251a614-57f9-11e4-b47b-12313b0e9678,Discussion,dark,text,False,False,True,0,0,False,all_ads,/r/AskEngineers/comments/won3eh/why_is_my_apartment_shaking_constantly/,False,6,,1660528613,1,"Hopefully this is allowed here. It’s more of an architectural engineering question. 

Within the past week my 3rd floor apartment floor has been subtly shaking nonstop. You can feel the floor moving, and it is especially prominent on furniture. I can feel it standing on the floor, sitting on the couch, laying in bed, even out on my balcony; I can’t escape it. It’s constant and never stops shaking as far as I’ve noticed in the past 3 days. 

I can’t pinpoint a cause - I turned all of my circuit breakers off and could still feel the shaking. Doesn’t seem to make a difference if appliances are running (air conditioning, washer/dryer, dishwasher, refrigerator, etc.). There is a constant hum, but that existed before the shaking started. 

I am next to a highway that gets pretty heavy traffic, but I’ve lived in this unit since August 2021 and haven’t had this problem until now. The building is brand new, I’m the first tenant to occupy my unit. It’s a 4-floor building. 

It’s starting to affect my sleep. I put anti-vibration mats under the posts of my bed frame but you can still feel the floor shaking regardless. Any ideas?",True,False,False,AskEngineers,t5_2sebk,281412,public,self,Why is my apartment shaking constantly?,0,[],1.0,https://www.reddit.com/r/AskEngineers/comments/won3eh/why_is_my_apartment_shaking_constantly/,all_ads,6,,,,,,
56,[],False,mjhv1,,[],,text,t2_3lzunhem,False,False,False,[],False,False,1660526572,self.AskEngineers,https://www.reddit.com/r/AskEngineers/comments/womdis/any_other_methods_on_getting_the_pe/,{},womdis,False,True,False,False,False,True,True,False,,blue,[],90a1d45a-3f64-11e5-8667-0e60d8112001,Mechanical,dark,text,False,False,True,0,0,False,all_ads,/r/AskEngineers/comments/womdis/any_other_methods_on_getting_the_pe/,False,6,,1660526583,1,Can I get a PE without working under a person with a professional license? To my knowledge that's what is almost required to get one. Basically working for a steel mill company at the moment and I still need to get my FE but in the long term I was wondering if I could still get a professional license not working under a professional licensed engineer. The company might have professional licensed engineers but to my knowledge none under my degree.,True,False,False,AskEngineers,t5_2sebk,281411,public,self,Any other methods on getting the PE,0,[],1.0,https://www.reddit.com/r/AskEngineers/comments/womdis/any_other_methods_on_getting_the_pe/,all_ads,6,,,,,,
57,[],False,stricly_business,,[],,text,t2_9tt3ub97,False,False,False,[],False,False,1660525396,self.AskEngineers,https://www.reddit.com/r/AskEngineers/comments/wolygu/please_share_your_experience_as_a_freelance/,{},wolygu,False,True,False,False,False,True,True,False,,blue,[],90a1d45a-3f64-11e5-8667-0e60d8112001,Mechanical,dark,text,False,False,True,0,0,False,all_ads,/r/AskEngineers/comments/wolygu/please_share_your_experience_as_a_freelance/,False,6,,1660525407,1,"I'm considering eventually quitting my regular office job and going into semi-retirement by working part time from home as a freelance mechanical engineer.

I'm wondering how much money is there to be made as a freelance mechanical engineer. I worry about competing against people in countries that are willing to work for much less money than me. I wonder if it will be worth my time. What are your thoughts and experiences?",True,False,False,AskEngineers,t5_2sebk,281410,public,self,Please share your experience as a freelance mechanical engineer.,0,[],1.0,https://www.reddit.com/r/AskEngineers/comments/wolygu/please_share_your_experience_as_a_freelance/,all_ads,6,,,,,,
58,[],False,Jelopuddinpop,,[],,text,t2_1gvvslbr,False,False,False,[],False,False,1660524127,self.AskEngineers,https://www.reddit.com/r/AskEngineers/comments/wolhpv/good_material_for_use_in_an_automatic_chicken/,{},wolhpv,False,True,False,False,False,True,True,False,,blue,[],90a1d45a-3f64-11e5-8667-0e60d8112001,Mechanical,dark,text,False,False,True,0,0,False,all_ads,/r/AskEngineers/comments/wolhpv/good_material_for_use_in_an_automatic_chicken/,False,6,,1660524138,1,"Hi everyone!

I'm building an automatic door for my chicken coop, and am doing a DIY design. It uses a drapery motor with a timer, a sheet of 1/8 aluminum, and material for two tracks for the sheet to ride up and down in. See this link for the original design:

https://www.buildeazy.com/automatic-chicken-house-door/

My problem lies with the tracks. The original design uses wooden slats with 1/4 grooves cut in them for the sheet to slide up and down in. I live in New England, and I'm not too keen on leaving that much of a gap for drafts in the winter. I could easily use a piece of metal channel with a 1/8"" slot, but I'm afraid that it would bind in the winter.

My last thought was Delrin plastic. We use it where I work, and that stuff always feels slippery. What I don't know is how it would react in cold or hot weather, and if the aluminum sheet would be able to bind up in it if I only cut a 1/8""+ gap. 

Would Delrin work? Are there any other alternatives that would be better?",True,False,False,AskEngineers,t5_2sebk,281408,public,self,Good material for use in an automatic chicken coop door,0,[],1.0,https://www.reddit.com/r/AskEngineers/comments/wolhpv/good_material_for_use_in_an_automatic_chicken/,all_ads,6,,,,self,"{'enabled': False, 'images': [{'id': 'JdoxrYyNLAfdXX1hMLJ2_Sn8fepYFez59B1vxMDOuno', 'resolutions': [{'height': 150, 'url': 'https://external-preview.redd.it/ndWnl2nJ7ITaGdb18DkycE3wIZutveJ7Ce9Jw2dfhsk.jpg?width=108&amp;crop=smart&amp;auto=webp&amp;s=3d223bb2d80b4ea5fa1e7714894b47b41585e079', 'width': 108}, {'height': 300, 'url': 'https://external-preview.redd.it/ndWnl2nJ7ITaGdb18DkycE3wIZutveJ7Ce9Jw2dfhsk.jpg?width=216&amp;crop=smart&amp;auto=webp&amp;s=a4cb928ae73908db3e946e8157581c46b08af5df', 'width': 216}, {'height': 445, 'url': 'https://external-preview.redd.it/ndWnl2nJ7ITaGdb18DkycE3wIZutveJ7Ce9Jw2dfhsk.jpg?width=320&amp;crop=smart&amp;auto=webp&amp;s=1304bab3eff1e06058306c52b8ce0405f1c14d19', 'width': 320}], 'source': {'height': 554, 'url': 'https://external-preview.redd.it/ndWnl2nJ7ITaGdb18DkycE3wIZutveJ7Ce9Jw2dfhsk.jpg?auto=webp&amp;s=f7848b0fcccc8848c0d0142b123ed18592f7b690', 'width': 398}, 'variants': {}}]}",
59,[],False,Dense_Cloud1100,,[],,text,t2_gag0zl0t,False,False,False,[],False,False,1660518756,self.AskEngineers,https://www.reddit.com/r/AskEngineers/comments/wojlne/should_i_obtain_an_associate_degree_in/,{},wojlne,False,True,False,False,False,True,True,False,,blue,[],b251a614-57f9-11e4-b47b-12313b0e9678,Discussion,dark,text,False,False,True,0,0,False,all_ads,/r/AskEngineers/comments/wojlne/should_i_obtain_an_associate_degree_in/,False,6,,1660518767,1,"Hi all,

My major is Aerospace Engineering. 

I was speaking with one of my professor's and he advised I take courses in Engineering Technology, Graphics and Design, and Manufacturing. His argument is that students learn a lot of theory but not much hands on experience. By taking these course, he says, I will learn a hands on approach and obtain an Associates Degree in either Engineering Technology: Advanced Manufacturing or an Associate's in Engineering Graphics and Design Technology, before I transfer to a CSU.

Is it worth taking extra courses in these areas and obtaining an Associates Degree?

&amp;#x200B;

Thanks!",True,False,False,AskEngineers,t5_2sebk,281403,public,self,Should I obtain an Associate Degree in Engineering Technology while in Community College?,0,[],1.0,https://www.reddit.com/r/AskEngineers/comments/wojlne/should_i_obtain_an_associate_degree_in/,all_ads,6,,,,,,
60,[],False,ihavethekeyto_space,,[],,text,t2_a478b7ra,False,False,False,[],False,False,1660518119,self.AskEngineers,https://www.reddit.com/r/AskEngineers/comments/wojdi8/combining_different_pressure_and_fluid_sources/,{},wojdi8,False,True,False,False,False,True,True,False,,blue,[],b251a614-57f9-11e4-b47b-12313b0e9678,Discussion,dark,text,False,False,True,0,0,False,all_ads,/r/AskEngineers/comments/wojdi8/combining_different_pressure_and_fluid_sources/,False,6,,1660518130,1,"What is the best design to combine different pressure sources that has both a high pressure gas and liquid inlet?

To give a brief description, I have a high pressure gas, and a low pressure fluid being mixed into a heat exchanger. The mix needs to exit at high pressure.  Obviously I can just pressurize the fluid reservoir tank, however I am at the drawing board rn because of weight and size restrictions (and i need something that is readily available or that I'm able to build myself). Also I'll mention (if it helps any) the fluid does have a high viscosity. Open to theories and suggestions!

TYiA!",True,False,False,AskEngineers,t5_2sebk,281404,public,self,Combining different pressure and fluid sources,0,[],1.0,https://www.reddit.com/r/AskEngineers/comments/wojdi8/combining_different_pressure_and_fluid_sources/,all_ads,6,,,,,,
61,[],False,MouthBursting,,[],,text,t2_7mvkpsp,False,False,False,[],False,False,1660517794,self.AskEngineers,https://www.reddit.com/r/AskEngineers/comments/woj92b/is_it_worth_pursuing_computer_engineering_if_i/,{},woj92b,False,True,False,False,False,True,True,False,,blue,[],b251a614-57f9-11e4-b47b-12313b0e9678,Discussion,dark,text,False,False,True,0,0,False,all_ads,/r/AskEngineers/comments/woj92b/is_it_worth_pursuing_computer_engineering_if_i/,False,6,,1660517805,1," Hello everyone. Sorry for this post but just wanted to see if people have experienced this before. I graduated with a bachelors in Electrical Engineer in 2018 and currently on my second semester in my masters in computer engineering. However, I am not sure if I want to pursue this path anymore. I was thinking of going to the software engineering route since I do software development at my job. Not sure in what to do. To be completely honest, I am lost in what I want to do in regards to my career in pursuing electrical engineering or computer engineering or software engineering. My semester starts in two weeks and plan on talking to an advisor on this topic within the next few days. However, any advice from anyone would be appreciated. Thank you.",True,False,False,AskEngineers,t5_2sebk,281404,public,self,Is it worth pursuing computer engineering if I felt miserable my first semester? Is software engineering a better path for me to choose?,0,[],1.0,https://www.reddit.com/r/AskEngineers/comments/woj92b/is_it_worth_pursuing_computer_engineering_if_i/,all_ads,6,,,,,,
62,[],False,MouthBursting,,[],,text,t2_7mvkpsp,False,False,False,[],False,False,1660517545,self.AskEngineers,https://www.reddit.com/r/AskEngineers/comments/woj5xh/switching_careers_maybe/,{},woj5xh,False,False,False,False,False,False,True,False,,blue,[],b251a614-57f9-11e4-b47b-12313b0e9678,Discussion,dark,text,False,False,True,1,0,False,all_ads,/r/AskEngineers/comments/woj5xh/switching_careers_maybe/,False,6,moderator,1660517556,1,[removed],True,False,False,AskEngineers,t5_2sebk,281403,public,self,"Switching Careers, maybe?????",0,[],1.0,https://www.reddit.com/r/AskEngineers/comments/woj5xh/switching_careers_maybe/,all_ads,6,,,,,,
